[I 2025-04-07 01:41:33,177] Using an existing study with name 'adaboost' instead of creating a new one.
[I 2025-04-07 01:42:28,945] Trial 6 finished with value: 0.789544231637733 and parameters: {'n_estimators': 27, 'learning_rate': 0.002632421942391965, 'criterion': 'log_loss', 'max_depth': 20, 'min_samples_split': 30, 'min_samples_leaf': 6}. Best is trial 14 with value: 0.8119725477585005.
[I 2025-04-07 01:42:32,934] Trial 21 finished with value: 0.7542439914174404 and parameters: {'n_estimators': 15, 'learning_rate': 0.010058483040430128, 'criterion': 'entropy', 'max_depth': 2, 'min_samples_split': 4, 'min_samples_leaf': 30}. Best is trial 18 with value: 0.8139437248379349.
[I 2025-04-07 01:43:30,120] Trial 24 finished with value: 0.7988088096003768 and parameters: {'n_estimators': 43, 'learning_rate': 0.0001049215856605636, 'criterion': 'gini', 'max_depth': 13, 'min_samples_split': 43, 'min_samples_leaf': 12}. Best is trial 18 with value: 0.8139437248379349.
[I 2025-04-07 01:44:34,438] Trial 36 finished with value: 0.8144049759164659 and parameters: {'n_estimators': 54, 'learning_rate': 0.11950842818275163, 'criterion': 'log_loss', 'max_depth': 10, 'min_samples_split': 64, 'min_samples_leaf': 11}. Best is trial 32 with value: 0.8155366999319933.
[I 2025-04-07 01:45:09,932] Trial 49 finished with value: 0.7949941394683523 and parameters: {'n_estimators': 54, 'learning_rate': 0.018305325287531243, 'criterion': 'log_loss', 'max_depth': 5, 'min_samples_split': 52, 'min_samples_leaf': 19}. Best is trial 37 with value: 0.8173394767871986.
[I 2025-04-07 01:46:57,406] Trial 64 finished with value: 0.8030851174127204 and parameters: {'n_estimators': 57, 'learning_rate': 0.502906792701472, 'criterion': 'log_loss', 'max_depth': 15, 'min_samples_split': 50, 'min_samples_leaf': 2}. Best is trial 37 with value: 0.8173394767871986.
[I 2025-04-07 01:48:47,281] Trial 79 finished with value: 0.8107571068830934 and parameters: {'n_estimators': 64, 'learning_rate': 0.006022503884352259, 'criterion': 'entropy', 'max_depth': 17, 'min_samples_split': 39, 'min_samples_leaf': 21}. Best is trial 37 with value: 0.8173394767871986.
[I 2025-04-07 01:49:55,654] Trial 94 finished with value: 0.8156205398015327 and parameters: {'n_estimators': 43, 'learning_rate': 0.02799176958298773, 'criterion': 'gini', 'max_depth': 19, 'min_samples_split': 47, 'min_samples_leaf': 17}. Best is trial 37 with value: 0.8173394767871986.
[I 2025-04-07 01:50:51,107] Trial 109 finished with value: 0.8165849179613434 and parameters: {'n_estimators': 42, 'learning_rate': 0.028615149036129526, 'criterion': 'gini', 'max_depth': 12, 'min_samples_split': 60, 'min_samples_leaf': 16}. Best is trial 96 with value: 0.8178426390140953.
[I 2025-04-07 01:51:25,701] Trial 124 finished with value: 0.8112189554371149 and parameters: {'n_estimators': 34, 'learning_rate': 0.008954766466404697, 'criterion': 'gini', 'max_depth': 9, 'min_samples_split': 59, 'min_samples_leaf': 14}. Best is trial 96 with value: 0.8178426390140953.
[I 2025-04-07 01:52:04,900] Trial 131 finished with value: 0.8149076109591062 and parameters: {'n_estimators': 34, 'learning_rate': 0.04137943579269102, 'criterion': 'gini', 'max_depth': 11, 'min_samples_split': 55, 'min_samples_leaf': 11}. Best is trial 121 with value: 0.8182618559346011.
[I 2025-04-07 01:52:39,801] Trial 146 finished with value: 0.8126439169087322 and parameters: {'n_estimators': 29, 'learning_rate': 0.3368323562475784, 'criterion': 'gini', 'max_depth': 11, 'min_samples_split': 23, 'min_samples_leaf': 3}. Best is trial 121 with value: 0.8182618559346011.
[I 2025-04-07 01:54:20,313] Trial 162 finished with value: 0.8144883588929833 and parameters: {'n_estimators': 39, 'learning_rate': 0.019940379443906933, 'criterion': 'gini', 'max_depth': 14, 'min_samples_split': 57, 'min_samples_leaf': 15}. Best is trial 121 with value: 0.8182618559346011.
[I 2025-04-07 01:55:15,401] Trial 177 finished with value: 0.8150755718631219 and parameters: {'n_estimators': 42, 'learning_rate': 0.07277809018570895, 'criterion': 'gini', 'max_depth': 12, 'min_samples_split': 60, 'min_samples_leaf': 5}. Best is trial 121 with value: 0.8182618559346011.
[I 2025-04-07 01:56:06,667] Trial 196 finished with value: 0.8146564076610417 and parameters: {'n_estimators': 44, 'learning_rate': 0.12996254373665836, 'criterion': 'gini', 'max_depth': 10, 'min_samples_split': 61, 'min_samples_leaf': 9}. Best is trial 121 with value: 0.8182618559346011.
[I 2025-04-07 01:56:57,538] Trial 211 finished with value: 0.8155784880706991 and parameters: {'n_estimators': 37, 'learning_rate': 0.05490111588448151, 'criterion': 'gini', 'max_depth': 13, 'min_samples_split': 58, 'min_samples_leaf': 4}. Best is trial 121 with value: 0.8182618559346011.
[I 2025-04-07 01:57:56,792] Trial 225 finished with value: 0.8157882195406116 and parameters: {'n_estimators': 40, 'learning_rate': 0.023566391301390852, 'criterion': 'log_loss', 'max_depth': 12, 'min_samples_split': 30, 'min_samples_leaf': 16}. Best is trial 121 with value: 0.8182618559346011.
[I 2025-04-07 01:58:59,651] Trial 239 finished with value: 0.8163752392098562 and parameters: {'n_estimators': 46, 'learning_rate': 0.08857010900760934, 'criterion': 'log_loss', 'max_depth': 11, 'min_samples_split': 56, 'min_samples_leaf': 18}. Best is trial 121 with value: 0.8182618559346011.
[I 2025-04-07 01:59:50,137] Trial 254 finished with value: 0.8158302009802112 and parameters: {'n_estimators': 38, 'learning_rate': 0.06499164880398918, 'criterion': 'log_loss', 'max_depth': 11, 'min_samples_split': 8, 'min_samples_leaf': 17}. Best is trial 121 with value: 0.8182618559346011.
[I 2025-04-07 02:00:35,654] Trial 264 finished with value: 0.816626741245666 and parameters: {'n_estimators': 35, 'learning_rate': 0.06223260120494088, 'criterion': 'log_loss', 'max_depth': 11, 'min_samples_split': 63, 'min_samples_leaf': 20}. Best is trial 121 with value: 0.8182618559346011.
[I 2025-04-07 02:02:05,338] Trial 278 finished with value: 0.8165010078005697 and parameters: {'n_estimators': 59, 'learning_rate': 0.04702915754503294, 'criterion': 'log_loss', 'max_depth': 12, 'min_samples_split': 63, 'min_samples_leaf': 19}. Best is trial 121 with value: 0.8182618559346011.
[I 2025-04-07 02:03:15,161] Trial 294 finished with value: 0.8146982836637899 and parameters: {'n_estimators': 58, 'learning_rate': 0.04130866253127409, 'criterion': 'log_loss', 'max_depth': 10, 'min_samples_split': 64, 'min_samples_leaf': 22}. Best is trial 121 with value: 0.8182618559346011.
[I 2025-04-07 02:04:53,238] Trial 309 finished with value: 0.8149497505539829 and parameters: {'n_estimators': 63, 'learning_rate': 0.11188492565275152, 'criterion': 'log_loss', 'max_depth': 13, 'min_samples_split': 62, 'min_samples_leaf': 20}. Best is trial 121 with value: 0.8182618559346011.
[I 2025-04-07 02:05:45,514] Trial 324 finished with value: 0.818010213316323 and parameters: {'n_estimators': 36, 'learning_rate': 0.04956010805913452, 'criterion': 'log_loss', 'max_depth': 11, 'min_samples_split': 62, 'min_samples_leaf': 18}. Best is trial 121 with value: 0.8182618559346011.
[I 2025-04-07 02:06:33,226] Trial 335 finished with value: 0.8161656131767948 and parameters: {'n_estimators': 36, 'learning_rate': 0.07318092232049206, 'criterion': 'log_loss', 'max_depth': 11, 'min_samples_split': 61, 'min_samples_leaf': 17}. Best is trial 121 with value: 0.8182618559346011.
[I 2025-04-07 02:07:22,168] Trial 352 finished with value: 0.8170460108845976 and parameters: {'n_estimators': 36, 'learning_rate': 0.04673811038229253, 'criterion': 'log_loss', 'max_depth': 11, 'min_samples_split': 59, 'min_samples_leaf': 27}. Best is trial 121 with value: 0.8182618559346011.
[I 2025-04-07 02:08:10,134] Trial 367 finished with value: 0.8166686875396486 and parameters: {'n_estimators': 38, 'learning_rate': 0.026666044860542314, 'criterion': 'log_loss', 'max_depth': 11, 'min_samples_split': 59, 'min_samples_leaf': 27}. Best is trial 121 with value: 0.8182618559346011.
[I 2025-04-07 02:09:01,972] Trial 385 finished with value: 0.8159977225640134 and parameters: {'n_estimators': 38, 'learning_rate': 0.07705821744587453, 'criterion': 'log_loss', 'max_depth': 12, 'min_samples_split': 64, 'min_samples_leaf': 23}. Best is trial 121 with value: 0.8182618559346011.
[I 2025-04-07 02:09:45,096] Trial 400 finished with value: 0.8147403881130495 and parameters: {'n_estimators': 35, 'learning_rate': 0.08091026188492964, 'criterion': 'log_loss', 'max_depth': 10, 'min_samples_split': 62, 'min_samples_leaf': 14}. Best is trial 121 with value: 0.8182618559346011.
[I 2025-04-07 02:10:31,546] Trial 415 finished with value: 0.8175491906843029 and parameters: {'n_estimators': 33, 'learning_rate': 0.04098259680593502, 'criterion': 'log_loss', 'max_depth': 11, 'min_samples_split': 57, 'min_samples_leaf': 16}. Best is trial 121 with value: 0.8182618559346011.
[I 2025-04-07 02:11:13,331] Trial 427 finished with value: 0.8165427607936584 and parameters: {'n_estimators': 30, 'learning_rate': 0.039664190340552366, 'criterion': 'log_loss', 'max_depth': 12, 'min_samples_split': 55, 'min_samples_leaf': 31}. Best is trial 121 with value: 0.8182618559346011.
[I 2025-04-07 02:12:33,935] Trial 436 finished with value: 0.8165849003885348 and parameters: {'n_estimators': 60, 'learning_rate': 0.01942155144722738, 'criterion': 'log_loss', 'max_depth': 11, 'min_samples_split': 60, 'min_samples_leaf': 17}. Best is trial 121 with value: 0.8182618559346011.
[I 2025-04-07 02:14:41,083] Trial 456 finished with value: 0.8123503104236628 and parameters: {'n_estimators': 64, 'learning_rate': 0.05948510655621552, 'criterion': 'log_loss', 'max_depth': 24, 'min_samples_split': 56, 'min_samples_leaf': 15}. Best is trial 460 with value: 0.8184711480843003.
[I 2025-04-07 02:16:19,723] Trial 477 finished with value: 0.8133565294406047 and parameters: {'n_estimators': 54, 'learning_rate': 0.014822833811205168, 'criterion': 'log_loss', 'max_depth': 31, 'min_samples_split': 53, 'min_samples_leaf': 18}. Best is trial 460 with value: 0.8184711480843003.
[I 2025-04-07 02:17:52,929] Trial 496 finished with value: 0.8187649127246465 and parameters: {'n_estimators': 58, 'learning_rate': 0.03213347717758001, 'criterion': 'entropy', 'max_depth': 14, 'min_samples_split': 55, 'min_samples_leaf': 16}. Best is trial 496 with value: 0.8187649127246465.
[I 2025-04-07 02:19:27,143] Trial 511 finished with value: 0.8169620128597812 and parameters: {'n_estimators': 59, 'learning_rate': 0.03187109262797776, 'criterion': 'entropy', 'max_depth': 14, 'min_samples_split': 56, 'min_samples_leaf': 16}. Best is trial 496 with value: 0.8187649127246465.
[I 2025-04-07 02:21:06,659] Trial 529 finished with value: 0.8170038537169126 and parameters: {'n_estimators': 59, 'learning_rate': 0.02494972196831354, 'criterion': 'log_loss', 'max_depth': 15, 'min_samples_split': 60, 'min_samples_leaf': 17}. Best is trial 496 with value: 0.8187649127246465.
[I 2025-04-07 02:22:28,721] Trial 544 finished with value: 0.8152434976215204 and parameters: {'n_estimators': 60, 'learning_rate': 0.04642323015310525, 'criterion': 'entropy', 'max_depth': 10, 'min_samples_split': 50, 'min_samples_leaf': 18}. Best is trial 496 with value: 0.8187649127246465.
[I 2025-04-07 02:23:52,854] Trial 561 finished with value: 0.8175909788230085 and parameters: {'n_estimators': 57, 'learning_rate': 0.03849747457803704, 'criterion': 'log_loss', 'max_depth': 12, 'min_samples_split': 54, 'min_samples_leaf': 12}. Best is trial 496 with value: 0.8187649127246465.
[I 2025-04-07 02:25:21,965] Trial 577 finished with value: 0.8166687226852657 and parameters: {'n_estimators': 57, 'learning_rate': 0.03418313868539421, 'criterion': 'log_loss', 'max_depth': 13, 'min_samples_split': 59, 'min_samples_leaf': 15}. Best is trial 496 with value: 0.8187649127246465.
[I 2025-04-07 02:27:17,827] Trial 594 finished with value: 0.8149495045346633 and parameters: {'n_estimators': 63, 'learning_rate': 0.05621979942420167, 'criterion': 'log_loss', 'max_depth': 18, 'min_samples_split': 60, 'min_samples_leaf': 16}. Best is trial 496 with value: 0.8187649127246465.
[I 2025-04-07 02:28:42,696] Trial 613 finished with value: 0.8168781729902419 and parameters: {'n_estimators': 60, 'learning_rate': 0.015420855654096467, 'criterion': 'log_loss', 'max_depth': 12, 'min_samples_split': 56, 'min_samples_leaf': 19}. Best is trial 496 with value: 0.8187649127246465.
[I 2025-04-07 02:29:40,907] Trial 627 finished with value: 0.8150755718631219 and parameters: {'n_estimators': 41, 'learning_rate': 0.024853535169403855, 'criterion': 'gini', 'max_depth': 15, 'min_samples_split': 56, 'min_samples_leaf': 14}. Best is trial 496 with value: 0.8187649127246465.
[I 2025-04-07 02:31:01,671] Trial 639 finished with value: 0.8161655780311776 and parameters: {'n_estimators': 58, 'learning_rate': 0.04366365773925329, 'criterion': 'entropy', 'max_depth': 11, 'min_samples_split': 58, 'min_samples_leaf': 28}. Best is trial 496 with value: 0.8187649127246465.
[I 2025-04-07 02:32:27,220] Trial 651 finished with value: 0.8161237723196635 and parameters: {'n_estimators': 56, 'learning_rate': 0.04359415612921053, 'criterion': 'log_loss', 'max_depth': 12, 'min_samples_split': 59, 'min_samples_leaf': 24}. Best is trial 496 with value: 0.8187649127246465.
[I 2025-04-07 02:33:44,865] Trial 669 finished with value: 0.8167104229599287 and parameters: {'n_estimators': 52, 'learning_rate': 0.066119565213925, 'criterion': 'log_loss', 'max_depth': 12, 'min_samples_split': 55, 'min_samples_leaf': 15}. Best is trial 496 with value: 0.8187649127246465.
[I 2025-04-07 02:35:25,787] Trial 688 finished with value: 0.8162491191629722 and parameters: {'n_estimators': 55, 'learning_rate': 0.03448401079750677, 'criterion': 'log_loss', 'max_depth': 17, 'min_samples_split': 57, 'min_samples_leaf': 16}. Best is trial 496 with value: 0.8187649127246465.
[I 2025-04-07 02:36:28,098] Trial 708 finished with value: 0.8171297980357115 and parameters: {'n_estimators': 38, 'learning_rate': 0.035546602054161054, 'criterion': 'log_loss', 'max_depth': 13, 'min_samples_split': 57, 'min_samples_leaf': 16}. Best is trial 496 with value: 0.8187649127246465.
[I 2025-04-07 02:37:48,333] Trial 721 finished with value: 0.8167525449819968 and parameters: {'n_estimators': 51, 'learning_rate': 0.022015412894153912, 'criterion': 'log_loss', 'max_depth': 14, 'min_samples_split': 58, 'min_samples_leaf': 16}. Best is trial 496 with value: 0.8187649127246465.
[I 2025-04-07 02:39:13,713] Trial 736 finished with value: 0.8173812297802872 and parameters: {'n_estimators': 52, 'learning_rate': 0.02802520038389809, 'criterion': 'log_loss', 'max_depth': 14, 'min_samples_split': 56, 'min_samples_leaf': 15}. Best is trial 496 with value: 0.8187649127246465.
[I 2025-04-07 02:40:41,699] Trial 751 finished with value: 0.8155365769223334 and parameters: {'n_estimators': 54, 'learning_rate': 0.015502019181774681, 'criterion': 'log_loss', 'max_depth': 15, 'min_samples_split': 60, 'min_samples_leaf': 17}. Best is trial 496 with value: 0.8187649127246465.
[I 2025-04-07 02:42:04,336] Trial 767 finished with value: 0.816165718613646 and parameters: {'n_estimators': 55, 'learning_rate': 0.032365214419081995, 'criterion': 'log_loss', 'max_depth': 13, 'min_samples_split': 55, 'min_samples_leaf': 16}. Best is trial 496 with value: 0.8187649127246465.
訓練集準確率: 0.8659288139856621
測試集準確率: 0.8076794097920859
10-fold CV 準確率:  0.8187649127246465

