[I 2025-04-07 03:36:09,455] Trial 245 finished with value: 0.8182195581844477 and parameters: {'iterations': 187, 'learning_rate': 0.2898037896440098, 'objective': 'CrossEntropy', 'colsample_bylevel': 0.5909592120924784, 'depth': 7, 'boosting_type': 'Ordered', 'bootstrap_type': 'Bernoulli', 'subsample': 0.9211999438605023}. Best is trial 224 with value: 0.8208191388972359.
[I 2025-04-07 03:36:35,826] Trial 248 finished with value: 0.8195193309680333 and parameters: {'iterations': 195, 'learning_rate': 0.24269264775693605, 'objective': 'CrossEntropy', 'colsample_bylevel': 0.5790304845093401, 'depth': 7, 'boosting_type': 'Ordered', 'bootstrap_type': 'Bernoulli', 'subsample': 0.910625863626552}. Best is trial 224 with value: 0.8208191388972359.
[I 2025-04-07 03:36:58,284] Trial 253 finished with value: 0.8202738546482715 and parameters: {'iterations': 181, 'learning_rate': 0.247151295213228, 'objective': 'CrossEntropy', 'colsample_bylevel': 0.48502390508121335, 'depth': 7, 'boosting_type': 'Ordered', 'bootstrap_type': 'Bernoulli', 'subsample': 0.9419830618720664}. Best is trial 224 with value: 0.8208191388972359.
[I 2025-04-07 03:37:24,326] Trial 257 finished with value: 0.8061457031847201 and parameters: {'iterations': 177, 'learning_rate': 0.27815744174527324, 'objective': 'CrossEntropy', 'colsample_bylevel': 0.7285838128794454, 'depth': 7, 'boosting_type': 'Ordered', 'bootstrap_type': 'Bayesian', 'bagging_temperature': 9.873454825162277}. Best is trial 224 with value: 0.8208191388972359.
[I 2025-04-07 03:37:47,693] Trial 261 finished with value: 0.8196451171315553 and parameters: {'iterations': 189, 'learning_rate': 0.19548134491787922, 'objective': 'CrossEntropy', 'colsample_bylevel': 0.4905648002870275, 'depth': 7, 'boosting_type': 'Ordered', 'bootstrap_type': 'Bernoulli', 'subsample': 0.9429464060700223}. Best is trial 224 with value: 0.8208191388972359.
[I 2025-04-07 03:38:10,045] Trial 265 finished with value: 0.8189744684664738 and parameters: {'iterations': 183, 'learning_rate': 0.22701994612640689, 'objective': 'CrossEntropy', 'colsample_bylevel': 0.4352664434981071, 'depth': 7, 'boosting_type': 'Ordered', 'bootstrap_type': 'Bernoulli', 'subsample': 0.9197290384592021}. Best is trial 224 with value: 0.8208191388972359.
[I 2025-04-07 03:38:32,679] Trial 269 finished with value: 0.8198966718857907 and parameters: {'iterations': 179, 'learning_rate': 0.23510868950922867, 'objective': 'CrossEntropy', 'colsample_bylevel': 0.5019615864543959, 'depth': 7, 'boosting_type': 'Ordered', 'bootstrap_type': 'Bernoulli', 'subsample': 0.9034076473956086}. Best is trial 224 with value: 0.8208191388972359.
[I 2025-04-07 03:38:46,326] Trial 273 finished with value: 0.8160817557344467 and parameters: {'iterations': 113, 'learning_rate': 0.15705878446726396, 'objective': 'CrossEntropy', 'colsample_bylevel': 0.465109211861006, 'depth': 7, 'boosting_type': 'Ordered', 'bootstrap_type': 'Bernoulli', 'subsample': 0.9661846889397924}. Best is trial 224 with value: 0.8208191388972359.
[I 2025-04-07 03:39:10,826] Trial 277 finished with value: 0.8192258474926237 and parameters: {'iterations': 193, 'learning_rate': 0.17782451323064558, 'objective': 'CrossEntropy', 'colsample_bylevel': 0.5288816798998786, 'depth': 7, 'boosting_type': 'Ordered', 'bootstrap_type': 'Bernoulli', 'subsample': 0.8995048299297576}. Best is trial 224 with value: 0.8208191388972359.
[I 2025-04-07 03:39:22,844] Trial 281 finished with value: 0.8162912411850399 and parameters: {'iterations': 94, 'learning_rate': 0.22073055870474784, 'objective': 'CrossEntropy', 'colsample_bylevel': 0.4780470137020333, 'depth': 7, 'boosting_type': 'Ordered', 'bootstrap_type': 'Bernoulli', 'subsample': 0.9344701560762717}. Best is trial 224 with value: 0.8208191388972359.
[I 2025-04-07 03:39:45,504] Trial 283 finished with value: 0.8182198393493844 and parameters: {'iterations': 180, 'learning_rate': 0.32284067079990497, 'objective': 'CrossEntropy', 'colsample_bylevel': 0.4945824017436173, 'depth': 7, 'boosting_type': 'Ordered', 'bootstrap_type': 'Bernoulli', 'subsample': 0.9482833647324178}. Best is trial 224 with value: 0.8208191388972359.
[I 2025-04-07 03:40:13,907] Trial 288 finished with value: 0.8181774537351882 and parameters: {'iterations': 187, 'learning_rate': 0.2804109455387326, 'objective': 'CrossEntropy', 'colsample_bylevel': 0.7917232931552999, 'depth': 7, 'boosting_type': 'Ordered', 'bootstrap_type': 'Bernoulli', 'subsample': 0.9794816429711554}. Best is trial 224 with value: 0.8208191388972359.
[I 2025-04-07 03:40:31,019] Trial 293 finished with value: 0.8168365078611959 and parameters: {'iterations': 131, 'learning_rate': 0.20435088172849566, 'objective': 'CrossEntropy', 'colsample_bylevel': 0.5943683714872063, 'depth': 7, 'boosting_type': 'Ordered', 'bootstrap_type': 'Bernoulli', 'subsample': 0.8809761479648256}. Best is trial 224 with value: 0.8208191388972359.
[I 2025-04-07 03:40:56,168] Trial 295 finished with value: 0.8180935435744148 and parameters: {'iterations': 190, 'learning_rate': 0.2878282427828327, 'objective': 'CrossEntropy', 'colsample_bylevel': 0.5806626771761844, 'depth': 7, 'boosting_type': 'Ordered', 'bootstrap_type': 'Bernoulli', 'subsample': 0.8746486818145659}. Best is trial 224 with value: 0.8208191388972359.
[I 2025-04-07 03:42:00,891] Trial 300 finished with value: 0.8188903650048062 and parameters: {'iterations': 176, 'learning_rate': 0.3256659985109215, 'objective': 'Logloss', 'colsample_bylevel': 0.5445579551234168, 'depth': 9, 'boosting_type': 'Ordered', 'bootstrap_type': 'Bernoulli', 'subsample': 0.9502302907921767}. Best is trial 224 with value: 0.8208191388972359.
[I 2025-04-07 03:43:14,443] Trial 305 finished with value: 0.819393597522937 and parameters: {'iterations': 181, 'learning_rate': 0.22143871778781105, 'objective': 'Logloss', 'colsample_bylevel': 0.6381172909833196, 'depth': 9, 'boosting_type': 'Ordered', 'bootstrap_type': 'Bernoulli', 'subsample': 0.967223072614829}. Best is trial 224 with value: 0.8208191388972359.
[I 2025-04-07 03:43:44,385] Trial 309 finished with value: 0.8194772089459654 and parameters: {'iterations': 80, 'learning_rate': 0.25855609479195635, 'objective': 'Logloss', 'colsample_bylevel': 0.5303210212046965, 'depth': 9, 'boosting_type': 'Ordered', 'bootstrap_type': 'MVS', 'subsample': 0.9245605548382673}. Best is trial 224 with value: 0.8208191388972359.
[I 2025-04-07 03:46:11,168] Trial 312 finished with value: 0.8174648412033158 and parameters: {'iterations': 256, 'learning_rate': 0.17069433542124207, 'objective': 'Logloss', 'colsample_bylevel': 0.6023959699032636, 'depth': 9, 'boosting_type': 'Ordered', 'bootstrap_type': 'Bernoulli', 'subsample': 0.9774974270192721}. Best is trial 224 with value: 0.8208191388972359.
[I 2025-04-07 03:47:22,629] Trial 320 finished with value: 0.8181778051913591 and parameters: {'iterations': 190, 'learning_rate': 0.11609987538286849, 'objective': 'Logloss', 'colsample_bylevel': 0.5662530281239004, 'depth': 9, 'boosting_type': 'Ordered', 'bootstrap_type': 'Bernoulli', 'subsample': 0.4165931988395134}. Best is trial 224 with value: 0.8208191388972359.
[I 2025-04-07 03:49:16,507] Trial 323 finished with value: 0.8183875893796972 and parameters: {'iterations': 203, 'learning_rate': 0.15245729656094492, 'objective': 'Logloss', 'colsample_bylevel': 0.6853404202456038, 'depth': 9, 'boosting_type': 'Ordered', 'bootstrap_type': 'Bernoulli', 'subsample': 0.9992232095604305}. Best is trial 224 with value: 0.8208191388972359.
[I 2025-04-07 03:50:33,336] Trial 327 finished with value: 0.8198546553005741 and parameters: {'iterations': 185, 'learning_rate': 0.18838385610735042, 'objective': 'Logloss', 'colsample_bylevel': 0.6663893603537087, 'depth': 9, 'boosting_type': 'Ordered', 'bootstrap_type': 'Bernoulli', 'subsample': 0.9618394423175276}. Best is trial 224 with value: 0.8208191388972359.
[I 2025-04-07 03:51:51,743] Trial 331 finished with value: 0.8195192079583735 and parameters: {'iterations': 180, 'learning_rate': 0.21020559346629772, 'objective': 'Logloss', 'colsample_bylevel': 0.6253025536240416, 'depth': 9, 'boosting_type': 'Ordered', 'bootstrap_type': 'Bernoulli', 'subsample': 0.9444395255941003}. Best is trial 224 with value: 0.8208191388972359.
[I 2025-04-07 03:52:36,195] Trial 335 finished with value: 0.8185550582450739 and parameters: {'iterations': 195, 'learning_rate': 0.1548566992350468, 'objective': 'Logloss', 'colsample_bylevel': 0.5952261774096602, 'depth': 8, 'boosting_type': 'Ordered', 'bootstrap_type': 'Bernoulli', 'subsample': 0.9744771454397015}. Best is trial 224 with value: 0.8208191388972359.
[I 2025-04-07 03:53:09,340] Trial 337 finished with value: 0.8188904880144661 and parameters: {'iterations': 90, 'learning_rate': 0.2158814734942425, 'objective': 'Logloss', 'colsample_bylevel': 0.4513389967101712, 'depth': 9, 'boosting_type': 'Ordered', 'bootstrap_type': 'Bernoulli', 'subsample': 0.9789784492131349}. Best is trial 224 with value: 0.8208191388972359.
[I 2025-04-07 03:54:33,396] Trial 340 finished with value: 0.8089129987822045 and parameters: {'iterations': 190, 'learning_rate': 0.12706887520496474, 'objective': 'Logloss', 'colsample_bylevel': 0.6346980988955192, 'depth': 9, 'boosting_type': 'Ordered', 'bootstrap_type': 'Bayesian', 'bagging_temperature': 7.031922623300391}. Best is trial 224 with value: 0.8208191388972359.
[I 2025-04-07 03:56:03,382] Trial 344 finished with value: 0.816165296866241 and parameters: {'iterations': 198, 'learning_rate': 0.35836410280190945, 'objective': 'Logloss', 'colsample_bylevel': 0.9281909942126649, 'depth': 9, 'boosting_type': 'Ordered', 'bootstrap_type': 'Bernoulli', 'subsample': 0.9720899636501987}. Best is trial 224 with value: 0.8208191388972359.
訓練集準確率: 0.8332704481616569
測試集準確率: 0.8110328638497653
10-fold CV 準確率:  0.8208191388972359

