[I 2025-04-07 03:29:21,754] Trial 217 finished with value: 0.8191841296451521 and parameters: {'iterations': 143, 'learning_rate': 0.3200843728734697, 'objective': 'Logloss', 'colsample_bylevel': 0.5449156263153282, 'depth': 9, 'boosting_type': 'Ordered', 'bootstrap_type': 'Bernoulli', 'subsample': 0.9126346148651521}. Best is trial 177 with value: 0.8206089681071098.
[I 2025-04-07 03:30:53,683] Trial 221 finished with value: 0.8200642813336356 and parameters: {'iterations': 186, 'learning_rate': 0.2585975865743175, 'objective': 'CrossEntropy', 'colsample_bylevel': 0.9600400785940444, 'depth': 9, 'boosting_type': 'Ordered', 'bootstrap_type': 'Bernoulli', 'subsample': 0.8899309982867598}. Best is trial 177 with value: 0.8206089681071098.
[I 2025-04-07 03:32:19,900] Trial 227 finished with value: 0.8179262152915066 and parameters: {'iterations': 181, 'learning_rate': 0.21843202719343946, 'objective': 'CrossEntropy', 'colsample_bylevel': 0.9700764564812008, 'depth': 9, 'boosting_type': 'Ordered', 'bootstrap_type': 'Bernoulli', 'subsample': 0.8654820944153399}. Best is trial 224 with value: 0.8208191388972359.
[I 2025-04-07 03:33:40,624] Trial 232 finished with value: 0.8186809322726386 and parameters: {'iterations': 190, 'learning_rate': 0.17224044107269462, 'objective': 'CrossEntropy', 'colsample_bylevel': 0.6254018759051344, 'depth': 9, 'boosting_type': 'Ordered', 'bootstrap_type': 'Bernoulli', 'subsample': 0.8911136934434318}. Best is trial 224 with value: 0.8208191388972359.
[I 2025-04-07 03:34:56,739] Trial 237 finished with value: 0.8190580974623108 and parameters: {'iterations': 158, 'learning_rate': 0.24729464487046005, 'objective': 'CrossEntropy', 'colsample_bylevel': 0.7752332563476702, 'depth': 9, 'boosting_type': 'Ordered', 'bootstrap_type': 'Bernoulli', 'subsample': 0.884850699036511}. Best is trial 224 with value: 0.8208191388972359.
[I 2025-04-07 03:35:25,118] Trial 241 finished with value: 0.818764736996561 and parameters: {'iterations': 150, 'learning_rate': 0.3776824764887109, 'objective': 'CrossEntropy', 'colsample_bylevel': 0.9933093786303072, 'depth': 7, 'boosting_type': 'Ordered', 'bootstrap_type': 'MVS', 'subsample': 0.9358356144132676}. Best is trial 224 with value: 0.8208191388972359.
[I 2025-04-07 03:36:24,699] Trial 244 finished with value: 0.81918391877145 and parameters: {'iterations': 168, 'learning_rate': 0.21384341967177528, 'objective': 'CrossEntropy', 'colsample_bylevel': 0.4867429486348308, 'depth': 9, 'boosting_type': 'Ordered', 'bootstrap_type': 'Bernoulli', 'subsample': 0.828513494435607}. Best is trial 224 with value: 0.8208191388972359.
[I 2025-04-07 03:36:49,244] Trial 250 finished with value: 0.8205674259877236 and parameters: {'iterations': 182, 'learning_rate': 0.25029171781209375, 'objective': 'CrossEntropy', 'colsample_bylevel': 0.6448909717016745, 'depth': 7, 'boosting_type': 'Ordered', 'bootstrap_type': 'Bernoulli', 'subsample': 0.9097795609499258}. Best is trial 224 with value: 0.8208191388972359.
[I 2025-04-07 03:37:14,635] Trial 254 finished with value: 0.8141531048516768 and parameters: {'iterations': 181, 'learning_rate': 0.25273625577165265, 'objective': 'CrossEntropy', 'colsample_bylevel': 0.6190144531259145, 'depth': 7, 'boosting_type': 'Ordered', 'bootstrap_type': 'Bayesian', 'bagging_temperature': 3.1798908300683557}. Best is trial 224 with value: 0.8208191388972359.
[I 2025-04-07 03:37:24,604] Trial 258 finished with value: 0.8179261625730809 and parameters: {'iterations': 177, 'learning_rate': 0.30224553458252906, 'objective': 'CrossEntropy', 'colsample_bylevel': 0.6445417323372233, 'depth': 7, 'boosting_type': 'Plain', 'bootstrap_type': 'Bernoulli', 'subsample': 0.9449670840570065}. Best is trial 224 with value: 0.8208191388972359.
[I 2025-04-07 03:37:50,736] Trial 262 finished with value: 0.8191840593539181 and parameters: {'iterations': 188, 'learning_rate': 0.19938848627462677, 'objective': 'CrossEntropy', 'colsample_bylevel': 0.7093066337341477, 'depth': 7, 'boosting_type': 'Ordered', 'bootstrap_type': 'Bernoulli', 'subsample': 0.9344649372399698}. Best is trial 224 with value: 0.8208191388972359.
[I 2025-04-07 03:38:13,913] Trial 267 finished with value: 0.819644976549087 and parameters: {'iterations': 184, 'learning_rate': 0.22718232578499992, 'objective': 'CrossEntropy', 'colsample_bylevel': 0.5061133772296775, 'depth': 7, 'boosting_type': 'Ordered', 'bootstrap_type': 'Bernoulli', 'subsample': 0.9153925746860521}. Best is trial 224 with value: 0.8208191388972359.
[I 2025-04-07 03:38:39,410] Trial 270 finished with value: 0.790298685026737 and parameters: {'iterations': 173, 'learning_rate': 0.002272741951588088, 'objective': 'CrossEntropy', 'colsample_bylevel': 0.7717332539401375, 'depth': 7, 'boosting_type': 'Ordered', 'bootstrap_type': 'Bernoulli', 'subsample': 0.9606026534314811}. Best is trial 224 with value: 0.8208191388972359.
[I 2025-04-07 03:38:53,193] Trial 275 finished with value: 0.8165431825410634 and parameters: {'iterations': 113, 'learning_rate': 0.15206577458369452, 'objective': 'CrossEntropy', 'colsample_bylevel': 0.5229761748687732, 'depth': 7, 'boosting_type': 'Ordered', 'bootstrap_type': 'Bernoulli', 'subsample': 0.9008065916887472}. Best is trial 224 with value: 0.8208191388972359.
[I 2025-04-07 03:39:17,648] Trial 278 finished with value: 0.8191002546299957 and parameters: {'iterations': 191, 'learning_rate': 0.1801926096269939, 'objective': 'CrossEntropy', 'colsample_bylevel': 0.5530215312517528, 'depth': 7, 'boosting_type': 'Ordered', 'bootstrap_type': 'Bernoulli', 'subsample': 0.8788856298848956}. Best is trial 224 with value: 0.8208191388972359.
[I 2025-04-07 03:39:42,949] Trial 282 finished with value: 0.819016045731477 and parameters: {'iterations': 197, 'learning_rate': 0.2223099689014417, 'objective': 'CrossEntropy', 'colsample_bylevel': 0.5011977863418171, 'depth': 7, 'boosting_type': 'Ordered', 'bootstrap_type': 'Bernoulli', 'subsample': 0.9319385751845034}. Best is trial 224 with value: 0.8208191388972359.
[I 2025-04-07 03:40:08,895] Trial 286 finished with value: 0.8182615747696644 and parameters: {'iterations': 171, 'learning_rate': 0.3226477118384383, 'objective': 'CrossEntropy', 'colsample_bylevel': 0.7935104260813216, 'depth': 7, 'boosting_type': 'Ordered', 'bootstrap_type': 'Bernoulli', 'subsample': 0.9817052553042616}. Best is trial 224 with value: 0.8208191388972359.
[I 2025-04-07 03:40:33,577] Trial 291 finished with value: 0.8188484890020578 and parameters: {'iterations': 186, 'learning_rate': 0.2834542502228095, 'objective': 'CrossEntropy', 'colsample_bylevel': 0.5771545395236127, 'depth': 7, 'boosting_type': 'Ordered', 'bootstrap_type': 'Bernoulli', 'subsample': 0.9055614299524524}. Best is trial 224 with value: 0.8208191388972359.
[I 2025-04-07 03:40:48,069] Trial 296 finished with value: 0.8180103011803656 and parameters: {'iterations': 71, 'learning_rate': 0.2326704322315673, 'objective': 'CrossEntropy', 'colsample_bylevel': 0.5672912297673947, 'depth': 8, 'boosting_type': 'Ordered', 'bootstrap_type': 'Bernoulli', 'subsample': 0.8771649264112821}. Best is trial 224 with value: 0.8208191388972359.
[I 2025-04-07 03:41:14,189] Trial 299 finished with value: 0.8183036792189238 and parameters: {'iterations': 192, 'learning_rate': 0.33705783978595505, 'objective': 'Logloss', 'colsample_bylevel': 0.6101939693451384, 'depth': 7, 'boosting_type': 'Ordered', 'bootstrap_type': 'Bernoulli', 'subsample': 0.9269814477477479}. Best is trial 224 with value: 0.8208191388972359.
[I 2025-04-07 03:42:22,084] Trial 301 finished with value: 0.8188064899896496 and parameters: {'iterations': 183, 'learning_rate': 0.23856064933359747, 'objective': 'Logloss', 'colsample_bylevel': 0.5464364143902857, 'depth': 9, 'boosting_type': 'Ordered', 'bootstrap_type': 'Bernoulli', 'subsample': 0.9474947604824664}. Best is trial 224 with value: 0.8208191388972359.
[I 2025-04-07 03:43:36,791] Trial 307 finished with value: 0.8201899972059234 and parameters: {'iterations': 180, 'learning_rate': 0.18158440388661387, 'objective': 'Logloss', 'colsample_bylevel': 0.642555311184286, 'depth': 9, 'boosting_type': 'Ordered', 'bootstrap_type': 'Bernoulli', 'subsample': 0.9273450762136707}. Best is trial 224 with value: 0.8208191388972359.
[I 2025-04-07 03:44:42,775] Trial 311 finished with value: 0.8193516336561458 and parameters: {'iterations': 169, 'learning_rate': 0.17019625580100287, 'objective': 'Logloss', 'colsample_bylevel': 0.6110132193074692, 'depth': 9, 'boosting_type': 'Ordered', 'bootstrap_type': 'MVS', 'subsample': 0.9205152142056665}. Best is trial 224 with value: 0.8208191388972359.
[I 2025-04-07 03:45:57,264] Trial 314 finished with value: 0.8200645097801467 and parameters: {'iterations': 196, 'learning_rate': 0.14170681896898826, 'objective': 'Logloss', 'colsample_bylevel': 0.5941058390345122, 'depth': 9, 'boosting_type': 'Ordered', 'bootstrap_type': 'Bernoulli', 'subsample': 0.9706007886837387}. Best is trial 224 with value: 0.8208191388972359.
[I 2025-04-07 03:47:51,788] Trial 319 finished with value: 0.8194355438169193 and parameters: {'iterations': 201, 'learning_rate': 0.13821895108334997, 'objective': 'Logloss', 'colsample_bylevel': 0.6914695365676121, 'depth': 9, 'boosting_type': 'Ordered', 'bootstrap_type': 'Bernoulli', 'subsample': 0.9988752126909826}. Best is trial 224 with value: 0.8208191388972359.
[I 2025-04-07 03:49:55,922] Trial 324 finished with value: 0.8198969003323017 and parameters: {'iterations': 202, 'learning_rate': 0.17139139651083632, 'objective': 'Logloss', 'colsample_bylevel': 0.6376645071050531, 'depth': 9, 'boosting_type': 'Ordered', 'bootstrap_type': 'Bernoulli', 'subsample': 0.9683446876154197}. Best is trial 224 with value: 0.8208191388972359.
[I 2025-04-07 03:51:16,143] Trial 328 finished with value: 0.8196033465656581 and parameters: {'iterations': 184, 'learning_rate': 0.18350723436150834, 'objective': 'Logloss', 'colsample_bylevel': 0.6598946750348247, 'depth': 9, 'boosting_type': 'Ordered', 'bootstrap_type': 'Bernoulli', 'subsample': 0.9539307422249157}. Best is trial 224 with value: 0.8208191388972359.
[I 2025-04-07 03:52:36,468] Trial 332 finished with value: 0.819016309323605 and parameters: {'iterations': 179, 'learning_rate': 0.21189437868408578, 'objective': 'Logloss', 'colsample_bylevel': 0.8316673987626266, 'depth': 9, 'boosting_type': 'Ordered', 'bootstrap_type': 'Bernoulli', 'subsample': 0.9494719838510234}. Best is trial 224 with value: 0.8208191388972359.
[I 2025-04-07 03:53:59,061] Trial 338 finished with value: 0.8118894283741109 and parameters: {'iterations': 190, 'learning_rate': 0.22146745670742896, 'objective': 'Logloss', 'colsample_bylevel': 0.6419606966632129, 'depth': 9, 'boosting_type': 'Ordered', 'bootstrap_type': 'Bayesian', 'bagging_temperature': 6.9345991968020115}. Best is trial 224 with value: 0.8208191388972359.
[I 2025-04-07 03:55:22,020] Trial 342 finished with value: 0.8200642989064442 and parameters: {'iterations': 193, 'learning_rate': 0.2374967217780115, 'objective': 'Logloss', 'colsample_bylevel': 0.6261096730297417, 'depth': 9, 'boosting_type': 'Ordered', 'bootstrap_type': 'Bernoulli', 'subsample': 0.9722238471661123}. Best is trial 224 with value: 0.8208191388972359.
[I 2025-04-07 03:56:32,991] Trial 346 finished with value: 0.8192259353566664 and parameters: {'iterations': 194, 'learning_rate': 0.17303935922144117, 'objective': 'Logloss', 'colsample_bylevel': 0.6138189609820273, 'depth': 9, 'boosting_type': 'Ordered', 'bootstrap_type': 'Bernoulli', 'subsample': 0.9842475690472697}. Best is trial 224 with value: 0.8208191388972359.
訓練集準確率: 0.8332704481616569
測試集準確率: 0.8110328638497653
10-fold CV 準確率:  0.8208191388972359

