[I 2025-04-07 02:55:29,127] Using an existing study with name 'catboost' instead of creating a new one.
[I 2025-04-07 02:56:02,828] Trial 3 finished with value: 0.7932332210430868 and parameters: {'iterations': 81, 'learning_rate': 0.001430158012731914, 'objective': 'Logloss', 'colsample_bylevel': 0.5583190320726895, 'depth': 9, 'boosting_type': 'Ordered', 'bootstrap_type': 'MVS', 'subsample': 0.46363088721983114}. Best is trial 2 with value: 0.793610649824887.
[I 2025-04-07 02:56:35,231] Trial 7 finished with value: 0.7991027323959997 and parameters: {'iterations': 132, 'learning_rate': 0.03137097400571258, 'objective': 'CrossEntropy', 'colsample_bylevel': 0.7568583918981976, 'depth': 8, 'boosting_type': 'Ordered', 'bootstrap_type': 'Bayesian', 'bagging_temperature': 5.939317292490999}. Best is trial 4 with value: 0.8079485679039682.
[I 2025-04-07 02:56:57,731] Trial 13 finished with value: 0.8133147237290904 and parameters: {'iterations': 241, 'learning_rate': 0.17976668538510768, 'objective': 'CrossEntropy', 'colsample_bylevel': 0.13715753843605089, 'depth': 9, 'boosting_type': 'Plain', 'bootstrap_type': 'Bernoulli', 'subsample': 0.8027522240783157}. Best is trial 13 with value: 0.8133147237290904.
[I 2025-04-07 02:57:17,419] Trial 17 finished with value: 0.8132725665614056 and parameters: {'iterations': 252, 'learning_rate': 0.14186707231592754, 'objective': 'CrossEntropy', 'colsample_bylevel': 0.12344583651188173, 'depth': 9, 'boosting_type': 'Plain', 'bootstrap_type': 'Bernoulli', 'subsample': 0.7702381257553874}. Best is trial 13 with value: 0.8133147237290904.
[I 2025-04-07 02:57:34,068] Trial 18 finished with value: 0.8122247527066518 and parameters: {'iterations': 254, 'learning_rate': 0.1581868318955894, 'objective': 'CrossEntropy', 'colsample_bylevel': 0.1123858200377593, 'depth': 9, 'boosting_type': 'Plain', 'bootstrap_type': 'Bernoulli', 'subsample': 0.7542079983823791}. Best is trial 13 with value: 0.8133147237290904.
[I 2025-04-07 02:57:52,814] Trial 19 finished with value: 0.814237173167727 and parameters: {'iterations': 233, 'learning_rate': 0.1087518925466514, 'objective': 'CrossEntropy', 'colsample_bylevel': 0.20040548230184663, 'depth': 7, 'boosting_type': 'Plain', 'bootstrap_type': 'Bernoulli', 'subsample': 0.6459150058536367}. Best is trial 19 with value: 0.814237173167727.
[I 2025-04-07 02:58:11,144] Trial 20 finished with value: 0.8159978631464817 and parameters: {'iterations': 225, 'learning_rate': 0.12854643960065176, 'objective': 'CrossEntropy', 'colsample_bylevel': 0.2362729443142344, 'depth': 7, 'boosting_type': 'Plain', 'bootstrap_type': 'Bernoulli', 'subsample': 0.63431053261279}. Best is trial 20 with value: 0.8159978631464817.
[I 2025-04-07 02:59:20,949] Trial 22 finished with value: 0.8132727598622994 and parameters: {'iterations': 222, 'learning_rate': 0.37471039607459206, 'objective': 'CrossEntropy', 'colsample_bylevel': 0.9435597061506764, 'depth': 7, 'boosting_type': 'Ordered', 'bootstrap_type': 'Bernoulli', 'subsample': 0.5934532765802749}. Best is trial 20 with value: 0.8159978631464817.
[I 2025-04-07 03:00:13,610] Trial 24 finished with value: 0.8119732858164591 and parameters: {'iterations': 229, 'learning_rate': 0.07206419715931221, 'objective': 'CrossEntropy', 'colsample_bylevel': 0.2284496008123344, 'depth': 6, 'boosting_type': 'Ordered', 'bootstrap_type': 'Bernoulli', 'subsample': 0.9843437031250235}. Best is trial 20 with value: 0.8159978631464817.
[I 2025-04-07 03:00:28,920] Trial 30 finished with value: 0.818764701850944 and parameters: {'iterations': 184, 'learning_rate': 0.27067840564034806, 'objective': 'CrossEntropy', 'colsample_bylevel': 0.8533605594832282, 'depth': 5, 'boosting_type': 'Ordered', 'bootstrap_type': 'Bernoulli', 'subsample': 0.5460633348427139}. Best is trial 29 with value: 0.8192257596285811.
[I 2025-04-07 03:00:41,050] Trial 32 finished with value: 0.815871725526789 and parameters: {'iterations': 152, 'learning_rate': 0.5449010003933026, 'objective': 'CrossEntropy', 'colsample_bylevel': 0.8269685309835211, 'depth': 5, 'boosting_type': 'Ordered', 'bootstrap_type': 'Bernoulli', 'subsample': 0.5400415342847067}. Best is trial 31 with value: 0.8192259177838579.
[I 2025-04-07 03:00:57,200] Trial 34 finished with value: 0.818177928201019 and parameters: {'iterations': 188, 'learning_rate': 0.22451084680864533, 'objective': 'CrossEntropy', 'colsample_bylevel': 0.8117170123522509, 'depth': 5, 'boosting_type': 'Ordered', 'bootstrap_type': 'Bernoulli', 'subsample': 0.8739897244578344}. Best is trial 31 with value: 0.8192259177838579.
[I 2025-04-07 03:01:11,239] Trial 37 finished with value: 0.8150751149700998 and parameters: {'iterations': 152, 'learning_rate': 0.783201308813124, 'objective': 'CrossEntropy', 'colsample_bylevel': 0.8728384049921895, 'depth': 5, 'boosting_type': 'Ordered', 'bootstrap_type': 'Bernoulli', 'subsample': 0.9019745707114175}. Best is trial 31 with value: 0.8192259177838579.
[I 2025-04-07 03:01:18,471] Trial 40 finished with value: 0.8154947184923935 and parameters: {'iterations': 113, 'learning_rate': 0.3225208355330728, 'objective': 'Logloss', 'colsample_bylevel': 0.5930298586057338, 'depth': 4, 'boosting_type': 'Ordered', 'bootstrap_type': 'MVS', 'subsample': 0.8180133448267813}. Best is trial 31 with value: 0.8192259177838579.
[I 2025-04-07 03:01:34,448] Trial 43 finished with value: 0.8042176146318232 and parameters: {'iterations': 166, 'learning_rate': 0.03645637650334463, 'objective': 'Logloss', 'colsample_bylevel': 0.7541210489355495, 'depth': 5, 'boosting_type': 'Ordered', 'bootstrap_type': 'MVS', 'subsample': 0.9698522997558248}. Best is trial 31 with value: 0.8192259177838579.
[I 2025-04-07 03:02:00,449] Trial 47 finished with value: 0.8203578175274707 and parameters: {'iterations': 188, 'learning_rate': 0.20113050906433294, 'objective': 'CrossEntropy', 'colsample_bylevel': 0.9057157187089582, 'depth': 6, 'boosting_type': 'Ordered', 'bootstrap_type': 'Bernoulli', 'subsample': 0.93256045054456}. Best is trial 47 with value: 0.8203578175274707.
[I 2025-04-07 03:02:56,068] Trial 51 finished with value: 0.8083679781253679 and parameters: {'iterations': 204, 'learning_rate': 0.10420909843747765, 'objective': 'CrossEntropy', 'colsample_bylevel': 0.9080294383300974, 'depth': 6, 'boosting_type': 'Ordered', 'bootstrap_type': 'Bayesian', 'bagging_temperature': 4.000718879465115}. Best is trial 47 with value: 0.8203578175274707.
[I 2025-04-07 03:03:20,513] Trial 55 finished with value: 0.8011989927266144 and parameters: {'iterations': 180, 'learning_rate': 0.01915629454602274, 'objective': 'CrossEntropy', 'colsample_bylevel': 0.9333578899352708, 'depth': 6, 'boosting_type': 'Ordered', 'bootstrap_type': 'Bernoulli', 'subsample': 0.8465701761770531}. Best is trial 47 with value: 0.8203578175274707.
[I 2025-04-07 03:03:33,235] Trial 60 finished with value: 0.8167103878143116 and parameters: {'iterations': 163, 'learning_rate': 0.46824268968993704, 'objective': 'CrossEntropy', 'colsample_bylevel': 0.3878278012684309, 'depth': 5, 'boosting_type': 'Ordered', 'bootstrap_type': 'Bernoulli', 'subsample': 0.7666597948507646}. Best is trial 47 with value: 0.8203578175274707.
[I 2025-04-07 03:03:48,470] Trial 64 finished with value: 0.8178007102929211 and parameters: {'iterations': 171, 'learning_rate': 0.167136259221532, 'objective': 'CrossEntropy', 'colsample_bylevel': 0.800911585855753, 'depth': 5, 'boosting_type': 'Ordered', 'bootstrap_type': 'Bernoulli', 'subsample': 0.9379315862956613}. Best is trial 47 with value: 0.8203578175274707.
[I 2025-04-07 03:04:02,430] Trial 68 finished with value: 0.8169621885878666 and parameters: {'iterations': 189, 'learning_rate': 0.33038712741967075, 'objective': 'CrossEntropy', 'colsample_bylevel': 0.9935880747366109, 'depth': 5, 'boosting_type': 'Ordered', 'bootstrap_type': 'Bernoulli', 'subsample': 0.26152493194782317}. Best is trial 47 with value: 0.8203578175274707.
[I 2025-04-07 03:04:13,233] Trial 72 finished with value: 0.8170877990233032 and parameters: {'iterations': 198, 'learning_rate': 0.377027660530546, 'objective': 'CrossEntropy', 'colsample_bylevel': 0.9593528677490472, 'depth': 6, 'boosting_type': 'Plain', 'bootstrap_type': 'Bernoulli', 'subsample': 0.9977027112504392}. Best is trial 47 with value: 0.8203578175274707.
[I 2025-04-07 03:05:11,446] Trial 75 finished with value: 0.818428850334147 and parameters: {'iterations': 203, 'learning_rate': 0.23741096892737468, 'objective': 'CrossEntropy', 'colsample_bylevel': 0.720130937915405, 'depth': 6, 'boosting_type': 'Ordered', 'bootstrap_type': 'Bernoulli', 'subsample': 0.8868981502370656}. Best is trial 47 with value: 0.8203578175274707.
[I 2025-04-07 03:05:38,884] Trial 79 finished with value: 0.8178844447256093 and parameters: {'iterations': 185, 'learning_rate': 0.13916426244516436, 'objective': 'CrossEntropy', 'colsample_bylevel': 0.6503038029147392, 'depth': 7, 'boosting_type': 'Ordered', 'bootstrap_type': 'Bernoulli', 'subsample': 0.9526221012892367}. Best is trial 47 with value: 0.8203578175274707.
[I 2025-04-07 03:05:54,402] Trial 82 finished with value: 0.8117637300746319 and parameters: {'iterations': 158, 'learning_rate': 0.08637541796584192, 'objective': 'Logloss', 'colsample_bylevel': 0.9760986817371433, 'depth': 5, 'boosting_type': 'Ordered', 'bootstrap_type': 'MVS', 'subsample': 0.8181821022523106}. Best is trial 47 with value: 0.8203578175274707.
[I 2025-04-07 03:06:12,249] Trial 84 finished with value: 0.8180520717462627 and parameters: {'iterations': 192, 'learning_rate': 0.45930412721950603, 'objective': 'CrossEntropy', 'colsample_bylevel': 0.5188805246151529, 'depth': 5, 'boosting_type': 'Ordered', 'bootstrap_type': 'Bernoulli', 'subsample': 0.874243759016188}. Best is trial 47 with value: 0.8203578175274707.
[I 2025-04-07 03:06:26,368] Trial 87 finished with value: 0.8177167298409135 and parameters: {'iterations': 175, 'learning_rate': 0.3136023901195934, 'objective': 'CrossEntropy', 'colsample_bylevel': 0.8407406812852343, 'depth': 5, 'boosting_type': 'Ordered', 'bootstrap_type': 'Bernoulli', 'subsample': 0.4842294483831124}. Best is trial 47 with value: 0.8203578175274707.
[I 2025-04-07 03:06:42,898] Trial 90 finished with value: 0.8179263207283579 and parameters: {'iterations': 185, 'learning_rate': 0.182867583863167, 'objective': 'CrossEntropy', 'colsample_bylevel': 0.8766737985023962, 'depth': 5, 'boosting_type': 'Ordered', 'bootstrap_type': 'Bernoulli', 'subsample': 0.8307402620370954}. Best is trial 47 with value: 0.8203578175274707.
[I 2025-04-07 03:06:51,468] Trial 95 finished with value: 0.8187226501201101 and parameters: {'iterations': 196, 'learning_rate': 0.27882928416751535, 'objective': 'CrossEntropy', 'colsample_bylevel': 0.9963430374119463, 'depth': 6, 'boosting_type': 'Plain', 'bootstrap_type': 'Bernoulli', 'subsample': 0.9754460243612262}. Best is trial 47 with value: 0.8203578175274707.
[I 2025-04-07 03:07:07,865] Trial 97 finished with value: 0.8106730209942343 and parameters: {'iterations': 206, 'learning_rate': 0.3854255971248085, 'objective': 'CrossEntropy', 'colsample_bylevel': 0.9350458476741249, 'depth': 6, 'boosting_type': 'Plain', 'bootstrap_type': 'Bernoulli', 'subsample': 0.5697491854829484}. Best is trial 47 with value: 0.8203578175274707.
[I 2025-04-07 03:07:30,455] Trial 103 finished with value: 0.8179684076048085 and parameters: {'iterations': 179, 'learning_rate': 0.12619458691365026, 'objective': 'CrossEntropy', 'colsample_bylevel': 0.9793114543144283, 'depth': 6, 'boosting_type': 'Ordered', 'bootstrap_type': 'Bernoulli', 'subsample': 0.9959493782886459}. Best is trial 47 with value: 0.8203578175274707.
[I 2025-04-07 03:07:42,545] Trial 107 finished with value: 0.8162075243251602 and parameters: {'iterations': 175, 'learning_rate': 0.6829250223565628, 'objective': 'CrossEntropy', 'colsample_bylevel': 0.8682123799141719, 'depth': 4, 'boosting_type': 'Ordered', 'bootstrap_type': 'Bernoulli', 'subsample': 0.8641242908138134}. Best is trial 47 with value: 0.8203578175274707.
[I 2025-04-07 03:07:52,544] Trial 109 finished with value: 0.8176749768478248 and parameters: {'iterations': 162, 'learning_rate': 0.20237904419539726, 'objective': 'CrossEntropy', 'colsample_bylevel': 0.9052343354029803, 'depth': 4, 'boosting_type': 'Ordered', 'bootstrap_type': 'Bernoulli', 'subsample': 0.8889381638227692}. Best is trial 47 with value: 0.8203578175274707.
[I 2025-04-07 03:08:47,550] Trial 110 finished with value: 0.7864837864482016 and parameters: {'iterations': 214, 'learning_rate': 0.0010683799884873189, 'objective': 'CrossEntropy', 'colsample_bylevel': 0.8261356498045584, 'depth': 6, 'boosting_type': 'Ordered', 'bootstrap_type': 'Bernoulli', 'subsample': 0.28850843406315874}. Best is trial 47 with value: 0.8203578175274707.
[I 2025-04-07 03:09:01,411] Trial 116 finished with value: 0.8188905934513173 and parameters: {'iterations': 170, 'learning_rate': 0.33813909217821836, 'objective': 'CrossEntropy', 'colsample_bylevel': 0.9883093951585968, 'depth': 5, 'boosting_type': 'Ordered', 'bootstrap_type': 'Bernoulli', 'subsample': 0.5426569326887635}. Best is trial 47 with value: 0.8203578175274707.
[I 2025-04-07 03:09:17,658] Trial 118 finished with value: 0.8168365957252387 and parameters: {'iterations': 170, 'learning_rate': 0.1664803656528238, 'objective': 'CrossEntropy', 'colsample_bylevel': 0.9807044547565053, 'depth': 5, 'boosting_type': 'Ordered', 'bootstrap_type': 'Bernoulli', 'subsample': 0.9441066724495902}. Best is trial 115 with value: 0.8204418331250954.
[I 2025-04-07 03:09:47,060] Trial 122 finished with value: 0.8190580271710765 and parameters: {'iterations': 188, 'learning_rate': 0.22285839121653606, 'objective': 'CrossEntropy', 'colsample_bylevel': 0.7957328328230285, 'depth': 7, 'boosting_type': 'Ordered', 'bootstrap_type': 'Bernoulli', 'subsample': 0.9330644895165237}. Best is trial 115 with value: 0.8204418331250954.
[I 2025-04-07 03:10:30,604] Trial 126 finished with value: 0.8198127617250173 and parameters: {'iterations': 181, 'learning_rate': 0.24866120880108822, 'objective': 'CrossEntropy', 'colsample_bylevel': 0.7183784356810151, 'depth': 8, 'boosting_type': 'Ordered', 'bootstrap_type': 'Bernoulli', 'subsample': 0.9033896439438758}. Best is trial 115 with value: 0.8204418331250954.
[I 2025-04-07 03:11:18,121] Trial 132 finished with value: 0.8191839714898753 and parameters: {'iterations': 198, 'learning_rate': 0.13671619742832472, 'objective': 'CrossEntropy', 'colsample_bylevel': 0.7516508343729292, 'depth': 8, 'boosting_type': 'Ordered', 'bootstrap_type': 'Bernoulli', 'subsample': 0.9645198229628149}. Best is trial 115 with value: 0.8204418331250954.
[I 2025-04-07 03:11:44,460] Trial 136 finished with value: 0.8189745739033251 and parameters: {'iterations': 175, 'learning_rate': 0.18350881056853818, 'objective': 'CrossEntropy', 'colsample_bylevel': 0.7289452844214134, 'depth': 7, 'boosting_type': 'Ordered', 'bootstrap_type': 'Bernoulli', 'subsample': 0.9991902103919047}. Best is trial 135 with value: 0.8204832873804391.
[I 2025-04-07 03:12:26,306] Trial 140 finished with value: 0.8119310583575399 and parameters: {'iterations': 177, 'learning_rate': 0.24167501159096422, 'objective': 'CrossEntropy', 'colsample_bylevel': 0.7043004204679506, 'depth': 8, 'boosting_type': 'Ordered', 'bootstrap_type': 'Bayesian', 'bagging_temperature': 5.535597173299604}. Best is trial 135 with value: 0.8204832873804391.
[I 2025-04-07 03:13:13,500] Trial 145 finished with value: 0.8188487525941858 and parameters: {'iterations': 183, 'learning_rate': 0.17753692590230882, 'objective': 'CrossEntropy', 'colsample_bylevel': 0.7479679337150293, 'depth': 8, 'boosting_type': 'Ordered', 'bootstrap_type': 'Bernoulli', 'subsample': 0.9160926344140157}. Best is trial 135 with value: 0.8204832873804391.
[I 2025-04-07 03:13:41,332] Trial 149 finished with value: 0.8201482442128348 and parameters: {'iterations': 193, 'learning_rate': 0.20281256040713883, 'objective': 'CrossEntropy', 'colsample_bylevel': 0.5685156523463156, 'depth': 7, 'boosting_type': 'Ordered', 'bootstrap_type': 'Bernoulli', 'subsample': 0.9533700604075596}. Best is trial 135 with value: 0.8204832873804391.
[I 2025-04-07 03:14:10,269] Trial 150 finished with value: 0.8191422360695955 and parameters: {'iterations': 193, 'learning_rate': 0.22077373204731607, 'objective': 'CrossEntropy', 'colsample_bylevel': 0.5589426694885267, 'depth': 7, 'boosting_type': 'Ordered', 'bootstrap_type': 'Bernoulli', 'subsample': 0.9591761480689832}. Best is trial 135 with value: 0.8204832873804391.
[I 2025-04-07 03:15:22,928] Trial 153 finished with value: 0.8194771562275397 and parameters: {'iterations': 171, 'learning_rate': 0.20106723276012306, 'objective': 'CrossEntropy', 'colsample_bylevel': 0.7834061430600975, 'depth': 9, 'boosting_type': 'Ordered', 'bootstrap_type': 'Bernoulli', 'subsample': 0.8638030496979572}. Best is trial 135 with value: 0.8204832873804391.
[I 2025-04-07 03:16:37,861] Trial 158 finished with value: 0.8178426565869037 and parameters: {'iterations': 180, 'learning_rate': 0.17719430885570336, 'objective': 'CrossEntropy', 'colsample_bylevel': 0.5923491967109294, 'depth': 9, 'boosting_type': 'Ordered', 'bootstrap_type': 'Bernoulli', 'subsample': 0.8603438021050304}. Best is trial 135 with value: 0.8204832873804391.
[I 2025-04-07 03:17:43,524] Trial 162 finished with value: 0.8195194012592675 and parameters: {'iterations': 171, 'learning_rate': 0.18892946276724973, 'objective': 'Logloss', 'colsample_bylevel': 0.5445869073516534, 'depth': 9, 'boosting_type': 'Ordered', 'bootstrap_type': 'Bernoulli', 'subsample': 0.8932361113587584}. Best is trial 135 with value: 0.8204832873804391.
[I 2025-04-07 03:18:51,988] Trial 166 finished with value: 0.8203996759574105 and parameters: {'iterations': 166, 'learning_rate': 0.2817438620553287, 'objective': 'Logloss', 'colsample_bylevel': 0.5552375753840328, 'depth': 9, 'boosting_type': 'Ordered', 'bootstrap_type': 'Bernoulli', 'subsample': 0.8997138171161255}. Best is trial 135 with value: 0.8204832873804391.
[I 2025-04-07 03:19:50,923] Trial 170 finished with value: 0.8190997977369736 and parameters: {'iterations': 155, 'learning_rate': 0.341031021497257, 'objective': 'Logloss', 'colsample_bylevel': 0.4973204764029494, 'depth': 9, 'boosting_type': 'Ordered', 'bootstrap_type': 'Bernoulli', 'subsample': 0.932771102999133}. Best is trial 135 with value: 0.8204832873804391.
[I 2025-04-07 03:20:55,863] Trial 174 finished with value: 0.7959583946185032 and parameters: {'iterations': 164, 'learning_rate': 0.006637826004181557, 'objective': 'Logloss', 'colsample_bylevel': 0.5778817138787673, 'depth': 9, 'boosting_type': 'Ordered', 'bootstrap_type': 'Bernoulli', 'subsample': 0.9104575650003729}. Best is trial 135 with value: 0.8204832873804391.
[I 2025-04-07 03:21:20,683] Trial 178 finished with value: 0.819477296810008 and parameters: {'iterations': 178, 'learning_rate': 0.23668765821428758, 'objective': 'Logloss', 'colsample_bylevel': 0.538292015627897, 'depth': 7, 'boosting_type': 'Ordered', 'bootstrap_type': 'Bernoulli', 'subsample': 0.9482004546705894}. Best is trial 135 with value: 0.8204832873804391.
[I 2025-04-07 03:21:47,463] Trial 181 finished with value: 0.8182618032161754 and parameters: {'iterations': 191, 'learning_rate': 0.44723377104507367, 'objective': 'Logloss', 'colsample_bylevel': 0.6217333758091973, 'depth': 7, 'boosting_type': 'Ordered', 'bootstrap_type': 'Bernoulli', 'subsample': 0.8797606104142632}. Best is trial 177 with value: 0.8206089681071098.
[I 2025-04-07 03:22:50,339] Trial 186 finished with value: 0.8179259516993784 and parameters: {'iterations': 160, 'learning_rate': 0.4098979908476103, 'objective': 'Logloss', 'colsample_bylevel': 0.5600594733852751, 'depth': 9, 'boosting_type': 'Ordered', 'bootstrap_type': 'Bernoulli', 'subsample': 0.9031291216599187}. Best is trial 177 with value: 0.8206089681071098.
[I 2025-04-07 03:23:54,862] Trial 189 finished with value: 0.8178424808588183 and parameters: {'iterations': 156, 'learning_rate': 0.3101928989155169, 'objective': 'Logloss', 'colsample_bylevel': 0.5835405882908026, 'depth': 9, 'boosting_type': 'Ordered', 'bootstrap_type': 'Bernoulli', 'subsample': 0.9207941298584811}. Best is trial 177 with value: 0.8206089681071098.
[I 2025-04-07 03:25:01,005] Trial 193 finished with value: 0.818806595426501 and parameters: {'iterations': 175, 'learning_rate': 0.2637414179951187, 'objective': 'Logloss', 'colsample_bylevel': 0.5170601579901719, 'depth': 9, 'boosting_type': 'Ordered', 'bootstrap_type': 'Bernoulli', 'subsample': 0.9607566282491684}. Best is trial 177 with value: 0.8206089681071098.
[I 2025-04-07 03:26:10,684] Trial 197 finished with value: 0.8191835848880876 and parameters: {'iterations': 187, 'learning_rate': 0.2992622603419253, 'objective': 'Logloss', 'colsample_bylevel': 0.48811752959059035, 'depth': 9, 'boosting_type': 'Ordered', 'bootstrap_type': 'Bernoulli', 'subsample': 0.9366053634319094}. Best is trial 177 with value: 0.8206089681071098.
[I 2025-04-07 03:26:49,592] Trial 202 finished with value: 0.8186390386970815 and parameters: {'iterations': 195, 'learning_rate': 0.22533641023272774, 'objective': 'Logloss', 'colsample_bylevel': 0.45278568544799963, 'depth': 8, 'boosting_type': 'Ordered', 'bootstrap_type': 'Bernoulli', 'subsample': 0.9746593362975724}. Best is trial 177 with value: 0.8206089681071098.
[I 2025-04-07 03:27:25,887] Trial 207 finished with value: 0.8175908558133486 and parameters: {'iterations': 104, 'learning_rate': 0.36548733309161446, 'objective': 'Logloss', 'colsample_bylevel': 0.4055343801795854, 'depth': 9, 'boosting_type': 'Ordered', 'bootstrap_type': 'Bernoulli', 'subsample': 0.9278761509553078}. Best is trial 177 with value: 0.8206089681071098.
