[I 2025-04-07 02:55:29,055] Using an existing study with name 'catboost' instead of creating a new one.
[I 2025-04-07 02:56:02,582] Trial 2 finished with value: 0.793610649824887 and parameters: {'iterations': 173, 'learning_rate': 0.008619668014613786, 'objective': 'Logloss', 'colsample_bylevel': 0.3301536680500068, 'depth': 8, 'boosting_type': 'Ordered', 'bootstrap_type': 'MVS', 'subsample': 0.8635165072647778}. Best is trial 2 with value: 0.793610649824887.
[I 2025-04-07 02:56:29,000] Trial 6 finished with value: 0.7941976694941315 and parameters: {'iterations': 201, 'learning_rate': 0.003873927668212545, 'objective': 'Logloss', 'colsample_bylevel': 0.5001473107272045, 'depth': 8, 'boosting_type': 'Plain', 'bootstrap_type': 'MVS', 'subsample': 0.41279292885557617}. Best is trial 4 with value: 0.8079485679039682.
[I 2025-04-07 02:56:39,998] Trial 11 finished with value: 0.8050138210139159 and parameters: {'iterations': 244, 'learning_rate': 0.7716294475136979, 'objective': 'Logloss', 'colsample_bylevel': 0.11472153374807746, 'depth': 4, 'boosting_type': 'Plain', 'bootstrap_type': 'Bayesian', 'bagging_temperature': 7.446040545560759}. Best is trial 4 with value: 0.8079485679039682.
[I 2025-04-07 02:57:56,162] Trial 15 finished with value: 0.815871989118917 and parameters: {'iterations': 244, 'learning_rate': 0.29732200797114994, 'objective': 'CrossEntropy', 'colsample_bylevel': 0.9622090477829067, 'depth': 7, 'boosting_type': 'Ordered', 'bootstrap_type': 'Bernoulli', 'subsample': 0.6982940077098556}. Best is trial 15 with value: 0.815871989118917.
[I 2025-04-07 02:59:08,929] Trial 21 finished with value: 0.8138595510850332 and parameters: {'iterations': 227, 'learning_rate': 0.3898717420844765, 'objective': 'CrossEntropy', 'colsample_bylevel': 0.9812990166533027, 'depth': 7, 'boosting_type': 'Ordered', 'bootstrap_type': 'Bernoulli', 'subsample': 0.615969739120177}. Best is trial 20 with value: 0.8159978631464817.
[I 2025-04-07 02:59:23,997] Trial 23 finished with value: 0.8052656042146623 and parameters: {'iterations': 97, 'learning_rate': 0.06250488003831706, 'objective': 'CrossEntropy', 'colsample_bylevel': 0.8886343020547879, 'depth': 6, 'boosting_type': 'Ordered', 'bootstrap_type': 'Bernoulli', 'subsample': 0.9794114534704288}. Best is trial 20 with value: 0.8159978631464817.
[I 2025-04-07 02:59:43,360] Trial 25 finished with value: 0.8130212402536809 and parameters: {'iterations': 229, 'learning_rate': 0.06533224145933182, 'objective': 'CrossEntropy', 'colsample_bylevel': 0.2316364872620701, 'depth': 7, 'boosting_type': 'Plain', 'bootstrap_type': 'Bernoulli', 'subsample': 0.6668741121545766}. Best is trial 20 with value: 0.8159978631464817.
[I 2025-04-07 03:00:51,125] Trial 26 finished with value: 0.8139436369738922 and parameters: {'iterations': 231, 'learning_rate': 0.07143804960843836, 'objective': 'CrossEntropy', 'colsample_bylevel': 0.22917796373273808, 'depth': 8, 'boosting_type': 'Ordered', 'bootstrap_type': 'Bernoulli', 'subsample': 0.6741677629499007}. Best is trial 31 with value: 0.8192259177838579.
[I 2025-04-07 03:01:07,124] Trial 36 finished with value: 0.8161655253127522 and parameters: {'iterations': 178, 'learning_rate': 0.6845199992933828, 'objective': 'CrossEntropy', 'colsample_bylevel': 0.8255268249962044, 'depth': 5, 'boosting_type': 'Ordered', 'bootstrap_type': 'Bernoulli', 'subsample': 0.885908956460432}. Best is trial 31 with value: 0.8192259177838579.
[I 2025-04-07 03:01:16,888] Trial 39 finished with value: 0.8109249447774491 and parameters: {'iterations': 155, 'learning_rate': 0.9374045201061414, 'objective': 'CrossEntropy', 'colsample_bylevel': 0.6123616918798084, 'depth': 4, 'boosting_type': 'Ordered', 'bootstrap_type': 'Bayesian', 'bagging_temperature': 2.2976274235398133}. Best is trial 31 with value: 0.8192259177838579.
[I 2025-04-07 03:01:28,328] Trial 42 finished with value: 0.8011570991510576 and parameters: {'iterations': 113, 'learning_rate': 0.03999649375478303, 'objective': 'Logloss', 'colsample_bylevel': 0.7500509762935819, 'depth': 5, 'boosting_type': 'Ordered', 'bootstrap_type': 'MVS', 'subsample': 0.8420753750185052}. Best is trial 31 with value: 0.8192259177838579.
[I 2025-04-07 03:01:44,865] Trial 46 finished with value: 0.8184714116764283 and parameters: {'iterations': 191, 'learning_rate': 0.19511250034266833, 'objective': 'CrossEntropy', 'colsample_bylevel': 0.8844776679185157, 'depth': 5, 'boosting_type': 'Ordered', 'bootstrap_type': 'Bernoulli', 'subsample': 0.9362910133556025}. Best is trial 44 with value: 0.8193519323938909.
[I 2025-04-07 03:02:16,257] Trial 50 finished with value: 0.8170878517417289 and parameters: {'iterations': 199, 'learning_rate': 0.1161492456962438, 'objective': 'CrossEntropy', 'colsample_bylevel': 0.688458209858971, 'depth': 6, 'boosting_type': 'Ordered', 'bootstrap_type': 'Bernoulli', 'subsample': 0.9547955920743041}. Best is trial 47 with value: 0.8203578175274707.
[I 2025-04-07 03:03:12,012] Trial 54 finished with value: 0.817632960262608 and parameters: {'iterations': 214, 'learning_rate': 0.10990800705395223, 'objective': 'CrossEntropy', 'colsample_bylevel': 0.9209512197239895, 'depth': 6, 'boosting_type': 'Ordered', 'bootstrap_type': 'Bernoulli', 'subsample': 0.9998856843909243}. Best is trial 47 with value: 0.8203578175274707.
[I 2025-04-07 03:03:27,072] Trial 58 finished with value: 0.8007797055148744 and parameters: {'iterations': 183, 'learning_rate': 0.02156722354055395, 'objective': 'CrossEntropy', 'colsample_bylevel': 0.8573298587925747, 'depth': 5, 'boosting_type': 'Ordered', 'bootstrap_type': 'Bernoulli', 'subsample': 0.8482120132695867}. Best is trial 47 with value: 0.8203578175274707.
[I 2025-04-07 03:03:37,996] Trial 61 finished with value: 0.8174233166567382 and parameters: {'iterations': 167, 'learning_rate': 0.2646753014368985, 'objective': 'CrossEntropy', 'colsample_bylevel': 0.7802776267279095, 'depth': 4, 'boosting_type': 'Ordered', 'bootstrap_type': 'Bernoulli', 'subsample': 0.7669023914844737}. Best is trial 47 with value: 0.8203578175274707.
[I 2025-04-07 03:03:55,346] Trial 66 finished with value: 0.8193937908238309 and parameters: {'iterations': 197, 'learning_rate': 0.14696545784062845, 'objective': 'CrossEntropy', 'colsample_bylevel': 0.7120746280908847, 'depth': 5, 'boosting_type': 'Ordered', 'bootstrap_type': 'Bernoulli', 'subsample': 0.9433062368292519}. Best is trial 47 with value: 0.8203578175274707.
[I 2025-04-07 03:04:51,529] Trial 70 finished with value: 0.8180936138656488 and parameters: {'iterations': 200, 'learning_rate': 0.33205957321815766, 'objective': 'CrossEntropy', 'colsample_bylevel': 0.7261730890249412, 'depth': 6, 'boosting_type': 'Ordered', 'bootstrap_type': 'Bernoulli', 'subsample': 0.5817494107489002}. Best is trial 47 with value: 0.8203578175274707.
[I 2025-04-07 03:05:59,112] Trial 76 finished with value: 0.8183033277627529 and parameters: {'iterations': 207, 'learning_rate': 0.23481524104850854, 'objective': 'CrossEntropy', 'colsample_bylevel': 0.9525075742879537, 'depth': 7, 'boosting_type': 'Ordered', 'bootstrap_type': 'Bernoulli', 'subsample': 0.8780367217476928}. Best is trial 47 with value: 0.8203578175274707.
[I 2025-04-07 03:06:16,665] Trial 85 finished with value: 0.8175489095193662 and parameters: {'iterations': 193, 'learning_rate': 0.46013810705436736, 'objective': 'CrossEntropy', 'colsample_bylevel': 0.8415981021659311, 'depth': 5, 'boosting_type': 'Ordered', 'bootstrap_type': 'Bernoulli', 'subsample': 0.9099804210958203}. Best is trial 47 with value: 0.8203578175274707.
[I 2025-04-07 03:06:33,892] Trial 89 finished with value: 0.8176746253916539 and parameters: {'iterations': 185, 'learning_rate': 0.5945869531167506, 'objective': 'CrossEntropy', 'colsample_bylevel': 0.8880741130094864, 'depth': 5, 'boosting_type': 'Ordered', 'bootstrap_type': 'Bernoulli', 'subsample': 0.8312064074312495}. Best is trial 47 with value: 0.8203578175274707.
[I 2025-04-07 03:06:53,813] Trial 93 finished with value: 0.818177506453614 and parameters: {'iterations': 210, 'learning_rate': 0.18595769805482928, 'objective': 'CrossEntropy', 'colsample_bylevel': 0.9288200025020608, 'depth': 6, 'boosting_type': 'Plain', 'bootstrap_type': 'Bayesian', 'bagging_temperature': 0.26763294170854834}. Best is trial 47 with value: 0.8203578175274707.
[I 2025-04-07 03:07:03,533] Trial 98 finished with value: 0.8171295695892005 and parameters: {'iterations': 190, 'learning_rate': 0.3926908108858209, 'objective': 'CrossEntropy', 'colsample_bylevel': 0.9432258120672794, 'depth': 6, 'boosting_type': 'Plain', 'bootstrap_type': 'Bernoulli', 'subsample': 0.923931392500148}. Best is trial 47 with value: 0.8203578175274707.
[I 2025-04-07 03:08:00,272] Trial 101 finished with value: 0.8095838407481798 and parameters: {'iterations': 205, 'learning_rate': 0.6804382569967331, 'objective': 'CrossEntropy', 'colsample_bylevel': 0.9097276477946298, 'depth': 6, 'boosting_type': 'Ordered', 'bootstrap_type': 'Bernoulli', 'subsample': 0.8975857710682662}. Best is trial 47 with value: 0.8203578175274707.
[I 2025-04-07 03:09:03,124] Trial 113 finished with value: 0.8185130943782829 and parameters: {'iterations': 212, 'learning_rate': 0.15086756781049224, 'objective': 'Logloss', 'colsample_bylevel': 0.7650785895292059, 'depth': 7, 'boosting_type': 'Ordered', 'bootstrap_type': 'MVS', 'subsample': 0.9527689310888076}. Best is trial 115 with value: 0.8204418331250954.
[I 2025-04-07 03:09:21,246] Trial 120 finished with value: 0.8196031884103814 and parameters: {'iterations': 195, 'learning_rate': 0.21297413861707049, 'objective': 'CrossEntropy', 'colsample_bylevel': 0.968169853660058, 'depth': 5, 'boosting_type': 'Ordered', 'bootstrap_type': 'Bernoulli', 'subsample': 0.9391041930066075}. Best is trial 115 with value: 0.8204418331250954.
[I 2025-04-07 03:09:52,567] Trial 124 finished with value: 0.8191419549046588 and parameters: {'iterations': 188, 'learning_rate': 0.21458156308029674, 'objective': 'CrossEntropy', 'colsample_bylevel': 0.8029716052868017, 'depth': 7, 'boosting_type': 'Ordered', 'bootstrap_type': 'Bernoulli', 'subsample': 0.9044581543339282}. Best is trial 115 with value: 0.8204418331250954.
[I 2025-04-07 03:10:20,803] Trial 127 finished with value: 0.8203159942431479 and parameters: {'iterations': 182, 'learning_rate': 0.20951846660273193, 'objective': 'CrossEntropy', 'colsample_bylevel': 0.7669459292683584, 'depth': 7, 'boosting_type': 'Ordered', 'bootstrap_type': 'Bernoulli', 'subsample': 0.906394636152571}. Best is trial 115 with value: 0.8204418331250954.
[I 2025-04-07 03:10:48,711] Trial 130 finished with value: 0.8201481563487922 and parameters: {'iterations': 183, 'learning_rate': 0.18285049527967995, 'objective': 'CrossEntropy', 'colsample_bylevel': 0.7517614864815061, 'depth': 7, 'boosting_type': 'Ordered', 'bootstrap_type': 'Bernoulli', 'subsample': 0.9652603210609139}. Best is trial 115 with value: 0.8204418331250954.
[I 2025-04-07 03:11:30,771] Trial 134 finished with value: 0.8182198920678099 and parameters: {'iterations': 174, 'learning_rate': 0.12018487770563634, 'objective': 'CrossEntropy', 'colsample_bylevel': 0.7380223523372113, 'depth': 8, 'boosting_type': 'Ordered', 'bootstrap_type': 'Bernoulli', 'subsample': 0.968738381048554}. Best is trial 115 with value: 0.8204418331250954.
[I 2025-04-07 03:11:58,479] Trial 138 finished with value: 0.8193097927990145 and parameters: {'iterations': 192, 'learning_rate': 0.19063049755872113, 'objective': 'CrossEntropy', 'colsample_bylevel': 0.7030970523990965, 'depth': 7, 'boosting_type': 'Ordered', 'bootstrap_type': 'Bernoulli', 'subsample': 0.9996034465727223}. Best is trial 135 with value: 0.8204832873804391.
[I 2025-04-07 03:12:24,284] Trial 142 finished with value: 0.8110928881086561 and parameters: {'iterations': 162, 'learning_rate': 0.3211369058358767, 'objective': 'CrossEntropy', 'colsample_bylevel': 0.7707909282725804, 'depth': 7, 'boosting_type': 'Ordered', 'bootstrap_type': 'Bayesian', 'bagging_temperature': 5.468244198513083}. Best is trial 135 with value: 0.8204832873804391.
[I 2025-04-07 03:13:12,297] Trial 144 finished with value: 0.8188065251352669 and parameters: {'iterations': 185, 'learning_rate': 0.16975174857772027, 'objective': 'CrossEntropy', 'colsample_bylevel': 0.750460817886095, 'depth': 8, 'boosting_type': 'Ordered', 'bootstrap_type': 'Bernoulli', 'subsample': 0.9153480269911923}. Best is trial 135 with value: 0.8204832873804391.
[I 2025-04-07 03:14:34,626] Trial 148 finished with value: 0.8188485417204834 and parameters: {'iterations': 193, 'learning_rate': 0.20561140838368283, 'objective': 'CrossEntropy', 'colsample_bylevel': 0.680369533142593, 'depth': 9, 'boosting_type': 'Ordered', 'bootstrap_type': 'Bernoulli', 'subsample': 0.9629117034884873}. Best is trial 135 with value: 0.8204832873804391.
[I 2025-04-07 03:15:00,478] Trial 154 finished with value: 0.8184713062395771 and parameters: {'iterations': 199, 'learning_rate': 0.11020447200131994, 'objective': 'CrossEntropy', 'colsample_bylevel': 0.44413950310844635, 'depth': 7, 'boosting_type': 'Ordered', 'bootstrap_type': 'Bernoulli', 'subsample': 0.9360373861879757}. Best is trial 135 with value: 0.8204832873804391.
[I 2025-04-07 03:16:21,727] Trial 155 finished with value: 0.8193937381054053 and parameters: {'iterations': 188, 'learning_rate': 0.1571332249288206, 'objective': 'CrossEntropy', 'colsample_bylevel': 0.7226021286575531, 'depth': 9, 'boosting_type': 'Ordered', 'bootstrap_type': 'Bernoulli', 'subsample': 0.8669416081578585}. Best is trial 135 with value: 0.8204832873804391.
[I 2025-04-07 03:17:33,539] Trial 160 finished with value: 0.8188902771407636 and parameters: {'iterations': 172, 'learning_rate': 0.24885102742692655, 'objective': 'CrossEntropy', 'colsample_bylevel': 0.6414550882469844, 'depth': 9, 'boosting_type': 'Ordered', 'bootstrap_type': 'Bernoulli', 'subsample': 0.8889135560665242}. Best is trial 135 with value: 0.8204832873804391.
[I 2025-04-07 03:18:43,020] Trial 164 finished with value: 0.8187228082753869 and parameters: {'iterations': 167, 'learning_rate': 0.20231542003032757, 'objective': 'CrossEntropy', 'colsample_bylevel': 0.6278883050307905, 'depth': 9, 'boosting_type': 'Ordered', 'bootstrap_type': 'Bernoulli', 'subsample': 0.899173216101752}. Best is trial 135 with value: 0.8204832873804391.
[I 2025-04-07 03:19:45,070] Trial 168 finished with value: 0.8184292017903179 and parameters: {'iterations': 160, 'learning_rate': 0.28821235718487614, 'objective': 'Logloss', 'colsample_bylevel': 0.5414764515560369, 'depth': 9, 'boosting_type': 'Ordered', 'bootstrap_type': 'Bernoulli', 'subsample': 0.8419559169268133}. Best is trial 135 with value: 0.8204832873804391.
[I 2025-04-07 03:20:38,857] Trial 172 finished with value: 0.8184292896543603 and parameters: {'iterations': 144, 'learning_rate': 0.3486172823761893, 'objective': 'Logloss', 'colsample_bylevel': 0.5196838895166475, 'depth': 9, 'boosting_type': 'Ordered', 'bootstrap_type': 'MVS', 'subsample': 0.9281250123944661}. Best is trial 135 with value: 0.8204832873804391.
[I 2025-04-07 03:21:43,274] Trial 177 finished with value: 0.8206089681071098 and parameters: {'iterations': 161, 'learning_rate': 0.24687063938655832, 'objective': 'Logloss', 'colsample_bylevel': 0.5843394364339475, 'depth': 9, 'boosting_type': 'Ordered', 'bootstrap_type': 'Bernoulli', 'subsample': 0.9497706620394358}. Best is trial 177 with value: 0.8206089681071098.
[I 2025-04-07 03:22:43,720] Trial 184 finished with value: 0.8196449941218956 and parameters: {'iterations': 159, 'learning_rate': 0.3967699795359095, 'objective': 'Logloss', 'colsample_bylevel': 0.5644913612878151, 'depth': 9, 'boosting_type': 'Ordered', 'bootstrap_type': 'Bernoulli', 'subsample': 0.9799993132639242}. Best is trial 177 with value: 0.8206089681071098.
[I 2025-04-07 03:23:48,525] Trial 187 finished with value: 0.816710299950269 and parameters: {'iterations': 158, 'learning_rate': 0.4079660846869442, 'objective': 'Logloss', 'colsample_bylevel': 0.5559302563648367, 'depth': 9, 'boosting_type': 'Ordered', 'bootstrap_type': 'Bernoulli', 'subsample': 0.9059536579367353}. Best is trial 177 with value: 0.8206089681071098.
[I 2025-04-07 03:24:38,362] Trial 191 finished with value: 0.8199804238912876 and parameters: {'iterations': 131, 'learning_rate': 0.30956768982192856, 'objective': 'Logloss', 'colsample_bylevel': 0.5207332829516005, 'depth': 9, 'boosting_type': 'Ordered', 'bootstrap_type': 'Bernoulli', 'subsample': 0.9558004133765439}. Best is trial 177 with value: 0.8206089681071098.
[I 2025-04-07 03:25:28,283] Trial 195 finished with value: 0.8185966355100771 and parameters: {'iterations': 135, 'learning_rate': 0.3261373039428555, 'objective': 'Logloss', 'colsample_bylevel': 0.49575904754340866, 'depth': 9, 'boosting_type': 'Ordered', 'bootstrap_type': 'Bernoulli', 'subsample': 0.9546865657991949}. Best is trial 177 with value: 0.8206089681071098.
[I 2025-04-07 03:26:12,873] Trial 199 finished with value: 0.8189326276093425 and parameters: {'iterations': 123, 'learning_rate': 0.2942843451475179, 'objective': 'Logloss', 'colsample_bylevel': 0.4669194756935583, 'depth': 9, 'boosting_type': 'Ordered', 'bootstrap_type': 'Bernoulli', 'subsample': 0.9802719562714477}. Best is trial 177 with value: 0.8206089681071098.
[I 2025-04-07 03:26:30,872] Trial 203 finished with value: 0.8191422536424039 and parameters: {'iterations': 77, 'learning_rate': 0.22780830602766508, 'objective': 'Logloss', 'colsample_bylevel': 0.6004521740398123, 'depth': 8, 'boosting_type': 'Ordered', 'bootstrap_type': 'Bernoulli', 'subsample': 0.980510424372952}. Best is trial 177 with value: 0.8206089681071098.
[I 2025-04-07 03:27:04,900] Trial 206 finished with value: 0.8185970396846736 and parameters: {'iterations': 103, 'learning_rate': 0.36447933921369446, 'objective': 'Logloss', 'colsample_bylevel': 0.41169792548519946, 'depth': 9, 'boosting_type': 'Ordered', 'bootstrap_type': 'Bernoulli', 'subsample': 0.9272368272631429}. Best is trial 177 with value: 0.8206089681071098.
[I 2025-04-07 03:27:52,394] Trial 208 finished with value: 0.8203998868311132 and parameters: {'iterations': 124, 'learning_rate': 0.26154920333077686, 'objective': 'Logloss', 'colsample_bylevel': 0.5277412248489246, 'depth': 9, 'boosting_type': 'Ordered', 'bootstrap_type': 'Bernoulli', 'subsample': 0.9281592989794376}. Best is trial 177 with value: 0.8206089681071098.
[I 2025-04-07 03:28:09,722] Trial 212 finished with value: 0.8167524746907626 and parameters: {'iterations': 122, 'learning_rate': 0.527591834953789, 'objective': 'Logloss', 'colsample_bylevel': 0.5607574031260373, 'depth': 7, 'boosting_type': 'Ordered', 'bootstrap_type': 'Bernoulli', 'subsample': 0.9541981269197553}. Best is trial 177 with value: 0.8206089681071098.
[I 2025-04-07 03:28:59,773] Trial 215 finished with value: 0.8177165892584449 and parameters: {'iterations': 142, 'learning_rate': 0.19373563540632374, 'objective': 'Logloss', 'colsample_bylevel': 0.5086858573952411, 'depth': 9, 'boosting_type': 'Ordered', 'bootstrap_type': 'Bernoulli', 'subsample': 0.660482850194402}. Best is trial 177 with value: 0.8206089681071098.
[I 2025-04-07 03:29:54,634] Trial 220 finished with value: 0.8180098970057692 and parameters: {'iterations': 138, 'learning_rate': 0.2640979787527369, 'objective': 'CrossEntropy', 'colsample_bylevel': 0.5450245158925493, 'depth': 9, 'boosting_type': 'Ordered', 'bootstrap_type': 'Bernoulli', 'subsample': 0.22457816197336994}. Best is trial 177 with value: 0.8206089681071098.
[I 2025-04-07 03:31:05,483] Trial 224 finished with value: 0.8208191388972359 and parameters: {'iterations': 164, 'learning_rate': 0.21452421430497562, 'objective': 'CrossEntropy', 'colsample_bylevel': 0.5744820300507832, 'depth': 9, 'boosting_type': 'Ordered', 'bootstrap_type': 'Bernoulli', 'subsample': 0.9337456176876163}. Best is trial 224 with value: 0.8208191388972359.
[I 2025-04-07 03:32:23,459] Trial 228 finished with value: 0.8196870458527293 and parameters: {'iterations': 163, 'learning_rate': 0.2032208317272618, 'objective': 'CrossEntropy', 'colsample_bylevel': 0.9986479003992917, 'depth': 9, 'boosting_type': 'Ordered', 'bootstrap_type': 'Bernoulli', 'subsample': 0.8582013331195442}. Best is trial 224 with value: 0.8208191388972359.
[I 2025-04-07 03:33:35,214] Trial 233 finished with value: 0.8186808795542131 and parameters: {'iterations': 190, 'learning_rate': 0.17022108159908472, 'objective': 'CrossEntropy', 'colsample_bylevel': 0.42815132296292, 'depth': 9, 'boosting_type': 'Ordered', 'bootstrap_type': 'Bernoulli', 'subsample': 0.85680824337895}. Best is trial 224 with value: 0.8208191388972359.
[I 2025-04-07 03:34:00,098] Trial 236 finished with value: 0.8153271969085916 and parameters: {'iterations': 156, 'learning_rate': 0.24598202053573195, 'objective': 'CrossEntropy', 'colsample_bylevel': 0.15856459131104084, 'depth': 9, 'boosting_type': 'Ordered', 'bootstrap_type': 'Bernoulli', 'subsample': 0.8874112564704817}. Best is trial 224 with value: 0.8208191388972359.
[I 2025-04-07 03:35:17,675] Trial 238 finished with value: 0.8168362618418763 and parameters: {'iterations': 151, 'learning_rate': 0.36370997399757865, 'objective': 'CrossEntropy', 'colsample_bylevel': 0.9943882598788932, 'depth': 9, 'boosting_type': 'Ordered', 'bootstrap_type': 'Bernoulli', 'subsample': 0.8989920044933515}. Best is trial 224 with value: 0.8208191388972359.
[I 2025-04-07 03:35:44,230] Trial 242 finished with value: 0.8201899093418807 and parameters: {'iterations': 187, 'learning_rate': 0.2923497635491906, 'objective': 'CrossEntropy', 'colsample_bylevel': 0.5720191713337225, 'depth': 7, 'boosting_type': 'Ordered', 'bootstrap_type': 'Bernoulli', 'subsample': 0.9343896061437783}. Best is trial 224 with value: 0.8208191388972359.
