[I 2025-04-07 02:55:29,052] Using an existing study with name 'catboost' instead of creating a new one.
[I 2025-04-07 02:55:43,950] Trial 1 finished with value: 0.7692942935818833 and parameters: {'iterations': 210, 'learning_rate': 0.014668423659206163, 'objective': 'Logloss', 'colsample_bylevel': 0.3862066476840259, 'depth': 4, 'boosting_type': 'Plain', 'bootstrap_type': 'Bayesian', 'bagging_temperature': 8.58524424552269}. Best is trial 0 with value: 0.7843873855351184.
[I 2025-04-07 02:56:12,401] Trial 5 finished with value: 0.8050979947668176 and parameters: {'iterations': 195, 'learning_rate': 0.9482797533702514, 'objective': 'CrossEntropy', 'colsample_bylevel': 0.9387089357866077, 'depth': 7, 'boosting_type': 'Ordered', 'bootstrap_type': 'Bernoulli', 'subsample': 0.20310612901745873}. Best is trial 5 with value: 0.8050979947668176.
[I 2025-04-07 02:56:48,789] Trial 8 finished with value: 0.7585200883560814 and parameters: {'iterations': 206, 'learning_rate': 0.003336932875319682, 'objective': 'CrossEntropy', 'colsample_bylevel': 0.252528507311575, 'depth': 5, 'boosting_type': 'Ordered', 'bootstrap_type': 'Bernoulli', 'subsample': 0.3326530819464963}. Best is trial 4 with value: 0.8079485679039682.
[I 2025-04-07 02:59:54,167] Trial 16 finished with value: 0.8154109664868969 and parameters: {'iterations': 250, 'learning_rate': 0.24335675114809246, 'objective': 'CrossEntropy', 'colsample_bylevel': 0.96786845002163, 'depth': 9, 'boosting_type': 'Ordered', 'bootstrap_type': 'Bernoulli', 'subsample': 0.6830130009484506}. Best is trial 20 with value: 0.8159978631464817.
[I 2025-04-07 03:01:23,320] Trial 28 finished with value: 0.8146141977749309 and parameters: {'iterations': 217, 'learning_rate': 0.06699785756348758, 'objective': 'CrossEntropy', 'colsample_bylevel': 0.8279049654611639, 'depth': 8, 'boosting_type': 'Ordered', 'bootstrap_type': 'Bernoulli', 'subsample': 0.5130614769088735}. Best is trial 31 with value: 0.8192259177838579.
[I 2025-04-07 03:01:40,662] Trial 45 finished with value: 0.8187226501201101 and parameters: {'iterations': 190, 'learning_rate': 0.1850791197006032, 'objective': 'CrossEntropy', 'colsample_bylevel': 0.77362850587482, 'depth': 5, 'boosting_type': 'Ordered', 'bootstrap_type': 'Bernoulli', 'subsample': 0.9430044926169698}. Best is trial 44 with value: 0.8193519323938909.
[I 2025-04-07 03:02:05,352] Trial 49 finished with value: 0.8167525801276136 and parameters: {'iterations': 195, 'learning_rate': 0.2175080267339436, 'objective': 'CrossEntropy', 'colsample_bylevel': 0.8921547904081333, 'depth': 6, 'boosting_type': 'Ordered', 'bootstrap_type': 'Bernoulli', 'subsample': 0.13805618314126333}. Best is trial 47 with value: 0.8203578175274707.
[I 2025-04-07 03:03:02,372] Trial 52 finished with value: 0.80828399767336 and parameters: {'iterations': 209, 'learning_rate': 0.10818194921209924, 'objective': 'CrossEntropy', 'colsample_bylevel': 0.9142815461767035, 'depth': 6, 'boosting_type': 'Ordered', 'bootstrap_type': 'Bayesian', 'bagging_temperature': 4.171817235056205}. Best is trial 47 with value: 0.8203578175274707.
[I 2025-04-07 03:03:27,087] Trial 56 finished with value: 0.8174231409286525 and parameters: {'iterations': 180, 'learning_rate': 0.46145285986799145, 'objective': 'CrossEntropy', 'colsample_bylevel': 0.42064829211425014, 'depth': 6, 'boosting_type': 'Ordered', 'bootstrap_type': 'Bernoulli', 'subsample': 0.8511881413081898}. Best is trial 47 with value: 0.8203578175274707.
[I 2025-04-07 03:03:37,818] Trial 62 finished with value: 0.7843034050831106 and parameters: {'iterations': 165, 'learning_rate': 0.002132924779583026, 'objective': 'CrossEntropy', 'colsample_bylevel': 0.7895822444595115, 'depth': 4, 'boosting_type': 'Ordered', 'bootstrap_type': 'Bernoulli', 'subsample': 0.7738950343631555}. Best is trial 47 with value: 0.8203578175274707.
[I 2025-04-07 03:03:52,699] Trial 65 finished with value: 0.8185136039897305 and parameters: {'iterations': 172, 'learning_rate': 0.16929686633437174, 'objective': 'CrossEntropy', 'colsample_bylevel': 0.7925441969989252, 'depth': 5, 'boosting_type': 'Ordered', 'bootstrap_type': 'Bernoulli', 'subsample': 0.9201182045610508}. Best is trial 47 with value: 0.8203578175274707.
[I 2025-04-07 03:04:12,986] Trial 69 finished with value: 0.8197706924213748 and parameters: {'iterations': 188, 'learning_rate': 0.3517415910073981, 'objective': 'CrossEntropy', 'colsample_bylevel': 0.9942835092725049, 'depth': 6, 'boosting_type': 'Ordered', 'bootstrap_type': 'Bernoulli', 'subsample': 0.9512848114089557}. Best is trial 47 with value: 0.8203578175274707.
[I 2025-04-07 03:05:04,124] Trial 74 finished with value: 0.8174232112198867 and parameters: {'iterations': 200, 'learning_rate': 0.23939203927609934, 'objective': 'CrossEntropy', 'colsample_bylevel': 0.9559375235530327, 'depth': 6, 'boosting_type': 'Ordered', 'bootstrap_type': 'Bernoulli', 'subsample': 0.9818911301610355}. Best is trial 47 with value: 0.8203578175274707.
[I 2025-04-07 03:05:15,472] Trial 78 finished with value: 0.8157884479871227 and parameters: {'iterations': 66, 'learning_rate': 0.21201800815227806, 'objective': 'CrossEntropy', 'colsample_bylevel': 0.9019507853039106, 'depth': 7, 'boosting_type': 'Ordered', 'bootstrap_type': 'Bernoulli', 'subsample': 0.9073934283835975}. Best is trial 47 with value: 0.8203578175274707.
[I 2025-04-07 03:06:00,523] Trial 80 finished with value: 0.81515942930547 and parameters: {'iterations': 220, 'learning_rate': 0.463302692905729, 'objective': 'CrossEntropy', 'colsample_bylevel': 0.973205242975619, 'depth': 5, 'boosting_type': 'Ordered', 'bootstrap_type': 'Bernoulli', 'subsample': 0.9526889917062319}. Best is trial 47 with value: 0.8203578175274707.
[I 2025-04-07 03:06:15,027] Trial 86 finished with value: 0.8178004818464102 and parameters: {'iterations': 176, 'learning_rate': 0.2735660082239161, 'objective': 'CrossEntropy', 'colsample_bylevel': 0.8441243672910647, 'depth': 5, 'boosting_type': 'Ordered', 'bootstrap_type': 'Bernoulli', 'subsample': 0.5194770063956735}. Best is trial 47 with value: 0.8203578175274707.
[I 2025-04-07 03:06:30,208] Trial 88 finished with value: 0.8152012701626014 and parameters: {'iterations': 183, 'learning_rate': 0.5685291973342768, 'objective': 'CrossEntropy', 'colsample_bylevel': 0.8825780037234364, 'depth': 5, 'boosting_type': 'Ordered', 'bootstrap_type': 'Bernoulli', 'subsample': 0.4536122583226851}. Best is trial 47 with value: 0.8203578175274707.
[I 2025-04-07 03:06:56,620] Trial 91 finished with value: 0.8188484890020578 and parameters: {'iterations': 186, 'learning_rate': 0.27895276837372174, 'objective': 'CrossEntropy', 'colsample_bylevel': 0.9082281975771062, 'depth': 6, 'boosting_type': 'Ordered', 'bootstrap_type': 'Bernoulli', 'subsample': 0.57036264189406}. Best is trial 47 with value: 0.8203578175274707.
[I 2025-04-07 03:07:05,787] Trial 99 finished with value: 0.8160813515598504 and parameters: {'iterations': 191, 'learning_rate': 0.4040891779562994, 'objective': 'CrossEntropy', 'colsample_bylevel': 0.9441767808572269, 'depth': 6, 'boosting_type': 'Plain', 'bootstrap_type': 'Bernoulli', 'subsample': 0.919080734374459}. Best is trial 47 with value: 0.8203578175274707.
[I 2025-04-07 03:07:59,952] Trial 102 finished with value: 0.8070264874943108 and parameters: {'iterations': 204, 'learning_rate': 0.6978789099049212, 'objective': 'CrossEntropy', 'colsample_bylevel': 0.913812442719364, 'depth': 6, 'boosting_type': 'Ordered', 'bootstrap_type': 'Bernoulli', 'subsample': 0.3817518221951355}. Best is trial 47 with value: 0.8203578175274707.
[I 2025-04-07 03:08:31,209] Trial 112 finished with value: 0.8162492597454403 and parameters: {'iterations': 197, 'learning_rate': 0.152900915200916, 'objective': 'Logloss', 'colsample_bylevel': 0.8211731557603672, 'depth': 6, 'boosting_type': 'Ordered', 'bootstrap_type': 'MVS', 'subsample': 0.7265476370723135}. Best is trial 47 with value: 0.8203578175274707.
[I 2025-04-07 03:08:46,203] Trial 114 finished with value: 0.8170459581661719 and parameters: {'iterations': 182, 'learning_rate': 0.19650793263585462, 'objective': 'CrossEntropy', 'colsample_bylevel': 0.8608770375590069, 'depth': 5, 'boosting_type': 'Ordered', 'bootstrap_type': 'Bernoulli', 'subsample': 0.6133472979511074}. Best is trial 47 with value: 0.8203578175274707.
[I 2025-04-07 03:09:02,668] Trial 115 finished with value: 0.8204418331250954 and parameters: {'iterations': 188, 'learning_rate': 0.24558003539583148, 'objective': 'CrossEntropy', 'colsample_bylevel': 0.9819220726063055, 'depth': 5, 'boosting_type': 'Ordered', 'bootstrap_type': 'Bernoulli', 'subsample': 0.9390850302107026}. Best is trial 115 with value: 0.8204418331250954.
[I 2025-04-07 03:09:19,452] Trial 119 finished with value: 0.8176330305538423 and parameters: {'iterations': 194, 'learning_rate': 0.17051418695471973, 'objective': 'CrossEntropy', 'colsample_bylevel': 0.9716316477697221, 'depth': 5, 'boosting_type': 'Ordered', 'bootstrap_type': 'Bernoulli', 'subsample': 0.9421225644821652}. Best is trial 115 with value: 0.8204418331250954.
[I 2025-04-07 03:10:01,797] Trial 123 finished with value: 0.8165429365217436 and parameters: {'iterations': 167, 'learning_rate': 0.09184282877486628, 'objective': 'CrossEntropy', 'colsample_bylevel': 0.8008377687230066, 'depth': 8, 'boosting_type': 'Ordered', 'bootstrap_type': 'Bernoulli', 'subsample': 0.9305951475989775}. Best is trial 115 with value: 0.8204418331250954.
[I 2025-04-07 03:10:30,108] Trial 128 finished with value: 0.8198547431646167 and parameters: {'iterations': 182, 'learning_rate': 0.23943981654145963, 'objective': 'CrossEntropy', 'colsample_bylevel': 0.7423108389844194, 'depth': 7, 'boosting_type': 'Ordered', 'bootstrap_type': 'Bernoulli', 'subsample': 0.9050084982131881}. Best is trial 115 with value: 0.8204418331250954.
[I 2025-04-07 03:10:56,973] Trial 131 finished with value: 0.8176329426897995 and parameters: {'iterations': 183, 'learning_rate': 0.13004818540651372, 'objective': 'CrossEntropy', 'colsample_bylevel': 0.6827811400406137, 'depth': 7, 'boosting_type': 'Ordered', 'bootstrap_type': 'Bernoulli', 'subsample': 0.963094544034703}. Best is trial 115 with value: 0.8204418331250954.
[I 2025-04-07 03:11:39,728] Trial 135 finished with value: 0.8204832873804391 and parameters: {'iterations': 174, 'learning_rate': 0.24188441587599507, 'objective': 'CrossEntropy', 'colsample_bylevel': 0.7509496219378443, 'depth': 8, 'boosting_type': 'Ordered', 'bootstrap_type': 'Bernoulli', 'subsample': 0.9656103574910723}. Best is trial 135 with value: 0.8204832873804391.
[I 2025-04-07 03:12:05,862] Trial 139 finished with value: 0.8115539810319105 and parameters: {'iterations': 176, 'learning_rate': 0.2447785191287924, 'objective': 'CrossEntropy', 'colsample_bylevel': 0.6951319371508381, 'depth': 7, 'boosting_type': 'Ordered', 'bootstrap_type': 'Bayesian', 'bagging_temperature': 5.396031922888998}. Best is trial 135 with value: 0.8204832873804391.
[I 2025-04-07 03:12:44,943] Trial 143 finished with value: 0.8185548825169885 and parameters: {'iterations': 154, 'learning_rate': 0.298039829746311, 'objective': 'CrossEntropy', 'colsample_bylevel': 0.7611255176366621, 'depth': 8, 'boosting_type': 'Ordered', 'bootstrap_type': 'Bernoulli', 'subsample': 0.9204037876918968}. Best is trial 135 with value: 0.8204832873804391.
[I 2025-04-07 03:14:07,816] Trial 147 finished with value: 0.8017019967982343 and parameters: {'iterations': 184, 'learning_rate': 0.013274799128953555, 'objective': 'CrossEntropy', 'colsample_bylevel': 0.7460189915024511, 'depth': 9, 'boosting_type': 'Ordered', 'bootstrap_type': 'Bernoulli', 'subsample': 0.9146585329562973}. Best is trial 135 with value: 0.8204832873804391.
[I 2025-04-07 03:15:10,565] Trial 152 finished with value: 0.8189741697287285 and parameters: {'iterations': 170, 'learning_rate': 0.22264266968409938, 'objective': 'CrossEntropy', 'colsample_bylevel': 0.4966591631152127, 'depth': 9, 'boosting_type': 'Ordered', 'bootstrap_type': 'Bernoulli', 'subsample': 0.9593367742249286}. Best is trial 135 with value: 0.8204832873804391.
[I 2025-04-07 03:15:30,964] Trial 156 finished with value: 0.8171296223076261 and parameters: {'iterations': 179, 'learning_rate': 0.15836242938956613, 'objective': 'CrossEntropy', 'colsample_bylevel': 0.2928394878010806, 'depth': 7, 'boosting_type': 'Ordered', 'bootstrap_type': 'Bernoulli', 'subsample': 0.981041182977394}. Best is trial 135 with value: 0.8204832873804391.
[I 2025-04-07 03:16:40,516] Trial 159 finished with value: 0.8199802305903937 and parameters: {'iterations': 168, 'learning_rate': 0.2597102380005193, 'objective': 'CrossEntropy', 'colsample_bylevel': 0.5656001357470183, 'depth': 9, 'boosting_type': 'Ordered', 'bootstrap_type': 'Bernoulli', 'subsample': 0.8796840805687922}. Best is trial 135 with value: 0.8204832873804391.
[I 2025-04-07 03:17:47,455] Trial 163 finished with value: 0.8186805456708507 and parameters: {'iterations': 171, 'learning_rate': 0.2595896168886811, 'objective': 'Logloss', 'colsample_bylevel': 0.5751504783901913, 'depth': 9, 'boosting_type': 'Ordered', 'bootstrap_type': 'Bernoulli', 'subsample': 0.8827002658566635}. Best is trial 135 with value: 0.8204832873804391.
[I 2025-04-07 03:18:52,377] Trial 167 finished with value: 0.8200222647484189 and parameters: {'iterations': 160, 'learning_rate': 0.29680384214967453, 'objective': 'Logloss', 'colsample_bylevel': 0.5375578169825896, 'depth': 9, 'boosting_type': 'Ordered', 'bootstrap_type': 'Bernoulli', 'subsample': 0.9043847229235089}. Best is trial 135 with value: 0.8204832873804391.
[I 2025-04-07 03:19:49,692] Trial 171 finished with value: 0.818555356982819 and parameters: {'iterations': 150, 'learning_rate': 0.34064822501996866, 'objective': 'Logloss', 'colsample_bylevel': 0.5249218855444727, 'depth': 9, 'boosting_type': 'Ordered', 'bootstrap_type': 'Bernoulli', 'subsample': 0.9287788159665736}. Best is trial 135 with value: 0.8204832873804391.
[I 2025-04-07 03:20:10,826] Trial 173 finished with value: 0.8189322937259803 and parameters: {'iterations': 155, 'learning_rate': 0.30175496789894785, 'objective': 'Logloss', 'colsample_bylevel': 0.4844249387720089, 'depth': 7, 'boosting_type': 'Ordered', 'bootstrap_type': 'MVS', 'subsample': 0.9041568491172753}. Best is trial 135 with value: 0.8204832873804391.
[I 2025-04-07 03:21:08,700] Trial 176 finished with value: 0.8192257947741982 and parameters: {'iterations': 149, 'learning_rate': 0.24150340213014904, 'objective': 'Logloss', 'colsample_bylevel': 0.5338953746689046, 'depth': 9, 'boosting_type': 'Ordered', 'bootstrap_type': 'Bernoulli', 'subsample': 0.9454241582366341}. Best is trial 135 with value: 0.8204832873804391.
[I 2025-04-07 03:21:32,320] Trial 180 finished with value: 0.8183875366612717 and parameters: {'iterations': 166, 'learning_rate': 0.288854864273559, 'objective': 'Logloss', 'colsample_bylevel': 0.613641037466281, 'depth': 7, 'boosting_type': 'Ordered', 'bootstrap_type': 'Bernoulli', 'subsample': 0.8721324273032759}. Best is trial 135 with value: 0.8204832873804391.
[I 2025-04-07 03:22:47,085] Trial 183 finished with value: 0.8076969955769242 and parameters: {'iterations': 192, 'learning_rate': 0.02827891552926751, 'objective': 'Logloss', 'colsample_bylevel': 0.5525027120246251, 'depth': 9, 'boosting_type': 'Ordered', 'bootstrap_type': 'Bernoulli', 'subsample': 0.9810060054262402}. Best is trial 177 with value: 0.8206089681071098.
[I 2025-04-07 03:23:54,671] Trial 188 finished with value: 0.8187226149744931 and parameters: {'iterations': 161, 'learning_rate': 0.38035600963361, 'objective': 'Logloss', 'colsample_bylevel': 0.5612302280650583, 'depth': 9, 'boosting_type': 'Ordered', 'bootstrap_type': 'Bernoulli', 'subsample': 0.9068540669894792}. Best is trial 177 with value: 0.8206089681071098.
[I 2025-04-07 03:25:00,669] Trial 192 finished with value: 0.8183875015156546 and parameters: {'iterations': 174, 'learning_rate': 0.3364746184338589, 'objective': 'Logloss', 'colsample_bylevel': 0.5161434641731103, 'depth': 9, 'boosting_type': 'Ordered', 'bootstrap_type': 'Bernoulli', 'subsample': 0.9539133963157369}. Best is trial 177 with value: 0.8206089681071098.
[I 2025-04-07 03:25:36,407] Trial 196 finished with value: 0.8203159239519138 and parameters: {'iterations': 97, 'learning_rate': 0.27839504839958884, 'objective': 'Logloss', 'colsample_bylevel': 0.46865168455295325, 'depth': 9, 'boosting_type': 'Ordered', 'bootstrap_type': 'Bernoulli', 'subsample': 0.9797893963774538}. Best is trial 177 with value: 0.8206089681071098.
[I 2025-04-07 03:26:26,751] Trial 200 finished with value: 0.8187646491325182 and parameters: {'iterations': 135, 'learning_rate': 0.22839771457022873, 'objective': 'Logloss', 'colsample_bylevel': 0.46942007732678004, 'depth': 9, 'boosting_type': 'Ordered', 'bootstrap_type': 'Bernoulli', 'subsample': 0.9765982957269409}. Best is trial 177 with value: 0.8206089681071098.
[I 2025-04-07 03:27:05,886] Trial 204 finished with value: 0.8188904177232317 and parameters: {'iterations': 118, 'learning_rate': 0.2264488873821188, 'objective': 'Logloss', 'colsample_bylevel': 0.40377908106305677, 'depth': 9, 'boosting_type': 'Ordered', 'bootstrap_type': 'Bernoulli', 'subsample': 0.925781298590277}. Best is trial 177 with value: 0.8206089681071098.
[I 2025-04-07 03:27:55,591] Trial 209 finished with value: 0.8188066305721179 and parameters: {'iterations': 129, 'learning_rate': 0.2663918797049851, 'objective': 'Logloss', 'colsample_bylevel': 0.5356125040601615, 'depth': 9, 'boosting_type': 'Ordered', 'bootstrap_type': 'Bernoulli', 'subsample': 0.943179404479317}. Best is trial 177 with value: 0.8206089681071098.
[I 2025-04-07 03:28:13,053] Trial 213 finished with value: 0.8183455903672894 and parameters: {'iterations': 126, 'learning_rate': 0.1831080059639136, 'objective': 'Logloss', 'colsample_bylevel': 0.5617343957815094, 'depth': 7, 'boosting_type': 'Ordered', 'bootstrap_type': 'Bernoulli', 'subsample': 0.9560965813763106}. Best is trial 177 with value: 0.8206089681071098.
[I 2025-04-07 03:28:45,683] Trial 216 finished with value: 0.8192677059225636 and parameters: {'iterations': 96, 'learning_rate': 0.32191218053662946, 'objective': 'Logloss', 'colsample_bylevel': 0.511992508030986, 'depth': 9, 'boosting_type': 'Ordered', 'bootstrap_type': 'Bernoulli', 'subsample': 0.9993716181801641}. Best is trial 177 with value: 0.8206089681071098.
[I 2025-04-07 03:30:02,534] Trial 219 finished with value: 0.8196029775366789 and parameters: {'iterations': 185, 'learning_rate': 0.25782660291561055, 'objective': 'CrossEntropy', 'colsample_bylevel': 0.5446175219671474, 'depth': 9, 'boosting_type': 'Ordered', 'bootstrap_type': 'Bernoulli', 'subsample': 0.9154813339934087}. Best is trial 177 with value: 0.8206089681071098.
[I 2025-04-07 03:31:16,463] Trial 225 finished with value: 0.8200643691976783 and parameters: {'iterations': 187, 'learning_rate': 0.2128692111284557, 'objective': 'CrossEntropy', 'colsample_bylevel': 0.43748062885491695, 'depth': 9, 'boosting_type': 'Ordered', 'bootstrap_type': 'Bernoulli', 'subsample': 0.9308630657944942}. Best is trial 224 with value: 0.8208191388972359.
[I 2025-04-07 03:32:14,649] Trial 229 finished with value: 0.8152431110197325 and parameters: {'iterations': 163, 'learning_rate': 0.21699746456900815, 'objective': 'CrossEntropy', 'colsample_bylevel': 0.4483152191054323, 'depth': 9, 'boosting_type': 'Ordered', 'bootstrap_type': 'Bernoulli', 'subsample': 0.10548474901107657}. Best is trial 224 with value: 0.8208191388972359.
[I 2025-04-07 03:33:30,183] Trial 231 finished with value: 0.819351862102657 and parameters: {'iterations': 182, 'learning_rate': 0.22958252527043016, 'objective': 'CrossEntropy', 'colsample_bylevel': 0.6251647184280685, 'depth': 9, 'boosting_type': 'Ordered', 'bootstrap_type': 'Bernoulli', 'subsample': 0.8637426442010642}. Best is trial 224 with value: 0.8208191388972359.
[I 2025-04-07 03:34:52,259] Trial 235 finished with value: 0.8193937381054053 and parameters: {'iterations': 161, 'learning_rate': 0.1634992506245424, 'objective': 'CrossEntropy', 'colsample_bylevel': 0.9864031315759095, 'depth': 9, 'boosting_type': 'Ordered', 'bootstrap_type': 'Bernoulli', 'subsample': 0.8920202316718983}. Best is trial 224 with value: 0.8208191388972359.
[I 2025-04-07 03:35:21,532] Trial 240 finished with value: 0.8191000261834848 and parameters: {'iterations': 160, 'learning_rate': 0.36962239643559, 'objective': 'CrossEntropy', 'colsample_bylevel': 0.9535392852334972, 'depth': 7, 'boosting_type': 'Ordered', 'bootstrap_type': 'MVS', 'subsample': 0.963432591223943}. Best is trial 224 with value: 0.8208191388972359.
[I 2025-04-07 03:36:01,561] Trial 243 finished with value: 0.8169619952869727 and parameters: {'iterations': 186, 'learning_rate': 0.28098019341397595, 'objective': 'CrossEntropy', 'colsample_bylevel': 0.5710236051234168, 'depth': 8, 'boosting_type': 'Ordered', 'bootstrap_type': 'Bernoulli', 'subsample': 0.9402657508450567}. Best is trial 224 with value: 0.8208191388972359.
[I 2025-04-07 03:36:27,090] Trial 247 finished with value: 0.8188485241476748 and parameters: {'iterations': 193, 'learning_rate': 0.293496319924372, 'objective': 'CrossEntropy', 'colsample_bylevel': 0.5920927347894225, 'depth': 7, 'boosting_type': 'Ordered', 'bootstrap_type': 'Bernoulli', 'subsample': 0.92190108936303}. Best is trial 224 with value: 0.8208191388972359.
[I 2025-04-07 03:36:51,467] Trial 251 finished with value: 0.818974380602431 and parameters: {'iterations': 180, 'learning_rate': 0.24881392766052168, 'objective': 'CrossEntropy', 'colsample_bylevel': 0.6135985562183226, 'depth': 7, 'boosting_type': 'Ordered', 'bootstrap_type': 'Bernoulli', 'subsample': 0.908757772666319}. Best is trial 224 with value: 0.8208191388972359.
