[I 2025-04-07 05:55:35,178] Trial 1047 finished with value: 0.8150333268313942 and parameters: {'n_estimators': 100, 'criterion': 'gini', 'max_depth': 57, 'min_samples_split': 9, 'min_samples_leaf': 1}. Best is trial 276 with value: 0.8188065954265008.
[I 2025-04-07 05:55:46,371] Trial 1052 finished with value: 0.8164171855038388 and parameters: {'n_estimators': 98, 'criterion': 'gini', 'max_depth': 55, 'min_samples_split': 10, 'min_samples_leaf': 2}. Best is trial 276 with value: 0.8188065954265008.
[I 2025-04-07 05:55:59,725] Trial 1056 finished with value: 0.8162492070270148 and parameters: {'n_estimators': 105, 'criterion': 'gini', 'max_depth': 58, 'min_samples_split': 11, 'min_samples_leaf': 2}. Best is trial 276 with value: 0.8188065954265008.
[I 2025-04-07 05:56:14,777] Trial 1059 finished with value: 0.8180520014550285 and parameters: {'n_estimators': 117, 'criterion': 'gini', 'max_depth': 64, 'min_samples_split': 10, 'min_samples_leaf': 1}. Best is trial 276 with value: 0.8188065954265008.
[I 2025-04-07 05:56:26,658] Trial 1063 finished with value: 0.816207454033926 and parameters: {'n_estimators': 110, 'criterion': 'gini', 'max_depth': 54, 'min_samples_split': 19, 'min_samples_leaf': 1}. Best is trial 276 with value: 0.8188065954265008.
[I 2025-04-07 05:56:37,701] Trial 1068 finished with value: 0.815914146286602 and parameters: {'n_estimators': 102, 'criterion': 'gini', 'max_depth': 53, 'min_samples_split': 10, 'min_samples_leaf': 2}. Best is trial 276 with value: 0.8188065954265008.
[I 2025-04-07 05:56:47,371] Trial 1072 finished with value: 0.8180518960181773 and parameters: {'n_estimators': 86, 'criterion': 'gini', 'max_depth': 59, 'min_samples_split': 10, 'min_samples_leaf': 1}. Best is trial 276 with value: 0.8188065954265008.
[I 2025-04-07 05:56:58,501] Trial 1075 finished with value: 0.8182616274880902 and parameters: {'n_estimators': 98, 'criterion': 'gini', 'max_depth': 56, 'min_samples_split': 10, 'min_samples_leaf': 1}. Best is trial 276 with value: 0.8188065954265008.
[I 2025-04-07 05:57:10,936] Trial 1079 finished with value: 0.817004064590615 and parameters: {'n_estimators': 108, 'criterion': 'entropy', 'max_depth': 56, 'min_samples_split': 11, 'min_samples_leaf': 1}. Best is trial 276 with value: 0.8188065954265008.
[I 2025-04-07 05:57:21,613] Trial 1083 finished with value: 0.8146141450565054 and parameters: {'n_estimators': 103, 'criterion': 'gini', 'max_depth': 18, 'min_samples_split': 9, 'min_samples_leaf': 2}. Best is trial 276 with value: 0.8188065954265008.
[I 2025-04-07 05:57:34,534] Trial 1087 finished with value: 0.8167524219723369 and parameters: {'n_estimators': 123, 'criterion': 'gini', 'max_depth': 54, 'min_samples_split': 10, 'min_samples_leaf': 2}. Best is trial 276 with value: 0.8188065954265008.
[I 2025-04-07 05:57:46,671] Trial 1093 finished with value: 0.8158300076793173 and parameters: {'n_estimators': 112, 'criterion': 'gini', 'max_depth': 58, 'min_samples_split': 11, 'min_samples_leaf': 1}. Best is trial 276 with value: 0.8188065954265008.
[I 2025-04-07 05:57:58,421] Trial 1097 finished with value: 0.8188065954265008 and parameters: {'n_estimators': 99, 'criterion': 'gini', 'max_depth': 64, 'min_samples_split': 10, 'min_samples_leaf': 1}. Best is trial 276 with value: 0.8188065954265008.
[I 2025-04-07 05:58:09,976] Trial 1101 finished with value: 0.8160398973045069 and parameters: {'n_estimators': 101, 'criterion': 'gini', 'max_depth': 64, 'min_samples_split': 10, 'min_samples_leaf': 2}. Best is trial 276 with value: 0.8188065954265008.
[I 2025-04-07 05:58:22,361] Trial 1105 finished with value: 0.8155364363398651 and parameters: {'n_estimators': 109, 'criterion': 'gini', 'max_depth': 63, 'min_samples_split': 9, 'min_samples_leaf': 1}. Best is trial 276 with value: 0.8188065954265008.
[I 2025-04-07 05:58:34,306] Trial 1109 finished with value: 0.8157461853825863 and parameters: {'n_estimators': 118, 'criterion': 'gini', 'max_depth': 63, 'min_samples_split': 11, 'min_samples_leaf': 1}. Best is trial 276 with value: 0.8188065954265008.
[I 2025-04-07 05:58:46,452] Trial 1113 finished with value: 0.8187646667053269 and parameters: {'n_estimators': 106, 'criterion': 'gini', 'max_depth': 64, 'min_samples_split': 10, 'min_samples_leaf': 1}. Best is trial 276 with value: 0.8188065954265008.
[I 2025-04-07 05:58:57,980] Trial 1117 finished with value: 0.8162493651822915 and parameters: {'n_estimators': 106, 'criterion': 'gini', 'max_depth': 64, 'min_samples_split': 10, 'min_samples_leaf': 2}. Best is trial 276 with value: 0.8188065954265008.
[I 2025-04-07 05:59:09,254] Trial 1121 finished with value: 0.8185550055266484 and parameters: {'n_estimators': 100, 'criterion': 'gini', 'max_depth': 61, 'min_samples_split': 10, 'min_samples_leaf': 1}. Best is trial 276 with value: 0.8188065954265008.
[I 2025-04-07 05:59:19,254] Trial 1124 finished with value: 0.8154106150307261 and parameters: {'n_estimators': 88, 'criterion': 'gini', 'max_depth': 64, 'min_samples_split': 9, 'min_samples_leaf': 1}. Best is trial 276 with value: 0.8188065954265008.
[I 2025-04-07 05:59:30,098] Trial 1127 finished with value: 0.8157460272273095 and parameters: {'n_estimators': 103, 'criterion': 'gini', 'max_depth': 63, 'min_samples_split': 9, 'min_samples_leaf': 1}. Best is trial 276 with value: 0.8188065954265008.
[I 2025-04-07 05:59:42,616] Trial 1132 finished with value: 0.8172136554780595 and parameters: {'n_estimators': 110, 'criterion': 'gini', 'max_depth': 61, 'min_samples_split': 4, 'min_samples_leaf': 2}. Best is trial 276 with value: 0.8188065954265008.
[I 2025-04-07 05:59:52,759] Trial 1136 finished with value: 0.8163330644693627 and parameters: {'n_estimators': 95, 'criterion': 'gini', 'max_depth': 64, 'min_samples_split': 13, 'min_samples_leaf': 1}. Best is trial 276 with value: 0.8188065954265008.
訓練集準確率: 0.9335094118140276
測試集準確率: 0.8105298457411133
10-fold CV 準確率:  0.8188065954265008

