[I 2025-04-07 05:55:15,430] Trial 1040 finished with value: 0.8159139178400909 and parameters: {'n_estimators': 108, 'criterion': 'gini', 'max_depth': 63, 'min_samples_split': 11, 'min_samples_leaf': 1}. Best is trial 276 with value: 0.8188065954265008.
[I 2025-04-07 05:55:26,409] Trial 1044 finished with value: 0.8157460272273095 and parameters: {'n_estimators': 103, 'criterion': 'gini', 'max_depth': 56, 'min_samples_split': 9, 'min_samples_leaf': 1}. Best is trial 276 with value: 0.8188065954265008.
[I 2025-04-07 05:55:36,431] Trial 1049 finished with value: 0.8026242705087856 and parameters: {'n_estimators': 99, 'criterion': 'gini', 'max_depth': 10, 'min_samples_split': 10, 'min_samples_leaf': 1}. Best is trial 276 with value: 0.8188065954265008.
[I 2025-04-07 05:55:48,673] Trial 1053 finished with value: 0.8161236493100038 and parameters: {'n_estimators': 105, 'criterion': 'gini', 'max_depth': 55, 'min_samples_split': 10, 'min_samples_leaf': 2}. Best is trial 276 with value: 0.8188065954265008.
[I 2025-04-07 05:56:02,340] Trial 1057 finished with value: 0.8130212929721067 and parameters: {'n_estimators': 106, 'criterion': 'gini', 'max_depth': 58, 'min_samples_split': 11, 'min_samples_leaf': 13}. Best is trial 276 with value: 0.8188065954265008.
[I 2025-04-07 05:56:16,899] Trial 1061 finished with value: 0.8184712183755345 and parameters: {'n_estimators': 114, 'criterion': 'gini', 'max_depth': 56, 'min_samples_split': 10, 'min_samples_leaf': 1}. Best is trial 276 with value: 0.8188065954265008.
[I 2025-04-07 05:56:27,312] Trial 1065 finished with value: 0.8152430231556899 and parameters: {'n_estimators': 96, 'criterion': 'gini', 'max_depth': 54, 'min_samples_split': 9, 'min_samples_leaf': 1}. Best is trial 276 with value: 0.8188065954265008.
[I 2025-04-07 05:56:37,901] Trial 1069 finished with value: 0.815914146286602 and parameters: {'n_estimators': 102, 'criterion': 'gini', 'max_depth': 57, 'min_samples_split': 10, 'min_samples_leaf': 2}. Best is trial 276 with value: 0.8188065954265008.
[I 2025-04-07 05:56:48,067] Trial 1073 finished with value: 0.81805198388222 and parameters: {'n_estimators': 91, 'criterion': 'gini', 'max_depth': 62, 'min_samples_split': 10, 'min_samples_leaf': 1}. Best is trial 276 with value: 0.8188065954265008.
[I 2025-04-07 05:56:58,902] Trial 1077 finished with value: 0.8159138475488568 and parameters: {'n_estimators': 98, 'criterion': 'gini', 'max_depth': 56, 'min_samples_split': 11, 'min_samples_leaf': 1}. Best is trial 276 with value: 0.8188065954265008.
[I 2025-04-07 05:57:11,476] Trial 1080 finished with value: 0.8159138651216653 and parameters: {'n_estimators': 108, 'criterion': 'entropy', 'max_depth': 53, 'min_samples_split': 9, 'min_samples_leaf': 1}. Best is trial 276 with value: 0.8188065954265008.
[I 2025-04-07 05:57:22,551] Trial 1084 finished with value: 0.8161656131767948 and parameters: {'n_estimators': 104, 'criterion': 'gini', 'max_depth': 54, 'min_samples_split': 10, 'min_samples_leaf': 2}. Best is trial 276 with value: 0.8188065954265008.
[I 2025-04-07 05:57:33,276] Trial 1088 finished with value: 0.8181776821816994 and parameters: {'n_estimators': 93, 'criterion': 'gini', 'max_depth': 55, 'min_samples_split': 10, 'min_samples_leaf': 1}. Best is trial 276 with value: 0.8188065954265008.
[I 2025-04-07 05:57:45,350] Trial 1091 finished with value: 0.8158300076793173 and parameters: {'n_estimators': 112, 'criterion': 'gini', 'max_depth': 58, 'min_samples_split': 11, 'min_samples_leaf': 1}. Best is trial 276 with value: 0.8188065954265008.
[I 2025-04-07 05:57:57,059] Trial 1095 finished with value: 0.8159139705585167 and parameters: {'n_estimators': 98, 'criterion': 'gini', 'max_depth': 22, 'min_samples_split': 10, 'min_samples_leaf': 1}. Best is trial 276 with value: 0.8188065954265008.
[I 2025-04-07 05:58:08,251] Trial 1099 finished with value: 0.8185550055266484 and parameters: {'n_estimators': 100, 'criterion': 'gini', 'max_depth': 64, 'min_samples_split': 10, 'min_samples_leaf': 1}. Best is trial 276 with value: 0.8188065954265008.
[I 2025-04-07 05:58:20,079] Trial 1103 finished with value: 0.8160397742948472 and parameters: {'n_estimators': 102, 'criterion': 'gini', 'max_depth': 64, 'min_samples_split': 9, 'min_samples_leaf': 2}. Best is trial 276 with value: 0.8188065954265008.
[I 2025-04-07 05:58:32,832] Trial 1107 finished with value: 0.8170039767265724 and parameters: {'n_estimators': 118, 'criterion': 'gini', 'max_depth': 63, 'min_samples_split': 12, 'min_samples_leaf': 1}. Best is trial 276 with value: 0.8188065954265008.
[I 2025-04-07 05:58:44,116] Trial 1112 finished with value: 0.8160397040036129 and parameters: {'n_estimators': 105, 'criterion': 'gini', 'max_depth': 64, 'min_samples_split': 11, 'min_samples_leaf': 1}. Best is trial 276 with value: 0.8188065954265008.
[I 2025-04-07 05:58:55,949] Trial 1116 finished with value: 0.8162493651822915 and parameters: {'n_estimators': 106, 'criterion': 'gini', 'max_depth': 61, 'min_samples_split': 10, 'min_samples_leaf': 2}. Best is trial 276 with value: 0.8188065954265008.
[I 2025-04-07 05:59:15,938] Trial 1120 finished with value: 0.8176327493889056 and parameters: {'n_estimators': 194, 'criterion': 'gini', 'max_depth': 62, 'min_samples_split': 10, 'min_samples_leaf': 1}. Best is trial 276 with value: 0.8188065954265008.
[I 2025-04-07 05:59:24,121] Trial 1126 finished with value: 0.8155784177794647 and parameters: {'n_estimators': 70, 'criterion': 'gini', 'max_depth': 64, 'min_samples_split': 9, 'min_samples_leaf': 1}. Best is trial 276 with value: 0.8188065954265008.
[I 2025-04-07 05:59:33,552] Trial 1129 finished with value: 0.8159138475488568 and parameters: {'n_estimators': 83, 'criterion': 'gini', 'max_depth': 62, 'min_samples_split': 11, 'min_samples_leaf': 3}. Best is trial 276 with value: 0.8188065954265008.
[I 2025-04-07 05:59:45,686] Trial 1133 finished with value: 0.8162074891795431 and parameters: {'n_estimators': 111, 'criterion': 'gini', 'max_depth': 62, 'min_samples_split': 10, 'min_samples_leaf': 2}. Best is trial 276 with value: 0.8188065954265008.
[I 2025-04-07 05:59:54,730] Trial 1137 finished with value: 0.8175489798106004 and parameters: {'n_estimators': 96, 'criterion': 'gini', 'max_depth': 64, 'min_samples_split': 8, 'min_samples_leaf': 1}. Best is trial 276 with value: 0.8188065954265008.
訓練集準確率: 0.9335094118140276
測試集準確率: 0.8105298457411133
10-fold CV 準確率:  0.8188065954265008

