[I 2025-04-07 05:54:58,054] Trial 1034 finished with value: 0.8161654725943265 and parameters: {'n_estimators': 112, 'criterion': 'gini', 'max_depth': 62, 'min_samples_split': 10, 'min_samples_leaf': 3}. Best is trial 276 with value: 0.8188065954265008.
[I 2025-04-07 05:55:10,128] Trial 1038 finished with value: 0.816207260733032 and parameters: {'n_estimators': 109, 'criterion': 'gini', 'max_depth': 60, 'min_samples_split': 11, 'min_samples_leaf': 2}. Best is trial 276 with value: 0.8188065954265008.
[I 2025-04-07 05:55:21,821] Trial 1042 finished with value: 0.8154525788975171 and parameters: {'n_estimators': 104, 'criterion': 'gini', 'max_depth': 56, 'min_samples_split': 9, 'min_samples_leaf': 1}. Best is trial 276 with value: 0.8188065954265008.
[I 2025-04-07 05:55:32,375] Trial 1046 finished with value: 0.815368809319212 and parameters: {'n_estimators': 101, 'criterion': 'gini', 'max_depth': 57, 'min_samples_split': 9, 'min_samples_leaf': 1}. Best is trial 276 with value: 0.8188065954265008.
[I 2025-04-07 05:55:41,100] Trial 1050 finished with value: 0.7605320694969432 and parameters: {'n_estimators': 91, 'criterion': 'gini', 'max_depth': 3, 'min_samples_split': 10, 'min_samples_leaf': 1}. Best is trial 276 with value: 0.8188065954265008.
[I 2025-04-07 05:55:54,452] Trial 1054 finished with value: 0.8162492070270148 and parameters: {'n_estimators': 105, 'criterion': 'gini', 'max_depth': 55, 'min_samples_split': 11, 'min_samples_leaf': 2}. Best is trial 276 with value: 0.8188065954265008.
[I 2025-04-07 05:56:09,756] Trial 1058 finished with value: 0.8157461853825863 and parameters: {'n_estimators': 118, 'criterion': 'gini', 'max_depth': 58, 'min_samples_split': 11, 'min_samples_leaf': 1}. Best is trial 276 with value: 0.8188065954265008.
[I 2025-04-07 05:56:23,068] Trial 1062 finished with value: 0.8167524395451453 and parameters: {'n_estimators': 113, 'criterion': 'gini', 'max_depth': 54, 'min_samples_split': 12, 'min_samples_leaf': 1}. Best is trial 276 with value: 0.8188065954265008.
[I 2025-04-07 05:56:32,947] Trial 1066 finished with value: 0.7797757358174255 and parameters: {'n_estimators': 95, 'criterion': 'gini', 'max_depth': 5, 'min_samples_split': 9, 'min_samples_leaf': 16}. Best is trial 276 with value: 0.8188065954265008.
[I 2025-04-07 05:56:44,308] Trial 1070 finished with value: 0.815914146286602 and parameters: {'n_estimators': 102, 'criterion': 'gini', 'max_depth': 59, 'min_samples_split': 10, 'min_samples_leaf': 2}. Best is trial 276 with value: 0.8188065954265008.
[I 2025-04-07 05:56:54,315] Trial 1074 finished with value: 0.8177584301155763 and parameters: {'n_estimators': 88, 'criterion': 'gini', 'max_depth': 61, 'min_samples_split': 10, 'min_samples_leaf': 1}. Best is trial 276 with value: 0.8188065954265008.
[I 2025-04-07 05:57:06,108] Trial 1078 finished with value: 0.8167943682663192 and parameters: {'n_estimators': 99, 'criterion': 'entropy', 'max_depth': 56, 'min_samples_split': 11, 'min_samples_leaf': 1}. Best is trial 276 with value: 0.8188065954265008.
[I 2025-04-07 05:57:17,634] Trial 1082 finished with value: 0.8156202410637876 and parameters: {'n_estimators': 107, 'criterion': 'gini', 'max_depth': 53, 'min_samples_split': 9, 'min_samples_leaf': 1}. Best is trial 276 with value: 0.8188065954265008.
[I 2025-04-07 05:57:28,528] Trial 1086 finished with value: 0.8161656131767948 and parameters: {'n_estimators': 104, 'criterion': 'gini', 'max_depth': 54, 'min_samples_split': 10, 'min_samples_leaf': 2}. Best is trial 276 with value: 0.8188065954265008.
[I 2025-04-07 05:57:38,747] Trial 1090 finished with value: 0.8171716564656512 and parameters: {'n_estimators': 91, 'criterion': 'gini', 'max_depth': 58, 'min_samples_split': 8, 'min_samples_leaf': 1}. Best is trial 276 with value: 0.8188065954265008.
[I 2025-04-07 05:57:52,032] Trial 1094 finished with value: 0.8158300076793173 and parameters: {'n_estimators': 112, 'criterion': 'gini', 'max_depth': 57, 'min_samples_split': 11, 'min_samples_leaf': 1}. Best is trial 276 with value: 0.8188065954265008.
[I 2025-04-07 05:58:02,686] Trial 1098 finished with value: 0.8159557938428394 and parameters: {'n_estimators': 98, 'criterion': 'gini', 'max_depth': 53, 'min_samples_split': 10, 'min_samples_leaf': 3}. Best is trial 276 with value: 0.8188065954265008.
[I 2025-04-07 05:58:13,954] Trial 1102 finished with value: 0.8160397742948472 and parameters: {'n_estimators': 102, 'criterion': 'gini', 'max_depth': 64, 'min_samples_split': 9, 'min_samples_leaf': 2}. Best is trial 276 with value: 0.8188065954265008.
[I 2025-04-07 05:58:26,538] Trial 1106 finished with value: 0.8150753082709938 and parameters: {'n_estimators': 118, 'criterion': 'gini', 'max_depth': 63, 'min_samples_split': 9, 'min_samples_leaf': 1}. Best is trial 276 with value: 0.8188065954265008.
[I 2025-04-07 05:58:36,879] Trial 1110 finished with value: 0.8180519487366029 and parameters: {'n_estimators': 95, 'criterion': 'gini', 'max_depth': 63, 'min_samples_split': 10, 'min_samples_leaf': 1}. Best is trial 276 with value: 0.8188065954265008.
[I 2025-04-07 05:58:48,805] Trial 1114 finished with value: 0.8162493651822915 and parameters: {'n_estimators': 106, 'criterion': 'gini', 'max_depth': 62, 'min_samples_split': 10, 'min_samples_leaf': 2}. Best is trial 276 with value: 0.8188065954265008.
[I 2025-04-07 05:58:59,700] Trial 1118 finished with value: 0.8161656131767948 and parameters: {'n_estimators': 99, 'criterion': 'gini', 'max_depth': 60, 'min_samples_split': 10, 'min_samples_leaf': 2}. Best is trial 276 with value: 0.8188065954265008.
[I 2025-04-07 05:59:19,341] Trial 1122 finished with value: 0.8175908206677317 and parameters: {'n_estimators': 192, 'criterion': 'gini', 'max_depth': 64, 'min_samples_split': 10, 'min_samples_leaf': 1}. Best is trial 276 with value: 0.8188065954265008.
[I 2025-04-07 05:59:27,373] Trial 1128 finished with value: 0.8153688268920204 and parameters: {'n_estimators': 69, 'criterion': 'gini', 'max_depth': 64, 'min_samples_split': 9, 'min_samples_leaf': 1}. Best is trial 276 with value: 0.8188065954265008.
[I 2025-04-07 05:59:39,420] Trial 1131 finished with value: 0.8162491894542061 and parameters: {'n_estimators': 110, 'criterion': 'gini', 'max_depth': 61, 'min_samples_split': 11, 'min_samples_leaf': 2}. Best is trial 276 with value: 0.8188065954265008.
[I 2025-04-07 05:59:50,251] Trial 1135 finished with value: 0.8165847949516835 and parameters: {'n_estimators': 95, 'criterion': 'gini', 'max_depth': 62, 'min_samples_split': 10, 'min_samples_leaf': 2}. Best is trial 276 with value: 0.8188065954265008.
訓練集準確率: 0.9335094118140276
測試集準確率: 0.8105298457411133
10-fold CV 準確率:  0.8188065954265008

