[I 2025-04-07 05:36:44,276] Trial 693 finished with value: 0.8159977577096305 and parameters: {'n_estimators': 125, 'criterion': 'gini', 'max_depth': 52, 'min_samples_split': 11, 'min_samples_leaf': 1}. Best is trial 276 with value: 0.8188065954265008.
[I 2025-04-07 05:36:54,070] Trial 697 finished with value: 0.815955881706882 and parameters: {'n_estimators': 93, 'criterion': 'gini', 'max_depth': 54, 'min_samples_split': 9, 'min_samples_leaf': 2}. Best is trial 276 with value: 0.8188065954265008.
[I 2025-04-07 05:37:04,754] Trial 701 finished with value: 0.7803206686102192 and parameters: {'n_estimators': 105, 'criterion': 'gini', 'max_depth': 5, 'min_samples_split': 12, 'min_samples_leaf': 1}. Best is trial 276 with value: 0.8188065954265008.
[I 2025-04-07 05:37:18,915] Trial 705 finished with value: 0.8185550406722653 and parameters: {'n_estimators': 111, 'criterion': 'gini', 'max_depth': 50, 'min_samples_split': 10, 'min_samples_leaf': 1}. Best is trial 276 with value: 0.8188065954265008.
[I 2025-04-07 05:37:32,863] Trial 710 finished with value: 0.8162072607330322 and parameters: {'n_estimators': 107, 'criterion': 'gini', 'max_depth': 57, 'min_samples_split': 11, 'min_samples_leaf': 2}. Best is trial 276 with value: 0.8188065954265008.
[I 2025-04-07 05:37:46,166] Trial 714 finished with value: 0.815368809319212 and parameters: {'n_estimators': 101, 'criterion': 'gini', 'max_depth': 63, 'min_samples_split': 9, 'min_samples_leaf': 1}. Best is trial 276 with value: 0.8188065954265008.
[I 2025-04-07 05:38:01,466] Trial 718 finished with value: 0.8185969518206309 and parameters: {'n_estimators': 105, 'criterion': 'gini', 'max_depth': 58, 'min_samples_split': 10, 'min_samples_leaf': 1}. Best is trial 276 with value: 0.8188065954265008.
[I 2025-04-07 05:38:14,371] Trial 721 finished with value: 0.8158721121285767 and parameters: {'n_estimators': 97, 'criterion': 'gini', 'max_depth': 52, 'min_samples_split': 10, 'min_samples_leaf': 2}. Best is trial 276 with value: 0.8188065954265008.
[I 2025-04-07 05:38:29,992] Trial 725 finished with value: 0.8167524219723369 and parameters: {'n_estimators': 120, 'criterion': 'gini', 'max_depth': 57, 'min_samples_split': 10, 'min_samples_leaf': 2}. Best is trial 276 with value: 0.8188065954265008.
[I 2025-04-07 05:38:44,461] Trial 730 finished with value: 0.8158298143784235 and parameters: {'n_estimators': 110, 'criterion': 'gini', 'max_depth': 50, 'min_samples_split': 9, 'min_samples_leaf': 1}. Best is trial 276 with value: 0.8188065954265008.
[I 2025-04-07 05:38:57,949] Trial 734 finished with value: 0.8155363836214395 and parameters: {'n_estimators': 102, 'criterion': 'gini', 'max_depth': 51, 'min_samples_split': 9, 'min_samples_leaf': 1}. Best is trial 276 with value: 0.8188065954265008.
[I 2025-04-07 05:39:11,389] Trial 738 finished with value: 0.8182616274880902 and parameters: {'n_estimators': 98, 'criterion': 'gini', 'max_depth': 56, 'min_samples_split': 10, 'min_samples_leaf': 1}. Best is trial 276 with value: 0.8188065954265008.
[I 2025-04-07 05:39:23,384] Trial 741 finished with value: 0.8171295344435834 and parameters: {'n_estimators': 94, 'criterion': 'entropy', 'max_depth': 54, 'min_samples_split': 10, 'min_samples_leaf': 3}. Best is trial 276 with value: 0.8188065954265008.
[I 2025-04-07 05:39:34,714] Trial 745 finished with value: 0.8100027940765578 and parameters: {'n_estimators': 89, 'criterion': 'gini', 'max_depth': 54, 'min_samples_split': 11, 'min_samples_leaf': 20}. Best is trial 276 with value: 0.8188065954265008.
[I 2025-04-07 05:39:47,664] Trial 749 finished with value: 0.8182616274880902 and parameters: {'n_estimators': 98, 'criterion': 'gini', 'max_depth': 52, 'min_samples_split': 10, 'min_samples_leaf': 1}. Best is trial 276 with value: 0.8188065954265008.
[I 2025-04-07 05:40:00,036] Trial 753 finished with value: 0.818345414639204 and parameters: {'n_estimators': 94, 'criterion': 'gini', 'max_depth': 53, 'min_samples_split': 10, 'min_samples_leaf': 1}. Best is trial 276 with value: 0.8188065954265008.
[I 2025-04-07 05:40:12,056] Trial 757 finished with value: 0.8161234911547268 and parameters: {'n_estimators': 91, 'criterion': 'gini', 'max_depth': 49, 'min_samples_split': 9, 'min_samples_leaf': 2}. Best is trial 276 with value: 0.8188065954265008.
[I 2025-04-07 05:40:25,330] Trial 761 finished with value: 0.8164588506328847 and parameters: {'n_estimators': 99, 'criterion': 'gini', 'max_depth': 51, 'min_samples_split': 11, 'min_samples_leaf': 1}. Best is trial 276 with value: 0.8188065954265008.
[I 2025-04-07 05:40:38,253] Trial 765 finished with value: 0.8185550055266484 and parameters: {'n_estimators': 100, 'criterion': 'gini', 'max_depth': 53, 'min_samples_split': 10, 'min_samples_leaf': 1}. Best is trial 276 with value: 0.8188065954265008.
[I 2025-04-07 05:40:49,923] Trial 769 finished with value: 0.8170879396057715 and parameters: {'n_estimators': 87, 'criterion': 'gini', 'max_depth': 48, 'min_samples_split': 10, 'min_samples_leaf': 2}. Best is trial 276 with value: 0.8188065954265008.
[I 2025-04-07 05:41:02,454] Trial 773 finished with value: 0.8182196109028734 and parameters: {'n_estimators': 93, 'criterion': 'gini', 'max_depth': 50, 'min_samples_split': 10, 'min_samples_leaf': 1}. Best is trial 276 with value: 0.8188065954265008.
[I 2025-04-07 05:41:14,953] Trial 777 finished with value: 0.8152430231556899 and parameters: {'n_estimators': 96, 'criterion': 'gini', 'max_depth': 51, 'min_samples_split': 9, 'min_samples_leaf': 1}. Best is trial 276 with value: 0.8188065954265008.
[I 2025-04-07 05:41:27,790] Trial 781 finished with value: 0.816584777378875 and parameters: {'n_estimators': 100, 'criterion': 'gini', 'max_depth': 52, 'min_samples_split': 11, 'min_samples_leaf': 2}. Best is trial 276 with value: 0.8188065954265008.
[I 2025-04-07 05:41:40,927] Trial 785 finished with value: 0.8182615220512389 and parameters: {'n_estimators': 102, 'criterion': 'gini', 'max_depth': 52, 'min_samples_split': 10, 'min_samples_leaf': 1}. Best is trial 276 with value: 0.8188065954265008.
[I 2025-04-07 05:41:53,450] Trial 789 finished with value: 0.8122666990006344 and parameters: {'n_estimators': 92, 'criterion': 'gini', 'max_depth': 49, 'min_samples_split': 10, 'min_samples_leaf': 13}. Best is trial 276 with value: 0.8188065954265008.
[I 2025-04-07 05:42:06,689] Trial 793 finished with value: 0.8164588506328847 and parameters: {'n_estimators': 99, 'criterion': 'gini', 'max_depth': 53, 'min_samples_split': 11, 'min_samples_leaf': 1}. Best is trial 276 with value: 0.8188065954265008.
[I 2025-04-07 05:42:19,912] Trial 797 finished with value: 0.8159979158649072 and parameters: {'n_estimators': 97, 'criterion': 'gini', 'max_depth': 51, 'min_samples_split': 9, 'min_samples_leaf': 2}. Best is trial 276 with value: 0.8188065954265008.
[I 2025-04-07 05:42:33,955] Trial 801 finished with value: 0.8166267236728576 and parameters: {'n_estimators': 104, 'criterion': 'entropy', 'max_depth': 54, 'min_samples_split': 10, 'min_samples_leaf': 2}. Best is trial 276 with value: 0.8188065954265008.
[I 2025-04-07 05:42:46,090] Trial 805 finished with value: 0.8182615220512389 and parameters: {'n_estimators': 102, 'criterion': 'gini', 'max_depth': 51, 'min_samples_split': 10, 'min_samples_leaf': 1}. Best is trial 276 with value: 0.8188065954265008.
[I 2025-04-07 05:42:56,653] Trial 809 finished with value: 0.8183034859180299 and parameters: {'n_estimators': 94, 'criterion': 'gini', 'max_depth': 46, 'min_samples_split': 10, 'min_samples_leaf': 1}. Best is trial 276 with value: 0.8188065954265008.
[I 2025-04-07 05:43:08,313] Trial 813 finished with value: 0.8161234735819182 and parameters: {'n_estimators': 109, 'criterion': 'gini', 'max_depth': 55, 'min_samples_split': 11, 'min_samples_leaf': 1}. Best is trial 276 with value: 0.8188065954265008.
[I 2025-04-07 05:43:20,254] Trial 817 finished with value: 0.8154109137684712 and parameters: {'n_estimators': 107, 'criterion': 'gini', 'max_depth': 50, 'min_samples_split': 9, 'min_samples_leaf': 2}. Best is trial 276 with value: 0.8188065954265008.
[I 2025-04-07 05:43:25,713] Trial 822 finished with value: 0.8161652968662411 and parameters: {'n_estimators': 40, 'criterion': 'gini', 'max_depth': 53, 'min_samples_split': 10, 'min_samples_leaf': 1}. Best is trial 276 with value: 0.8188065954265008.
[I 2025-04-07 05:43:37,160] Trial 824 finished with value: 0.8182616274880902 and parameters: {'n_estimators': 98, 'criterion': 'gini', 'max_depth': 52, 'min_samples_split': 10, 'min_samples_leaf': 1}. Best is trial 276 with value: 0.8188065954265008.
[I 2025-04-07 05:43:48,285] Trial 827 finished with value: 0.8185550055266484 and parameters: {'n_estimators': 100, 'criterion': 'gini', 'max_depth': 52, 'min_samples_split': 10, 'min_samples_leaf': 1}. Best is trial 276 with value: 0.8188065954265008.
[I 2025-04-07 05:43:58,184] Trial 831 finished with value: 0.8166266182360064 and parameters: {'n_estimators': 91, 'criterion': 'gini', 'max_depth': 48, 'min_samples_split': 9, 'min_samples_leaf': 3}. Best is trial 276 with value: 0.8188065954265008.
[I 2025-04-07 05:44:08,976] Trial 835 finished with value: 0.8164170624941791 and parameters: {'n_estimators': 95, 'criterion': 'gini', 'max_depth': 51, 'min_samples_split': 11, 'min_samples_leaf': 2}. Best is trial 276 with value: 0.8188065954265008.
[I 2025-04-07 05:44:19,568] Trial 839 finished with value: 0.8185970396846735 and parameters: {'n_estimators': 97, 'criterion': 'gini', 'max_depth': 55, 'min_samples_split': 10, 'min_samples_leaf': 1}. Best is trial 276 with value: 0.8188065954265008.
[I 2025-04-07 05:44:29,379] Trial 844 finished with value: 0.8152010417160902 and parameters: {'n_estimators': 84, 'criterion': 'gini', 'max_depth': 54, 'min_samples_split': 9, 'min_samples_leaf': 1}. Best is trial 276 with value: 0.8188065954265008.
[I 2025-04-07 05:44:40,866] Trial 848 finished with value: 0.8185969518206309 and parameters: {'n_estimators': 105, 'criterion': 'gini', 'max_depth': 56, 'min_samples_split': 10, 'min_samples_leaf': 1}. Best is trial 276 with value: 0.8188065954265008.
[I 2025-04-07 05:44:52,561] Trial 852 finished with value: 0.8161236493100038 and parameters: {'n_estimators': 105, 'criterion': 'gini', 'max_depth': 52, 'min_samples_split': 10, 'min_samples_leaf': 2}. Best is trial 276 with value: 0.8188065954265008.
[I 2025-04-07 05:45:03,312] Trial 856 finished with value: 0.81612345600911 and parameters: {'n_estimators': 94, 'criterion': 'gini', 'max_depth': 50, 'min_samples_split': 11, 'min_samples_leaf': 1}. Best is trial 276 with value: 0.8188065954265008.
[I 2025-04-07 05:45:14,267] Trial 858 finished with value: 0.8113443374260404 and parameters: {'n_estimators': 101, 'criterion': 'gini', 'max_depth': 53, 'min_samples_split': 12, 'min_samples_leaf': 16}. Best is trial 276 with value: 0.8188065954265008.
[I 2025-04-07 05:45:24,644] Trial 862 finished with value: 0.8180519487366029 and parameters: {'n_estimators': 95, 'criterion': 'gini', 'max_depth': 55, 'min_samples_split': 10, 'min_samples_leaf': 1}. Best is trial 276 with value: 0.8188065954265008.
[I 2025-04-07 05:45:36,318] Trial 866 finished with value: 0.81805198388222 and parameters: {'n_estimators': 91, 'criterion': 'gini', 'max_depth': 51, 'min_samples_split': 10, 'min_samples_leaf': 1}. Best is trial 276 with value: 0.8188065954265008.
[I 2025-04-07 05:45:51,985] Trial 869 finished with value: 0.8162911533209971 and parameters: {'n_estimators': 115, 'criterion': 'gini', 'max_depth': 50, 'min_samples_split': 11, 'min_samples_leaf': 2}. Best is trial 276 with value: 0.8188065954265008.
[I 2025-04-07 05:46:06,734] Trial 873 finished with value: 0.8186389332602305 and parameters: {'n_estimators': 104, 'criterion': 'gini', 'max_depth': 54, 'min_samples_split': 10, 'min_samples_leaf': 1}. Best is trial 276 with value: 0.8188065954265008.
[I 2025-04-07 05:46:21,162] Trial 877 finished with value: 0.8183873257875692 and parameters: {'n_estimators': 111, 'criterion': 'gini', 'max_depth': 47, 'min_samples_split': 10, 'min_samples_leaf': 1}. Best is trial 276 with value: 0.8188065954265008.
[I 2025-04-07 05:46:32,018] Trial 881 finished with value: 0.8178423227035415 and parameters: {'n_estimators': 82, 'criterion': 'gini', 'max_depth': 56, 'min_samples_split': 10, 'min_samples_leaf': 1}. Best is trial 276 with value: 0.8188065954265008.
[I 2025-04-07 05:46:44,931] Trial 885 finished with value: 0.8159978280008644 and parameters: {'n_estimators': 99, 'criterion': 'gini', 'max_depth': 52, 'min_samples_split': 9, 'min_samples_leaf': 2}. Best is trial 276 with value: 0.8188065954265008.
[I 2025-04-07 05:46:58,358] Trial 890 finished with value: 0.8182615220512389 and parameters: {'n_estimators': 102, 'criterion': 'gini', 'max_depth': 53, 'min_samples_split': 10, 'min_samples_leaf': 1}. Best is trial 276 with value: 0.8188065954265008.
[I 2025-04-07 05:47:12,487] Trial 894 finished with value: 0.8185969518206309 and parameters: {'n_estimators': 105, 'criterion': 'gini', 'max_depth': 55, 'min_samples_split': 10, 'min_samples_leaf': 1}. Best is trial 276 with value: 0.8188065954265008.
[I 2025-04-07 05:47:25,768] Trial 898 finished with value: 0.8182615220512389 and parameters: {'n_estimators': 102, 'criterion': 'gini', 'max_depth': 51, 'min_samples_split': 10, 'min_samples_leaf': 1}. Best is trial 276 with value: 0.8188065954265008.
[I 2025-04-07 05:47:37,807] Trial 902 finished with value: 0.816836349705919 and parameters: {'n_estimators': 92, 'criterion': 'gini', 'max_depth': 53, 'min_samples_split': 11, 'min_samples_leaf': 2}. Best is trial 276 with value: 0.8188065954265008.
[I 2025-04-07 05:47:52,036] Trial 906 finished with value: 0.8184712183755345 and parameters: {'n_estimators': 113, 'criterion': 'gini', 'max_depth': 55, 'min_samples_split': 10, 'min_samples_leaf': 1}. Best is trial 276 with value: 0.8188065954265008.
[I 2025-04-07 05:48:07,410] Trial 910 finished with value: 0.8159138651216653 and parameters: {'n_estimators': 108, 'criterion': 'entropy', 'max_depth': 51, 'min_samples_split': 9, 'min_samples_leaf': 1}. Best is trial 276 with value: 0.8188065954265008.
[I 2025-04-07 05:48:23,125] Trial 914 finished with value: 0.8172134973227825 and parameters: {'n_estimators': 119, 'criterion': 'gini', 'max_depth': 56, 'min_samples_split': 17, 'min_samples_leaf': 1}. Best is trial 276 with value: 0.8188065954265008.
[I 2025-04-07 05:48:35,220] Trial 919 finished with value: 0.8163750634817708 and parameters: {'n_estimators': 90, 'criterion': 'gini', 'max_depth': 36, 'min_samples_split': 10, 'min_samples_leaf': 2}. Best is trial 276 with value: 0.8188065954265008.
[I 2025-04-07 05:48:48,098] Trial 923 finished with value: 0.8164588506328847 and parameters: {'n_estimators': 99, 'criterion': 'gini', 'max_depth': 52, 'min_samples_split': 11, 'min_samples_leaf': 1}. Best is trial 276 with value: 0.8188065954265008.
[I 2025-04-07 05:49:01,689] Trial 927 finished with value: 0.8186389332602305 and parameters: {'n_estimators': 104, 'criterion': 'gini', 'max_depth': 54, 'min_samples_split': 10, 'min_samples_leaf': 1}. Best is trial 276 with value: 0.8188065954265008.
[I 2025-04-07 05:49:15,827] Trial 931 finished with value: 0.816417027348562 and parameters: {'n_estimators': 107, 'criterion': 'gini', 'max_depth': 50, 'min_samples_split': 10, 'min_samples_leaf': 3}. Best is trial 276 with value: 0.8188065954265008.
[I 2025-04-07 05:49:29,326] Trial 935 finished with value: 0.8159139881313251 and parameters: {'n_estimators': 101, 'criterion': 'gini', 'max_depth': 58, 'min_samples_split': 9, 'min_samples_leaf': 2}. Best is trial 276 with value: 0.8188065954265008.
[I 2025-04-07 05:49:44,253] Trial 939 finished with value: 0.8184712183755345 and parameters: {'n_estimators': 114, 'criterion': 'gini', 'max_depth': 51, 'min_samples_split': 10, 'min_samples_leaf': 1}. Best is trial 276 with value: 0.8188065954265008.
[I 2025-04-07 05:50:01,029] Trial 943 finished with value: 0.8159138299760482 and parameters: {'n_estimators': 150, 'criterion': 'gini', 'max_depth': 53, 'min_samples_split': 11, 'min_samples_leaf': 1}. Best is trial 276 with value: 0.8188065954265008.
[I 2025-04-07 05:50:14,359] Trial 948 finished with value: 0.8158720594101512 and parameters: {'n_estimators': 107, 'criterion': 'gini', 'max_depth': 57, 'min_samples_split': 10, 'min_samples_leaf': 2}. Best is trial 276 with value: 0.8188065954265008.
[I 2025-04-07 05:50:26,695] Trial 952 finished with value: 0.8150754488534622 and parameters: {'n_estimators': 98, 'criterion': 'gini', 'max_depth': 52, 'min_samples_split': 9, 'min_samples_leaf': 7}. Best is trial 276 with value: 0.8188065954265008.
[I 2025-04-07 05:50:39,088] Trial 956 finished with value: 0.81809384231216 and parameters: {'n_estimators': 92, 'criterion': 'gini', 'max_depth': 48, 'min_samples_split': 10, 'min_samples_leaf': 1}. Best is trial 276 with value: 0.8188065954265008.
[I 2025-04-07 05:50:54,339] Trial 960 finished with value: 0.8156623103674299 and parameters: {'n_estimators': 117, 'criterion': 'gini', 'max_depth': 54, 'min_samples_split': 11, 'min_samples_leaf': 1}. Best is trial 276 with value: 0.8188065954265008.
[I 2025-04-07 05:51:07,816] Trial 964 finished with value: 0.8110087846469887 and parameters: {'n_estimators': 109, 'criterion': 'gini', 'max_depth': 51, 'min_samples_split': 11, 'min_samples_leaf': 18}. Best is trial 276 with value: 0.8188065954265008.
[I 2025-04-07 05:51:21,255] Trial 968 finished with value: 0.8165427256480413 and parameters: {'n_estimators': 102, 'criterion': 'entropy', 'max_depth': 52, 'min_samples_split': 10, 'min_samples_leaf': 1}. Best is trial 276 with value: 0.8188065954265008.
[I 2025-04-07 05:51:35,165] Trial 971 finished with value: 0.8162493651822915 and parameters: {'n_estimators': 106, 'criterion': 'gini', 'max_depth': 55, 'min_samples_split': 10, 'min_samples_leaf': 2}. Best is trial 276 with value: 0.8188065954265008.
[I 2025-04-07 05:51:48,063] Trial 976 finished with value: 0.8149495748258975 and parameters: {'n_estimators': 95, 'criterion': 'gini', 'max_depth': 50, 'min_samples_split': 9, 'min_samples_leaf': 1}. Best is trial 276 with value: 0.8188065954265008.
[I 2025-04-07 05:52:00,863] Trial 979 finished with value: 0.8188065954265008 and parameters: {'n_estimators': 99, 'criterion': 'gini', 'max_depth': 53, 'min_samples_split': 10, 'min_samples_leaf': 1}. Best is trial 276 with value: 0.8188065954265008.
[I 2025-04-07 05:52:12,974] Trial 983 finished with value: 0.8128536308058363 and parameters: {'n_estimators': 93, 'criterion': 'gini', 'max_depth': 55, 'min_samples_split': 10, 'min_samples_leaf': 11}. Best is trial 276 with value: 0.8188065954265008.
[I 2025-04-07 05:52:25,259] Trial 987 finished with value: 0.816836349705919 and parameters: {'n_estimators': 92, 'criterion': 'gini', 'max_depth': 59, 'min_samples_split': 11, 'min_samples_leaf': 2}. Best is trial 276 with value: 0.8188065954265008.
[I 2025-04-07 05:52:38,649] Trial 991 finished with value: 0.8188065954265008 and parameters: {'n_estimators': 99, 'criterion': 'gini', 'max_depth': 61, 'min_samples_split': 10, 'min_samples_leaf': 1}. Best is trial 276 with value: 0.8188065954265008.
[I 2025-04-07 05:52:51,783] Trial 995 finished with value: 0.8185550055266484 and parameters: {'n_estimators': 100, 'criterion': 'gini', 'max_depth': 62, 'min_samples_split': 10, 'min_samples_leaf': 1}. Best is trial 276 with value: 0.8188065954265008.
[I 2025-04-07 05:53:04,652] Trial 999 finished with value: 0.8185970396846735 and parameters: {'n_estimators': 97, 'criterion': 'gini', 'max_depth': 61, 'min_samples_split': 10, 'min_samples_leaf': 1}. Best is trial 276 with value: 0.8188065954265008.
[I 2025-04-07 05:53:18,221] Trial 1004 finished with value: 0.8157882019678031 and parameters: {'n_estimators': 104, 'criterion': 'gini', 'max_depth': 61, 'min_samples_split': 9, 'min_samples_leaf': 2}. Best is trial 276 with value: 0.8188065954265008.
[I 2025-04-07 05:53:33,003] Trial 1008 finished with value: 0.8161234735819182 and parameters: {'n_estimators': 109, 'criterion': 'gini', 'max_depth': 64, 'min_samples_split': 11, 'min_samples_leaf': 1}. Best is trial 276 with value: 0.8188065954265008.
[I 2025-04-07 05:53:48,090] Trial 1012 finished with value: 0.8180938950305855 and parameters: {'n_estimators': 115, 'criterion': 'gini', 'max_depth': 64, 'min_samples_split': 10, 'min_samples_leaf': 1}. Best is trial 276 with value: 0.8188065954265008.
[I 2025-04-07 05:54:00,209] Trial 1016 finished with value: 0.8150336958603734 and parameters: {'n_estimators': 89, 'criterion': 'gini', 'max_depth': 59, 'min_samples_split': 10, 'min_samples_leaf': 9}. Best is trial 276 with value: 0.8188065954265008.
[I 2025-04-07 05:54:13,366] Trial 1020 finished with value: 0.8160398973045069 and parameters: {'n_estimators': 101, 'criterion': 'gini', 'max_depth': 60, 'min_samples_split': 10, 'min_samples_leaf': 2}. Best is trial 276 with value: 0.8188065954265008.
[I 2025-04-07 05:54:27,750] Trial 1024 finished with value: 0.816207383742692 and parameters: {'n_estimators': 106, 'criterion': 'entropy', 'max_depth': 60, 'min_samples_split': 9, 'min_samples_leaf': 1}. Best is trial 276 with value: 0.8188065954265008.
[I 2025-04-07 05:54:38,987] Trial 1028 finished with value: 0.81612345600911 and parameters: {'n_estimators': 94, 'criterion': 'gini', 'max_depth': 58, 'min_samples_split': 11, 'min_samples_leaf': 1}. Best is trial 276 with value: 0.8188065954265008.
[I 2025-04-07 05:54:50,675] Trial 1032 finished with value: 0.8182616274880902 and parameters: {'n_estimators': 98, 'criterion': 'gini', 'max_depth': 57, 'min_samples_split': 10, 'min_samples_leaf': 1}. Best is trial 276 with value: 0.8188065954265008.
[I 2025-04-07 05:55:03,317] Trial 1036 finished with value: 0.8164589033513104 and parameters: {'n_estimators': 112, 'criterion': 'gini', 'max_depth': 60, 'min_samples_split': 10, 'min_samples_leaf': 2}. Best is trial 276 with value: 0.8188065954265008.
