[I 2025-04-07 05:36:47,000] Trial 695 finished with value: 0.8158720594101512 and parameters: {'n_estimators': 96, 'criterion': 'gini', 'max_depth': 54, 'min_samples_split': 9, 'min_samples_leaf': 2}. Best is trial 276 with value: 0.8188065954265008.
[I 2025-04-07 05:36:58,063] Trial 699 finished with value: 0.8186389332602305 and parameters: {'n_estimators': 104, 'criterion': 'gini', 'max_depth': 54, 'min_samples_split': 10, 'min_samples_leaf': 1}. Best is trial 276 with value: 0.8188065954265008.
[I 2025-04-07 05:37:09,965] Trial 703 finished with value: 0.8185131119510913 and parameters: {'n_estimators': 111, 'criterion': 'gini', 'max_depth': 48, 'min_samples_split': 10, 'min_samples_leaf': 1}. Best is trial 276 with value: 0.8188065954265008.
[I 2025-04-07 05:37:24,473] Trial 707 finished with value: 0.815788166822186 and parameters: {'n_estimators': 108, 'criterion': 'gini', 'max_depth': 42, 'min_samples_split': 10, 'min_samples_leaf': 2}. Best is trial 276 with value: 0.8188065954265008.
[I 2025-04-07 05:37:37,437] Trial 711 finished with value: 0.8162073310242663 and parameters: {'n_estimators': 101, 'criterion': 'gini', 'max_depth': 53, 'min_samples_split': 11, 'min_samples_leaf': 1}. Best is trial 276 with value: 0.8188065954265008.
[I 2025-04-07 05:37:52,985] Trial 715 finished with value: 0.815787938375675 and parameters: {'n_estimators': 114, 'criterion': 'gini', 'max_depth': 55, 'min_samples_split': 9, 'min_samples_leaf': 1}. Best is trial 276 with value: 0.8188065954265008.
[I 2025-04-07 05:38:07,115] Trial 719 finished with value: 0.8185130943782829 and parameters: {'n_estimators': 105, 'criterion': 'gini', 'max_depth': 46, 'min_samples_split': 10, 'min_samples_leaf': 1}. Best is trial 276 with value: 0.8188065954265008.
[I 2025-04-07 05:38:20,070] Trial 723 finished with value: 0.8164171855038388 and parameters: {'n_estimators': 98, 'criterion': 'gini', 'max_depth': 57, 'min_samples_split': 10, 'min_samples_leaf': 2}. Best is trial 276 with value: 0.8188065954265008.
[I 2025-04-07 05:38:33,953] Trial 727 finished with value: 0.8185969869662479 and parameters: {'n_estimators': 109, 'criterion': 'gini', 'max_depth': 53, 'min_samples_split': 10, 'min_samples_leaf': 1}. Best is trial 276 with value: 0.8188065954265008.
[I 2025-04-07 05:38:47,531] Trial 731 finished with value: 0.8164588506328847 and parameters: {'n_estimators': 103, 'criterion': 'gini', 'max_depth': 50, 'min_samples_split': 11, 'min_samples_leaf': 1}. Best is trial 276 with value: 0.8188065954265008.
[I 2025-04-07 05:39:00,536] Trial 735 finished with value: 0.8149914332558371 and parameters: {'n_estimators': 99, 'criterion': 'gini', 'max_depth': 52, 'min_samples_split': 9, 'min_samples_leaf': 1}. Best is trial 276 with value: 0.8188065954265008.
[I 2025-04-07 05:39:14,619] Trial 739 finished with value: 0.8172974074835562 and parameters: {'n_estimators': 107, 'criterion': 'gini', 'max_depth': 56, 'min_samples_split': 12, 'min_samples_leaf': 2}. Best is trial 276 with value: 0.8188065954265008.
[I 2025-04-07 05:39:25,355] Trial 743 finished with value: 0.8170877638776861 and parameters: {'n_estimators': 87, 'criterion': 'entropy', 'max_depth': 54, 'min_samples_split': 11, 'min_samples_leaf': 2}. Best is trial 276 with value: 0.8188065954265008.
[I 2025-04-07 05:39:37,889] Trial 747 finished with value: 0.8188065954265008 and parameters: {'n_estimators': 99, 'criterion': 'gini', 'max_depth': 53, 'min_samples_split': 10, 'min_samples_leaf': 1}. Best is trial 276 with value: 0.8188065954265008.
[I 2025-04-07 05:39:49,099] Trial 751 finished with value: 0.818345449784821 and parameters: {'n_estimators': 84, 'criterion': 'gini', 'max_depth': 52, 'min_samples_split': 10, 'min_samples_leaf': 1}. Best is trial 276 with value: 0.8188065954265008.
[I 2025-04-07 05:40:01,622] Trial 754 finished with value: 0.8155366999319933 and parameters: {'n_estimators': 95, 'criterion': 'gini', 'max_depth': 49, 'min_samples_split': 9, 'min_samples_leaf': 2}. Best is trial 276 with value: 0.8188065954265008.
[I 2025-04-07 05:40:13,835] Trial 758 finished with value: 0.8152429704372641 and parameters: {'n_estimators': 92, 'criterion': 'gini', 'max_depth': 51, 'min_samples_split': 9, 'min_samples_leaf': 1}. Best is trial 276 with value: 0.8188065954265008.
[I 2025-04-07 05:40:26,740] Trial 762 finished with value: 0.8164588506328847 and parameters: {'n_estimators': 99, 'criterion': 'gini', 'max_depth': 51, 'min_samples_split': 11, 'min_samples_leaf': 1}. Best is trial 276 with value: 0.8188065954265008.
[I 2025-04-07 05:40:39,696] Trial 766 finished with value: 0.8160398973045069 and parameters: {'n_estimators': 101, 'criterion': 'gini', 'max_depth': 53, 'min_samples_split': 10, 'min_samples_leaf': 2}. Best is trial 276 with value: 0.8188065954265008.
[I 2025-04-07 05:40:52,206] Trial 771 finished with value: 0.8180938774577768 and parameters: {'n_estimators': 95, 'criterion': 'gini', 'max_depth': 50, 'min_samples_split': 10, 'min_samples_leaf': 1}. Best is trial 276 with value: 0.8188065954265008.
[I 2025-04-07 05:41:05,365] Trial 775 finished with value: 0.8175909788230085 and parameters: {'n_estimators': 97, 'criterion': 'gini', 'max_depth': 50, 'min_samples_split': 8, 'min_samples_leaf': 1}. Best is trial 276 with value: 0.8188065954265008.
[I 2025-04-07 05:41:17,466] Trial 779 finished with value: 0.8159138124032396 and parameters: {'n_estimators': 90, 'criterion': 'gini', 'max_depth': 47, 'min_samples_split': 9, 'min_samples_leaf': 2}. Best is trial 276 with value: 0.8188065954265008.
[I 2025-04-07 05:41:30,708] Trial 783 finished with value: 0.8185550055266484 and parameters: {'n_estimators': 100, 'criterion': 'gini', 'max_depth': 52, 'min_samples_split': 10, 'min_samples_leaf': 1}. Best is trial 276 with value: 0.8188065954265008.
[I 2025-04-07 05:41:44,078] Trial 787 finished with value: 0.8186389332602305 and parameters: {'n_estimators': 104, 'criterion': 'gini', 'max_depth': 52, 'min_samples_split': 10, 'min_samples_leaf': 1}. Best is trial 276 with value: 0.8188065954265008.
[I 2025-04-07 05:41:57,077] Trial 791 finished with value: 0.8149078569784258 and parameters: {'n_estimators': 92, 'criterion': 'gini', 'max_depth': 49, 'min_samples_split': 10, 'min_samples_leaf': 6}. Best is trial 276 with value: 0.8188065954265008.
[I 2025-04-07 05:42:09,951] Trial 795 finished with value: 0.8163749404721111 and parameters: {'n_estimators': 97, 'criterion': 'gini', 'max_depth': 53, 'min_samples_split': 11, 'min_samples_leaf': 1}. Best is trial 276 with value: 0.8188065954265008.
[I 2025-04-07 05:42:23,978] Trial 799 finished with value: 0.8178424105675841 and parameters: {'n_estimators': 104, 'criterion': 'entropy', 'max_depth': 24, 'min_samples_split': 9, 'min_samples_leaf': 2}. Best is trial 276 with value: 0.8188065954265008.
[I 2025-04-07 05:42:37,752] Trial 803 finished with value: 0.8186389332602305 and parameters: {'n_estimators': 104, 'criterion': 'gini', 'max_depth': 54, 'min_samples_split': 10, 'min_samples_leaf': 1}. Best is trial 276 with value: 0.8188065954265008.
[I 2025-04-07 05:42:49,278] Trial 807 finished with value: 0.8182615571968558 and parameters: {'n_estimators': 101, 'criterion': 'gini', 'max_depth': 51, 'min_samples_split': 10, 'min_samples_leaf': 1}. Best is trial 276 with value: 0.8188065954265008.
[I 2025-04-07 05:43:01,219] Trial 811 finished with value: 0.8185969869662479 and parameters: {'n_estimators': 109, 'criterion': 'gini', 'max_depth': 55, 'min_samples_split': 10, 'min_samples_leaf': 1}. Best is trial 276 with value: 0.8188065954265008.
[I 2025-04-07 05:43:12,627] Trial 815 finished with value: 0.8159139178400909 and parameters: {'n_estimators': 108, 'criterion': 'gini', 'max_depth': 55, 'min_samples_split': 11, 'min_samples_leaf': 1}. Best is trial 276 with value: 0.8188065954265008.
[I 2025-04-07 05:43:24,394] Trial 819 finished with value: 0.8156204519374899 and parameters: {'n_estimators': 113, 'criterion': 'gini', 'max_depth': 50, 'min_samples_split': 9, 'min_samples_leaf': 2}. Best is trial 276 with value: 0.8188065954265008.
[I 2025-04-07 05:43:41,756] Trial 823 finished with value: 0.8165428310848923 and parameters: {'n_estimators': 165, 'criterion': 'gini', 'max_depth': 53, 'min_samples_split': 18, 'min_samples_leaf': 1}. Best is trial 276 with value: 0.8188065954265008.
[I 2025-04-07 05:43:52,937] Trial 829 finished with value: 0.8166266885272405 and parameters: {'n_estimators': 100, 'criterion': 'gini', 'max_depth': 31, 'min_samples_split': 10, 'min_samples_leaf': 1}. Best is trial 276 with value: 0.8188065954265008.
[I 2025-04-07 05:44:07,460] Trial 834 finished with value: 0.8168363321331105 and parameters: {'n_estimators': 141, 'criterion': 'gini', 'max_depth': 49, 'min_samples_split': 11, 'min_samples_leaf': 4}. Best is trial 276 with value: 0.8188065954265008.
[I 2025-04-07 05:44:18,111] Trial 838 finished with value: 0.8161655780311776 and parameters: {'n_estimators': 97, 'criterion': 'gini', 'max_depth': 39, 'min_samples_split': 10, 'min_samples_leaf': 2}. Best is trial 276 with value: 0.8188065954265008.
[I 2025-04-07 05:44:28,945] Trial 843 finished with value: 0.8150333268313942 and parameters: {'n_estimators': 100, 'criterion': 'gini', 'max_depth': 54, 'min_samples_split': 9, 'min_samples_leaf': 1}. Best is trial 276 with value: 0.8188065954265008.
[I 2025-04-07 05:44:40,228] Trial 847 finished with value: 0.8182615923424729 and parameters: {'n_estimators': 103, 'criterion': 'gini', 'max_depth': 56, 'min_samples_split': 10, 'min_samples_leaf': 1}. Best is trial 276 with value: 0.8188065954265008.
[I 2025-04-07 05:44:51,704] Trial 851 finished with value: 0.8162493651822915 and parameters: {'n_estimators': 106, 'criterion': 'gini', 'max_depth': 52, 'min_samples_split': 10, 'min_samples_leaf': 2}. Best is trial 276 with value: 0.8188065954265008.
[I 2025-04-07 05:45:04,327] Trial 855 finished with value: 0.8161236317371952 and parameters: {'n_estimators': 111, 'criterion': 'gini', 'max_depth': 22, 'min_samples_split': 11, 'min_samples_leaf': 1}. Best is trial 276 with value: 0.8188065954265008.
[I 2025-04-07 05:45:15,202] Trial 860 finished with value: 0.8185550055266484 and parameters: {'n_estimators': 100, 'criterion': 'gini', 'max_depth': 53, 'min_samples_split': 10, 'min_samples_leaf': 1}. Best is trial 276 with value: 0.8188065954265008.
[I 2025-04-07 05:45:25,928] Trial 864 finished with value: 0.8149495748258975 and parameters: {'n_estimators': 95, 'criterion': 'gini', 'max_depth': 55, 'min_samples_split': 9, 'min_samples_leaf': 1}. Best is trial 276 with value: 0.8188065954265008.
[I 2025-04-07 05:45:39,796] Trial 868 finished with value: 0.8158720594101512 and parameters: {'n_estimators': 107, 'criterion': 'gini', 'max_depth': 51, 'min_samples_split': 10, 'min_samples_leaf': 2}. Best is trial 276 with value: 0.8188065954265008.
[I 2025-04-07 05:45:56,011] Trial 872 finished with value: 0.817716782559339 and parameters: {'n_estimators': 115, 'criterion': 'entropy', 'max_depth': 49, 'min_samples_split': 11, 'min_samples_leaf': 1}. Best is trial 276 with value: 0.8188065954265008.
[I 2025-04-07 05:46:10,018] Trial 876 finished with value: 0.8186389332602305 and parameters: {'n_estimators': 104, 'criterion': 'gini', 'max_depth': 54, 'min_samples_split': 10, 'min_samples_leaf': 1}. Best is trial 276 with value: 0.8188065954265008.
[I 2025-04-07 05:46:24,490] Trial 880 finished with value: 0.8185969869662479 and parameters: {'n_estimators': 109, 'criterion': 'gini', 'max_depth': 53, 'min_samples_split': 10, 'min_samples_leaf': 1}. Best is trial 276 with value: 0.8188065954265008.
[I 2025-04-07 05:46:36,322] Trial 884 finished with value: 0.815997845573673 and parameters: {'n_estimators': 98, 'criterion': 'gini', 'max_depth': 57, 'min_samples_split': 9, 'min_samples_leaf': 2}. Best is trial 276 with value: 0.8188065954265008.
[I 2025-04-07 05:46:49,563] Trial 888 finished with value: 0.8164588506328847 and parameters: {'n_estimators': 99, 'criterion': 'gini', 'max_depth': 49, 'min_samples_split': 11, 'min_samples_leaf': 1}. Best is trial 276 with value: 0.8188065954265008.
[I 2025-04-07 05:47:03,767] Trial 892 finished with value: 0.8173393537775387 and parameters: {'n_estimators': 106, 'criterion': 'gini', 'max_depth': 54, 'min_samples_split': 8, 'min_samples_leaf': 1}. Best is trial 276 with value: 0.8188065954265008.
[I 2025-04-07 05:47:17,556] Trial 896 finished with value: 0.8182615923424729 and parameters: {'n_estimators': 103, 'criterion': 'gini', 'max_depth': 51, 'min_samples_split': 10, 'min_samples_leaf': 1}. Best is trial 276 with value: 0.8188065954265008.
[I 2025-04-07 05:47:30,182] Trial 900 finished with value: 0.8159976522727792 and parameters: {'n_estimators': 96, 'criterion': 'gini', 'max_depth': 57, 'min_samples_split': 11, 'min_samples_leaf': 1}. Best is trial 276 with value: 0.8188065954265008.
[I 2025-04-07 05:47:44,431] Trial 904 finished with value: 0.8165428135120839 and parameters: {'n_estimators': 114, 'criterion': 'gini', 'max_depth': 53, 'min_samples_split': 10, 'min_samples_leaf': 3}. Best is trial 276 with value: 0.8188065954265008.
[I 2025-04-07 05:47:58,808] Trial 908 finished with value: 0.8184292369359347 and parameters: {'n_estimators': 110, 'criterion': 'gini', 'max_depth': 51, 'min_samples_split': 10, 'min_samples_leaf': 1}. Best is trial 276 with value: 0.8188065954265008.
[I 2025-04-07 05:48:13,836] Trial 912 finished with value: 0.8159138651216653 and parameters: {'n_estimators': 108, 'criterion': 'entropy', 'max_depth': 56, 'min_samples_split': 9, 'min_samples_leaf': 1}. Best is trial 276 with value: 0.8188065954265008.
[I 2025-04-07 05:48:26,212] Trial 917 finished with value: 0.81805198388222 and parameters: {'n_estimators': 91, 'criterion': 'gini', 'max_depth': 54, 'min_samples_split': 10, 'min_samples_leaf': 1}. Best is trial 276 with value: 0.8188065954265008.
[I 2025-04-07 05:48:38,881] Trial 920 finished with value: 0.816291311476274 and parameters: {'n_estimators': 99, 'criterion': 'gini', 'max_depth': 49, 'min_samples_split': 11, 'min_samples_leaf': 2}. Best is trial 276 with value: 0.8188065954265008.
[I 2025-04-07 05:48:52,637] Trial 924 finished with value: 0.8163749756177282 and parameters: {'n_estimators': 104, 'criterion': 'gini', 'max_depth': 52, 'min_samples_split': 11, 'min_samples_leaf': 1}. Best is trial 276 with value: 0.8188065954265008.
[I 2025-04-07 05:49:06,403] Trial 928 finished with value: 0.8186389332602305 and parameters: {'n_estimators': 104, 'criterion': 'gini', 'max_depth': 54, 'min_samples_split': 10, 'min_samples_leaf': 1}. Best is trial 276 with value: 0.8188065954265008.
[I 2025-04-07 05:49:18,761] Trial 932 finished with value: 0.8155366999319933 and parameters: {'n_estimators': 95, 'criterion': 'gini', 'max_depth': 58, 'min_samples_split': 9, 'min_samples_leaf': 2}. Best is trial 276 with value: 0.8188065954265008.
[I 2025-04-07 05:49:32,987] Trial 936 finished with value: 0.816123561445961 and parameters: {'n_estimators': 111, 'criterion': 'gini', 'max_depth': 51, 'min_samples_split': 9, 'min_samples_leaf': 2}. Best is trial 276 with value: 0.8188065954265008.
[I 2025-04-07 05:49:54,027] Trial 940 finished with value: 0.8175909085317741 and parameters: {'n_estimators': 176, 'criterion': 'gini', 'max_depth': 53, 'min_samples_split': 10, 'min_samples_leaf': 1}. Best is trial 276 with value: 0.8188065954265008.
[I 2025-04-07 05:50:07,016] Trial 946 finished with value: 0.8162073134514578 and parameters: {'n_estimators': 106, 'criterion': 'gini', 'max_depth': 55, 'min_samples_split': 11, 'min_samples_leaf': 1}. Best is trial 276 with value: 0.8188065954265008.
[I 2025-04-07 05:50:19,636] Trial 950 finished with value: 0.8168362091234508 and parameters: {'n_estimators': 98, 'criterion': 'gini', 'max_depth': 57, 'min_samples_split': 12, 'min_samples_leaf': 2}. Best is trial 276 with value: 0.8188065954265008.
[I 2025-04-07 05:50:31,422] Trial 954 finished with value: 0.8152429704372641 and parameters: {'n_estimators': 92, 'criterion': 'gini', 'max_depth': 52, 'min_samples_split': 9, 'min_samples_leaf': 1}. Best is trial 276 with value: 0.8188065954265008.
[I 2025-04-07 05:50:44,987] Trial 958 finished with value: 0.8182196636212989 and parameters: {'n_estimators': 103, 'criterion': 'gini', 'max_depth': 48, 'min_samples_split': 10, 'min_samples_leaf': 1}. Best is trial 276 with value: 0.8188065954265008.
[I 2025-04-07 05:50:59,527] Trial 962 finished with value: 0.8163749580449196 and parameters: {'n_estimators': 111, 'criterion': 'gini', 'max_depth': 54, 'min_samples_split': 11, 'min_samples_leaf': 2}. Best is trial 276 with value: 0.8188065954265008.
[I 2025-04-07 05:51:13,057] Trial 966 finished with value: 0.8165427256480413 and parameters: {'n_estimators': 102, 'criterion': 'entropy', 'max_depth': 51, 'min_samples_split': 10, 'min_samples_leaf': 1}. Best is trial 276 with value: 0.8188065954265008.
[I 2025-04-07 05:51:27,189] Trial 969 finished with value: 0.8186808268357874 and parameters: {'n_estimators': 105, 'criterion': 'gini', 'max_depth': 45, 'min_samples_split': 10, 'min_samples_leaf': 1}. Best is trial 276 with value: 0.8188065954265008.
[I 2025-04-07 05:51:43,255] Trial 973 finished with value: 0.8155366120679505 and parameters: {'n_estimators': 121, 'criterion': 'gini', 'max_depth': 56, 'min_samples_split': 9, 'min_samples_leaf': 2}. Best is trial 276 with value: 0.8188065954265008.
[I 2025-04-07 05:51:56,111] Trial 977 finished with value: 0.8151591481405331 and parameters: {'n_estimators': 97, 'criterion': 'gini', 'max_depth': 53, 'min_samples_split': 9, 'min_samples_leaf': 1}. Best is trial 276 with value: 0.8188065954265008.
[I 2025-04-07 05:52:07,421] Trial 981 finished with value: 0.8177584301155763 and parameters: {'n_estimators': 88, 'criterion': 'gini', 'max_depth': 55, 'min_samples_split': 10, 'min_samples_leaf': 1}. Best is trial 276 with value: 0.8188065954265008.
[I 2025-04-07 05:52:19,265] Trial 985 finished with value: 0.8166266885272405 and parameters: {'n_estimators': 93, 'criterion': 'gini', 'max_depth': 55, 'min_samples_split': 11, 'min_samples_leaf': 2}. Best is trial 276 with value: 0.8188065954265008.
[I 2025-04-07 05:52:32,358] Trial 989 finished with value: 0.8182616274880902 and parameters: {'n_estimators': 98, 'criterion': 'gini', 'max_depth': 61, 'min_samples_split': 10, 'min_samples_leaf': 1}. Best is trial 276 with value: 0.8188065954265008.
[I 2025-04-07 05:52:45,589] Trial 993 finished with value: 0.8188065954265008 and parameters: {'n_estimators': 99, 'criterion': 'gini', 'max_depth': 64, 'min_samples_split': 10, 'min_samples_leaf': 1}. Best is trial 276 with value: 0.8188065954265008.
[I 2025-04-07 05:52:57,902] Trial 997 finished with value: 0.81826162748809 and parameters: {'n_estimators': 96, 'criterion': 'gini', 'max_depth': 61, 'min_samples_split': 10, 'min_samples_leaf': 1}. Best is trial 276 with value: 0.8188065954265008.
[I 2025-04-07 05:53:11,154] Trial 1001 finished with value: 0.8159139881313251 and parameters: {'n_estimators': 101, 'criterion': 'gini', 'max_depth': 62, 'min_samples_split': 9, 'min_samples_leaf': 2}. Best is trial 276 with value: 0.8188065954265008.
[I 2025-04-07 05:53:24,350] Trial 1005 finished with value: 0.8164169570573276 and parameters: {'n_estimators': 104, 'criterion': 'gini', 'max_depth': 62, 'min_samples_split': 11, 'min_samples_leaf': 2}. Best is trial 276 with value: 0.8188065954265008.
[I 2025-04-07 05:53:38,307] Trial 1009 finished with value: 0.8156624509498982 and parameters: {'n_estimators': 109, 'criterion': 'gini', 'max_depth': 63, 'min_samples_split': 20, 'min_samples_leaf': 1}. Best is trial 276 with value: 0.8188065954265008.
[I 2025-04-07 05:53:50,724] Trial 1013 finished with value: 0.8177165013944026 and parameters: {'n_estimators': 89, 'criterion': 'gini', 'max_depth': 64, 'min_samples_split': 10, 'min_samples_leaf': 1}. Best is trial 276 with value: 0.8188065954265008.
[I 2025-04-07 05:54:03,932] Trial 1017 finished with value: 0.815914146286602 and parameters: {'n_estimators': 102, 'criterion': 'gini', 'max_depth': 59, 'min_samples_split': 10, 'min_samples_leaf': 2}. Best is trial 276 with value: 0.8188065954265008.
[I 2025-04-07 05:54:17,180] Trial 1021 finished with value: 0.8159139881313251 and parameters: {'n_estimators': 101, 'criterion': 'gini', 'max_depth': 61, 'min_samples_split': 9, 'min_samples_leaf': 2}. Best is trial 276 with value: 0.8188065954265008.
[I 2025-04-07 05:54:30,266] Trial 1025 finished with value: 0.8165429013761267 and parameters: {'n_estimators': 105, 'criterion': 'entropy', 'max_depth': 58, 'min_samples_split': 11, 'min_samples_leaf': 1}. Best is trial 276 with value: 0.8188065954265008.
[I 2025-04-07 05:54:41,623] Trial 1029 finished with value: 0.818345414639204 and parameters: {'n_estimators': 94, 'criterion': 'gini', 'max_depth': 58, 'min_samples_split': 10, 'min_samples_leaf': 1}. Best is trial 276 with value: 0.8188065954265008.
[I 2025-04-07 05:54:53,263] Trial 1033 finished with value: 0.8182616274880902 and parameters: {'n_estimators': 98, 'criterion': 'gini', 'max_depth': 62, 'min_samples_split': 10, 'min_samples_leaf': 1}. Best is trial 276 with value: 0.8188065954265008.
[I 2025-04-07 05:55:05,877] Trial 1037 finished with value: 0.8162491894542061 and parameters: {'n_estimators': 110, 'criterion': 'gini', 'max_depth': 60, 'min_samples_split': 11, 'min_samples_leaf': 2}. Best is trial 276 with value: 0.8188065954265008.
[I 2025-04-07 05:55:17,995] Trial 1041 finished with value: 0.8163331171877883 and parameters: {'n_estimators': 107, 'criterion': 'gini', 'max_depth': 32, 'min_samples_split': 8, 'min_samples_leaf': 1}. Best is trial 276 with value: 0.8188065954265008.
[I 2025-04-07 05:55:25,590] Trial 1045 finished with value: 0.8157043093798381 and parameters: {'n_estimators': 62, 'criterion': 'gini', 'max_depth': 56, 'min_samples_split': 6, 'min_samples_leaf': 1}. Best is trial 276 with value: 0.8188065954265008.
