[I 2025-04-07 05:18:30,754] Trial 348 finished with value: 0.8166265830903893 and parameters: {'n_estimators': 93, 'criterion': 'entropy', 'max_depth': 54, 'min_samples_split': 10, 'min_samples_leaf': 1}. Best is trial 276 with value: 0.8188065954265008.
[I 2025-04-07 05:18:42,002] Trial 352 finished with value: 0.8187227379841528 and parameters: {'n_estimators': 99, 'criterion': 'gini', 'max_depth': 51, 'min_samples_split': 10, 'min_samples_leaf': 1}. Best is trial 276 with value: 0.8188065954265008.
[I 2025-04-07 05:18:53,332] Trial 356 finished with value: 0.817255566626425 and parameters: {'n_estimators': 105, 'criterion': 'gini', 'max_depth': 57, 'min_samples_split': 16, 'min_samples_leaf': 2}. Best is trial 276 with value: 0.8188065954265008.
[I 2025-04-07 05:19:04,132] Trial 360 finished with value: 0.8169201544298413 and parameters: {'n_estimators': 95, 'criterion': 'gini', 'max_depth': 53, 'min_samples_split': 8, 'min_samples_leaf': 1}. Best is trial 276 with value: 0.8188065954265008.
[I 2025-04-07 05:19:14,713] Trial 364 finished with value: 0.8163330996149796 and parameters: {'n_estimators': 97, 'criterion': 'gini', 'max_depth': 56, 'min_samples_split': 10, 'min_samples_leaf': 3}. Best is trial 276 with value: 0.8188065954265008.
[I 2025-04-07 05:19:25,547] Trial 368 finished with value: 0.8164169394845192 and parameters: {'n_estimators': 100, 'criterion': 'gini', 'max_depth': 57, 'min_samples_split': 11, 'min_samples_leaf': 1}. Best is trial 276 with value: 0.8188065954265008.
[I 2025-04-07 05:19:35,287] Trial 372 finished with value: 0.8166685821027974 and parameters: {'n_estimators': 90, 'criterion': 'gini', 'max_depth': 58, 'min_samples_split': 10, 'min_samples_leaf': 2}. Best is trial 276 with value: 0.8188065954265008.
[I 2025-04-07 05:19:46,058] Trial 376 finished with value: 0.814865734956358 and parameters: {'n_estimators': 93, 'criterion': 'gini', 'max_depth': 54, 'min_samples_split': 9, 'min_samples_leaf': 1}. Best is trial 276 with value: 0.8188065954265008.
[I 2025-04-07 05:19:57,783] Trial 380 finished with value: 0.8186389332602305 and parameters: {'n_estimators': 104, 'criterion': 'gini', 'max_depth': 55, 'min_samples_split': 10, 'min_samples_leaf': 1}. Best is trial 276 with value: 0.8188065954265008.
[I 2025-04-07 05:20:08,773] Trial 384 finished with value: 0.8182615923424729 and parameters: {'n_estimators': 103, 'criterion': 'gini', 'max_depth': 56, 'min_samples_split': 10, 'min_samples_leaf': 1}. Best is trial 276 with value: 0.8188065954265008.
[I 2025-04-07 05:20:21,103] Trial 388 finished with value: 0.8158719012548742 and parameters: {'n_estimators': 105, 'criterion': 'gini', 'max_depth': 55, 'min_samples_split': 10, 'min_samples_leaf': 6}. Best is trial 276 with value: 0.8188065954265008.
[I 2025-04-07 05:20:34,018] Trial 392 finished with value: 0.8164169394845192 and parameters: {'n_estimators': 100, 'criterion': 'gini', 'max_depth': 59, 'min_samples_split': 11, 'min_samples_leaf': 1}. Best is trial 276 with value: 0.8188065954265008.
[I 2025-04-07 05:20:47,460] Trial 396 finished with value: 0.8159556532603711 and parameters: {'n_estimators': 105, 'criterion': 'gini', 'max_depth': 52, 'min_samples_split': 9, 'min_samples_leaf': 1}. Best is trial 276 with value: 0.8188065954265008.
[I 2025-04-07 05:21:01,163] Trial 400 finished with value: 0.8162493651822915 and parameters: {'n_estimators': 106, 'criterion': 'gini', 'max_depth': 54, 'min_samples_split': 10, 'min_samples_leaf': 2}. Best is trial 276 with value: 0.8188065954265008.
[I 2025-04-07 05:21:14,188] Trial 404 finished with value: 0.818219698766916 and parameters: {'n_estimators': 96, 'criterion': 'gini', 'max_depth': 50, 'min_samples_split': 10, 'min_samples_leaf': 1}. Best is trial 276 with value: 0.8188065954265008.
[I 2025-04-07 05:21:27,917] Trial 408 finished with value: 0.8182615571968558 and parameters: {'n_estimators': 101, 'criterion': 'gini', 'max_depth': 51, 'min_samples_split': 10, 'min_samples_leaf': 1}. Best is trial 276 with value: 0.8188065954265008.
[I 2025-04-07 05:21:42,191] Trial 412 finished with value: 0.8159139178400909 and parameters: {'n_estimators': 108, 'criterion': 'gini', 'max_depth': 56, 'min_samples_split': 11, 'min_samples_leaf': 1}. Best is trial 276 with value: 0.8188065954265008.
[I 2025-04-07 05:22:03,915] Trial 416 finished with value: 0.816961942568547 and parameters: {'n_estimators': 166, 'criterion': 'gini', 'max_depth': 53, 'min_samples_split': 10, 'min_samples_leaf': 2}. Best is trial 276 with value: 0.8188065954265008.
[I 2025-04-07 05:22:18,650] Trial 423 finished with value: 0.8167104405327372 and parameters: {'n_estimators': 104, 'criterion': 'entropy', 'max_depth': 55, 'min_samples_split': 10, 'min_samples_leaf': 1}. Best is trial 276 with value: 0.8188065954265008.
[I 2025-04-07 05:22:30,294] Trial 427 finished with value: 0.8151591481405331 and parameters: {'n_estimators': 97, 'criterion': 'gini', 'max_depth': 57, 'min_samples_split': 9, 'min_samples_leaf': 1}. Best is trial 276 with value: 0.8188065954265008.
[I 2025-04-07 05:22:41,149] Trial 431 finished with value: 0.8161236844556209 and parameters: {'n_estimators': 100, 'criterion': 'gini', 'max_depth': 55, 'min_samples_split': 10, 'min_samples_leaf': 2}. Best is trial 276 with value: 0.8188065954265008.
[I 2025-04-07 05:22:53,340] Trial 435 finished with value: 0.8162491894542061 and parameters: {'n_estimators': 110, 'criterion': 'gini', 'max_depth': 51, 'min_samples_split': 11, 'min_samples_leaf': 2}. Best is trial 276 with value: 0.8188065954265008.
[I 2025-04-07 05:23:05,514] Trial 439 finished with value: 0.8164169219117106 and parameters: {'n_estimators': 110, 'criterion': 'gini', 'max_depth': 54, 'min_samples_split': 11, 'min_samples_leaf': 1}. Best is trial 276 with value: 0.8188065954265008.
[I 2025-04-07 05:23:17,653] Trial 442 finished with value: 0.8182615923424729 and parameters: {'n_estimators': 103, 'criterion': 'gini', 'max_depth': 52, 'min_samples_split': 10, 'min_samples_leaf': 1}. Best is trial 276 with value: 0.8188065954265008.
[I 2025-04-07 05:23:30,914] Trial 446 finished with value: 0.8187646667053269 and parameters: {'n_estimators': 106, 'criterion': 'gini', 'max_depth': 53, 'min_samples_split': 10, 'min_samples_leaf': 1}. Best is trial 276 with value: 0.8188065954265008.
[I 2025-04-07 05:23:42,876] Trial 450 finished with value: 0.8163330117509371 and parameters: {'n_estimators': 95, 'criterion': 'gini', 'max_depth': 49, 'min_samples_split': 19, 'min_samples_leaf': 2}. Best is trial 276 with value: 0.8188065954265008.
[I 2025-04-07 05:23:57,375] Trial 454 finished with value: 0.8160816151519784 and parameters: {'n_estimators': 107, 'criterion': 'gini', 'max_depth': 35, 'min_samples_split': 11, 'min_samples_leaf': 1}. Best is trial 276 with value: 0.8188065954265008.
[I 2025-04-07 05:24:10,593] Trial 458 finished with value: 0.818345414639204 and parameters: {'n_estimators': 101, 'criterion': 'gini', 'max_depth': 56, 'min_samples_split': 10, 'min_samples_leaf': 1}. Best is trial 276 with value: 0.8188065954265008.
[I 2025-04-07 05:24:24,320] Trial 463 finished with value: 0.814027424125006 and parameters: {'n_estimators': 110, 'criterion': 'gini', 'max_depth': 53, 'min_samples_split': 10, 'min_samples_leaf': 12}. Best is trial 276 with value: 0.8188065954265008.
[I 2025-04-07 05:24:38,886] Trial 467 finished with value: 0.8159557235516053 and parameters: {'n_estimators': 111, 'criterion': 'gini', 'max_depth': 51, 'min_samples_split': 9, 'min_samples_leaf': 1}. Best is trial 276 with value: 0.8188065954265008.
[I 2025-04-07 05:24:51,751] Trial 471 finished with value: 0.8161654725943265 and parameters: {'n_estimators': 107, 'criterion': 'gini', 'max_depth': 58, 'min_samples_split': 11, 'min_samples_leaf': 1}. Best is trial 276 with value: 0.8188065954265008.
[I 2025-04-07 05:25:04,558] Trial 475 finished with value: 0.8157881492493775 and parameters: {'n_estimators': 97, 'criterion': 'gini', 'max_depth': 54, 'min_samples_split': 20, 'min_samples_leaf': 3}. Best is trial 276 with value: 0.8188065954265008.
[I 2025-04-07 05:25:16,406] Trial 479 finished with value: 0.8111768509878553 and parameters: {'n_estimators': 97, 'criterion': 'gini', 'max_depth': 52, 'min_samples_split': 10, 'min_samples_leaf': 19}. Best is trial 276 with value: 0.8188065954265008.
[I 2025-04-07 05:25:28,340] Trial 483 finished with value: 0.8177165013944026 and parameters: {'n_estimators': 89, 'criterion': 'gini', 'max_depth': 56, 'min_samples_split': 10, 'min_samples_leaf': 1}. Best is trial 276 with value: 0.8188065954265008.
[I 2025-04-07 05:25:43,084] Trial 486 finished with value: 0.8154945076186912 and parameters: {'n_estimators': 113, 'criterion': 'gini', 'max_depth': 48, 'min_samples_split': 9, 'min_samples_leaf': 1}. Best is trial 276 with value: 0.8188065954265008.
[I 2025-04-07 05:25:58,654] Trial 491 finished with value: 0.8188065954265008 and parameters: {'n_estimators': 108, 'criterion': 'gini', 'max_depth': 53, 'min_samples_split': 10, 'min_samples_leaf': 1}. Best is trial 276 with value: 0.8188065954265008.
[I 2025-04-07 05:26:12,452] Trial 494 finished with value: 0.8162072607330322 and parameters: {'n_estimators': 107, 'criterion': 'gini', 'max_depth': 53, 'min_samples_split': 11, 'min_samples_leaf': 2}. Best is trial 276 with value: 0.8188065954265008.
[I 2025-04-07 05:26:26,492] Trial 498 finished with value: 0.8161234735819182 and parameters: {'n_estimators': 101, 'criterion': 'entropy', 'max_depth': 50, 'min_samples_split': 10, 'min_samples_leaf': 1}. Best is trial 276 with value: 0.8188065954265008.
[I 2025-04-07 05:26:37,327] Trial 502 finished with value: 0.8185550055266484 and parameters: {'n_estimators': 100, 'criterion': 'gini', 'max_depth': 58, 'min_samples_split': 10, 'min_samples_leaf': 1}. Best is trial 276 with value: 0.8188065954265008.
[I 2025-04-07 05:26:48,315] Trial 506 finished with value: 0.81826162748809 and parameters: {'n_estimators': 96, 'criterion': 'gini', 'max_depth': 59, 'min_samples_split': 10, 'min_samples_leaf': 1}. Best is trial 276 with value: 0.8188065954265008.
[I 2025-04-07 05:26:59,184] Trial 510 finished with value: 0.815997845573673 and parameters: {'n_estimators': 98, 'criterion': 'gini', 'max_depth': 57, 'min_samples_split': 9, 'min_samples_leaf': 2}. Best is trial 276 with value: 0.8188065954265008.
[I 2025-04-07 05:27:10,441] Trial 514 finished with value: 0.8163749756177282 and parameters: {'n_estimators': 104, 'criterion': 'gini', 'max_depth': 57, 'min_samples_split': 11, 'min_samples_leaf': 1}. Best is trial 276 with value: 0.8188065954265008.
[I 2025-04-07 05:27:21,752] Trial 518 finished with value: 0.8151173072834019 and parameters: {'n_estimators': 108, 'criterion': 'gini', 'max_depth': 55, 'min_samples_split': 17, 'min_samples_leaf': 8}. Best is trial 276 with value: 0.8188065954265008.
[I 2025-04-07 05:27:32,373] Trial 522 finished with value: 0.7798175239561312 and parameters: {'n_estimators': 109, 'criterion': 'gini', 'max_depth': 5, 'min_samples_split': 10, 'min_samples_leaf': 1}. Best is trial 276 with value: 0.8188065954265008.
[I 2025-04-07 05:27:46,934] Trial 526 finished with value: 0.8155366120679506 and parameters: {'n_estimators': 112, 'criterion': 'gini', 'max_depth': 54, 'min_samples_split': 9, 'min_samples_leaf': 2}. Best is trial 276 with value: 0.8188065954265008.
[I 2025-04-07 05:28:02,233] Trial 530 finished with value: 0.8159558641340736 and parameters: {'n_estimators': 116, 'criterion': 'gini', 'max_depth': 38, 'min_samples_split': 9, 'min_samples_leaf': 2}. Best is trial 276 with value: 0.8188065954265008.
[I 2025-04-07 05:28:07,236] Trial 534 finished with value: 0.8159138124032397 and parameters: {'n_estimators': 30, 'criterion': 'gini', 'max_depth': 52, 'min_samples_split': 10, 'min_samples_leaf': 1}. Best is trial 276 with value: 0.8188065954265008.
[I 2025-04-07 05:28:20,946] Trial 537 finished with value: 0.8159138651216653 and parameters: {'n_estimators': 108, 'criterion': 'gini', 'max_depth': 30, 'min_samples_split': 11, 'min_samples_leaf': 1}. Best is trial 276 with value: 0.8188065954265008.
[I 2025-04-07 05:28:34,706] Trial 541 finished with value: 0.8162074188883089 and parameters: {'n_estimators': 108, 'criterion': 'gini', 'max_depth': 55, 'min_samples_split': 10, 'min_samples_leaf': 3}. Best is trial 276 with value: 0.8188065954265008.
[I 2025-04-07 05:28:47,940] Trial 545 finished with value: 0.8161236493100038 and parameters: {'n_estimators': 105, 'criterion': 'gini', 'max_depth': 53, 'min_samples_split': 10, 'min_samples_leaf': 2}. Best is trial 276 with value: 0.8188065954265008.
[I 2025-04-07 05:29:01,533] Trial 549 finished with value: 0.8155363836214395 and parameters: {'n_estimators': 102, 'criterion': 'gini', 'max_depth': 56, 'min_samples_split': 9, 'min_samples_leaf': 1}. Best is trial 276 with value: 0.8188065954265008.
[I 2025-04-07 05:29:15,879] Trial 553 finished with value: 0.8158300076793173 and parameters: {'n_estimators': 112, 'criterion': 'gini', 'max_depth': 51, 'min_samples_split': 11, 'min_samples_leaf': 1}. Best is trial 276 with value: 0.8188065954265008.
[I 2025-04-07 05:29:29,175] Trial 557 finished with value: 0.8164589209241189 and parameters: {'n_estimators': 106, 'criterion': 'entropy', 'max_depth': 54, 'min_samples_split': 10, 'min_samples_leaf': 1}. Best is trial 276 with value: 0.8188065954265008.
[I 2025-04-07 05:29:42,366] Trial 561 finished with value: 0.8161656131767948 and parameters: {'n_estimators': 99, 'criterion': 'gini', 'max_depth': 54, 'min_samples_split': 10, 'min_samples_leaf': 2}. Best is trial 276 with value: 0.8188065954265008.
[I 2025-04-07 05:29:56,032] Trial 564 finished with value: 0.8188065954265008 and parameters: {'n_estimators': 99, 'criterion': 'gini', 'max_depth': 52, 'min_samples_split': 10, 'min_samples_leaf': 1}. Best is trial 276 with value: 0.8188065954265008.
[I 2025-04-07 05:30:08,416] Trial 567 finished with value: 0.814865734956358 and parameters: {'n_estimators': 93, 'criterion': 'gini', 'max_depth': 50, 'min_samples_split': 9, 'min_samples_leaf': 1}. Best is trial 276 with value: 0.8188065954265008.
[I 2025-04-07 05:30:20,713] Trial 571 finished with value: 0.8155365417767164 and parameters: {'n_estimators': 95, 'criterion': 'gini', 'max_depth': 51, 'min_samples_split': 11, 'min_samples_leaf': 1}. Best is trial 276 with value: 0.8188065954265008.
[I 2025-04-07 05:30:33,212] Trial 576 finished with value: 0.8162493827551002 and parameters: {'n_estimators': 96, 'criterion': 'gini', 'max_depth': 52, 'min_samples_split': 10, 'min_samples_leaf': 2}. Best is trial 276 with value: 0.8188065954265008.
[I 2025-04-07 05:30:47,102] Trial 580 finished with value: 0.8182615923424729 and parameters: {'n_estimators': 103, 'criterion': 'gini', 'max_depth': 53, 'min_samples_split': 10, 'min_samples_leaf': 1}. Best is trial 276 with value: 0.8188065954265008.
[I 2025-04-07 05:31:01,349] Trial 584 finished with value: 0.8155364363398651 and parameters: {'n_estimators': 109, 'criterion': 'gini', 'max_depth': 57, 'min_samples_split': 9, 'min_samples_leaf': 1}. Best is trial 276 with value: 0.8188065954265008.
[I 2025-04-07 05:31:16,146] Trial 588 finished with value: 0.8157880789581433 and parameters: {'n_estimators': 113, 'criterion': 'gini', 'max_depth': 59, 'min_samples_split': 11, 'min_samples_leaf': 1}. Best is trial 276 with value: 0.8188065954265008.
[I 2025-04-07 05:31:31,161] Trial 592 finished with value: 0.8162074013155005 and parameters: {'n_estimators': 114, 'criterion': 'gini', 'max_depth': 61, 'min_samples_split': 10, 'min_samples_leaf': 2}. Best is trial 276 with value: 0.8188065954265008.
[I 2025-04-07 05:31:52,761] Trial 597 finished with value: 0.8175070159438093 and parameters: {'n_estimators': 175, 'criterion': 'gini', 'max_depth': 55, 'min_samples_split': 10, 'min_samples_leaf': 1}. Best is trial 276 with value: 0.8188065954265008.
[I 2025-04-07 05:31:59,522] Trial 602 finished with value: 0.8142367865659393 and parameters: {'n_estimators': 43, 'criterion': 'gini', 'max_depth': 57, 'min_samples_split': 9, 'min_samples_leaf': 1}. Best is trial 276 with value: 0.8188065954265008.
[I 2025-04-07 05:32:14,168] Trial 604 finished with value: 0.8184292369359347 and parameters: {'n_estimators': 110, 'criterion': 'gini', 'max_depth': 58, 'min_samples_split': 10, 'min_samples_leaf': 1}. Best is trial 276 with value: 0.8188065954265008.
[I 2025-04-07 05:32:27,919] Trial 609 finished with value: 0.816500621198782 and parameters: {'n_estimators': 106, 'criterion': 'gini', 'max_depth': 55, 'min_samples_split': 11, 'min_samples_leaf': 3}. Best is trial 276 with value: 0.8188065954265008.
[I 2025-04-07 05:32:42,428] Trial 613 finished with value: 0.8171299561909884 and parameters: {'n_estimators': 117, 'criterion': 'entropy', 'max_depth': 60, 'min_samples_split': 10, 'min_samples_leaf': 2}. Best is trial 276 with value: 0.8188065954265008.
[I 2025-04-07 05:32:54,417] Trial 617 finished with value: 0.8183034507724127 and parameters: {'n_estimators': 112, 'criterion': 'gini', 'max_depth': 62, 'min_samples_split': 10, 'min_samples_leaf': 1}. Best is trial 276 with value: 0.8188065954265008.
[I 2025-04-07 05:33:06,412] Trial 621 finished with value: 0.8156202410637876 and parameters: {'n_estimators': 107, 'criterion': 'gini', 'max_depth': 56, 'min_samples_split': 9, 'min_samples_leaf': 1}. Best is trial 276 with value: 0.8188065954265008.
[I 2025-04-07 05:33:17,554] Trial 625 finished with value: 0.815914146286602 and parameters: {'n_estimators': 102, 'criterion': 'gini', 'max_depth': 57, 'min_samples_split': 10, 'min_samples_leaf': 2}. Best is trial 276 with value: 0.8188065954265008.
[I 2025-04-07 05:33:29,032] Trial 629 finished with value: 0.8161656131767948 and parameters: {'n_estimators': 99, 'criterion': 'gini', 'max_depth': 54, 'min_samples_split': 10, 'min_samples_leaf': 2}. Best is trial 276 with value: 0.8188065954265008.
[I 2025-04-07 05:33:40,900] Trial 633 finished with value: 0.8157461678097778 and parameters: {'n_estimators': 111, 'criterion': 'gini', 'max_depth': 59, 'min_samples_split': 11, 'min_samples_leaf': 1}. Best is trial 276 with value: 0.8188065954265008.
[I 2025-04-07 05:33:52,673] Trial 637 finished with value: 0.8185969518206309 and parameters: {'n_estimators': 105, 'criterion': 'gini', 'max_depth': 55, 'min_samples_split': 10, 'min_samples_leaf': 1}. Best is trial 276 with value: 0.8188065954265008.
[I 2025-04-07 05:34:05,366] Trial 639 finished with value: 0.8156204519374899 and parameters: {'n_estimators': 113, 'criterion': 'gini', 'max_depth': 53, 'min_samples_split': 9, 'min_samples_leaf': 2}. Best is trial 276 with value: 0.8188065954265008.
[I 2025-04-07 05:34:16,960] Trial 644 finished with value: 0.8188065954265008 and parameters: {'n_estimators': 108, 'criterion': 'gini', 'max_depth': 58, 'min_samples_split': 10, 'min_samples_leaf': 1}. Best is trial 276 with value: 0.8188065954265008.
[I 2025-04-07 05:34:19,734] Trial 648 finished with value: 0.8133149170299845 and parameters: {'n_estimators': 15, 'criterion': 'gini', 'max_depth': 60, 'min_samples_split': 10, 'min_samples_leaf': 4}. Best is trial 276 with value: 0.8188065954265008.
[I 2025-04-07 05:34:31,633] Trial 649 finished with value: 0.8185969869662479 and parameters: {'n_estimators': 109, 'criterion': 'gini', 'max_depth': 58, 'min_samples_split': 10, 'min_samples_leaf': 1}. Best is trial 276 with value: 0.8188065954265008.
[I 2025-04-07 05:34:44,215] Trial 653 finished with value: 0.8157042215157952 and parameters: {'n_estimators': 116, 'criterion': 'gini', 'max_depth': 59, 'min_samples_split': 11, 'min_samples_leaf': 1}. Best is trial 276 with value: 0.8188065954265008.
[I 2025-04-07 05:34:56,327] Trial 657 finished with value: 0.8129792588140814 and parameters: {'n_estimators': 108, 'criterion': 'gini', 'max_depth': 55, 'min_samples_split': 9, 'min_samples_leaf': 11}. Best is trial 276 with value: 0.8188065954265008.
[I 2025-04-07 05:35:07,955] Trial 661 finished with value: 0.81650088479091 and parameters: {'n_estimators': 103, 'criterion': 'gini', 'max_depth': 35, 'min_samples_split': 10, 'min_samples_leaf': 2}. Best is trial 276 with value: 0.8188065954265008.
[I 2025-04-07 05:35:19,893] Trial 665 finished with value: 0.8183034507724127 and parameters: {'n_estimators': 112, 'criterion': 'gini', 'max_depth': 52, 'min_samples_split': 10, 'min_samples_leaf': 1}. Best is trial 276 with value: 0.8188065954265008.
[I 2025-04-07 05:35:30,657] Trial 669 finished with value: 0.8176747132556967 and parameters: {'n_estimators': 99, 'criterion': 'gini', 'max_depth': 54, 'min_samples_split': 8, 'min_samples_leaf': 1}. Best is trial 276 with value: 0.8188065954265008.
[I 2025-04-07 05:35:42,364] Trial 673 finished with value: 0.8162492070270148 and parameters: {'n_estimators': 106, 'criterion': 'gini', 'max_depth': 33, 'min_samples_split': 11, 'min_samples_leaf': 1}. Best is trial 276 with value: 0.8188065954265008.
[I 2025-04-07 05:35:53,962] Trial 677 finished with value: 0.8159558641340736 and parameters: {'n_estimators': 109, 'criterion': 'gini', 'max_depth': 53, 'min_samples_split': 9, 'min_samples_leaf': 2}. Best is trial 276 with value: 0.8188065954265008.
[I 2025-04-07 05:36:05,353] Trial 681 finished with value: 0.818345414639204 and parameters: {'n_estimators': 101, 'criterion': 'gini', 'max_depth': 54, 'min_samples_split': 10, 'min_samples_leaf': 1}. Best is trial 276 with value: 0.8188065954265008.
[I 2025-04-07 05:36:18,282] Trial 685 finished with value: 0.8169200841386072 and parameters: {'n_estimators': 115, 'criterion': 'entropy', 'max_depth': 51, 'min_samples_split': 10, 'min_samples_leaf': 1}. Best is trial 276 with value: 0.8188065954265008.
[I 2025-04-07 05:36:31,275] Trial 689 finished with value: 0.817674660537271 and parameters: {'n_estimators': 119, 'criterion': 'gini', 'max_depth': 56, 'min_samples_split': 10, 'min_samples_leaf': 1}. Best is trial 276 with value: 0.8188065954265008.
