[I 2025-04-07 05:18:33,010] Trial 349 finished with value: 0.8168362618418763 and parameters: {'n_estimators': 99, 'criterion': 'entropy', 'max_depth': 52, 'min_samples_split': 10, 'min_samples_leaf': 1}. Best is trial 276 with value: 0.8188065954265008.
[I 2025-04-07 05:18:44,287] Trial 353 finished with value: 0.8186808619814044 and parameters: {'n_estimators': 104, 'criterion': 'gini', 'max_depth': 51, 'min_samples_split': 10, 'min_samples_leaf': 1}. Best is trial 276 with value: 0.8188065954265008.
[I 2025-04-07 05:18:55,015] Trial 357 finished with value: 0.8119314098137107 and parameters: {'n_estimators': 103, 'criterion': 'gini', 'max_depth': 53, 'min_samples_split': 9, 'min_samples_leaf': 14}. Best is trial 276 with value: 0.8188065954265008.
[I 2025-04-07 05:19:05,499] Trial 361 finished with value: 0.81826162748809 and parameters: {'n_estimators': 96, 'criterion': 'gini', 'max_depth': 53, 'min_samples_split': 10, 'min_samples_leaf': 1}. Best is trial 276 with value: 0.8188065954265008.
[I 2025-04-07 05:19:16,398] Trial 365 finished with value: 0.8182615923424729 and parameters: {'n_estimators': 103, 'criterion': 'gini', 'max_depth': 52, 'min_samples_split': 10, 'min_samples_leaf': 1}. Best is trial 276 with value: 0.8188065954265008.
[I 2025-04-07 05:19:27,652] Trial 369 finished with value: 0.8162073310242663 and parameters: {'n_estimators': 101, 'criterion': 'gini', 'max_depth': 56, 'min_samples_split': 11, 'min_samples_leaf': 1}. Best is trial 276 with value: 0.8188065954265008.
[I 2025-04-07 05:19:37,477] Trial 373 finished with value: 0.8167943682663195 and parameters: {'n_estimators': 91, 'criterion': 'gini', 'max_depth': 58, 'min_samples_split': 10, 'min_samples_leaf': 2}. Best is trial 276 with value: 0.8188065954265008.
[I 2025-04-07 05:19:48,309] Trial 377 finished with value: 0.8149495748258975 and parameters: {'n_estimators': 95, 'criterion': 'gini', 'max_depth': 54, 'min_samples_split': 9, 'min_samples_leaf': 1}. Best is trial 276 with value: 0.8188065954265008.
[I 2025-04-07 05:19:59,463] Trial 381 finished with value: 0.8185969518206309 and parameters: {'n_estimators': 105, 'criterion': 'gini', 'max_depth': 55, 'min_samples_split': 10, 'min_samples_leaf': 1}. Best is trial 276 with value: 0.8188065954265008.
[I 2025-04-07 05:20:11,046] Trial 385 finished with value: 0.8160396512851873 and parameters: {'n_estimators': 104, 'criterion': 'gini', 'max_depth': 56, 'min_samples_split': 10, 'min_samples_leaf': 6}. Best is trial 276 with value: 0.8188065954265008.
[I 2025-04-07 05:20:23,047] Trial 389 finished with value: 0.8166267588184747 and parameters: {'n_estimators': 102, 'criterion': 'gini', 'max_depth': 26, 'min_samples_split': 11, 'min_samples_leaf': 2}. Best is trial 276 with value: 0.8188065954265008.
[I 2025-04-07 05:20:35,826] Trial 393 finished with value: 0.8159138475488568 and parameters: {'n_estimators': 98, 'criterion': 'gini', 'max_depth': 57, 'min_samples_split': 11, 'min_samples_leaf': 1}. Best is trial 276 with value: 0.8188065954265008.
[I 2025-04-07 05:20:49,075] Trial 397 finished with value: 0.8155366472135677 and parameters: {'n_estimators': 106, 'criterion': 'gini', 'max_depth': 52, 'min_samples_split': 9, 'min_samples_leaf': 2}. Best is trial 276 with value: 0.8188065954265008.
[I 2025-04-07 05:21:03,189] Trial 401 finished with value: 0.8158720594101512 and parameters: {'n_estimators': 107, 'criterion': 'gini', 'max_depth': 54, 'min_samples_split': 10, 'min_samples_leaf': 2}. Best is trial 276 with value: 0.8188065954265008.
[I 2025-04-07 05:21:16,792] Trial 406 finished with value: 0.817464946640167 and parameters: {'n_estimators': 102, 'criterion': 'gini', 'max_depth': 50, 'min_samples_split': 15, 'min_samples_leaf': 1}. Best is trial 276 with value: 0.8188065954265008.
[I 2025-04-07 05:21:30,764] Trial 410 finished with value: 0.818345414639204 and parameters: {'n_estimators': 101, 'criterion': 'gini', 'max_depth': 52, 'min_samples_split': 10, 'min_samples_leaf': 1}. Best is trial 276 with value: 0.8188065954265008.
[I 2025-04-07 05:21:44,663] Trial 414 finished with value: 0.8165426377839985 and parameters: {'n_estimators': 108, 'criterion': 'gini', 'max_depth': 55, 'min_samples_split': 11, 'min_samples_leaf': 2}. Best is trial 276 with value: 0.8188065954265008.
[I 2025-04-07 05:21:58,169] Trial 418 finished with value: 0.8152429704372641 and parameters: {'n_estimators': 92, 'criterion': 'gini', 'max_depth': 53, 'min_samples_split': 9, 'min_samples_leaf': 1}. Best is trial 276 with value: 0.8188065954265008.
[I 2025-04-07 05:22:12,073] Trial 421 finished with value: 0.8186389332602305 and parameters: {'n_estimators': 104, 'criterion': 'gini', 'max_depth': 55, 'min_samples_split': 10, 'min_samples_leaf': 1}. Best is trial 276 with value: 0.8188065954265008.
[I 2025-04-07 05:22:25,805] Trial 425 finished with value: 0.8167104405327372 and parameters: {'n_estimators': 104, 'criterion': 'entropy', 'max_depth': 57, 'min_samples_split': 10, 'min_samples_leaf': 1}. Best is trial 276 with value: 0.8188065954265008.
[I 2025-04-07 05:22:36,460] Trial 429 finished with value: 0.8151591481405331 and parameters: {'n_estimators': 97, 'criterion': 'gini', 'max_depth': 57, 'min_samples_split': 9, 'min_samples_leaf': 1}. Best is trial 276 with value: 0.8188065954265008.
[I 2025-04-07 05:22:45,854] Trial 433 finished with value: 0.8170879396057715 and parameters: {'n_estimators': 87, 'criterion': 'gini', 'max_depth': 55, 'min_samples_split': 10, 'min_samples_leaf': 2}. Best is trial 276 with value: 0.8188065954265008.
[I 2025-04-07 05:22:58,198] Trial 436 finished with value: 0.8162912236122313 and parameters: {'n_estimators': 110, 'criterion': 'gini', 'max_depth': 33, 'min_samples_split': 14, 'min_samples_leaf': 1}. Best is trial 276 with value: 0.8188065954265008.
[I 2025-04-07 05:23:10,731] Trial 440 finished with value: 0.8173393537775387 and parameters: {'n_estimators': 106, 'criterion': 'gini', 'max_depth': 51, 'min_samples_split': 8, 'min_samples_leaf': 1}. Best is trial 276 with value: 0.8188065954265008.
[I 2025-04-07 05:23:23,765] Trial 444 finished with value: 0.8182615923424729 and parameters: {'n_estimators': 103, 'criterion': 'gini', 'max_depth': 53, 'min_samples_split': 10, 'min_samples_leaf': 1}. Best is trial 276 with value: 0.8188065954265008.
[I 2025-04-07 05:23:35,530] Trial 448 finished with value: 0.8117635543465462 and parameters: {'n_estimators': 95, 'criterion': 'gini', 'max_depth': 14, 'min_samples_split': 10, 'min_samples_leaf': 2}. Best is trial 276 with value: 0.8188065954265008.
[I 2025-04-07 05:23:48,585] Trial 452 finished with value: 0.811428212441197 and parameters: {'n_estimators': 107, 'criterion': 'gini', 'max_depth': 52, 'min_samples_split': 9, 'min_samples_leaf': 16}. Best is trial 276 with value: 0.8188065954265008.
[I 2025-04-07 05:24:02,010] Trial 456 finished with value: 0.8163749756177282 and parameters: {'n_estimators': 102, 'criterion': 'gini', 'max_depth': 56, 'min_samples_split': 11, 'min_samples_leaf': 1}. Best is trial 276 with value: 0.8188065954265008.
[I 2025-04-07 05:24:15,043] Trial 460 finished with value: 0.8161236844556209 and parameters: {'n_estimators': 100, 'criterion': 'gini', 'max_depth': 53, 'min_samples_split': 10, 'min_samples_leaf': 2}. Best is trial 276 with value: 0.8188065954265008.
[I 2025-04-07 05:24:29,666] Trial 464 finished with value: 0.8162074891795431 and parameters: {'n_estimators': 111, 'criterion': 'gini', 'max_depth': 51, 'min_samples_split': 10, 'min_samples_leaf': 2}. Best is trial 276 with value: 0.8188065954265008.
[I 2025-04-07 05:24:43,225] Trial 469 finished with value: 0.8159556532603711 and parameters: {'n_estimators': 105, 'criterion': 'gini', 'max_depth': 58, 'min_samples_split': 9, 'min_samples_leaf': 1}. Best is trial 276 with value: 0.8188065954265008.
[I 2025-04-07 05:24:55,861] Trial 472 finished with value: 0.8160397040036129 and parameters: {'n_estimators': 105, 'criterion': 'gini', 'max_depth': 54, 'min_samples_split': 11, 'min_samples_leaf': 1}. Best is trial 276 with value: 0.8188065954265008.
[I 2025-04-07 05:25:07,719] Trial 476 finished with value: 0.8158721121285767 and parameters: {'n_estimators': 97, 'criterion': 'gini', 'max_depth': 50, 'min_samples_split': 10, 'min_samples_leaf': 2}. Best is trial 276 with value: 0.8188065954265008.
[I 2025-04-07 05:25:18,841] Trial 480 finished with value: 0.8166685821027974 and parameters: {'n_estimators': 90, 'criterion': 'gini', 'max_depth': 52, 'min_samples_split': 10, 'min_samples_leaf': 2}. Best is trial 276 with value: 0.8188065954265008.
[I 2025-04-07 05:25:32,229] Trial 484 finished with value: 0.8155363836214395 and parameters: {'n_estimators': 102, 'criterion': 'gini', 'max_depth': 56, 'min_samples_split': 9, 'min_samples_leaf': 1}. Best is trial 276 with value: 0.8188065954265008.
[I 2025-04-07 05:25:35,091] Trial 488 finished with value: 0.8093322157027103 and parameters: {'n_estimators': 10, 'criterion': 'gini', 'max_depth': 50, 'min_samples_split': 11, 'min_samples_leaf': 4}. Best is trial 276 with value: 0.8188065954265008.
[I 2025-04-07 05:25:49,961] Trial 489 finished with value: 0.815997581981545 and parameters: {'n_estimators': 112, 'criterion': 'gini', 'max_depth': 55, 'min_samples_split': 9, 'min_samples_leaf': 1}. Best is trial 276 with value: 0.8188065954265008.
[I 2025-04-07 05:26:04,843] Trial 493 finished with value: 0.8158720242645341 and parameters: {'n_estimators': 108, 'criterion': 'gini', 'max_depth': 53, 'min_samples_split': 10, 'min_samples_leaf': 2}. Best is trial 276 with value: 0.8188065954265008.
[I 2025-04-07 05:26:18,433] Trial 497 finished with value: 0.8169619601413558 and parameters: {'n_estimators': 102, 'criterion': 'entropy', 'max_depth': 49, 'min_samples_split': 11, 'min_samples_leaf': 3}. Best is trial 276 with value: 0.8188065954265008.
[I 2025-04-07 05:26:31,364] Trial 501 finished with value: 0.8160813867054675 and parameters: {'n_estimators': 100, 'criterion': 'gini', 'max_depth': 25, 'min_samples_split': 10, 'min_samples_leaf': 1}. Best is trial 276 with value: 0.8188065954265008.
[I 2025-04-07 05:26:41,919] Trial 505 finished with value: 0.8164589033513103 and parameters: {'n_estimators': 94, 'criterion': 'gini', 'max_depth': 60, 'min_samples_split': 12, 'min_samples_leaf': 1}. Best is trial 276 with value: 0.8188065954265008.
[I 2025-04-07 05:26:53,143] Trial 509 finished with value: 0.8140693879917971 and parameters: {'n_estimators': 98, 'criterion': 'gini', 'max_depth': 58, 'min_samples_split': 9, 'min_samples_leaf': 5}. Best is trial 276 with value: 0.8188065954265008.
[I 2025-04-07 05:27:04,722] Trial 513 finished with value: 0.8160397040036129 and parameters: {'n_estimators': 105, 'criterion': 'gini', 'max_depth': 57, 'min_samples_split': 11, 'min_samples_leaf': 1}. Best is trial 276 with value: 0.8188065954265008.
[I 2025-04-07 05:27:16,172] Trial 517 finished with value: 0.8188065954265008 and parameters: {'n_estimators': 108, 'criterion': 'gini', 'max_depth': 55, 'min_samples_split': 10, 'min_samples_leaf': 1}. Best is trial 276 with value: 0.8188065954265008.
[I 2025-04-07 05:27:26,921] Trial 521 finished with value: 0.8188065954265008 and parameters: {'n_estimators': 108, 'criterion': 'gini', 'max_depth': 54, 'min_samples_split': 10, 'min_samples_leaf': 1}. Best is trial 276 with value: 0.8188065954265008.
[I 2025-04-07 05:27:40,082] Trial 525 finished with value: 0.8184292369359347 and parameters: {'n_estimators': 110, 'criterion': 'gini', 'max_depth': 54, 'min_samples_split': 10, 'min_samples_leaf': 1}. Best is trial 276 with value: 0.8188065954265008.
[I 2025-04-07 05:27:55,023] Trial 529 finished with value: 0.815788166822186 and parameters: {'n_estimators': 114, 'criterion': 'gini', 'max_depth': 54, 'min_samples_split': 9, 'min_samples_leaf': 2}. Best is trial 276 with value: 0.8188065954265008.
[I 2025-04-07 05:28:09,672] Trial 533 finished with value: 0.8181777173273164 and parameters: {'n_estimators': 116, 'criterion': 'gini', 'max_depth': 52, 'min_samples_split': 10, 'min_samples_leaf': 1}. Best is trial 276 with value: 0.8188065954265008.
[I 2025-04-07 05:28:23,135] Trial 538 finished with value: 0.8164169219117106 and parameters: {'n_estimators': 110, 'criterion': 'gini', 'max_depth': 51, 'min_samples_split': 11, 'min_samples_leaf': 1}. Best is trial 276 with value: 0.8188065954265008.
[I 2025-04-07 05:28:36,638] Trial 542 finished with value: 0.816417027348562 and parameters: {'n_estimators': 107, 'criterion': 'gini', 'max_depth': 55, 'min_samples_split': 10, 'min_samples_leaf': 3}. Best is trial 276 with value: 0.8188065954265008.
[I 2025-04-07 05:28:50,172] Trial 546 finished with value: 0.8161656131767948 and parameters: {'n_estimators': 104, 'criterion': 'gini', 'max_depth': 53, 'min_samples_split': 10, 'min_samples_leaf': 2}. Best is trial 276 with value: 0.8188065954265008.
[I 2025-04-07 05:29:03,873] Trial 550 finished with value: 0.8155363836214395 and parameters: {'n_estimators': 102, 'criterion': 'gini', 'max_depth': 56, 'min_samples_split': 9, 'min_samples_leaf': 1}. Best is trial 276 with value: 0.8188065954265008.
[I 2025-04-07 05:29:18,231] Trial 554 finished with value: 0.817465280523529 and parameters: {'n_estimators': 112, 'criterion': 'entropy', 'max_depth': 51, 'min_samples_split': 11, 'min_samples_leaf': 1}. Best is trial 276 with value: 0.8188065954265008.
[I 2025-04-07 05:29:32,690] Trial 558 finished with value: 0.8164589384969275 and parameters: {'n_estimators': 119, 'criterion': 'gini', 'max_depth': 47, 'min_samples_split': 10, 'min_samples_leaf': 2}. Best is trial 276 with value: 0.8188065954265008.
[I 2025-04-07 05:29:46,271] Trial 562 finished with value: 0.8161236844556209 and parameters: {'n_estimators': 100, 'criterion': 'gini', 'max_depth': 54, 'min_samples_split': 10, 'min_samples_leaf': 2}. Best is trial 276 with value: 0.8188065954265008.
[I 2025-04-07 05:30:00,390] Trial 566 finished with value: 0.815368809319212 and parameters: {'n_estimators': 101, 'criterion': 'gini', 'max_depth': 49, 'min_samples_split': 9, 'min_samples_leaf': 1}. Best is trial 276 with value: 0.8188065954265008.
[I 2025-04-07 05:30:12,737] Trial 570 finished with value: 0.8158299725337003 and parameters: {'n_estimators': 93, 'criterion': 'gini', 'max_depth': 40, 'min_samples_split': 11, 'min_samples_leaf': 1}. Best is trial 276 with value: 0.8188065954265008.
[I 2025-04-07 05:30:24,830] Trial 574 finished with value: 0.818219698766916 and parameters: {'n_estimators': 96, 'criterion': 'gini', 'max_depth': 51, 'min_samples_split': 10, 'min_samples_leaf': 1}. Best is trial 276 with value: 0.8188065954265008.
[I 2025-04-07 05:30:38,103] Trial 578 finished with value: 0.8158722351382366 and parameters: {'n_estimators': 104, 'criterion': 'gini', 'max_depth': 53, 'min_samples_split': 8, 'min_samples_leaf': 2}. Best is trial 276 with value: 0.8188065954265008.
[I 2025-04-07 05:30:52,289] Trial 582 finished with value: 0.8186807741173618 and parameters: {'n_estimators': 107, 'criterion': 'gini', 'max_depth': 57, 'min_samples_split': 10, 'min_samples_leaf': 1}. Best is trial 276 with value: 0.8188065954265008.
[I 2025-04-07 05:31:06,485] Trial 586 finished with value: 0.8155364363398651 and parameters: {'n_estimators': 109, 'criterion': 'gini', 'max_depth': 57, 'min_samples_split': 9, 'min_samples_leaf': 1}. Best is trial 276 with value: 0.8188065954265008.
[I 2025-04-07 05:31:20,917] Trial 590 finished with value: 0.8157880789581433 and parameters: {'n_estimators': 113, 'criterion': 'gini', 'max_depth': 58, 'min_samples_split': 11, 'min_samples_leaf': 1}. Best is trial 276 with value: 0.8188065954265008.
[I 2025-04-07 05:31:34,895] Trial 594 finished with value: 0.8162493651822915 and parameters: {'n_estimators': 106, 'criterion': 'gini', 'max_depth': 55, 'min_samples_split': 10, 'min_samples_leaf': 2}. Best is trial 276 with value: 0.8188065954265008.
[I 2025-04-07 05:31:48,426] Trial 598 finished with value: 0.8185550055266484 and parameters: {'n_estimators': 100, 'criterion': 'gini', 'max_depth': 55, 'min_samples_split': 10, 'min_samples_leaf': 1}. Best is trial 276 with value: 0.8188065954265008.
[I 2025-04-07 05:32:02,408] Trial 601 finished with value: 0.8158298143784235 and parameters: {'n_estimators': 110, 'criterion': 'gini', 'max_depth': 57, 'min_samples_split': 9, 'min_samples_leaf': 1}. Best is trial 276 with value: 0.8188065954265008.
[I 2025-04-07 05:32:15,924] Trial 606 finished with value: 0.8186807741173618 and parameters: {'n_estimators': 107, 'criterion': 'gini', 'max_depth': 58, 'min_samples_split': 10, 'min_samples_leaf': 1}. Best is trial 276 with value: 0.8188065954265008.
[I 2025-04-07 05:32:30,578] Trial 610 finished with value: 0.81654274322085 and parameters: {'n_estimators': 116, 'criterion': 'gini', 'max_depth': 60, 'min_samples_split': 11, 'min_samples_leaf': 2}. Best is trial 276 with value: 0.8188065954265008.
[I 2025-04-07 05:32:44,549] Trial 614 finished with value: 0.8163330644693627 and parameters: {'n_estimators': 113, 'criterion': 'entropy', 'max_depth': 57, 'min_samples_split': 8, 'min_samples_leaf': 5}. Best is trial 276 with value: 0.8188065954265008.
[I 2025-04-07 05:32:55,487] Trial 618 finished with value: 0.8185550055266484 and parameters: {'n_estimators': 100, 'criterion': 'gini', 'max_depth': 62, 'min_samples_split': 10, 'min_samples_leaf': 1}. Best is trial 276 with value: 0.8188065954265008.
[I 2025-04-07 05:33:07,870] Trial 622 finished with value: 0.8156202410637876 and parameters: {'n_estimators': 107, 'criterion': 'gini', 'max_depth': 56, 'min_samples_split': 9, 'min_samples_leaf': 1}. Best is trial 276 with value: 0.8188065954265008.
[I 2025-04-07 05:33:19,136] Trial 626 finished with value: 0.8160398973045069 and parameters: {'n_estimators': 101, 'criterion': 'gini', 'max_depth': 58, 'min_samples_split': 10, 'min_samples_leaf': 2}. Best is trial 276 with value: 0.8188065954265008.
[I 2025-04-07 05:33:31,083] Trial 630 finished with value: 0.8185131119510913 and parameters: {'n_estimators': 111, 'criterion': 'gini', 'max_depth': 54, 'min_samples_split': 10, 'min_samples_leaf': 1}. Best is trial 276 with value: 0.8188065954265008.
[I 2025-04-07 05:33:42,506] Trial 634 finished with value: 0.8162073134514578 and parameters: {'n_estimators': 106, 'criterion': 'gini', 'max_depth': 59, 'min_samples_split': 11, 'min_samples_leaf': 1}. Best is trial 276 with value: 0.8188065954265008.
[I 2025-04-07 05:33:54,026] Trial 638 finished with value: 0.8186389332602305 and parameters: {'n_estimators': 104, 'criterion': 'gini', 'max_depth': 56, 'min_samples_split': 10, 'min_samples_leaf': 1}. Best is trial 276 with value: 0.8188065954265008.
[I 2025-04-07 05:34:11,037] Trial 642 finished with value: 0.8171296925988603 and parameters: {'n_estimators': 157, 'criterion': 'gini', 'max_depth': 53, 'min_samples_split': 10, 'min_samples_leaf': 2}. Best is trial 276 with value: 0.8188065954265008.
[I 2025-04-07 05:34:22,647] Trial 646 finished with value: 0.8167522813898686 and parameters: {'n_estimators': 107, 'criterion': 'gini', 'max_depth': 55, 'min_samples_split': 16, 'min_samples_leaf': 1}. Best is trial 276 with value: 0.8188065954265008.
[I 2025-04-07 05:34:35,338] Trial 650 finished with value: 0.8181777173273164 and parameters: {'n_estimators': 116, 'criterion': 'gini', 'max_depth': 58, 'min_samples_split': 10, 'min_samples_leaf': 1}. Best is trial 276 with value: 0.8188065954265008.
[I 2025-04-07 05:34:47,442] Trial 654 finished with value: 0.8159139178400909 and parameters: {'n_estimators': 108, 'criterion': 'gini', 'max_depth': 58, 'min_samples_split': 11, 'min_samples_leaf': 1}. Best is trial 276 with value: 0.8188065954265008.
[I 2025-04-07 05:34:58,507] Trial 658 finished with value: 0.8164171152126046 and parameters: {'n_estimators': 103, 'criterion': 'gini', 'max_depth': 27, 'min_samples_split': 9, 'min_samples_leaf': 2}. Best is trial 276 with value: 0.8188065954265008.
[I 2025-04-07 05:35:09,697] Trial 662 finished with value: 0.8182615220512389 and parameters: {'n_estimators': 102, 'criterion': 'gini', 'max_depth': 57, 'min_samples_split': 10, 'min_samples_leaf': 1}. Best is trial 276 with value: 0.8188065954265008.
[I 2025-04-07 05:35:21,681] Trial 666 finished with value: 0.8184712183755345 and parameters: {'n_estimators': 113, 'criterion': 'gini', 'max_depth': 54, 'min_samples_split': 10, 'min_samples_leaf': 1}. Best is trial 276 with value: 0.8188065954265008.
[I 2025-04-07 05:35:33,418] Trial 671 finished with value: 0.8171716037472256 and parameters: {'n_estimators': 107, 'criterion': 'gini', 'max_depth': 49, 'min_samples_split': 8, 'min_samples_leaf': 1}. Best is trial 276 with value: 0.8188065954265008.
[I 2025-04-07 05:35:45,117] Trial 675 finished with value: 0.8161652441478155 and parameters: {'n_estimators': 107, 'criterion': 'gini', 'max_depth': 50, 'min_samples_split': 11, 'min_samples_leaf': 3}. Best is trial 276 with value: 0.8188065954265008.
[I 2025-04-07 05:35:57,013] Trial 678 finished with value: 0.815620487083107 and parameters: {'n_estimators': 110, 'criterion': 'gini', 'max_depth': 53, 'min_samples_split': 9, 'min_samples_leaf': 2}. Best is trial 276 with value: 0.8188065954265008.
[I 2025-04-07 05:36:08,446] Trial 682 finished with value: 0.818345414639204 and parameters: {'n_estimators': 101, 'criterion': 'gini', 'max_depth': 55, 'min_samples_split': 10, 'min_samples_leaf': 1}. Best is trial 276 with value: 0.8188065954265008.
[I 2025-04-07 05:36:21,566] Trial 686 finished with value: 0.8184712183755345 and parameters: {'n_estimators': 114, 'criterion': 'gini', 'max_depth': 51, 'min_samples_split': 10, 'min_samples_leaf': 1}. Best is trial 276 with value: 0.8188065954265008.
[I 2025-04-07 05:36:34,407] Trial 690 finished with value: 0.8115958394618502 and parameters: {'n_estimators': 125, 'criterion': 'gini', 'max_depth': 56, 'min_samples_split': 11, 'min_samples_leaf': 15}. Best is trial 276 with value: 0.8188065954265008.
