[I 2025-04-07 05:36:44,985] Trial 694 finished with value: 0.8159558289884563 and parameters: {'n_estimators': 96, 'criterion': 'gini', 'max_depth': 52, 'min_samples_split': 6, 'min_samples_leaf': 1}. Best is trial 276 with value: 0.8188065954265008.
[I 2025-04-07 05:36:55,702] Trial 698 finished with value: 0.8105476741509259 and parameters: {'n_estimators': 104, 'criterion': 'gini', 'max_depth': 54, 'min_samples_split': 9, 'min_samples_leaf': 18}. Best is trial 276 with value: 0.8188065954265008.
[I 2025-04-07 05:37:06,689] Trial 702 finished with value: 0.8050559254631754 and parameters: {'n_estimators': 111, 'criterion': 'gini', 'max_depth': 11, 'min_samples_split': 10, 'min_samples_leaf': 1}. Best is trial 276 with value: 0.8188065954265008.
[I 2025-04-07 05:37:18,557] Trial 706 finished with value: 0.8166686172484144 and parameters: {'n_estimators': 89, 'criterion': 'gini', 'max_depth': 60, 'min_samples_split': 10, 'min_samples_leaf': 2}. Best is trial 276 with value: 0.8188065954265008.
[I 2025-04-07 05:37:32,174] Trial 709 finished with value: 0.8158720242645341 and parameters: {'n_estimators': 108, 'criterion': 'gini', 'max_depth': 50, 'min_samples_split': 10, 'min_samples_leaf': 2}. Best is trial 276 with value: 0.8188065954265008.
[I 2025-04-07 05:37:45,826] Trial 713 finished with value: 0.8163749756177282 and parameters: {'n_estimators': 102, 'criterion': 'gini', 'max_depth': 55, 'min_samples_split': 11, 'min_samples_leaf': 1}. Best is trial 276 with value: 0.8188065954265008.
[I 2025-04-07 05:38:01,833] Trial 717 finished with value: 0.8154945076186912 and parameters: {'n_estimators': 113, 'criterion': 'gini', 'max_depth': 52, 'min_samples_split': 9, 'min_samples_leaf': 1}. Best is trial 276 with value: 0.8188065954265008.
[I 2025-04-07 05:38:17,215] Trial 722 finished with value: 0.8167524219723369 and parameters: {'n_estimators': 120, 'criterion': 'gini', 'max_depth': 57, 'min_samples_split': 10, 'min_samples_leaf': 2}. Best is trial 276 with value: 0.8188065954265008.
[I 2025-04-07 05:38:29,811] Trial 726 finished with value: 0.81809384231216 and parameters: {'n_estimators': 92, 'criterion': 'gini', 'max_depth': 53, 'min_samples_split': 10, 'min_samples_leaf': 1}. Best is trial 276 with value: 0.8188065954265008.
[I 2025-04-07 05:38:44,050] Trial 729 finished with value: 0.8161234735819182 and parameters: {'n_estimators': 109, 'criterion': 'gini', 'max_depth': 55, 'min_samples_split': 11, 'min_samples_leaf': 1}. Best is trial 276 with value: 0.8188065954265008.
[I 2025-04-07 05:38:57,312] Trial 733 finished with value: 0.8149079096968516 and parameters: {'n_estimators': 103, 'criterion': 'gini', 'max_depth': 50, 'min_samples_split': 9, 'min_samples_leaf': 9}. Best is trial 276 with value: 0.8188065954265008.
[I 2025-04-07 05:39:12,612] Trial 737 finished with value: 0.8181777173273164 and parameters: {'n_estimators': 116, 'criterion': 'gini', 'max_depth': 56, 'min_samples_split': 10, 'min_samples_leaf': 1}. Best is trial 276 with value: 0.8188065954265008.
[I 2025-04-07 05:39:24,145] Trial 742 finished with value: 0.8172134270315485 and parameters: {'n_estimators': 91, 'criterion': 'entropy', 'max_depth': 54, 'min_samples_split': 11, 'min_samples_leaf': 3}. Best is trial 276 with value: 0.8188065954265008.
[I 2025-04-07 05:39:36,137] Trial 746 finished with value: 0.8164171855038388 and parameters: {'n_estimators': 98, 'criterion': 'gini', 'max_depth': 52, 'min_samples_split': 10, 'min_samples_leaf': 2}. Best is trial 276 with value: 0.8188065954265008.
[I 2025-04-07 05:39:49,286] Trial 750 finished with value: 0.8188065954265008 and parameters: {'n_estimators': 99, 'criterion': 'gini', 'max_depth': 52, 'min_samples_split': 10, 'min_samples_leaf': 1}. Best is trial 276 with value: 0.8188065954265008.
[I 2025-04-07 05:40:01,818] Trial 755 finished with value: 0.8159139705585167 and parameters: {'n_estimators': 94, 'criterion': 'gini', 'max_depth': 51, 'min_samples_split': 9, 'min_samples_leaf': 2}. Best is trial 276 with value: 0.8188065954265008.
[I 2025-04-07 05:40:14,459] Trial 759 finished with value: 0.8163749404721111 and parameters: {'n_estimators': 97, 'criterion': 'gini', 'max_depth': 48, 'min_samples_split': 11, 'min_samples_leaf': 1}. Best is trial 276 with value: 0.8188065954265008.
[I 2025-04-07 05:40:27,756] Trial 763 finished with value: 0.8187227379841528 and parameters: {'n_estimators': 99, 'criterion': 'gini', 'max_depth': 51, 'min_samples_split': 10, 'min_samples_leaf': 1}. Best is trial 276 with value: 0.8188065954265008.
[I 2025-04-07 05:40:39,236] Trial 767 finished with value: 0.8162912411850399 and parameters: {'n_estimators': 83, 'criterion': 'gini', 'max_depth': 50, 'min_samples_split': 10, 'min_samples_leaf': 2}. Best is trial 276 with value: 0.8188065954265008.
[I 2025-04-07 05:40:50,829] Trial 770 finished with value: 0.8179261098546554 and parameters: {'n_estimators': 86, 'criterion': 'gini', 'max_depth': 48, 'min_samples_split': 10, 'min_samples_leaf': 1}. Best is trial 276 with value: 0.8188065954265008.
[I 2025-04-07 05:41:03,474] Trial 774 finished with value: 0.8149495748258975 and parameters: {'n_estimators': 95, 'criterion': 'gini', 'max_depth': 50, 'min_samples_split': 9, 'min_samples_leaf': 1}. Best is trial 276 with value: 0.8188065954265008.
[I 2025-04-07 05:41:15,747] Trial 778 finished with value: 0.8159979158649072 and parameters: {'n_estimators': 97, 'criterion': 'gini', 'max_depth': 51, 'min_samples_split': 9, 'min_samples_leaf': 2}. Best is trial 276 with value: 0.8188065954265008.
[I 2025-04-07 05:41:28,583] Trial 782 finished with value: 0.8162913114762741 and parameters: {'n_estimators': 101, 'criterion': 'gini', 'max_depth': 52, 'min_samples_split': 11, 'min_samples_leaf': 2}. Best is trial 276 with value: 0.8188065954265008.
[I 2025-04-07 05:41:41,551] Trial 786 finished with value: 0.8182615220512389 and parameters: {'n_estimators': 102, 'criterion': 'gini', 'max_depth': 52, 'min_samples_split': 10, 'min_samples_leaf': 1}. Best is trial 276 with value: 0.8188065954265008.
[I 2025-04-07 05:41:54,870] Trial 790 finished with value: 0.8181776821816994 and parameters: {'n_estimators': 93, 'criterion': 'gini', 'max_depth': 53, 'min_samples_split': 10, 'min_samples_leaf': 1}. Best is trial 276 with value: 0.8188065954265008.
[I 2025-04-07 05:42:08,281] Trial 794 finished with value: 0.8159138475488568 and parameters: {'n_estimators': 98, 'criterion': 'gini', 'max_depth': 51, 'min_samples_split': 11, 'min_samples_leaf': 1}. Best is trial 276 with value: 0.8188065954265008.
[I 2025-04-07 05:42:22,196] Trial 798 finished with value: 0.8158720418373425 and parameters: {'n_estimators': 105, 'criterion': 'gini', 'max_depth': 54, 'min_samples_split': 9, 'min_samples_leaf': 2}. Best is trial 276 with value: 0.8188065954265008.
[I 2025-04-07 05:42:36,196] Trial 802 finished with value: 0.8147819302324356 and parameters: {'n_estimators': 104, 'criterion': 'entropy', 'max_depth': 54, 'min_samples_split': 10, 'min_samples_leaf': 8}. Best is trial 276 with value: 0.8188065954265008.
[I 2025-04-07 05:42:48,067] Trial 806 finished with value: 0.8166685293843718 and parameters: {'n_estimators': 101, 'criterion': 'gini', 'max_depth': 50, 'min_samples_split': 12, 'min_samples_leaf': 1}. Best is trial 276 with value: 0.8188065954265008.
[I 2025-04-07 05:42:58,419] Trial 810 finished with value: 0.8180519487366029 and parameters: {'n_estimators': 95, 'criterion': 'gini', 'max_depth': 53, 'min_samples_split': 10, 'min_samples_leaf': 1}. Best is trial 276 with value: 0.8188065954265008.
[I 2025-04-07 05:43:10,140] Trial 814 finished with value: 0.8120153199744843 and parameters: {'n_estimators': 109, 'criterion': 'gini', 'max_depth': 55, 'min_samples_split': 11, 'min_samples_leaf': 14}. Best is trial 276 with value: 0.8188065954265008.
[I 2025-04-07 05:43:19,951] Trial 818 finished with value: 0.8164588857785018 and parameters: {'n_estimators': 88, 'criterion': 'gini', 'max_depth': 50, 'min_samples_split': 9, 'min_samples_leaf': 2}. Best is trial 276 with value: 0.8188065954265008.
[I 2025-04-07 05:43:31,628] Trial 821 finished with value: 0.8165846543692152 and parameters: {'n_estimators': 105, 'criterion': 'gini', 'max_depth': 53, 'min_samples_split': 13, 'min_samples_leaf': 1}. Best is trial 276 with value: 0.8188065954265008.
[I 2025-04-07 05:43:42,562] Trial 826 finished with value: 0.8188065954265008 and parameters: {'n_estimators': 99, 'criterion': 'gini', 'max_depth': 52, 'min_samples_split': 10, 'min_samples_leaf': 1}. Best is trial 276 with value: 0.8188065954265008.
[I 2025-04-07 05:43:52,816] Trial 830 finished with value: 0.8182615396240474 and parameters: {'n_estimators': 93, 'criterion': 'gini', 'max_depth': 48, 'min_samples_split': 10, 'min_samples_leaf': 1}. Best is trial 276 with value: 0.8188065954265008.
[I 2025-04-07 05:44:02,660] Trial 833 finished with value: 0.8164590263609701 and parameters: {'n_estimators': 90, 'criterion': 'gini', 'max_depth': 49, 'min_samples_split': 11, 'min_samples_leaf': 2}. Best is trial 276 with value: 0.8188065954265008.
[I 2025-04-07 05:44:09,138] Trial 837 finished with value: 0.8163331171877883 and parameters: {'n_estimators': 51, 'criterion': 'gini', 'max_depth': 55, 'min_samples_split': 11, 'min_samples_leaf': 2}. Best is trial 276 with value: 0.8188065954265008.
[I 2025-04-07 05:44:17,484] Trial 840 finished with value: 0.8162911357481886 and parameters: {'n_estimators': 65, 'criterion': 'gini', 'max_depth': 40, 'min_samples_split': 10, 'min_samples_leaf': 1}. Best is trial 276 with value: 0.8188065954265008.
[I 2025-04-07 05:44:28,516] Trial 842 finished with value: 0.8152849343040554 and parameters: {'n_estimators': 98, 'criterion': 'gini', 'max_depth': 54, 'min_samples_split': 9, 'min_samples_leaf': 1}. Best is trial 276 with value: 0.8188065954265008.
[I 2025-04-07 05:44:39,693] Trial 846 finished with value: 0.8155363836214395 and parameters: {'n_estimators': 102, 'criterion': 'gini', 'max_depth': 51, 'min_samples_split': 9, 'min_samples_leaf': 1}. Best is trial 276 with value: 0.8188065954265008.
[I 2025-04-07 05:44:51,306] Trial 850 finished with value: 0.8161236493100038 and parameters: {'n_estimators': 105, 'criterion': 'gini', 'max_depth': 56, 'min_samples_split': 10, 'min_samples_leaf': 2}. Best is trial 276 with value: 0.8188065954265008.
[I 2025-04-07 05:45:03,757] Trial 854 finished with value: 0.8166264425079209 and parameters: {'n_estimators': 111, 'criterion': 'gini', 'max_depth': 52, 'min_samples_split': 5, 'min_samples_leaf': 2}. Best is trial 276 with value: 0.8188065954265008.
[I 2025-04-07 05:45:14,779] Trial 859 finished with value: 0.8144465531814692 and parameters: {'n_estimators': 100, 'criterion': 'gini', 'max_depth': 16, 'min_samples_split': 10, 'min_samples_leaf': 1}. Best is trial 276 with value: 0.8188065954265008.
[I 2025-04-07 05:45:25,130] Trial 863 finished with value: 0.8110509945330993 and parameters: {'n_estimators': 95, 'criterion': 'gini', 'max_depth': 55, 'min_samples_split': 10, 'min_samples_leaf': 19}. Best is trial 276 with value: 0.8188065954265008.
[I 2025-04-07 05:45:37,319] Trial 867 finished with value: 0.8150333092585857 and parameters: {'n_estimators': 91, 'criterion': 'gini', 'max_depth': 51, 'min_samples_split': 9, 'min_samples_leaf': 1}. Best is trial 276 with value: 0.8188065954265008.
[I 2025-04-07 05:45:52,368] Trial 871 finished with value: 0.8162072607330322 and parameters: {'n_estimators': 107, 'criterion': 'gini', 'max_depth': 53, 'min_samples_split': 11, 'min_samples_leaf': 2}. Best is trial 276 with value: 0.8188065954265008.
[I 2025-04-07 05:46:06,780] Trial 874 finished with value: 0.815914146286602 and parameters: {'n_estimators': 104, 'criterion': 'gini', 'max_depth': 54, 'min_samples_split': 7, 'min_samples_leaf': 1}. Best is trial 276 with value: 0.8188065954265008.
[I 2025-04-07 05:46:21,272] Trial 878 finished with value: 0.8183873257875692 and parameters: {'n_estimators': 111, 'criterion': 'gini', 'max_depth': 47, 'min_samples_split': 10, 'min_samples_leaf': 1}. Best is trial 276 with value: 0.8188065954265008.
[I 2025-04-07 05:46:32,835] Trial 882 finished with value: 0.8163750986273879 and parameters: {'n_estimators': 86, 'criterion': 'gini', 'max_depth': 56, 'min_samples_split': 9, 'min_samples_leaf': 2}. Best is trial 276 with value: 0.8188065954265008.
[I 2025-04-07 05:46:37,664] Trial 886 finished with value: 0.8142789788792415 and parameters: {'n_estimators': 28, 'criterion': 'gini', 'max_depth': 52, 'min_samples_split': 9, 'min_samples_leaf': 2}. Best is trial 276 with value: 0.8188065954265008.
[I 2025-04-07 05:46:50,832] Trial 889 finished with value: 0.8164588506328847 and parameters: {'n_estimators': 99, 'criterion': 'gini', 'max_depth': 50, 'min_samples_split': 11, 'min_samples_leaf': 1}. Best is trial 276 with value: 0.8188065954265008.
[I 2025-04-07 05:47:05,107] Trial 893 finished with value: 0.8173812473530957 and parameters: {'n_estimators': 108, 'criterion': 'gini', 'max_depth': 54, 'min_samples_split': 8, 'min_samples_leaf': 1}. Best is trial 276 with value: 0.8188065954265008.
[I 2025-04-07 05:47:18,618] Trial 897 finished with value: 0.8182615923424729 and parameters: {'n_estimators': 103, 'criterion': 'gini', 'max_depth': 57, 'min_samples_split': 10, 'min_samples_leaf': 1}. Best is trial 276 with value: 0.8188065954265008.
[I 2025-04-07 05:47:31,254] Trial 901 finished with value: 0.8167104581055458 and parameters: {'n_estimators': 96, 'criterion': 'gini', 'max_depth': 53, 'min_samples_split': 12, 'min_samples_leaf': 2}. Best is trial 276 with value: 0.8188065954265008.
[I 2025-04-07 05:47:46,118] Trial 905 finished with value: 0.815871989118917 and parameters: {'n_estimators': 113, 'criterion': 'gini', 'max_depth': 52, 'min_samples_split': 10, 'min_samples_leaf': 2}. Best is trial 276 with value: 0.8188065954265008.
[I 2025-04-07 05:48:00,527] Trial 909 finished with value: 0.8136082072044999 and parameters: {'n_estimators': 110, 'criterion': 'gini', 'max_depth': 55, 'min_samples_split': 9, 'min_samples_leaf': 10}. Best is trial 276 with value: 0.8188065954265008.
[I 2025-04-07 05:48:15,103] Trial 913 finished with value: 0.8156202410637876 and parameters: {'n_estimators': 107, 'criterion': 'gini', 'max_depth': 56, 'min_samples_split': 9, 'min_samples_leaf': 1}. Best is trial 276 with value: 0.8188065954265008.
[I 2025-04-07 05:48:27,295] Trial 918 finished with value: 0.8166686172484144 and parameters: {'n_estimators': 89, 'criterion': 'gini', 'max_depth': 54, 'min_samples_split': 10, 'min_samples_leaf': 2}. Best is trial 276 with value: 0.8188065954265008.
[I 2025-04-07 05:48:41,026] Trial 921 finished with value: 0.815578523216316 and parameters: {'n_estimators': 99, 'criterion': 'gini', 'max_depth': 49, 'min_samples_split': 2, 'min_samples_leaf': 1}. Best is trial 276 with value: 0.8188065954265008.
[I 2025-04-07 05:48:54,802] Trial 925 finished with value: 0.8163749756177282 and parameters: {'n_estimators': 104, 'criterion': 'gini', 'max_depth': 52, 'min_samples_split': 11, 'min_samples_leaf': 1}. Best is trial 276 with value: 0.8188065954265008.
[I 2025-04-07 05:49:07,305] Trial 929 finished with value: 0.81826162748809 and parameters: {'n_estimators': 96, 'criterion': 'gini', 'max_depth': 54, 'min_samples_split': 10, 'min_samples_leaf': 1}. Best is trial 276 with value: 0.8188065954265008.
[I 2025-04-07 05:49:19,521] Trial 933 finished with value: 0.8155366999319933 and parameters: {'n_estimators': 95, 'criterion': 'gini', 'max_depth': 58, 'min_samples_split': 9, 'min_samples_leaf': 2}. Best is trial 276 with value: 0.8188065954265008.
[I 2025-04-07 05:49:33,837] Trial 937 finished with value: 0.8185131119510913 and parameters: {'n_estimators': 111, 'criterion': 'gini', 'max_depth': 55, 'min_samples_split': 10, 'min_samples_leaf': 1}. Best is trial 276 with value: 0.8188065954265008.
[I 2025-04-07 05:49:46,836] Trial 941 finished with value: 0.818345414639204 and parameters: {'n_estimators': 101, 'criterion': 'gini', 'max_depth': 53, 'min_samples_split': 10, 'min_samples_leaf': 1}. Best is trial 276 with value: 0.8188065954265008.
[I 2025-04-07 05:49:59,225] Trial 944 finished with value: 0.8140693001277542 and parameters: {'n_estimators': 106, 'criterion': 'gini', 'max_depth': 55, 'min_samples_split': 11, 'min_samples_leaf': 12}. Best is trial 276 with value: 0.8188065954265008.
[I 2025-04-07 05:50:12,833] Trial 947 finished with value: 0.8186807741173618 and parameters: {'n_estimators': 107, 'criterion': 'gini', 'max_depth': 56, 'min_samples_split': 10, 'min_samples_leaf': 1}. Best is trial 276 with value: 0.8188065954265008.
[I 2025-04-07 05:50:24,804] Trial 951 finished with value: 0.8114281948683884 and parameters: {'n_estimators': 97, 'criterion': 'gini', 'max_depth': 57, 'min_samples_split': 10, 'min_samples_leaf': 15}. Best is trial 276 with value: 0.8188065954265008.
[I 2025-04-07 05:50:38,003] Trial 955 finished with value: 0.8155363836214395 and parameters: {'n_estimators': 102, 'criterion': 'gini', 'max_depth': 48, 'min_samples_split': 9, 'min_samples_leaf': 1}. Best is trial 276 with value: 0.8188065954265008.
[I 2025-04-07 05:50:52,586] Trial 959 finished with value: 0.8158299373880832 and parameters: {'n_estimators': 116, 'criterion': 'gini', 'max_depth': 54, 'min_samples_split': 10, 'min_samples_leaf': 6}. Best is trial 276 with value: 0.8188065954265008.
[I 2025-04-07 05:51:06,424] Trial 963 finished with value: 0.8161652968662411 and parameters: {'n_estimators': 112, 'criterion': 'gini', 'max_depth': 51, 'min_samples_split': 11, 'min_samples_leaf': 2}. Best is trial 276 with value: 0.8188065954265008.
[I 2025-04-07 05:51:20,699] Trial 967 finished with value: 0.8165427256480413 and parameters: {'n_estimators': 102, 'criterion': 'entropy', 'max_depth': 52, 'min_samples_split': 10, 'min_samples_leaf': 1}. Best is trial 276 with value: 0.8188065954265008.
[I 2025-04-07 05:51:34,281] Trial 970 finished with value: 0.8162493651822915 and parameters: {'n_estimators': 106, 'criterion': 'gini', 'max_depth': 56, 'min_samples_split': 10, 'min_samples_leaf': 2}. Best is trial 276 with value: 0.8188065954265008.
[I 2025-04-07 05:51:47,267] Trial 974 finished with value: 0.8152430231556899 and parameters: {'n_estimators': 96, 'criterion': 'gini', 'max_depth': 53, 'min_samples_split': 9, 'min_samples_leaf': 1}. Best is trial 276 with value: 0.8188065954265008.
[I 2025-04-07 05:51:59,139] Trial 978 finished with value: 0.8137340285136393 and parameters: {'n_estimators': 88, 'criterion': 'gini', 'max_depth': 50, 'min_samples_split': 10, 'min_samples_leaf': 5}. Best is trial 276 with value: 0.8188065954265008.
[I 2025-04-07 05:52:11,745] Trial 982 finished with value: 0.8188065954265008 and parameters: {'n_estimators': 99, 'criterion': 'gini', 'max_depth': 59, 'min_samples_split': 10, 'min_samples_leaf': 1}. Best is trial 276 with value: 0.8188065954265008.
[I 2025-04-07 05:52:24,104] Trial 986 finished with value: 0.816836349705919 and parameters: {'n_estimators': 92, 'criterion': 'gini', 'max_depth': 62, 'min_samples_split': 11, 'min_samples_leaf': 2}. Best is trial 276 with value: 0.8188065954265008.
[I 2025-04-07 05:52:37,194] Trial 990 finished with value: 0.8182616274880902 and parameters: {'n_estimators': 98, 'criterion': 'gini', 'max_depth': 60, 'min_samples_split': 10, 'min_samples_leaf': 1}. Best is trial 276 with value: 0.8188065954265008.
[I 2025-04-07 05:52:49,987] Trial 994 finished with value: 0.8185550055266484 and parameters: {'n_estimators': 100, 'criterion': 'gini', 'max_depth': 63, 'min_samples_split': 10, 'min_samples_leaf': 1}. Best is trial 276 with value: 0.8188065954265008.
[I 2025-04-07 05:53:02,334] Trial 998 finished with value: 0.8180519487366029 and parameters: {'n_estimators': 95, 'criterion': 'gini', 'max_depth': 60, 'min_samples_split': 10, 'min_samples_leaf': 1}. Best is trial 276 with value: 0.8188065954265008.
[I 2025-04-07 05:53:15,497] Trial 1002 finished with value: 0.8160397742948472 and parameters: {'n_estimators': 102, 'criterion': 'gini', 'max_depth': 64, 'min_samples_split': 9, 'min_samples_leaf': 2}. Best is trial 276 with value: 0.8188065954265008.
[I 2025-04-07 05:53:26,988] Trial 1006 finished with value: 0.8165008144996758 and parameters: {'n_estimators': 85, 'criterion': 'gini', 'max_depth': 64, 'min_samples_split': 11, 'min_samples_leaf': 1}. Best is trial 276 with value: 0.8188065954265008.
[I 2025-04-07 05:53:40,852] Trial 1010 finished with value: 0.8158720418373425 and parameters: {'n_estimators': 111, 'criterion': 'gini', 'max_depth': 61, 'min_samples_split': 20, 'min_samples_leaf': 1}. Best is trial 276 with value: 0.8188065954265008.
[I 2025-04-07 05:53:56,326] Trial 1014 finished with value: 0.8180938950305855 and parameters: {'n_estimators': 115, 'criterion': 'gini', 'max_depth': 59, 'min_samples_split': 10, 'min_samples_leaf': 1}. Best is trial 276 with value: 0.8188065954265008.
[I 2025-04-07 05:54:09,485] Trial 1018 finished with value: 0.8168362442690679 and parameters: {'n_estimators': 101, 'criterion': 'gini', 'max_depth': 63, 'min_samples_split': 12, 'min_samples_leaf': 2}. Best is trial 276 with value: 0.8188065954265008.
[I 2025-04-07 05:54:23,642] Trial 1022 finished with value: 0.8159556532603711 and parameters: {'n_estimators': 105, 'criterion': 'gini', 'max_depth': 64, 'min_samples_split': 9, 'min_samples_leaf': 1}. Best is trial 276 with value: 0.8188065954265008.
[I 2025-04-07 05:54:34,504] Trial 1026 finished with value: 0.818345414639204 and parameters: {'n_estimators': 94, 'criterion': 'gini', 'max_depth': 58, 'min_samples_split': 10, 'min_samples_leaf': 1}. Best is trial 276 with value: 0.8188065954265008.
[I 2025-04-07 05:54:45,893] Trial 1030 finished with value: 0.8185970396846735 and parameters: {'n_estimators': 97, 'criterion': 'gini', 'max_depth': 57, 'min_samples_split': 10, 'min_samples_leaf': 1}. Best is trial 276 with value: 0.8188065954265008.
