[I 2025-04-07 04:59:49,326] Using an existing study with name 'random-forest' instead of creating a new one.
[I 2025-04-07 05:00:11,301] Trial 2 finished with value: 0.8160817557344467 and parameters: {'n_estimators': 192, 'criterion': 'entropy', 'max_depth': 57, 'min_samples_split': 18, 'min_samples_leaf': 6}. Best is trial 3 with value: 0.8163331699062137.
[I 2025-04-07 05:00:14,708] Trial 7 finished with value: 0.8149494869618549 and parameters: {'n_estimators': 21, 'criterion': 'entropy', 'max_depth': 37, 'min_samples_split': 3, 'min_samples_leaf': 6}. Best is trial 3 with value: 0.8163331699062137.
[I 2025-04-07 05:00:18,185] Trial 9 finished with value: 0.8126020409059838 and parameters: {'n_estimators': 18, 'criterion': 'entropy', 'max_depth': 27, 'min_samples_split': 2, 'min_samples_leaf': 4}. Best is trial 3 with value: 0.8163331699062137.
[I 2025-04-07 05:00:36,514] Trial 10 finished with value: 0.8145725150730765 and parameters: {'n_estimators': 161, 'criterion': 'entropy', 'max_depth': 35, 'min_samples_split': 19, 'min_samples_leaf': 7}. Best is trial 3 with value: 0.8163331699062137.
[I 2025-04-07 05:00:53,517] Trial 17 finished with value: 0.8154528776352624 and parameters: {'n_estimators': 138, 'criterion': 'gini', 'max_depth': 64, 'min_samples_split': 20, 'min_samples_leaf': 4}. Best is trial 3 with value: 0.8163331699062137.
[I 2025-04-07 05:01:00,230] Trial 20 finished with value: 0.8099610586562775 and parameters: {'n_estimators': 53, 'criterion': 'entropy', 'max_depth': 49, 'min_samples_split': 4, 'min_samples_leaf': 17}. Best is trial 3 with value: 0.8163331699062137.
[I 2025-04-07 05:01:15,480] Trial 23 finished with value: 0.8145724096362252 and parameters: {'n_estimators': 123, 'criterion': 'entropy', 'max_depth': 16, 'min_samples_split': 13, 'min_samples_leaf': 2}. Best is trial 22 with value: 0.8174649466401668.
[I 2025-04-07 05:01:27,743] Trial 27 finished with value: 0.816165419875901 and parameters: {'n_estimators': 86, 'criterion': 'entropy', 'max_depth': 55, 'min_samples_split': 8, 'min_samples_leaf': 3}. Best is trial 22 with value: 0.8174649466401668.
[I 2025-04-07 05:01:37,794] Trial 31 finished with value: 0.8155364714854821 and parameters: {'n_estimators': 75, 'criterion': 'entropy', 'max_depth': 41, 'min_samples_split': 12, 'min_samples_leaf': 2}. Best is trial 28 with value: 0.8177586234164703.
[I 2025-04-07 05:01:43,689] Trial 35 finished with value: 0.8146143383573993 and parameters: {'n_estimators': 37, 'criterion': 'entropy', 'max_depth': 58, 'min_samples_split': 11, 'min_samples_leaf': 9}. Best is trial 28 with value: 0.8177586234164703.
[I 2025-04-07 05:01:58,357] Trial 38 finished with value: 0.8164589209241189 and parameters: {'n_estimators': 107, 'criterion': 'entropy', 'max_depth': 59, 'min_samples_split': 9, 'min_samples_leaf': 6}. Best is trial 28 with value: 0.8177586234164703.
[I 2025-04-07 05:02:14,130] Trial 42 finished with value: 0.8167943331207024 and parameters: {'n_estimators': 123, 'criterion': 'gini', 'max_depth': 54, 'min_samples_split': 5, 'min_samples_leaf': 1}. Best is trial 28 with value: 0.8177586234164703.
[I 2025-04-07 05:02:29,147] Trial 46 finished with value: 0.817339195622262 and parameters: {'n_estimators': 117, 'criterion': 'gini', 'max_depth': 46, 'min_samples_split': 15, 'min_samples_leaf': 1}. Best is trial 28 with value: 0.8177586234164703.
[I 2025-04-07 05:02:39,395] Trial 52 finished with value: 0.8160396512851873 and parameters: {'n_estimators': 80, 'criterion': 'entropy', 'max_depth': 61, 'min_samples_split': 14, 'min_samples_leaf': 5}. Best is trial 28 with value: 0.8177586234164703.
[I 2025-04-07 05:02:57,501] Trial 56 finished with value: 0.8169620128597813 and parameters: {'n_estimators': 149, 'criterion': 'gini', 'max_depth': 56, 'min_samples_split': 17, 'min_samples_leaf': 2}. Best is trial 28 with value: 0.8177586234164703.
[I 2025-04-07 05:03:12,616] Trial 59 finished with value: 0.8183034683452213 and parameters: {'n_estimators': 112, 'criterion': 'gini', 'max_depth': 44, 'min_samples_split': 10, 'min_samples_leaf': 1}. Best is trial 59 with value: 0.8183034683452213.
[I 2025-04-07 05:03:26,004] Trial 63 finished with value: 0.8155366296407591 and parameters: {'n_estimators': 95, 'criterion': 'entropy', 'max_depth': 61, 'min_samples_split': 12, 'min_samples_leaf': 4}. Best is trial 59 with value: 0.8183034683452213.
[I 2025-04-07 05:03:42,626] Trial 68 finished with value: 0.8177585882708531 and parameters: {'n_estimators': 128, 'criterion': 'gini', 'max_depth': 45, 'min_samples_split': 4, 'min_samples_leaf': 1}. Best is trial 59 with value: 0.8183034683452213.
[I 2025-04-07 05:04:02,616] Trial 72 finished with value: 0.8140694407102226 and parameters: {'n_estimators': 181, 'criterion': 'gini', 'max_depth': 39, 'min_samples_split': 5, 'min_samples_leaf': 12}. Best is trial 59 with value: 0.8183034683452213.
[I 2025-04-07 05:04:20,479] Trial 76 finished with value: 0.8165428838033181 and parameters: {'n_estimators': 138, 'criterion': 'gini', 'max_depth': 34, 'min_samples_split': 4, 'min_samples_leaf': 2}. Best is trial 59 with value: 0.8183034683452213.
[I 2025-04-07 05:04:34,920] Trial 81 finished with value: 0.815452807344028 and parameters: {'n_estimators': 102, 'criterion': 'gini', 'max_depth': 44, 'min_samples_split': 6, 'min_samples_leaf': 1}. Best is trial 59 with value: 0.8183034683452213.
[I 2025-04-07 05:04:51,437] Trial 84 finished with value: 0.8177585179796191 and parameters: {'n_estimators': 121, 'criterion': 'gini', 'max_depth': 64, 'min_samples_split': 3, 'min_samples_leaf': 1}. Best is trial 59 with value: 0.8183034683452213.
[I 2025-04-07 05:05:08,390] Trial 88 finished with value: 0.8162074716067347 and parameters: {'n_estimators': 126, 'criterion': 'gini', 'max_depth': 64, 'min_samples_split': 3, 'min_samples_leaf': 3}. Best is trial 59 with value: 0.8183034683452213.
[I 2025-04-07 05:05:27,035] Trial 92 finished with value: 0.8156624860955152 and parameters: {'n_estimators': 142, 'criterion': 'gini', 'max_depth': 42, 'min_samples_split': 2, 'min_samples_leaf': 4}. Best is trial 59 with value: 0.8183034683452213.
[I 2025-04-07 05:05:40,132] Trial 97 finished with value: 0.8164167813292424 and parameters: {'n_estimators': 99, 'criterion': 'gini', 'max_depth': 57, 'min_samples_split': 5, 'min_samples_leaf': 2}. Best is trial 59 with value: 0.8183034683452213.
[I 2025-04-07 05:05:58,470] Trial 101 finished with value: 0.8174651047954435 and parameters: {'n_estimators': 155, 'criterion': 'gini', 'max_depth': 60, 'min_samples_split': 4, 'min_samples_leaf': 1}. Best is trial 59 with value: 0.8183034683452213.
[I 2025-04-07 05:06:10,134] Trial 105 finished with value: 0.8175068050701068 and parameters: {'n_estimators': 104, 'criterion': 'gini', 'max_depth': 62, 'min_samples_split': 3, 'min_samples_leaf': 1}. Best is trial 59 with value: 0.8183034683452213.
[I 2025-04-07 05:06:21,078] Trial 109 finished with value: 0.8161656658952203 and parameters: {'n_estimators': 113, 'criterion': 'gini', 'max_depth': 63, 'min_samples_split': 8, 'min_samples_leaf': 2}. Best is trial 59 with value: 0.8183034683452213.
[I 2025-04-07 05:06:33,887] Trial 114 finished with value: 0.8177166068312536 and parameters: {'n_estimators': 121, 'criterion': 'gini', 'max_depth': 61, 'min_samples_split': 3, 'min_samples_leaf': 1}. Best is trial 59 with value: 0.8183034683452213.
[I 2025-04-07 05:06:47,992] Trial 118 finished with value: 0.8180100024426202 and parameters: {'n_estimators': 131, 'criterion': 'gini', 'max_depth': 61, 'min_samples_split': 10, 'min_samples_leaf': 1}. Best is trial 59 with value: 0.8183034683452213.
[I 2025-04-07 05:07:02,838] Trial 122 finished with value: 0.81692017200265 and parameters: {'n_estimators': 129, 'criterion': 'entropy', 'max_depth': 42, 'min_samples_split': 11, 'min_samples_leaf': 2}. Best is trial 59 with value: 0.8183034683452213.
[I 2025-04-07 05:07:15,714] Trial 126 finished with value: 0.8180938950305855 and parameters: {'n_estimators': 115, 'criterion': 'gini', 'max_depth': 47, 'min_samples_split': 10, 'min_samples_leaf': 1}. Best is trial 59 with value: 0.8183034683452213.
[I 2025-04-07 05:07:25,672] Trial 131 finished with value: 0.8164588506328847 and parameters: {'n_estimators': 89, 'criterion': 'gini', 'max_depth': 47, 'min_samples_split': 9, 'min_samples_leaf': 3}. Best is trial 59 with value: 0.8183034683452213.
[I 2025-04-07 05:07:38,047] Trial 135 finished with value: 0.8168782608542845 and parameters: {'n_estimators': 114, 'criterion': 'gini', 'max_depth': 50, 'min_samples_split': 12, 'min_samples_leaf': 1}. Best is trial 59 with value: 0.8183034683452213.
[I 2025-04-07 05:07:49,011] Trial 139 finished with value: 0.8127278622151227 and parameters: {'n_estimators': 102, 'criterion': 'gini', 'max_depth': 45, 'min_samples_split': 10, 'min_samples_leaf': 13}. Best is trial 59 with value: 0.8183034683452213.
[I 2025-04-07 05:08:01,101] Trial 143 finished with value: 0.8128954892357761 and parameters: {'n_estimators': 117, 'criterion': 'gini', 'max_depth': 52, 'min_samples_split': 10, 'min_samples_leaf': 11}. Best is trial 59 with value: 0.8183034683452213.
[I 2025-04-07 05:08:12,072] Trial 147 finished with value: 0.8149495748258975 and parameters: {'n_estimators': 95, 'criterion': 'gini', 'max_depth': 49, 'min_samples_split': 9, 'min_samples_leaf': 1}. Best is trial 59 with value: 0.8183034683452213.
[I 2025-04-07 05:08:23,746] Trial 150 finished with value: 0.8161654725943265 and parameters: {'n_estimators': 107, 'criterion': 'gini', 'max_depth': 48, 'min_samples_split': 11, 'min_samples_leaf': 1}. Best is trial 146 with value: 0.8185131119510913.
[I 2025-04-07 05:08:37,149] Trial 154 finished with value: 0.816291276330657 and parameters: {'n_estimators': 125, 'criterion': 'gini', 'max_depth': 46, 'min_samples_split': 10, 'min_samples_leaf': 2}. Best is trial 146 with value: 0.8185131119510913.
[I 2025-04-07 05:08:48,681] Trial 158 finished with value: 0.8187227379841528 and parameters: {'n_estimators': 99, 'criterion': 'gini', 'max_depth': 51, 'min_samples_split': 10, 'min_samples_leaf': 1}. Best is trial 158 with value: 0.8187227379841528.
[I 2025-04-07 05:08:59,532] Trial 162 finished with value: 0.8152849343040554 and parameters: {'n_estimators': 98, 'criterion': 'gini', 'max_depth': 50, 'min_samples_split': 9, 'min_samples_leaf': 1}. Best is trial 158 with value: 0.8187227379841528.
[I 2025-04-07 05:09:12,137] Trial 166 finished with value: 0.8157880789581433 and parameters: {'n_estimators': 113, 'criterion': 'gini', 'max_depth': 53, 'min_samples_split': 11, 'min_samples_leaf': 1}. Best is trial 158 with value: 0.8187227379841528.
[I 2025-04-07 05:09:23,741] Trial 170 finished with value: 0.8161236493100038 and parameters: {'n_estimators': 105, 'criterion': 'gini', 'max_depth': 53, 'min_samples_split': 10, 'min_samples_leaf': 2}. Best is trial 158 with value: 0.8187227379841528.
[I 2025-04-07 05:09:35,219] Trial 174 finished with value: 0.8161236493100038 and parameters: {'n_estimators': 105, 'criterion': 'gini', 'max_depth': 55, 'min_samples_split': 10, 'min_samples_leaf': 2}. Best is trial 158 with value: 0.8187227379841528.
[I 2025-04-07 05:09:46,939] Trial 178 finished with value: 0.8158298143784235 and parameters: {'n_estimators': 110, 'criterion': 'gini', 'max_depth': 49, 'min_samples_split': 9, 'min_samples_leaf': 1}. Best is trial 158 with value: 0.8187227379841528.
[I 2025-04-07 05:09:57,865] Trial 183 finished with value: 0.8162072607330322 and parameters: {'n_estimators': 92, 'criterion': 'gini', 'max_depth': 52, 'min_samples_split': 12, 'min_samples_leaf': 1}. Best is trial 158 with value: 0.8187227379841528.
[I 2025-04-07 05:10:10,570] Trial 186 finished with value: 0.815871989118917 and parameters: {'n_estimators': 113, 'criterion': 'gini', 'max_depth': 53, 'min_samples_split': 10, 'min_samples_leaf': 2}. Best is trial 158 with value: 0.8187227379841528.
[I 2025-04-07 05:10:20,640] Trial 190 finished with value: 0.816249417900717 and parameters: {'n_estimators': 87, 'criterion': 'gini', 'max_depth': 51, 'min_samples_split': 11, 'min_samples_leaf': 2}. Best is trial 158 with value: 0.8187227379841528.
[I 2025-04-07 05:10:33,931] Trial 194 finished with value: 0.8181776821816994 and parameters: {'n_estimators': 118, 'criterion': 'gini', 'max_depth': 49, 'min_samples_split': 10, 'min_samples_leaf': 1}. Best is trial 158 with value: 0.8187227379841528.
[I 2025-04-07 05:10:48,948] Trial 198 finished with value: 0.8181776821816994 and parameters: {'n_estimators': 118, 'criterion': 'gini', 'max_depth': 49, 'min_samples_split': 10, 'min_samples_leaf': 1}. Best is trial 158 with value: 0.8187227379841528.
[I 2025-04-07 05:10:59,381] Trial 204 finished with value: 0.8180938247393513 and parameters: {'n_estimators': 77, 'criterion': 'gini', 'max_depth': 49, 'min_samples_split': 10, 'min_samples_leaf': 1}. Best is trial 158 with value: 0.8187227379841528.
[I 2025-04-07 05:11:08,185] Trial 208 finished with value: 0.8149077163959575 and parameters: {'n_estimators': 66, 'criterion': 'gini', 'max_depth': 50, 'min_samples_split': 9, 'min_samples_leaf': 1}. Best is trial 158 with value: 0.8187227379841528.
[I 2025-04-07 05:11:18,569] Trial 211 finished with value: 0.8161654725943265 and parameters: {'n_estimators': 78, 'criterion': 'gini', 'max_depth': 50, 'min_samples_split': 11, 'min_samples_leaf': 2}. Best is trial 158 with value: 0.8187227379841528.
[I 2025-04-07 05:11:32,713] Trial 215 finished with value: 0.8182196811941076 and parameters: {'n_estimators': 118, 'criterion': 'gini', 'max_depth': 45, 'min_samples_split': 10, 'min_samples_leaf': 1}. Best is trial 158 with value: 0.8187227379841528.
[I 2025-04-07 05:11:47,100] Trial 219 finished with value: 0.8181776821816994 and parameters: {'n_estimators': 118, 'criterion': 'gini', 'max_depth': 54, 'min_samples_split': 10, 'min_samples_leaf': 1}. Best is trial 158 with value: 0.8187227379841528.
[I 2025-04-07 05:12:03,091] Trial 223 finished with value: 0.8149915035470714 and parameters: {'n_estimators': 119, 'criterion': 'gini', 'max_depth': 44, 'min_samples_split': 9, 'min_samples_leaf': 1}. Best is trial 158 with value: 0.8187227379841528.
[I 2025-04-07 05:12:18,845] Trial 227 finished with value: 0.8178842514247154 and parameters: {'n_estimators': 122, 'criterion': 'gini', 'max_depth': 44, 'min_samples_split': 10, 'min_samples_leaf': 1}. Best is trial 158 with value: 0.8187227379841528.
[I 2025-04-07 05:12:32,854] Trial 231 finished with value: 0.8159139705585167 and parameters: {'n_estimators': 110, 'criterion': 'gini', 'max_depth': 54, 'min_samples_split': 10, 'min_samples_leaf': 2}. Best is trial 158 with value: 0.8187227379841528.
[I 2025-04-07 05:12:47,624] Trial 235 finished with value: 0.8159558289884565 and parameters: {'n_estimators': 115, 'criterion': 'gini', 'max_depth': 52, 'min_samples_split': 11, 'min_samples_leaf': 1}. Best is trial 158 with value: 0.8187227379841528.
[I 2025-04-07 05:13:02,800] Trial 239 finished with value: 0.817968091294255 and parameters: {'n_estimators': 125, 'criterion': 'gini', 'max_depth': 56, 'min_samples_split': 10, 'min_samples_leaf': 1}. Best is trial 158 with value: 0.8187227379841528.
[I 2025-04-07 05:13:15,023] Trial 244 finished with value: 0.8183034507724127 and parameters: {'n_estimators': 112, 'criterion': 'gini', 'max_depth': 52, 'min_samples_split': 10, 'min_samples_leaf': 1}. Best is trial 158 with value: 0.8187227379841528.
[I 2025-04-07 05:13:26,629] Trial 248 finished with value: 0.8186807741173618 and parameters: {'n_estimators': 107, 'criterion': 'gini', 'max_depth': 53, 'min_samples_split': 10, 'min_samples_leaf': 1}. Best is trial 158 with value: 0.8187227379841528.
[I 2025-04-07 05:13:38,346] Trial 251 finished with value: 0.8160397040036129 and parameters: {'n_estimators': 105, 'criterion': 'gini', 'max_depth': 53, 'min_samples_split': 11, 'min_samples_leaf': 1}. Best is trial 158 with value: 0.8187227379841528.
[I 2025-04-07 05:13:50,655] Trial 255 finished with value: 0.8159558641340736 and parameters: {'n_estimators': 109, 'criterion': 'gini', 'max_depth': 55, 'min_samples_split': 9, 'min_samples_leaf': 2}. Best is trial 158 with value: 0.8187227379841528.
[I 2025-04-07 05:14:02,527] Trial 260 finished with value: 0.8183873082147608 and parameters: {'n_estimators': 112, 'criterion': 'gini', 'max_depth': 51, 'min_samples_split': 10, 'min_samples_leaf': 1}. Best is trial 158 with value: 0.8187227379841528.
[I 2025-04-07 05:14:09,738] Trial 264 finished with value: 0.8168361388322165 and parameters: {'n_estimators': 57, 'criterion': 'gini', 'max_depth': 51, 'min_samples_split': 10, 'min_samples_leaf': 1}. Best is trial 158 with value: 0.8187227379841528.
[I 2025-04-07 05:14:20,837] Trial 266 finished with value: 0.8182615571968558 and parameters: {'n_estimators': 101, 'criterion': 'gini', 'max_depth': 51, 'min_samples_split': 10, 'min_samples_leaf': 1}. Best is trial 158 with value: 0.8187227379841528.
[I 2025-04-07 05:14:33,037] Trial 270 finished with value: 0.8161653320118581 and parameters: {'n_estimators': 114, 'criterion': 'gini', 'max_depth': 53, 'min_samples_split': 11, 'min_samples_leaf': 2}. Best is trial 158 with value: 0.8187227379841528.
[I 2025-04-07 05:14:44,536] Trial 274 finished with value: 0.8154109137684712 and parameters: {'n_estimators': 107, 'criterion': 'gini', 'max_depth': 53, 'min_samples_split': 9, 'min_samples_leaf': 2}. Best is trial 158 with value: 0.8187227379841528.
[I 2025-04-07 05:14:50,488] Trial 278 finished with value: 0.8161653320118581 and parameters: {'n_estimators': 48, 'criterion': 'gini', 'max_depth': 57, 'min_samples_split': 10, 'min_samples_leaf': 1}. Best is trial 276 with value: 0.8188065954265008.
[I 2025-04-07 05:15:09,851] Trial 282 finished with value: 0.8162912411850399 and parameters: {'n_estimators': 181, 'criterion': 'gini', 'max_depth': 51, 'min_samples_split': 11, 'min_samples_leaf': 1}. Best is trial 276 with value: 0.8188065954265008.
[I 2025-04-07 05:15:21,161] Trial 287 finished with value: 0.8182615923424729 and parameters: {'n_estimators': 103, 'criterion': 'gini', 'max_depth': 56, 'min_samples_split': 10, 'min_samples_leaf': 1}. Best is trial 276 with value: 0.8188065954265008.
[I 2025-04-07 05:15:32,711] Trial 291 finished with value: 0.8163750810545792 and parameters: {'n_estimators': 109, 'criterion': 'gini', 'max_depth': 54, 'min_samples_split': 10, 'min_samples_leaf': 2}. Best is trial 276 with value: 0.8188065954265008.
[I 2025-04-07 05:15:45,388] Trial 295 finished with value: 0.815997581981545 and parameters: {'n_estimators': 112, 'criterion': 'gini', 'max_depth': 52, 'min_samples_split': 9, 'min_samples_leaf': 1}. Best is trial 276 with value: 0.8188065954265008.
[I 2025-04-07 05:15:56,066] Trial 299 finished with value: 0.818219698766916 and parameters: {'n_estimators': 96, 'criterion': 'gini', 'max_depth': 50, 'min_samples_split': 10, 'min_samples_leaf': 1}. Best is trial 276 with value: 0.8188065954265008.
[I 2025-04-07 05:16:07,908] Trial 303 finished with value: 0.8181358237517594 and parameters: {'n_estimators': 115, 'criterion': 'gini', 'max_depth': 50, 'min_samples_split': 10, 'min_samples_leaf': 1}. Best is trial 276 with value: 0.8188065954265008.
[I 2025-04-07 05:16:11,667] Trial 307 finished with value: 0.8139014622333984 and parameters: {'n_estimators': 25, 'criterion': 'gini', 'max_depth': 53, 'min_samples_split': 11, 'min_samples_leaf': 2}. Best is trial 276 with value: 0.8188065954265008.
[I 2025-04-07 05:16:23,202] Trial 311 finished with value: 0.7960423047792768 and parameters: {'n_estimators': 110, 'criterion': 'gini', 'max_depth': 8, 'min_samples_split': 10, 'min_samples_leaf': 1}. Best is trial 276 with value: 0.8188065954265008.
[I 2025-04-07 05:16:34,225] Trial 315 finished with value: 0.8185550055266484 and parameters: {'n_estimators': 100, 'criterion': 'gini', 'max_depth': 56, 'min_samples_split': 10, 'min_samples_leaf': 1}. Best is trial 276 with value: 0.8188065954265008.
[I 2025-04-07 05:16:47,165] Trial 319 finished with value: 0.8155783299154221 and parameters: {'n_estimators': 116, 'criterion': 'gini', 'max_depth': 57, 'min_samples_split': 9, 'min_samples_leaf': 1}. Best is trial 276 with value: 0.8188065954265008.
[I 2025-04-07 05:16:58,460] Trial 323 finished with value: 0.8158720594101512 and parameters: {'n_estimators': 107, 'criterion': 'gini', 'max_depth': 58, 'min_samples_split': 10, 'min_samples_leaf': 2}. Best is trial 276 with value: 0.8188065954265008.
[I 2025-04-07 05:17:10,088] Trial 327 finished with value: 0.8102960842510732 and parameters: {'n_estimators': 98, 'criterion': 'gini', 'max_depth': 55, 'min_samples_split': 11, 'min_samples_leaf': 18}. Best is trial 276 with value: 0.8188065954265008.
[I 2025-04-07 05:17:23,588] Trial 331 finished with value: 0.8166266182360061 and parameters: {'n_estimators': 103, 'criterion': 'gini', 'max_depth': 59, 'min_samples_split': 12, 'min_samples_leaf': 1}. Best is trial 276 with value: 0.8188065954265008.
[I 2025-04-07 05:17:38,172] Trial 335 finished with value: 0.8124343963125218 and parameters: {'n_estimators': 122, 'criterion': 'gini', 'max_depth': 53, 'min_samples_split': 10, 'min_samples_leaf': 13}. Best is trial 276 with value: 0.8188065954265008.
[I 2025-04-07 05:17:52,951] Trial 339 finished with value: 0.8158298143784235 and parameters: {'n_estimators': 110, 'criterion': 'gini', 'max_depth': 52, 'min_samples_split': 9, 'min_samples_leaf': 1}. Best is trial 276 with value: 0.8188065954265008.
[I 2025-04-07 05:18:07,858] Trial 343 finished with value: 0.81654274322085 and parameters: {'n_estimators': 116, 'criterion': 'gini', 'max_depth': 55, 'min_samples_split': 11, 'min_samples_leaf': 2}. Best is trial 276 with value: 0.8188065954265008.
