[I 2025-04-07 05:55:34,917] Trial 1048 finished with value: 0.81805198388222 and parameters: {'n_estimators': 91, 'criterion': 'gini', 'max_depth': 57, 'min_samples_split': 10, 'min_samples_leaf': 1}. Best is trial 276 with value: 0.8188065954265008.
[I 2025-04-07 05:55:46,110] Trial 1051 finished with value: 0.8157881668221861 and parameters: {'n_estimators': 100, 'criterion': 'gini', 'max_depth': 55, 'min_samples_split': 10, 'min_samples_leaf': 3}. Best is trial 276 with value: 0.8188065954265008.
[I 2025-04-07 05:56:00,857] Trial 1055 finished with value: 0.8167942276838511 and parameters: {'n_estimators': 117, 'criterion': 'gini', 'max_depth': 55, 'min_samples_split': 11, 'min_samples_leaf': 2}. Best is trial 276 with value: 0.8188065954265008.
[I 2025-04-07 05:56:15,197] Trial 1060 finished with value: 0.8184712183755345 and parameters: {'n_estimators': 113, 'criterion': 'gini', 'max_depth': 54, 'min_samples_split': 10, 'min_samples_leaf': 1}. Best is trial 276 with value: 0.8188065954265008.
[I 2025-04-07 05:56:26,011] Trial 1064 finished with value: 0.8149495748258975 and parameters: {'n_estimators': 95, 'criterion': 'gini', 'max_depth': 56, 'min_samples_split': 9, 'min_samples_leaf': 1}. Best is trial 276 with value: 0.8188065954265008.
[I 2025-04-07 05:56:37,183] Trial 1067 finished with value: 0.8155364363398651 and parameters: {'n_estimators': 109, 'criterion': 'gini', 'max_depth': 54, 'min_samples_split': 9, 'min_samples_leaf': 1}. Best is trial 276 with value: 0.8188065954265008.
[I 2025-04-07 05:56:47,870] Trial 1071 finished with value: 0.816249417900717 and parameters: {'n_estimators': 103, 'criterion': 'gini', 'max_depth': 61, 'min_samples_split': 10, 'min_samples_leaf': 2}. Best is trial 276 with value: 0.8188065954265008.
[I 2025-04-07 05:56:59,606] Trial 1076 finished with value: 0.8186807741173618 and parameters: {'n_estimators': 107, 'criterion': 'gini', 'max_depth': 56, 'min_samples_split': 10, 'min_samples_leaf': 1}. Best is trial 276 with value: 0.8188065954265008.
[I 2025-04-07 05:57:12,436] Trial 1081 finished with value: 0.8159138651216653 and parameters: {'n_estimators': 108, 'criterion': 'entropy', 'max_depth': 53, 'min_samples_split': 9, 'min_samples_leaf': 1}. Best is trial 276 with value: 0.8188065954265008.
[I 2025-04-07 05:57:23,391] Trial 1085 finished with value: 0.8161236493100038 and parameters: {'n_estimators': 105, 'criterion': 'gini', 'max_depth': 54, 'min_samples_split': 10, 'min_samples_leaf': 2}. Best is trial 276 with value: 0.8188065954265008.
[I 2025-04-07 05:57:33,576] Trial 1089 finished with value: 0.8166686348212229 and parameters: {'n_estimators': 93, 'criterion': 'gini', 'max_depth': 29, 'min_samples_split': 10, 'min_samples_leaf': 1}. Best is trial 276 with value: 0.8188065954265008.
[I 2025-04-07 05:57:45,982] Trial 1092 finished with value: 0.8135662609105175 and parameters: {'n_estimators': 112, 'criterion': 'gini', 'max_depth': 58, 'min_samples_split': 11, 'min_samples_leaf': 10}. Best is trial 276 with value: 0.8188065954265008.
[I 2025-04-07 05:57:57,606] Trial 1096 finished with value: 0.8182616274880902 and parameters: {'n_estimators': 98, 'criterion': 'gini', 'max_depth': 57, 'min_samples_split': 10, 'min_samples_leaf': 1}. Best is trial 276 with value: 0.8188065954265008.
[I 2025-04-07 05:58:09,032] Trial 1100 finished with value: 0.815914146286602 and parameters: {'n_estimators': 102, 'criterion': 'gini', 'max_depth': 53, 'min_samples_split': 10, 'min_samples_leaf': 2}. Best is trial 276 with value: 0.8188065954265008.
[I 2025-04-07 05:58:20,722] Trial 1104 finished with value: 0.815704116078944 and parameters: {'n_estimators': 108, 'criterion': 'gini', 'max_depth': 63, 'min_samples_split': 9, 'min_samples_leaf': 1}. Best is trial 276 with value: 0.8188065954265008.
[I 2025-04-07 05:58:31,314] Trial 1108 finished with value: 0.8180519487366029 and parameters: {'n_estimators': 95, 'criterion': 'gini', 'max_depth': 63, 'min_samples_split': 10, 'min_samples_leaf': 1}. Best is trial 276 with value: 0.8188065954265008.
[I 2025-04-07 05:58:42,038] Trial 1111 finished with value: 0.8159976522727792 and parameters: {'n_estimators': 96, 'criterion': 'gini', 'max_depth': 62, 'min_samples_split': 11, 'min_samples_leaf': 1}. Best is trial 276 with value: 0.8188065954265008.
[I 2025-04-07 05:58:53,877] Trial 1115 finished with value: 0.8162493651822915 and parameters: {'n_estimators': 106, 'criterion': 'gini', 'max_depth': 64, 'min_samples_split': 10, 'min_samples_leaf': 2}. Best is trial 276 with value: 0.8188065954265008.
[I 2025-04-07 05:59:04,773] Trial 1119 finished with value: 0.8185970396846735 and parameters: {'n_estimators': 97, 'criterion': 'gini', 'max_depth': 62, 'min_samples_split': 10, 'min_samples_leaf': 1}. Best is trial 276 with value: 0.8188065954265008.
[I 2025-04-07 05:59:15,395] Trial 1123 finished with value: 0.8163330820421713 and parameters: {'n_estimators': 91, 'criterion': 'gini', 'max_depth': 63, 'min_samples_split': 11, 'min_samples_leaf': 1}. Best is trial 276 with value: 0.8188065954265008.
[I 2025-04-07 05:59:26,111] Trial 1125 finished with value: 0.8155363836214395 and parameters: {'n_estimators': 102, 'criterion': 'gini', 'max_depth': 63, 'min_samples_split': 9, 'min_samples_leaf': 1}. Best is trial 276 with value: 0.8188065954265008.
[I 2025-04-07 05:59:37,877] Trial 1130 finished with value: 0.8164169219117106 and parameters: {'n_estimators': 110, 'criterion': 'gini', 'max_depth': 62, 'min_samples_split': 11, 'min_samples_leaf': 1}. Best is trial 276 with value: 0.8188065954265008.
[I 2025-04-07 05:59:52,268] Trial 1134 finished with value: 0.8176325736608202 and parameters: {'n_estimators': 136, 'criterion': 'gini', 'max_depth': 61, 'min_samples_split': 13, 'min_samples_leaf': 2}. Best is trial 276 with value: 0.8188065954265008.
訓練集準確率: 0.9335094118140276
測試集準確率: 0.8105298457411133
10-fold CV 準確率:  0.8188065954265008

