[I 2025-04-07 04:59:49,318] A new study created in RDB with name: random-forest
[I 2025-04-07 05:00:09,599] Trial 0 finished with value: 0.8124762020240361 and parameters: {'n_estimators': 172, 'criterion': 'gini', 'max_depth': 57, 'min_samples_split': 16, 'min_samples_leaf': 13}. Best is trial 3 with value: 0.8163331699062137.
[I 2025-04-07 05:00:20,280] Trial 6 finished with value: 0.8151173775746361 and parameters: {'n_estimators': 92, 'criterion': 'entropy', 'max_depth': 34, 'min_samples_split': 16, 'min_samples_leaf': 7}. Best is trial 3 with value: 0.8163331699062137.
[I 2025-04-07 05:00:30,163] Trial 12 finished with value: 0.7601967451644025 and parameters: {'n_estimators': 85, 'criterion': 'gini', 'max_depth': 3, 'min_samples_split': 14, 'min_samples_leaf': 1}. Best is trial 3 with value: 0.8163331699062137.
[I 2025-04-07 05:00:52,918] Trial 14 finished with value: 0.8105479201702452 and parameters: {'n_estimators': 198, 'criterion': 'gini', 'max_depth': 64, 'min_samples_split': 7, 'min_samples_leaf': 20}. Best is trial 3 with value: 0.8163331699062137.
[I 2025-04-07 05:00:59,580] Trial 19 finished with value: 0.8102122970999593 and parameters: {'n_estimators': 52, 'criterion': 'entropy', 'max_depth': 49, 'min_samples_split': 20, 'min_samples_leaf': 15}. Best is trial 3 with value: 0.8163331699062137.
[I 2025-04-07 05:01:10,569] Trial 22 finished with value: 0.8174649466401668 and parameters: {'n_estimators': 80, 'criterion': 'entropy', 'max_depth': 54, 'min_samples_split': 4, 'min_samples_leaf': 3}. Best is trial 22 with value: 0.8174649466401668.
[I 2025-04-07 05:01:22,519] Trial 25 finished with value: 0.8171714631647575 and parameters: {'n_estimators': 83, 'criterion': 'entropy', 'max_depth': 54, 'min_samples_split': 11, 'min_samples_leaf': 3}. Best is trial 22 with value: 0.8174649466401668.
[I 2025-04-07 05:01:34,379] Trial 29 finished with value: 0.8171714631647575 and parameters: {'n_estimators': 84, 'criterion': 'entropy', 'max_depth': 56, 'min_samples_split': 10, 'min_samples_leaf': 3}. Best is trial 28 with value: 0.8177586234164703.
[I 2025-04-07 05:01:39,889] Trial 33 finished with value: 0.8132307608498914 and parameters: {'n_estimators': 34, 'criterion': 'entropy', 'max_depth': 43, 'min_samples_split': 11, 'min_samples_leaf': 10}. Best is trial 28 with value: 0.8177586234164703.
[I 2025-04-07 05:01:53,769] Trial 36 finished with value: 0.8162494881919514 and parameters: {'n_estimators': 101, 'criterion': 'entropy', 'max_depth': 59, 'min_samples_split': 9, 'min_samples_leaf': 6}. Best is trial 28 with value: 0.8177586234164703.
[I 2025-04-07 05:02:06,810] Trial 40 finished with value: 0.8140693879917971 and parameters: {'n_estimators': 98, 'criterion': 'gini', 'max_depth': 53, 'min_samples_split': 8, 'min_samples_leaf': 5}. Best is trial 28 with value: 0.8177586234164703.
[I 2025-04-07 05:02:18,630] Trial 44 finished with value: 0.8153688971832546 and parameters: {'n_estimators': 91, 'criterion': 'entropy', 'max_depth': 46, 'min_samples_split': 15, 'min_samples_leaf': 3}. Best is trial 28 with value: 0.8177586234164703.
[I 2025-04-07 05:02:27,328] Trial 48 finished with value: 0.8170038185712956 and parameters: {'n_estimators': 60, 'criterion': 'gini', 'max_depth': 39, 'min_samples_split': 7, 'min_samples_leaf': 2}. Best is trial 28 with value: 0.8177586234164703.
[I 2025-04-07 05:02:37,642] Trial 50 finished with value: 0.8155784704978902 and parameters: {'n_estimators': 80, 'criterion': 'gini', 'max_depth': 51, 'min_samples_split': 13, 'min_samples_leaf': 3}. Best is trial 28 with value: 0.8177586234164703.
[I 2025-04-07 05:02:55,760] Trial 54 finished with value: 0.8136081896316915 and parameters: {'n_estimators': 147, 'criterion': 'gini', 'max_depth': 29, 'min_samples_split': 17, 'min_samples_leaf': 8}. Best is trial 28 with value: 0.8177586234164703.
[I 2025-04-07 05:03:10,966] Trial 58 finished with value: 0.815871989118917 and parameters: {'n_estimators': 113, 'criterion': 'gini', 'max_depth': 55, 'min_samples_split': 10, 'min_samples_leaf': 2}. Best is trial 28 with value: 0.8177586234164703.
[I 2025-04-07 05:03:25,504] Trial 62 finished with value: 0.8178842689975239 and parameters: {'n_estimators': 111, 'criterion': 'entropy', 'max_depth': 61, 'min_samples_split': 6, 'min_samples_leaf': 4}. Best is trial 59 with value: 0.8183034683452213.
[I 2025-04-07 05:03:41,840] Trial 66 finished with value: 0.8175070510894262 and parameters: {'n_estimators': 129, 'criterion': 'gini', 'max_depth': 62, 'min_samples_split': 3, 'min_samples_leaf': 1}. Best is trial 59 with value: 0.8183034683452213.
[I 2025-04-07 05:03:53,343] Trial 70 finished with value: 0.8175906273668376 and parameters: {'n_estimators': 107, 'criterion': 'gini', 'max_depth': 62, 'min_samples_split': 3, 'min_samples_leaf': 1}. Best is trial 59 with value: 0.8183034683452213.
[I 2025-04-07 05:04:07,200] Trial 74 finished with value: 0.8170878341689203 and parameters: {'n_estimators': 108, 'criterion': 'gini', 'max_depth': 39, 'min_samples_split': 2, 'min_samples_leaf': 2}. Best is trial 59 with value: 0.8183034683452213.
[I 2025-04-07 05:04:25,281] Trial 78 finished with value: 0.8168362091234508 and parameters: {'n_estimators': 136, 'criterion': 'gini', 'max_depth': 35, 'min_samples_split': 4, 'min_samples_leaf': 1}. Best is trial 59 with value: 0.8183034683452213.
[I 2025-04-07 05:04:41,519] Trial 82 finished with value: 0.8166685996756058 and parameters: {'n_estimators': 121, 'criterion': 'gini', 'max_depth': 59, 'min_samples_split': 5, 'min_samples_leaf': 1}. Best is trial 59 with value: 0.8183034683452213.
[I 2025-04-07 05:04:57,788] Trial 87 finished with value: 0.816375133773005 and parameters: {'n_estimators': 124, 'criterion': 'gini', 'max_depth': 64, 'min_samples_split': 3, 'min_samples_leaf': 3}. Best is trial 59 with value: 0.8183034683452213.
[I 2025-04-07 05:05:12,917] Trial 91 finished with value: 0.81541080833162 and parameters: {'n_estimators': 116, 'criterion': 'gini', 'max_depth': 23, 'min_samples_split': 2, 'min_samples_leaf': 3}. Best is trial 59 with value: 0.8183034683452213.
[I 2025-04-07 05:05:31,262] Trial 95 finished with value: 0.817255373325531 and parameters: {'n_estimators': 144, 'criterion': 'gini', 'max_depth': 57, 'min_samples_split': 5, 'min_samples_leaf': 2}. Best is trial 59 with value: 0.8183034683452213.
[I 2025-04-07 05:05:43,940] Trial 99 finished with value: 0.8154947360652022 and parameters: {'n_estimators': 96, 'criterion': 'gini', 'max_depth': 62, 'min_samples_split': 7, 'min_samples_leaf': 1}. Best is trial 59 with value: 0.8183034683452213.
[I 2025-04-07 05:05:59,502] Trial 102 finished with value: 0.8172974426291735 and parameters: {'n_estimators': 134, 'criterion': 'gini', 'max_depth': 51, 'min_samples_split': 4, 'min_samples_leaf': 1}. Best is trial 59 with value: 0.8183034683452213.
[I 2025-04-07 05:06:11,041] Trial 106 finished with value: 0.816794350693511 and parameters: {'n_estimators': 106, 'criterion': 'gini', 'max_depth': 62, 'min_samples_split': 3, 'min_samples_leaf': 2}. Best is trial 59 with value: 0.8183034683452213.
[I 2025-04-07 05:06:21,825] Trial 110 finished with value: 0.816123561445961 and parameters: {'n_estimators': 111, 'criterion': 'gini', 'max_depth': 63, 'min_samples_split': 9, 'min_samples_leaf': 2}. Best is trial 59 with value: 0.8183034683452213.
[I 2025-04-07 05:06:34,534] Trial 115 finished with value: 0.817674660537271 and parameters: {'n_estimators': 119, 'criterion': 'gini', 'max_depth': 61, 'min_samples_split': 10, 'min_samples_leaf': 1}. Best is trial 59 with value: 0.8183034683452213.
[I 2025-04-07 05:06:48,951] Trial 119 finished with value: 0.8178842689975239 and parameters: {'n_estimators': 129, 'criterion': 'gini', 'max_depth': 53, 'min_samples_split': 10, 'min_samples_leaf': 1}. Best is trial 59 with value: 0.8183034683452213.
[I 2025-04-07 05:07:03,421] Trial 123 finished with value: 0.81692017200265 and parameters: {'n_estimators': 129, 'criterion': 'entropy', 'max_depth': 41, 'min_samples_split': 11, 'min_samples_leaf': 2}. Best is trial 59 with value: 0.8183034683452213.
[I 2025-04-07 05:07:17,641] Trial 127 finished with value: 0.8177165365400194 and parameters: {'n_estimators': 133, 'criterion': 'gini', 'max_depth': 47, 'min_samples_split': 10, 'min_samples_leaf': 1}. Best is trial 59 with value: 0.8183034683452213.
[I 2025-04-07 05:07:27,312] Trial 132 finished with value: 0.8165007969268672 and parameters: {'n_estimators': 90, 'criterion': 'gini', 'max_depth': 49, 'min_samples_split': 9, 'min_samples_leaf': 3}. Best is trial 59 with value: 0.8183034683452213.
[I 2025-04-07 05:07:39,823] Trial 136 finished with value: 0.8181358237517594 and parameters: {'n_estimators': 115, 'criterion': 'gini', 'max_depth': 50, 'min_samples_split': 10, 'min_samples_leaf': 1}. Best is trial 59 with value: 0.8183034683452213.
[I 2025-04-07 05:07:50,429] Trial 140 finished with value: 0.8182615220512389 and parameters: {'n_estimators': 102, 'criterion': 'gini', 'max_depth': 50, 'min_samples_split': 10, 'min_samples_leaf': 1}. Best is trial 59 with value: 0.8183034683452213.
[I 2025-04-07 05:08:02,231] Trial 144 finished with value: 0.8158720242645341 and parameters: {'n_estimators': 116, 'criterion': 'gini', 'max_depth': 52, 'min_samples_split': 10, 'min_samples_leaf': 7}. Best is trial 59 with value: 0.8183034683452213.
[I 2025-04-07 05:08:14,723] Trial 148 finished with value: 0.8164169219117106 and parameters: {'n_estimators': 110, 'criterion': 'gini', 'max_depth': 49, 'min_samples_split': 11, 'min_samples_leaf': 1}. Best is trial 146 with value: 0.8185131119510913.
[I 2025-04-07 05:08:26,901] Trial 152 finished with value: 0.815704116078944 and parameters: {'n_estimators': 108, 'criterion': 'gini', 'max_depth': 54, 'min_samples_split': 9, 'min_samples_leaf': 1}. Best is trial 146 with value: 0.8185131119510913.
[I 2025-04-07 05:08:40,224] Trial 156 finished with value: 0.8167524219723369 and parameters: {'n_estimators': 123, 'criterion': 'gini', 'max_depth': 46, 'min_samples_split': 10, 'min_samples_leaf': 2}. Best is trial 146 with value: 0.8185131119510913.
[I 2025-04-07 05:08:51,788] Trial 160 finished with value: 0.8150333268313942 and parameters: {'n_estimators': 100, 'criterion': 'gini', 'max_depth': 50, 'min_samples_split': 9, 'min_samples_leaf': 1}. Best is trial 158 with value: 0.8187227379841528.
[I 2025-04-07 05:09:03,132] Trial 164 finished with value: 0.8164588506328847 and parameters: {'n_estimators': 99, 'criterion': 'gini', 'max_depth': 51, 'min_samples_split': 11, 'min_samples_leaf': 1}. Best is trial 158 with value: 0.8187227379841528.
[I 2025-04-07 05:09:15,507] Trial 168 finished with value: 0.8183034507724127 and parameters: {'n_estimators': 112, 'criterion': 'gini', 'max_depth': 54, 'min_samples_split': 10, 'min_samples_leaf': 1}. Best is trial 158 with value: 0.8187227379841528.
[I 2025-04-07 05:09:26,073] Trial 172 finished with value: 0.8167944385575536 and parameters: {'n_estimators': 84, 'criterion': 'entropy', 'max_depth': 55, 'min_samples_split': 10, 'min_samples_leaf': 2}. Best is trial 158 with value: 0.8187227379841528.
[I 2025-04-07 05:09:37,728] Trial 176 finished with value: 0.8154525788975171 and parameters: {'n_estimators': 104, 'criterion': 'gini', 'max_depth': 50, 'min_samples_split': 9, 'min_samples_leaf': 1}. Best is trial 158 with value: 0.8187227379841528.
[I 2025-04-07 05:09:48,173] Trial 180 finished with value: 0.8076132611442357 and parameters: {'n_estimators': 94, 'criterion': 'gini', 'max_depth': 12, 'min_samples_split': 9, 'min_samples_leaf': 1}. Best is trial 158 with value: 0.8187227379841528.
[I 2025-04-07 05:10:01,480] Trial 184 finished with value: 0.8181777173273164 and parameters: {'n_estimators': 116, 'criterion': 'gini', 'max_depth': 52, 'min_samples_split': 10, 'min_samples_leaf': 1}. Best is trial 158 with value: 0.8187227379841528.
[I 2025-04-07 05:10:13,508] Trial 188 finished with value: 0.8162074013155005 and parameters: {'n_estimators': 114, 'criterion': 'gini', 'max_depth': 51, 'min_samples_split': 10, 'min_samples_leaf': 2}. Best is trial 158 with value: 0.8187227379841528.
[I 2025-04-07 05:10:23,923] Trial 192 finished with value: 0.8159557411244137 and parameters: {'n_estimators': 89, 'criterion': 'gini', 'max_depth': 51, 'min_samples_split': 11, 'min_samples_leaf': 1}. Best is trial 158 with value: 0.8187227379841528.
[I 2025-04-07 05:10:36,350] Trial 196 finished with value: 0.8165847246604494 and parameters: {'n_estimators': 108, 'criterion': 'gini', 'max_depth': 49, 'min_samples_split': 19, 'min_samples_leaf': 1}. Best is trial 158 with value: 0.8187227379841528.
[I 2025-04-07 05:10:46,490] Trial 201 finished with value: 0.8181357534605253 and parameters: {'n_estimators': 77, 'criterion': 'gini', 'max_depth': 48, 'min_samples_split': 10, 'min_samples_leaf': 1}. Best is trial 158 with value: 0.8187227379841528.
[I 2025-04-07 05:10:56,634] Trial 202 finished with value: 0.8172553557527223 and parameters: {'n_estimators': 74, 'criterion': 'gini', 'max_depth': 48, 'min_samples_split': 10, 'min_samples_leaf': 1}. Best is trial 158 with value: 0.8187227379841528.
[I 2025-04-07 05:11:06,237] Trial 206 finished with value: 0.817171515883183 and parameters: {'n_estimators': 70, 'criterion': 'gini', 'max_depth': 49, 'min_samples_split': 10, 'min_samples_leaf': 1}. Best is trial 158 with value: 0.8187227379841528.
[I 2025-04-07 05:11:16,559] Trial 210 finished with value: 0.815997740136822 and parameters: {'n_estimators': 78, 'criterion': 'gini', 'max_depth': 50, 'min_samples_split': 9, 'min_samples_leaf': 2}. Best is trial 158 with value: 0.8187227379841528.
[I 2025-04-07 05:11:31,261] Trial 214 finished with value: 0.8182196109028734 and parameters: {'n_estimators': 118, 'criterion': 'gini', 'max_depth': 48, 'min_samples_split': 10, 'min_samples_leaf': 1}. Best is trial 158 with value: 0.8187227379841528.
[I 2025-04-07 05:11:45,265] Trial 218 finished with value: 0.8099609180738094 and parameters: {'n_estimators': 118, 'criterion': 'gini', 'max_depth': 52, 'min_samples_split': 10, 'min_samples_leaf': 20}. Best is trial 158 with value: 0.8187227379841528.
[I 2025-04-07 05:12:00,666] Trial 222 finished with value: 0.8149076812503404 and parameters: {'n_estimators': 119, 'criterion': 'gini', 'max_depth': 45, 'min_samples_split': 9, 'min_samples_leaf': 1}. Best is trial 158 with value: 0.8187227379841528.
[I 2025-04-07 05:12:16,073] Trial 226 finished with value: 0.818010055161046 and parameters: {'n_estimators': 120, 'criterion': 'gini', 'max_depth': 43, 'min_samples_split': 10, 'min_samples_leaf': 1}. Best is trial 158 with value: 0.8187227379841528.
[I 2025-04-07 05:12:30,807] Trial 230 finished with value: 0.8162074891795431 and parameters: {'n_estimators': 111, 'criterion': 'gini', 'max_depth': 54, 'min_samples_split': 10, 'min_samples_leaf': 2}. Best is trial 158 with value: 0.8187227379841528.
[I 2025-04-07 05:12:45,749] Trial 234 finished with value: 0.8184712183755345 and parameters: {'n_estimators': 114, 'criterion': 'gini', 'max_depth': 54, 'min_samples_split': 10, 'min_samples_leaf': 1}. Best is trial 158 with value: 0.8187227379841528.
[I 2025-04-07 05:13:00,354] Trial 238 finished with value: 0.8180938950305855 and parameters: {'n_estimators': 115, 'criterion': 'gini', 'max_depth': 56, 'min_samples_split': 10, 'min_samples_leaf': 1}. Best is trial 158 with value: 0.8187227379841528.
[I 2025-04-07 05:13:12,545] Trial 242 finished with value: 0.8170876408680264 and parameters: {'n_estimators': 107, 'criterion': 'gini', 'max_depth': 29, 'min_samples_split': 9, 'min_samples_leaf': 1}. Best is trial 158 with value: 0.8187227379841528.
[I 2025-04-07 05:13:25,297] Trial 246 finished with value: 0.8184712183755345 and parameters: {'n_estimators': 113, 'criterion': 'gini', 'max_depth': 53, 'min_samples_split': 10, 'min_samples_leaf': 1}. Best is trial 158 with value: 0.8187227379841528.
[I 2025-04-07 05:13:36,935] Trial 250 finished with value: 0.8160397040036129 and parameters: {'n_estimators': 105, 'criterion': 'gini', 'max_depth': 53, 'min_samples_split': 11, 'min_samples_leaf': 1}. Best is trial 158 with value: 0.8187227379841528.
[I 2025-04-07 05:13:48,541] Trial 254 finished with value: 0.815704116078944 and parameters: {'n_estimators': 108, 'criterion': 'gini', 'max_depth': 54, 'min_samples_split': 9, 'min_samples_leaf': 1}. Best is trial 158 with value: 0.8187227379841528.
[I 2025-04-07 05:13:59,342] Trial 258 finished with value: 0.7542020626962664 and parameters: {'n_estimators': 112, 'criterion': 'gini', 'max_depth': 2, 'min_samples_split': 10, 'min_samples_leaf': 2}. Best is trial 158 with value: 0.8187227379841528.
[I 2025-04-07 05:14:12,062] Trial 262 finished with value: 0.8184292896543605 and parameters: {'n_estimators': 113, 'criterion': 'gini', 'max_depth': 51, 'min_samples_split': 10, 'min_samples_leaf': 1}. Best is trial 158 with value: 0.8187227379841528.
[I 2025-04-07 05:14:23,466] Trial 268 finished with value: 0.8182615571968558 and parameters: {'n_estimators': 101, 'criterion': 'gini', 'max_depth': 51, 'min_samples_split': 10, 'min_samples_leaf': 1}. Best is trial 158 with value: 0.8187227379841528.
[I 2025-04-07 05:14:36,144] Trial 272 finished with value: 0.815788166822186 and parameters: {'n_estimators': 114, 'criterion': 'gini', 'max_depth': 53, 'min_samples_split': 9, 'min_samples_leaf': 2}. Best is trial 158 with value: 0.8187227379841528.
[I 2025-04-07 05:14:47,884] Trial 276 finished with value: 0.8188065954265008 and parameters: {'n_estimators': 108, 'criterion': 'gini', 'max_depth': 54, 'min_samples_split': 10, 'min_samples_leaf': 1}. Best is trial 276 with value: 0.8188065954265008.
[I 2025-04-07 05:14:58,525] Trial 280 finished with value: 0.8150754488534622 and parameters: {'n_estimators': 98, 'criterion': 'gini', 'max_depth': 56, 'min_samples_split': 10, 'min_samples_leaf': 7}. Best is trial 276 with value: 0.8188065954265008.
[I 2025-04-07 05:15:09,986] Trial 284 finished with value: 0.8163749756177282 and parameters: {'n_estimators': 104, 'criterion': 'gini', 'max_depth': 51, 'min_samples_split': 11, 'min_samples_leaf': 1}. Best is trial 276 with value: 0.8188065954265008.
[I 2025-04-07 05:15:22,015] Trial 288 finished with value: 0.8163750810545792 and parameters: {'n_estimators': 109, 'criterion': 'gini', 'max_depth': 55, 'min_samples_split': 10, 'min_samples_leaf': 2}. Best is trial 276 with value: 0.8188065954265008.
[I 2025-04-07 05:15:33,547] Trial 292 finished with value: 0.8113024438504836 and parameters: {'n_estimators': 109, 'criterion': 'gini', 'max_depth': 54, 'min_samples_split': 10, 'min_samples_leaf': 16}. Best is trial 276 with value: 0.8188065954265008.
[I 2025-04-07 05:15:46,411] Trial 296 finished with value: 0.815787938375675 and parameters: {'n_estimators': 114, 'criterion': 'gini', 'max_depth': 52, 'min_samples_split': 9, 'min_samples_leaf': 1}. Best is trial 276 with value: 0.8188065954265008.
[I 2025-04-07 05:15:57,612] Trial 301 finished with value: 0.8176747132556967 and parameters: {'n_estimators': 99, 'criterion': 'gini', 'max_depth': 50, 'min_samples_split': 8, 'min_samples_leaf': 1}. Best is trial 276 with value: 0.8188065954265008.
[I 2025-04-07 05:16:09,008] Trial 304 finished with value: 0.8162492070270148 and parameters: {'n_estimators': 105, 'criterion': 'gini', 'max_depth': 53, 'min_samples_split': 11, 'min_samples_leaf': 2}. Best is trial 276 with value: 0.8188065954265008.
[I 2025-04-07 05:16:20,194] Trial 308 finished with value: 0.8182615571968558 and parameters: {'n_estimators': 101, 'criterion': 'gini', 'max_depth': 50, 'min_samples_split': 10, 'min_samples_leaf': 1}. Best is trial 276 with value: 0.8188065954265008.
[I 2025-04-07 05:16:32,008] Trial 312 finished with value: 0.8145723393449913 and parameters: {'n_estimators': 111, 'criterion': 'gini', 'max_depth': 56, 'min_samples_split': 10, 'min_samples_leaf': 8}. Best is trial 276 with value: 0.8188065954265008.
[I 2025-04-07 05:16:44,419] Trial 317 finished with value: 0.8154525261790916 and parameters: {'n_estimators': 115, 'criterion': 'gini', 'max_depth': 54, 'min_samples_split': 9, 'min_samples_leaf': 1}. Best is trial 276 with value: 0.8188065954265008.
[I 2025-04-07 05:16:55,830] Trial 321 finished with value: 0.8186807741173618 and parameters: {'n_estimators': 107, 'criterion': 'gini', 'max_depth': 58, 'min_samples_split': 10, 'min_samples_leaf': 1}. Best is trial 276 with value: 0.8188065954265008.
[I 2025-04-07 05:17:08,148] Trial 325 finished with value: 0.8162072607330322 and parameters: {'n_estimators': 107, 'criterion': 'gini', 'max_depth': 57, 'min_samples_split': 11, 'min_samples_leaf': 2}. Best is trial 276 with value: 0.8188065954265008.
[I 2025-04-07 05:17:21,380] Trial 329 finished with value: 0.8166266182360061 and parameters: {'n_estimators': 103, 'criterion': 'gini', 'max_depth': 59, 'min_samples_split': 12, 'min_samples_leaf': 1}. Best is trial 276 with value: 0.8188065954265008.
[I 2025-04-07 05:17:36,819] Trial 333 finished with value: 0.8178422699851158 and parameters: {'n_estimators': 123, 'criterion': 'gini', 'max_depth': 53, 'min_samples_split': 10, 'min_samples_leaf': 1}. Best is trial 276 with value: 0.8188065954265008.
[I 2025-04-07 05:17:52,454] Trial 337 finished with value: 0.8185131119510913 and parameters: {'n_estimators': 111, 'criterion': 'gini', 'max_depth': 54, 'min_samples_split': 10, 'min_samples_leaf': 1}. Best is trial 276 with value: 0.8188065954265008.
[I 2025-04-07 05:18:06,948] Trial 342 finished with value: 0.8162072607330322 and parameters: {'n_estimators': 107, 'criterion': 'gini', 'max_depth': 55, 'min_samples_split': 11, 'min_samples_leaf': 2}. Best is trial 276 with value: 0.8188065954265008.
[I 2025-04-07 05:18:18,913] Trial 346 finished with value: 0.8161654023030923 and parameters: {'n_estimators': 92, 'criterion': 'gini', 'max_depth': 54, 'min_samples_split': 11, 'min_samples_leaf': 1}. Best is trial 276 with value: 0.8188065954265008.
