[I 2025-04-07 22:01:14,471] A new study created in RDB with name: random-forest-num_features-13
[I 2025-04-07 22:01:24,639] Trial 0 finished with value: 0.8188065075624582 and parameters: {'n_estimators': 108, 'criterion': 'gini', 'max_depth': 54, 'min_samples_split': 10, 'min_samples_leaf': 1}. Best is trial 0 with value: 0.8188065075624582.
[I 2025-04-07 22:01:29,647] Trial 1 finished with value: 0.8143211009013094 and parameters: {'n_estimators': 54, 'criterion': 'entropy', 'max_depth': 25, 'min_samples_split': 14, 'min_samples_leaf': 7}. Best is trial 0 with value: 0.8188065075624582.
[I 2025-04-07 22:01:35,368] Trial 2 finished with value: 0.7967551457576605 and parameters: {'n_estimators': 90, 'criterion': 'entropy', 'max_depth': 8, 'min_samples_split': 12, 'min_samples_leaf': 13}. Best is trial 0 with value: 0.8188065075624582.
[I 2025-04-07 22:01:41,563] Trial 3 finished with value: 0.8123086628674254 and parameters: {'n_estimators': 85, 'criterion': 'entropy', 'max_depth': 46, 'min_samples_split': 13, 'min_samples_leaf': 17}. Best is trial 0 with value: 0.8188065075624582.
[I 2025-04-07 22:01:55,434] Trial 4 finished with value: 0.8169621534422497 and parameters: {'n_estimators': 193, 'criterion': 'gini', 'max_depth': 22, 'min_samples_split': 10, 'min_samples_leaf': 1}. Best is trial 0 with value: 0.8188065075624582.
[I 2025-04-07 22:02:05,519] Trial 5 finished with value: 0.8170458175837038 and parameters: {'n_estimators': 117, 'criterion': 'gini', 'max_depth': 50, 'min_samples_split': 14, 'min_samples_leaf': 5}. Best is trial 0 with value: 0.8188065075624582.
[I 2025-04-07 22:02:20,158] Trial 6 finished with value: 0.811428282732431 and parameters: {'n_estimators': 181, 'criterion': 'gini', 'max_depth': 57, 'min_samples_split': 17, 'min_samples_leaf': 20}. Best is trial 0 with value: 0.8188065075624582.
[I 2025-04-07 22:02:24,452] Trial 7 finished with value: 0.8113862310015973 and parameters: {'n_estimators': 42, 'criterion': 'entropy', 'max_depth': 16, 'min_samples_split': 16, 'min_samples_leaf': 11}. Best is trial 0 with value: 0.8188065075624582.
[I 2025-04-07 22:02:35,146] Trial 8 finished with value: 0.8156204870831072 and parameters: {'n_estimators': 118, 'criterion': 'gini', 'max_depth': 62, 'min_samples_split': 7, 'min_samples_leaf': 4}. Best is trial 0 with value: 0.8188065075624582.
[I 2025-04-07 22:02:42,962] Trial 9 finished with value: 0.815830025252126 and parameters: {'n_estimators': 95, 'criterion': 'gini', 'max_depth': 48, 'min_samples_split': 9, 'min_samples_leaf': 9}. Best is trial 0 with value: 0.8188065075624582.
[I 2025-04-07 22:02:56,111] Trial 10 finished with value: 0.817842533577244 and parameters: {'n_estimators': 152, 'criterion': 'gini', 'max_depth': 35, 'min_samples_split': 4, 'min_samples_leaf': 1}. Best is trial 0 with value: 0.8188065075624582.
[I 2025-04-07 22:03:06,938] Trial 11 finished with value: 0.8170876584408351 and parameters: {'n_estimators': 154, 'criterion': 'gini', 'max_depth': 37, 'min_samples_split': 2, 'min_samples_leaf': 1}. Best is trial 0 with value: 0.8188065075624582.
[I 2025-04-07 22:03:17,544] Trial 12 finished with value: 0.8163751513458134 and parameters: {'n_estimators': 147, 'criterion': 'gini', 'max_depth': 36, 'min_samples_split': 4, 'min_samples_leaf': 4}. Best is trial 0 with value: 0.8188065075624582.
[I 2025-04-07 22:03:27,784] Trial 13 finished with value: 0.8169199435561391 and parameters: {'n_estimators': 150, 'criterion': 'gini', 'max_depth': 40, 'min_samples_split': 20, 'min_samples_leaf': 1}. Best is trial 0 with value: 0.8188065075624582.
[I 2025-04-07 22:03:37,031] Trial 14 finished with value: 0.8157461678097778 and parameters: {'n_estimators': 131, 'criterion': 'gini', 'max_depth': 31, 'min_samples_split': 6, 'min_samples_leaf': 6}. Best is trial 0 with value: 0.8188065075624582.
[I 2025-04-07 22:03:38,728] Trial 15 finished with value: 0.8120154429841442 and parameters: {'n_estimators': 14, 'criterion': 'gini', 'max_depth': 56, 'min_samples_split': 2, 'min_samples_leaf': 14}. Best is trial 0 with value: 0.8188065075624582.
[I 2025-04-07 22:03:48,214] Trial 16 finished with value: 0.7731096314806322 and parameters: {'n_estimators': 171, 'criterion': 'gini', 'max_depth': 4, 'min_samples_split': 8, 'min_samples_leaf': 3}. Best is trial 0 with value: 0.8188065075624582.
[I 2025-04-07 22:03:53,604] Trial 17 finished with value: 0.8143205737170531 and parameters: {'n_estimators': 70, 'criterion': 'gini', 'max_depth': 63, 'min_samples_split': 5, 'min_samples_leaf': 8}. Best is trial 0 with value: 0.8188065075624582.
[I 2025-04-07 22:04:03,904] Trial 18 finished with value: 0.8160816502975955 and parameters: {'n_estimators': 135, 'criterion': 'entropy', 'max_depth': 43, 'min_samples_split': 10, 'min_samples_leaf': 3}. Best is trial 0 with value: 0.8188065075624582.
[I 2025-04-07 22:04:18,503] Trial 19 finished with value: 0.814195367456213 and parameters: {'n_estimators': 167, 'criterion': 'gini', 'max_depth': 53, 'min_samples_split': 4, 'min_samples_leaf': 11}. Best is trial 0 with value: 0.8188065075624582.
[I 2025-04-07 22:04:29,978] Trial 20 finished with value: 0.8171295344435834 and parameters: {'n_estimators': 112, 'criterion': 'gini', 'max_depth': 28, 'min_samples_split': 7, 'min_samples_leaf': 2}. Best is trial 0 with value: 0.8188065075624582.
[I 2025-04-07 22:04:40,728] Trial 21 finished with value: 0.8172134973227825 and parameters: {'n_estimators': 111, 'criterion': 'gini', 'max_depth': 30, 'min_samples_split': 8, 'min_samples_leaf': 2}. Best is trial 0 with value: 0.8188065075624582.
[I 2025-04-07 22:04:49,997] Trial 22 finished with value: 0.8160817030160212 and parameters: {'n_estimators': 133, 'criterion': 'gini', 'max_depth': 19, 'min_samples_split': 11, 'min_samples_leaf': 5}. Best is trial 0 with value: 0.8188065075624582.
[I 2025-04-07 22:04:57,708] Trial 23 finished with value: 0.8124761493056105 and parameters: {'n_estimators': 101, 'criterion': 'gini', 'max_depth': 14, 'min_samples_split': 8, 'min_samples_leaf': 3}. Best is trial 0 with value: 0.8188065075624582.
[I 2025-04-07 22:05:04,262] Trial 24 finished with value: 0.8171716213200343 and parameters: {'n_estimators': 66, 'criterion': 'gini', 'max_depth': 32, 'min_samples_split': 4, 'min_samples_leaf': 1}. Best is trial 0 with value: 0.8188065075624582.
[I 2025-04-07 22:05:14,438] Trial 25 finished with value: 0.8159137772576226 and parameters: {'n_estimators': 126, 'criterion': 'gini', 'max_depth': 41, 'min_samples_split': 6, 'min_samples_leaf': 6}. Best is trial 0 with value: 0.8188065075624582.
[I 2025-04-07 22:05:29,588] Trial 26 finished with value: 0.8173814406539897 and parameters: {'n_estimators': 199, 'criterion': 'entropy', 'max_depth': 27, 'min_samples_split': 9, 'min_samples_leaf': 3}. Best is trial 0 with value: 0.8188065075624582.
[I 2025-04-07 22:05:46,904] Trial 27 finished with value: 0.8154947360652021 and parameters: {'n_estimators': 200, 'criterion': 'entropy', 'max_depth': 24, 'min_samples_split': 11, 'min_samples_leaf': 9}. Best is trial 0 with value: 0.8188065075624582.
[I 2025-04-07 22:06:03,006] Trial 28 finished with value: 0.8109249974958747 and parameters: {'n_estimators': 183, 'criterion': 'entropy', 'max_depth': 13, 'min_samples_split': 17, 'min_samples_leaf': 5}. Best is trial 0 with value: 0.8188065075624582.
[I 2025-04-07 22:06:16,710] Trial 29 finished with value: 0.8156625388139409 and parameters: {'n_estimators': 161, 'criterion': 'entropy', 'max_depth': 26, 'min_samples_split': 13, 'min_samples_leaf': 7}. Best is trial 0 with value: 0.8188065075624582.
[I 2025-04-07 22:06:31,575] Trial 30 finished with value: 0.8167105459695885 and parameters: {'n_estimators': 175, 'criterion': 'entropy', 'max_depth': 35, 'min_samples_split': 10, 'min_samples_leaf': 3}. Best is trial 0 with value: 0.8188065075624582.
[I 2025-04-07 22:06:39,384] Trial 31 finished with value: 0.8156624509498982 and parameters: {'n_estimators': 79, 'criterion': 'entropy', 'max_depth': 29, 'min_samples_split': 9, 'min_samples_leaf': 2}. Best is trial 0 with value: 0.8188065075624582.
[I 2025-04-07 22:06:48,677] Trial 32 finished with value: 0.8178002006814735 and parameters: {'n_estimators': 104, 'criterion': 'entropy', 'max_depth': 22, 'min_samples_split': 8, 'min_samples_leaf': 2}. Best is trial 0 with value: 0.8188065075624582.
[I 2025-04-07 22:06:52,940] Trial 33 finished with value: 0.8162910830297629 and parameters: {'n_estimators': 42, 'criterion': 'entropy', 'max_depth': 21, 'min_samples_split': 12, 'min_samples_leaf': 4}. Best is trial 0 with value: 0.8188065075624582.
[I 2025-04-07 22:07:03,373] Trial 34 finished with value: 0.7997314874855244 and parameters: {'n_estimators': 140, 'criterion': 'entropy', 'max_depth': 9, 'min_samples_split': 6, 'min_samples_leaf': 13}. Best is trial 0 with value: 0.8188065075624582.
[I 2025-04-07 22:07:12,755] Trial 35 finished with value: 0.8140692474093287 and parameters: {'n_estimators': 87, 'criterion': 'entropy', 'max_depth': 17, 'min_samples_split': 3, 'min_samples_leaf': 1}. Best is trial 0 with value: 0.8188065075624582.
[I 2025-04-07 22:07:27,480] Trial 36 finished with value: 0.8117637652202487 and parameters: {'n_estimators': 186, 'criterion': 'entropy', 'max_depth': 45, 'min_samples_split': 12, 'min_samples_leaf': 17}. Best is trial 0 with value: 0.8188065075624582.
[I 2025-04-07 22:07:36,865] Trial 37 finished with value: 0.8165427783664668 and parameters: {'n_estimators': 103, 'criterion': 'entropy', 'max_depth': 24, 'min_samples_split': 15, 'min_samples_leaf': 2}. Best is trial 0 with value: 0.8188065075624582.
[I 2025-04-07 22:07:47,667] Trial 38 finished with value: 0.8164588506328846 and parameters: {'n_estimators': 120, 'criterion': 'entropy', 'max_depth': 21, 'min_samples_split': 9, 'min_samples_leaf': 4}. Best is trial 0 with value: 0.8188065075624582.
[I 2025-04-07 22:08:04,987] Trial 39 finished with value: 0.8165009550821442 and parameters: {'n_estimators': 198, 'criterion': 'entropy', 'max_depth': 51, 'min_samples_split': 7, 'min_samples_leaf': 6}. Best is trial 0 with value: 0.8188065075624582.
[I 2025-04-07 22:08:11,000] Trial 40 finished with value: 0.8162913114762741 and parameters: {'n_estimators': 49, 'criterion': 'entropy', 'max_depth': 59, 'min_samples_split': 11, 'min_samples_leaf': 1}. Best is trial 0 with value: 0.8188065075624582.
[I 2025-04-07 22:08:20,431] Trial 41 finished with value: 0.8163330293237456 and parameters: {'n_estimators': 106, 'criterion': 'gini', 'max_depth': 28, 'min_samples_split': 8, 'min_samples_leaf': 2}. Best is trial 0 with value: 0.8188065075624582.
[I 2025-04-07 22:08:28,510] Trial 42 finished with value: 0.8180101957435143 and parameters: {'n_estimators': 93, 'criterion': 'gini', 'max_depth': 33, 'min_samples_split': 9, 'min_samples_leaf': 2}. Best is trial 0 with value: 0.8188065075624582.
[I 2025-04-07 22:08:37,567] Trial 43 finished with value: 0.8171296574532431 and parameters: {'n_estimators': 95, 'criterion': 'gini', 'max_depth': 39, 'min_samples_split': 10, 'min_samples_leaf': 3}. Best is trial 0 with value: 0.8188065075624582.
[I 2025-04-07 22:08:43,450] Trial 44 finished with value: 0.8156623279402384 and parameters: {'n_estimators': 61, 'criterion': 'gini', 'max_depth': 33, 'min_samples_split': 9, 'min_samples_leaf': 5}. Best is trial 0 with value: 0.8188065075624582.
[I 2025-04-07 22:08:50,183] Trial 45 finished with value: 0.8172975480660245 and parameters: {'n_estimators': 80, 'criterion': 'gini', 'max_depth': 34, 'min_samples_split': 14, 'min_samples_leaf': 1}. Best is trial 0 with value: 0.8188065075624582.
[I 2025-04-07 22:09:00,871] Trial 46 finished with value: 0.8116798023410496 and parameters: {'n_estimators': 143, 'criterion': 'gini', 'max_depth': 47, 'min_samples_split': 13, 'min_samples_leaf': 20}. Best is trial 0 with value: 0.8188065075624582.
[I 2025-04-07 22:09:15,617] Trial 47 finished with value: 0.816333169906214 and parameters: {'n_estimators': 156, 'criterion': 'gini', 'max_depth': 25, 'min_samples_split': 7, 'min_samples_leaf': 4}. Best is trial 0 with value: 0.8188065075624582.
[I 2025-04-07 22:09:25,344] Trial 48 finished with value: 0.8170038888625296 and parameters: {'n_estimators': 90, 'criterion': 'entropy', 'max_depth': 38, 'min_samples_split': 5, 'min_samples_leaf': 2}. Best is trial 0 with value: 0.8188065075624582.
[I 2025-04-07 22:09:36,131] Trial 49 finished with value: 0.8070682756330164 and parameters: {'n_estimators': 122, 'criterion': 'gini', 'max_depth': 12, 'min_samples_split': 11, 'min_samples_leaf': 17}. Best is trial 0 with value: 0.8188065075624582.
[I 2025-04-07 22:09:43,605] Trial 50 finished with value: 0.8141951565825105 and parameters: {'n_estimators': 98, 'criterion': 'gini', 'max_depth': 18, 'min_samples_split': 5, 'min_samples_leaf': 7}. Best is trial 0 with value: 0.8188065075624582.
[I 2025-04-07 22:09:50,897] Trial 51 finished with value: 0.817465210232295 and parameters: {'n_estimators': 81, 'criterion': 'gini', 'max_depth': 35, 'min_samples_split': 14, 'min_samples_leaf': 1}. Best is trial 0 with value: 0.8188065075624582.
[I 2025-04-07 22:09:58,760] Trial 52 finished with value: 0.816626477653538 and parameters: {'n_estimators': 75, 'criterion': 'gini', 'max_depth': 41, 'min_samples_split': 20, 'min_samples_leaf': 1}. Best is trial 0 with value: 0.8188065075624582.
[I 2025-04-07 22:10:01,533] Trial 53 finished with value: 0.8147399136472189 and parameters: {'n_estimators': 19, 'criterion': 'gini', 'max_depth': 37, 'min_samples_split': 18, 'min_samples_leaf': 3}. Best is trial 0 with value: 0.8188065075624582.
[I 2025-04-07 22:10:11,371] Trial 54 finished with value: 0.816836349705919 and parameters: {'n_estimators': 112, 'criterion': 'gini', 'max_depth': 43, 'min_samples_split': 15, 'min_samples_leaf': 2}. Best is trial 0 with value: 0.8188065075624582.
[I 2025-04-07 22:10:20,139] Trial 55 finished with value: 0.8167942101110425 and parameters: {'n_estimators': 86, 'criterion': 'gini', 'max_depth': 31, 'min_samples_split': 12, 'min_samples_leaf': 1}. Best is trial 0 with value: 0.8188065075624582.
[I 2025-04-07 22:10:26,879] Trial 56 finished with value: 0.8160817205888297 and parameters: {'n_estimators': 72, 'criterion': 'gini', 'max_depth': 27, 'min_samples_split': 10, 'min_samples_leaf': 4}. Best is trial 0 with value: 0.8188065075624582.
[I 2025-04-07 22:10:33,401] Trial 57 finished with value: 0.8166266885272405 and parameters: {'n_estimators': 56, 'criterion': 'gini', 'max_depth': 55, 'min_samples_split': 9, 'min_samples_leaf': 3}. Best is trial 0 with value: 0.8188065075624582.
[I 2025-04-07 22:10:44,475] Trial 58 finished with value: 0.8167943331207024 and parameters: {'n_estimators': 108, 'criterion': 'gini', 'max_depth': 60, 'min_samples_split': 3, 'min_samples_leaf': 2}. Best is trial 0 with value: 0.8188065075624582.
[I 2025-04-07 22:10:56,074] Trial 59 finished with value: 0.8168361739778337 and parameters: {'n_estimators': 126, 'criterion': 'entropy', 'max_depth': 23, 'min_samples_split': 8, 'min_samples_leaf': 1}. Best is trial 0 with value: 0.8188065075624582.
[I 2025-04-07 22:11:14,110] Trial 60 finished with value: 0.7513509623748597 and parameters: {'n_estimators': 192, 'criterion': 'gini', 'max_depth': 2, 'min_samples_split': 13, 'min_samples_leaf': 5}. Best is trial 0 with value: 0.8188065075624582.
[I 2025-04-07 22:11:21,147] Trial 61 finished with value: 0.817465210232295 and parameters: {'n_estimators': 81, 'criterion': 'gini', 'max_depth': 35, 'min_samples_split': 14, 'min_samples_leaf': 1}. Best is trial 0 with value: 0.8188065075624582.
[I 2025-04-07 22:11:22,382] A new study created in RDB with name: random-forest-num_features-12
[I 2025-04-07 22:11:31,310] Trial 0 finished with value: 0.8174648763489328 and parameters: {'n_estimators': 108, 'criterion': 'gini', 'max_depth': 54, 'min_samples_split': 10, 'min_samples_leaf': 1}. Best is trial 0 with value: 0.8174648763489328.
[I 2025-04-07 22:11:42,847] Trial 1 finished with value: 0.7887896552390692 and parameters: {'n_estimators': 190, 'criterion': 'entropy', 'max_depth': 6, 'min_samples_split': 11, 'min_samples_leaf': 15}. Best is trial 0 with value: 0.8174648763489328.
[I 2025-04-07 22:11:54,960] Trial 2 finished with value: 0.8150335728507138 and parameters: {'n_estimators': 170, 'criterion': 'gini', 'max_depth': 60, 'min_samples_split': 3, 'min_samples_leaf': 9}. Best is trial 0 with value: 0.8174648763489328.
[I 2025-04-07 22:12:02,610] Trial 3 finished with value: 0.8131470967084372 and parameters: {'n_estimators': 86, 'criterion': 'gini', 'max_depth': 62, 'min_samples_split': 7, 'min_samples_leaf': 19}. Best is trial 0 with value: 0.8174648763489328.
[I 2025-04-07 22:12:13,025] Trial 4 finished with value: 0.804762547424617 and parameters: {'n_estimators': 116, 'criterion': 'entropy', 'max_depth': 10, 'min_samples_split': 2, 'min_samples_leaf': 1}. Best is trial 0 with value: 0.8174648763489328.
[I 2025-04-07 22:12:23,073] Trial 5 finished with value: 0.8145724799274594 and parameters: {'n_estimators': 120, 'criterion': 'gini', 'max_depth': 57, 'min_samples_split': 11, 'min_samples_leaf': 12}. Best is trial 0 with value: 0.8174648763489328.
[I 2025-04-07 22:12:38,190] Trial 6 finished with value: 0.8128534550777509 and parameters: {'n_estimators': 185, 'criterion': 'gini', 'max_depth': 21, 'min_samples_split': 11, 'min_samples_leaf': 18}. Best is trial 0 with value: 0.8174648763489328.
[I 2025-04-07 22:12:48,816] Trial 7 finished with value: 0.8097931856163048 and parameters: {'n_estimators': 156, 'criterion': 'gini', 'max_depth': 12, 'min_samples_split': 18, 'min_samples_leaf': 15}. Best is trial 0 with value: 0.8174648763489328.
[I 2025-04-07 22:12:54,922] Trial 8 finished with value: 0.8150754137078451 and parameters: {'n_estimators': 81, 'criterion': 'entropy', 'max_depth': 43, 'min_samples_split': 16, 'min_samples_leaf': 13}. Best is trial 0 with value: 0.8174648763489328.
[I 2025-04-07 22:13:07,951] Trial 9 finished with value: 0.8175071038078519 and parameters: {'n_estimators': 184, 'criterion': 'entropy', 'max_depth': 29, 'min_samples_split': 7, 'min_samples_leaf': 2}. Best is trial 9 with value: 0.8175071038078519.
[I 2025-04-07 22:13:10,111] Trial 10 finished with value: 0.8141529994148256 and parameters: {'n_estimators': 15, 'criterion': 'entropy', 'max_depth': 30, 'min_samples_split': 7, 'min_samples_leaf': 6}. Best is trial 9 with value: 0.8175071038078519.
[I 2025-04-07 22:13:14,822] Trial 11 finished with value: 0.8157039403508588 and parameters: {'n_estimators': 40, 'criterion': 'entropy', 'max_depth': 43, 'min_samples_split': 7, 'min_samples_leaf': 1}. Best is trial 9 with value: 0.8175071038078519.
[I 2025-04-07 22:13:26,052] Trial 12 finished with value: 0.8170039942993809 and parameters: {'n_estimators': 150, 'criterion': 'gini', 'max_depth': 42, 'min_samples_split': 14, 'min_samples_leaf': 5}. Best is trial 9 with value: 0.8175071038078519.
[I 2025-04-07 22:13:36,117] Trial 13 finished with value: 0.8181778227641677 and parameters: {'n_estimators': 138, 'criterion': 'entropy', 'max_depth': 28, 'min_samples_split': 5, 'min_samples_leaf': 4}. Best is trial 13 with value: 0.8181778227641677.
[I 2025-04-07 22:13:47,515] Trial 14 finished with value: 0.8176328548257568 and parameters: {'n_estimators': 147, 'criterion': 'entropy', 'max_depth': 26, 'min_samples_split': 5, 'min_samples_leaf': 5}. Best is trial 13 with value: 0.8181778227641677.
[I 2025-04-07 22:13:57,662] Trial 15 finished with value: 0.8165008320724843 and parameters: {'n_estimators': 138, 'criterion': 'entropy', 'max_depth': 21, 'min_samples_split': 4, 'min_samples_leaf': 7}. Best is trial 13 with value: 0.8181778227641677.
[I 2025-04-07 22:14:07,127] Trial 16 finished with value: 0.8166266006631977 and parameters: {'n_estimators': 135, 'criterion': 'entropy', 'max_depth': 21, 'min_samples_split': 5, 'min_samples_leaf': 4}. Best is trial 13 with value: 0.8181778227641677.
[I 2025-04-07 22:14:13,100] Trial 17 finished with value: 0.8161656483224118 and parameters: {'n_estimators': 82, 'criterion': 'entropy', 'max_depth': 35, 'min_samples_split': 5, 'min_samples_leaf': 9}. Best is trial 13 with value: 0.8181778227641677.
[I 2025-04-07 22:14:18,094] Trial 18 finished with value: 0.8147820180964782 and parameters: {'n_estimators': 59, 'criterion': 'entropy', 'max_depth': 16, 'min_samples_split': 2, 'min_samples_leaf': 4}. Best is trial 13 with value: 0.8181778227641677.
[I 2025-04-07 22:14:30,105] Trial 19 finished with value: 0.8165846192235982 and parameters: {'n_estimators': 161, 'criterion': 'entropy', 'max_depth': 36, 'min_samples_split': 20, 'min_samples_leaf': 7}. Best is trial 13 with value: 0.8181778227641677.
[I 2025-04-07 22:14:38,226] Trial 20 finished with value: 0.7527765388947758 and parameters: {'n_estimators': 132, 'criterion': 'entropy', 'max_depth': 2, 'min_samples_split': 9, 'min_samples_leaf': 9}. Best is trial 13 with value: 0.8181778227641677.
[I 2025-04-07 22:14:51,508] Trial 21 finished with value: 0.8176745551004199 and parameters: {'n_estimators': 177, 'criterion': 'entropy', 'max_depth': 28, 'min_samples_split': 8, 'min_samples_leaf': 3}. Best is trial 13 with value: 0.8181778227641677.
[I 2025-04-07 22:15:04,254] Trial 22 finished with value: 0.8188487350213773 and parameters: {'n_estimators': 171, 'criterion': 'entropy', 'max_depth': 26, 'min_samples_split': 9, 'min_samples_leaf': 3}. Best is trial 22 with value: 0.8188487350213773.
[I 2025-04-07 22:15:17,197] Trial 23 finished with value: 0.8171715686016086 and parameters: {'n_estimators': 174, 'criterion': 'entropy', 'max_depth': 24, 'min_samples_split': 13, 'min_samples_leaf': 3}. Best is trial 22 with value: 0.8188487350213773.
[I 2025-04-07 22:15:31,874] Trial 24 finished with value: 0.8181357358877168 and parameters: {'n_estimators': 193, 'criterion': 'entropy', 'max_depth': 38, 'min_samples_split': 9, 'min_samples_leaf': 3}. Best is trial 22 with value: 0.8188487350213773.
