[I 2025-04-07 23:19:39,371] Trial 21 finished with value: 0.8065654648622906 and parameters: {'iterations': 200, 'learning_rate': 0.036068872343689225, 'objective': 'Logloss', 'colsample_bylevel': 0.4077736656714887, 'depth': 8, 'boosting_type': 'Ordered', 'bootstrap_type': 'Bernoulli', 'subsample': 0.7326550975067054}. Best is trial 0 with value: 0.8172555841992335.
[I 2025-04-07 23:20:12,925] Trial 22 finished with value: 0.8135242794709179 and parameters: {'iterations': 234, 'learning_rate': 0.4483602348799206, 'objective': 'Logloss', 'colsample_bylevel': 0.5211338083007825, 'depth': 7, 'boosting_type': 'Ordered', 'bootstrap_type': 'Bernoulli', 'subsample': 0.8915702660050413}. Best is trial 0 with value: 0.8172555841992335.
[I 2025-04-07 23:20:36,454] Trial 23 finished with value: 0.814698512110301 and parameters: {'iterations': 124, 'learning_rate': 0.11150942434809084, 'objective': 'CrossEntropy', 'colsample_bylevel': 0.8572325920948429, 'depth': 8, 'boosting_type': 'Ordered', 'bootstrap_type': 'Bernoulli', 'subsample': 0.55257289194503}. Best is trial 0 with value: 0.8172555841992335.
[I 2025-04-07 23:21:35,130] Trial 24 finished with value: 0.8171295344435834 and parameters: {'iterations': 161, 'learning_rate': 0.4823705673776544, 'objective': 'Logloss', 'colsample_bylevel': 0.7324601196922514, 'depth': 9, 'boosting_type': 'Ordered', 'bootstrap_type': 'Bernoulli', 'subsample': 0.34146084158912027}. Best is trial 0 with value: 0.8172555841992335.
[I 2025-04-07 23:22:33,732] Trial 25 finished with value: 0.8159140232769422 and parameters: {'iterations': 162, 'learning_rate': 0.4641886343608068, 'objective': 'Logloss', 'colsample_bylevel': 0.7488156031512778, 'depth': 9, 'boosting_type': 'Ordered', 'bootstrap_type': 'Bernoulli', 'subsample': 0.3413528762791458}. Best is trial 0 with value: 0.8172555841992335.
[I 2025-04-07 23:22:34,687] A new study created in RDB with name: catboost-num_features-5
[I 2025-04-07 23:22:39,929] Trial 0 finished with value: 0.8183035737820725 and parameters: {'iterations': 176, 'learning_rate': 0.31538824641015534, 'objective': 'Logloss', 'colsample_bylevel': 0.7069034147229618, 'depth': 7, 'boosting_type': 'Plain', 'bootstrap_type': 'MVS', 'subsample': 0.9294212407027955}. Best is trial 0 with value: 0.8183035737820725.
[I 2025-04-07 23:22:42,034] Trial 1 finished with value: 0.8065653242798223 and parameters: {'iterations': 76, 'learning_rate': 0.10077998912089557, 'objective': 'CrossEntropy', 'colsample_bylevel': 0.44869811150411376, 'depth': 8, 'boosting_type': 'Plain', 'bootstrap_type': 'Bernoulli', 'subsample': 0.888146380081812}. Best is trial 0 with value: 0.8183035737820725.
[I 2025-04-07 23:23:01,479] Trial 2 finished with value: 0.7898792748053373 and parameters: {'iterations': 214, 'learning_rate': 0.009265241494637446, 'objective': 'Logloss', 'colsample_bylevel': 0.3808659728831566, 'depth': 5, 'boosting_type': 'Ordered', 'bootstrap_type': 'Bayesian', 'bagging_temperature': 1.2437227635204795}. Best is trial 0 with value: 0.8183035737820725.
[I 2025-04-07 23:23:07,663] Trial 3 finished with value: 0.8115955758697222 and parameters: {'iterations': 240, 'learning_rate': 0.40386952203757487, 'objective': 'CrossEntropy', 'colsample_bylevel': 0.16471156969685977, 'depth': 8, 'boosting_type': 'Plain', 'bootstrap_type': 'MVS', 'subsample': 0.9464766154963713}. Best is trial 0 with value: 0.8183035737820725.
[I 2025-04-07 23:23:24,398] Trial 4 finished with value: 0.8100865285092459 and parameters: {'iterations': 198, 'learning_rate': 0.6761757062494594, 'objective': 'Logloss', 'colsample_bylevel': 0.5499373137454325, 'depth': 9, 'boosting_type': 'Plain', 'bootstrap_type': 'Bayesian', 'bagging_temperature': 0.6473473429793153}. Best is trial 0 with value: 0.8183035737820725.
[I 2025-04-07 23:23:33,058] Trial 5 finished with value: 0.7949941394683523 and parameters: {'iterations': 193, 'learning_rate': 0.01269802227878962, 'objective': 'CrossEntropy', 'colsample_bylevel': 0.8083789722328225, 'depth': 5, 'boosting_type': 'Ordered', 'bootstrap_type': 'Bernoulli', 'subsample': 0.7700272911396471}. Best is trial 0 with value: 0.8183035737820725.
[I 2025-04-07 23:24:29,128] Trial 6 finished with value: 0.799144766554025 and parameters: {'iterations': 173, 'learning_rate': 0.01721015111355417, 'objective': 'Logloss', 'colsample_bylevel': 0.7861546474939641, 'depth': 9, 'boosting_type': 'Ordered', 'bootstrap_type': 'MVS', 'subsample': 0.32639156707608613}. Best is trial 0 with value: 0.8183035737820725.
[I 2025-04-07 23:24:31,971] Trial 7 finished with value: 0.7900468315347564 and parameters: {'iterations': 103, 'learning_rate': 0.0028373225433769244, 'objective': 'Logloss', 'colsample_bylevel': 0.48858336708423755, 'depth': 8, 'boosting_type': 'Plain', 'bootstrap_type': 'Bernoulli', 'subsample': 0.6160311047807031}. Best is trial 0 with value: 0.8183035737820725.
[I 2025-04-07 23:24:51,270] Trial 8 finished with value: 0.7915565642347657 and parameters: {'iterations': 212, 'learning_rate': 0.014072602139656498, 'objective': 'CrossEntropy', 'colsample_bylevel': 0.3337005661272878, 'depth': 6, 'boosting_type': 'Ordered', 'bootstrap_type': 'MVS', 'subsample': 0.3988262722700734}. Best is trial 0 with value: 0.8183035737820725.
[I 2025-04-07 23:24:54,418] Trial 9 finished with value: 0.8165009023637186 and parameters: {'iterations': 111, 'learning_rate': 0.4582137667384545, 'objective': 'Logloss', 'colsample_bylevel': 0.9132937705785128, 'depth': 8, 'boosting_type': 'Plain', 'bootstrap_type': 'Bernoulli', 'subsample': 0.3769257449532738}. Best is trial 0 with value: 0.8183035737820725.
[I 2025-04-07 23:24:56,330] Trial 10 finished with value: 0.8027505135653297 and parameters: {'iterations': 136, 'learning_rate': 0.10119658534400025, 'objective': 'Logloss', 'colsample_bylevel': 0.690550032417545, 'depth': 4, 'boosting_type': 'Plain', 'bootstrap_type': 'MVS', 'subsample': 0.1280410017284001}. Best is trial 0 with value: 0.8183035737820725.
[I 2025-04-07 23:24:59,701] Trial 11 finished with value: 0.817045993311789 and parameters: {'iterations': 134, 'learning_rate': 0.21476044112921117, 'objective': 'Logloss', 'colsample_bylevel': 0.977692284852952, 'depth': 7, 'boosting_type': 'Plain', 'bootstrap_type': 'Bernoulli', 'subsample': 0.5242157133125158}. Best is trial 0 with value: 0.8183035737820725.
[I 2025-04-07 23:25:03,687] Trial 12 finished with value: 0.8162912587578486 and parameters: {'iterations': 148, 'learning_rate': 0.12033612008747176, 'objective': 'Logloss', 'colsample_bylevel': 0.9847196749881966, 'depth': 7, 'boosting_type': 'Plain', 'bootstrap_type': 'MVS', 'subsample': 0.6453777667853567}. Best is trial 0 with value: 0.8183035737820725.
[I 2025-04-07 23:25:06,434] Trial 13 finished with value: 0.8166687402580743 and parameters: {'iterations': 164, 'learning_rate': 0.20403732597191016, 'objective': 'Logloss', 'colsample_bylevel': 0.6624244761367063, 'depth': 6, 'boosting_type': 'Plain', 'bootstrap_type': 'Bernoulli', 'subsample': 0.5285730760405242}. Best is trial 0 with value: 0.8183035737820725.
[I 2025-04-07 23:25:09,861] Trial 14 finished with value: 0.7974259174324019 and parameters: {'iterations': 128, 'learning_rate': 0.043698234909791016, 'objective': 'Logloss', 'colsample_bylevel': 0.8817664430844616, 'depth': 7, 'boosting_type': 'Plain', 'bootstrap_type': 'Bayesian', 'bagging_temperature': 9.917854655573972}. Best is trial 0 with value: 0.8183035737820725.
[I 2025-04-07 23:25:24,001] Trial 15 finished with value: 0.7830043352118665 and parameters: {'iterations': 255, 'learning_rate': 0.9960770704963005, 'objective': 'Logloss', 'colsample_bylevel': 0.6788315808495756, 'depth': 7, 'boosting_type': 'Plain', 'bootstrap_type': 'Bernoulli', 'subsample': 0.7541302106787472}. Best is trial 0 with value: 0.8183035737820725.
[I 2025-04-07 23:25:27,532] Trial 16 finished with value: 0.8076553128750696 and parameters: {'iterations': 178, 'learning_rate': 0.04446831260560251, 'objective': 'Logloss', 'colsample_bylevel': 0.9825679610594631, 'depth': 6, 'boosting_type': 'Plain', 'bootstrap_type': 'MVS', 'subsample': 0.5105333603910693}. Best is trial 0 with value: 0.8183035737820725.
[I 2025-04-07 23:25:28,998] Trial 17 finished with value: 0.8135662257649005 and parameters: {'iterations': 69, 'learning_rate': 0.23956155334104365, 'objective': 'Logloss', 'colsample_bylevel': 0.7712952924002492, 'depth': 5, 'boosting_type': 'Plain', 'bootstrap_type': 'Bernoulli', 'subsample': 0.991019725924684}. Best is trial 0 with value: 0.8183035737820725.
[I 2025-04-07 23:25:40,439] Trial 18 finished with value: 0.8149918374304337 and parameters: {'iterations': 105, 'learning_rate': 0.2733409276096485, 'objective': 'CrossEntropy', 'colsample_bylevel': 0.587876483348627, 'depth': 7, 'boosting_type': 'Ordered', 'bootstrap_type': 'MVS', 'subsample': 0.7902663415341862}. Best is trial 0 with value: 0.8183035737820725.
[I 2025-04-07 23:25:44,278] Trial 19 finished with value: 0.7825847141167642 and parameters: {'iterations': 146, 'learning_rate': 0.0033037130774949096, 'objective': 'Logloss', 'colsample_bylevel': 0.8804142004869256, 'depth': 6, 'boosting_type': 'Plain', 'bootstrap_type': 'Bayesian', 'bagging_temperature': 7.154982735405442}. Best is trial 0 with value: 0.8183035737820725.
[I 2025-04-07 23:25:45,996] Trial 20 finished with value: 0.7542439914174404 and parameters: {'iterations': 122, 'learning_rate': 0.0014346051934433428, 'objective': 'Logloss', 'colsample_bylevel': 0.21779566946504963, 'depth': 4, 'boosting_type': 'Plain', 'bootstrap_type': 'MVS', 'subsample': 0.23915214908857296}. Best is trial 0 with value: 0.8183035737820725.
[I 2025-04-07 23:25:49,751] Trial 21 finished with value: 0.8167525801276139 and parameters: {'iterations': 171, 'learning_rate': 0.1907646409354244, 'objective': 'Logloss', 'colsample_bylevel': 0.6658656060807256, 'depth': 6, 'boosting_type': 'Plain', 'bootstrap_type': 'Bernoulli', 'subsample': 0.5010062165742933}. Best is trial 0 with value: 0.8183035737820725.
[I 2025-04-07 23:25:53,438] Trial 22 finished with value: 0.8144048001883805 and parameters: {'iterations': 156, 'learning_rate': 0.13063615303059878, 'objective': 'Logloss', 'colsample_bylevel': 0.6002740236502041, 'depth': 7, 'boosting_type': 'Plain', 'bootstrap_type': 'Bernoulli', 'subsample': 0.4492657696219239}. Best is trial 0 with value: 0.8183035737820725.
[I 2025-04-07 23:25:57,027] Trial 23 finished with value: 0.8100031103871116 and parameters: {'iterations': 187, 'learning_rate': 0.06203114598312113, 'objective': 'Logloss', 'colsample_bylevel': 0.7366791445690463, 'depth': 6, 'boosting_type': 'Plain', 'bootstrap_type': 'Bernoulli', 'subsample': 0.6455600958954713}. Best is trial 0 with value: 0.8183035737820725.
[I 2025-04-07 23:25:59,717] Trial 24 finished with value: 0.8159978807192904 and parameters: {'iterations': 162, 'learning_rate': 0.41637211941840435, 'objective': 'Logloss', 'colsample_bylevel': 0.8240177247813544, 'depth': 5, 'boosting_type': 'Plain', 'bootstrap_type': 'Bernoulli', 'subsample': 0.5778934760711258}. Best is trial 0 with value: 0.8183035737820725.
[I 2025-04-07 23:26:08,536] Trial 25 finished with value: 0.8177165892584449 and parameters: {'iterations': 212, 'learning_rate': 0.19595823991899353, 'objective': 'Logloss', 'colsample_bylevel': 0.5102973259813874, 'depth': 7, 'boosting_type': 'Plain', 'bootstrap_type': 'Bernoulli', 'subsample': 0.7053565984734745}. Best is trial 0 with value: 0.8183035737820725.
[I 2025-04-07 23:26:37,728] Trial 26 finished with value: 0.8008636683940737 and parameters: {'iterations': 224, 'learning_rate': 0.025686884996482112, 'objective': 'CrossEntropy', 'colsample_bylevel': 0.3479368709179168, 'depth': 8, 'boosting_type': 'Ordered', 'bootstrap_type': 'Bernoulli', 'subsample': 0.8629809367738794}. Best is trial 0 with value: 0.8183035737820725.
[I 2025-04-07 23:26:47,005] Trial 27 finished with value: 0.7911369431396634 and parameters: {'iterations': 202, 'learning_rate': 0.938035261683988, 'objective': 'Logloss', 'colsample_bylevel': 0.4989834500783031, 'depth': 7, 'boosting_type': 'Plain', 'bootstrap_type': 'Bernoulli', 'subsample': 0.7051794716060754}. Best is trial 0 with value: 0.8183035737820725.
[I 2025-04-07 23:26:53,138] Trial 28 finished with value: 0.7993543925870864 and parameters: {'iterations': 229, 'learning_rate': 0.07586873100332817, 'objective': 'Logloss', 'colsample_bylevel': 0.2537947808861441, 'depth': 8, 'boosting_type': 'Plain', 'bootstrap_type': 'Bayesian', 'bagging_temperature': 4.802451598189478}. Best is trial 0 with value: 0.8183035737820725.
[I 2025-04-07 23:27:00,748] Trial 29 finished with value: 0.8126861970860768 and parameters: {'iterations': 88, 'learning_rate': 0.14828039740147744, 'objective': 'CrossEntropy', 'colsample_bylevel': 0.467657217386805, 'depth': 9, 'boosting_type': 'Plain', 'bootstrap_type': 'MVS', 'subsample': 0.8464580176341117}. Best is trial 0 with value: 0.8183035737820725.
[I 2025-04-07 23:27:04,705] Trial 30 finished with value: 0.8170460284574063 and parameters: {'iterations': 143, 'learning_rate': 0.3538130788966469, 'objective': 'Logloss', 'colsample_bylevel': 0.5523039221539385, 'depth': 7, 'boosting_type': 'Plain', 'bootstrap_type': 'Bernoulli', 'subsample': 0.7028973625105459}. Best is trial 0 with value: 0.8183035737820725.
[I 2025-04-07 23:27:08,558] Trial 31 finished with value: 0.8168368593173667 and parameters: {'iterations': 141, 'learning_rate': 0.3296808253246143, 'objective': 'Logloss', 'colsample_bylevel': 0.5492550763034193, 'depth': 7, 'boosting_type': 'Plain', 'bootstrap_type': 'Bernoulli', 'subsample': 0.6896056301716869}. Best is trial 0 with value: 0.8183035737820725.
[I 2025-04-07 23:27:11,500] Trial 32 finished with value: 0.8155784880706989 and parameters: {'iterations': 120, 'learning_rate': 0.559267089826391, 'objective': 'Logloss', 'colsample_bylevel': 0.38847246520678397, 'depth': 7, 'boosting_type': 'Plain', 'bootstrap_type': 'Bernoulli', 'subsample': 0.7314350250202657}. Best is trial 0 with value: 0.8183035737820725.
[I 2025-04-07 23:27:16,605] Trial 33 finished with value: 0.816668599675606 and parameters: {'iterations': 184, 'learning_rate': 0.2936207691604323, 'objective': 'Logloss', 'colsample_bylevel': 0.40646420043290155, 'depth': 8, 'boosting_type': 'Plain', 'bootstrap_type': 'Bernoulli', 'subsample': 0.5798453932011847}. Best is trial 0 with value: 0.8183035737820725.
[I 2025-04-07 23:27:28,320] Trial 34 finished with value: 0.816081703016021 and parameters: {'iterations': 212, 'learning_rate': 0.07091858520575697, 'objective': 'Logloss', 'colsample_bylevel': 0.612230096691032, 'depth': 7, 'boosting_type': 'Plain', 'bootstrap_type': 'Bernoulli', 'subsample': 0.9121619066226379}. Best is trial 0 with value: 0.8183035737820725.
[I 2025-04-07 23:27:49,046] Trial 35 finished with value: 0.8133565821590304 and parameters: {'iterations': 154, 'learning_rate': 0.6925412484694514, 'objective': 'Logloss', 'colsample_bylevel': 0.5312557838966415, 'depth': 8, 'boosting_type': 'Ordered', 'bootstrap_type': 'Bayesian', 'bagging_temperature': 4.186157014246235}. Best is trial 0 with value: 0.8183035737820725.
[I 2025-04-07 23:27:50,652] Trial 36 finished with value: 0.8070263996302682 and parameters: {'iterations': 91, 'learning_rate': 0.1805661155875325, 'objective': 'CrossEntropy', 'colsample_bylevel': 0.30107365700525207, 'depth': 7, 'boosting_type': 'Plain', 'bootstrap_type': 'Bernoulli', 'subsample': 0.8387855554810031}. Best is trial 0 with value: 0.8183035737820725.
[I 2025-04-07 23:27:58,850] Trial 37 finished with value: 0.8087027401280353 and parameters: {'iterations': 201, 'learning_rate': 0.3870684691735104, 'objective': 'Logloss', 'colsample_bylevel': 0.7155783582204421, 'depth': 6, 'boosting_type': 'Plain', 'bootstrap_type': 'MVS', 'subsample': 0.8058652995257481}. Best is trial 0 with value: 0.8183035737820725.
[I 2025-04-07 23:28:01,498] Trial 38 finished with value: 0.80350465064378 and parameters: {'iterations': 134, 'learning_rate': 0.624183401315957, 'objective': 'Logloss', 'colsample_bylevel': 0.13469963215530256, 'depth': 9, 'boosting_type': 'Ordered', 'bootstrap_type': 'Bernoulli', 'subsample': 0.9282211795295574}. Best is trial 0 with value: 0.8183035737820725.
[I 2025-04-07 23:28:12,125] Trial 39 finished with value: 0.8040500227567872 and parameters: {'iterations': 242, 'learning_rate': 0.024729488230132737, 'objective': 'CrossEntropy', 'colsample_bylevel': 0.4148649819638752, 'depth': 8, 'boosting_type': 'Plain', 'bootstrap_type': 'MVS', 'subsample': 0.973374320686319}. Best is trial 0 with value: 0.8183035737820725.
[I 2025-04-07 23:28:22,607] Trial 40 finished with value: 0.7917240858185679 and parameters: {'iterations': 167, 'learning_rate': 0.00809247117502918, 'objective': 'Logloss', 'colsample_bylevel': 0.4439508864645795, 'depth': 7, 'boosting_type': 'Ordered', 'bootstrap_type': 'Bernoulli', 'subsample': 0.6666539596395036}. Best is trial 0 with value: 0.8183035737820725.
[I 2025-04-07 23:28:25,884] Trial 41 finished with value: 0.8171296047348175 and parameters: {'iterations': 140, 'learning_rate': 0.3073971038415054, 'objective': 'Logloss', 'colsample_bylevel': 0.529004009812966, 'depth': 7, 'boosting_type': 'Plain', 'bootstrap_type': 'Bernoulli', 'subsample': 0.6868529362905791}. Best is trial 0 with value: 0.8183035737820725.
[I 2025-04-07 23:28:28,385] Trial 42 finished with value: 0.8171294992979663 and parameters: {'iterations': 117, 'learning_rate': 0.48527146824532574, 'objective': 'Logloss', 'colsample_bylevel': 0.5056382078513766, 'depth': 7, 'boosting_type': 'Plain', 'bootstrap_type': 'Bernoulli', 'subsample': 0.6011809281434849}. Best is trial 0 with value: 0.8183035737820725.
[I 2025-04-07 23:28:32,131] Trial 43 finished with value: 0.8135241037428326 and parameters: {'iterations': 119, 'learning_rate': 0.5226798614072516, 'objective': 'Logloss', 'colsample_bylevel': 0.5131122358360354, 'depth': 8, 'boosting_type': 'Plain', 'bootstrap_type': 'Bernoulli', 'subsample': 0.5890993614297986}. Best is trial 0 with value: 0.8183035737820725.
[I 2025-04-07 23:28:34,543] Trial 44 finished with value: 0.8156206276655753 and parameters: {'iterations': 109, 'learning_rate': 0.33416873825896853, 'objective': 'Logloss', 'colsample_bylevel': 0.6232733619576996, 'depth': 6, 'boosting_type': 'Plain', 'bootstrap_type': 'Bernoulli', 'subsample': 0.732331802752755}. Best is trial 0 with value: 0.8183035737820725.
[I 2025-04-07 23:28:37,557] Trial 45 finished with value: 0.8096257870421624 and parameters: {'iterations': 98, 'learning_rate': 0.09609108629255225, 'objective': 'Logloss', 'colsample_bylevel': 0.567412316103712, 'depth': 8, 'boosting_type': 'Plain', 'bootstrap_type': 'Bernoulli', 'subsample': 0.6393777643028109}. Best is trial 0 with value: 0.8183035737820725.
[I 2025-04-07 23:28:41,231] Trial 46 finished with value: 0.8123925554553907 and parameters: {'iterations': 151, 'learning_rate': 0.8011477794873482, 'objective': 'Logloss', 'colsample_bylevel': 0.46834053256205416, 'depth': 7, 'boosting_type': 'Plain', 'bootstrap_type': 'Bayesian', 'bagging_temperature': 9.693730662120235}. Best is trial 0 with value: 0.8183035737820725.
[I 2025-04-07 23:28:45,415] Trial 47 finished with value: 0.8157465016931402 and parameters: {'iterations': 138, 'learning_rate': 0.4656628293614931, 'objective': 'Logloss', 'colsample_bylevel': 0.6377851878006442, 'depth': 7, 'boosting_type': 'Plain', 'bootstrap_type': 'MVS', 'subsample': 0.780912917588818}. Best is trial 0 with value: 0.8183035737820725.
[I 2025-04-07 23:28:49,207] Trial 48 finished with value: 0.815159394159853 and parameters: {'iterations': 193, 'learning_rate': 0.16538496769356958, 'objective': 'Logloss', 'colsample_bylevel': 0.44132610779882336, 'depth': 6, 'boosting_type': 'Plain', 'bootstrap_type': 'Bernoulli', 'subsample': 0.7017793668801434}. Best is trial 0 with value: 0.8183035737820725.
[I 2025-04-07 23:28:52,015] Trial 49 finished with value: 0.81599800372895 and parameters: {'iterations': 124, 'learning_rate': 0.24534139701062807, 'objective': 'Logloss', 'colsample_bylevel': 0.5592724803174675, 'depth': 7, 'boosting_type': 'Plain', 'bootstrap_type': 'Bernoulli', 'subsample': 0.44320440851208287}. Best is trial 0 with value: 0.8183035737820725.
[I 2025-04-07 23:28:55,052] Trial 50 finished with value: 0.8120572662684669 and parameters: {'iterations': 128, 'learning_rate': 0.0971244108611855, 'objective': 'CrossEntropy', 'colsample_bylevel': 0.5054169874500191, 'depth': 7, 'boosting_type': 'Plain', 'bootstrap_type': 'MVS', 'subsample': 0.6138007115720472}. Best is trial 0 with value: 0.8183035737820725.
[I 2025-04-07 23:28:58,260] Trial 51 finished with value: 0.8158721648470024 and parameters: {'iterations': 133, 'learning_rate': 0.2431698811645791, 'objective': 'Logloss', 'colsample_bylevel': 0.9296493362250484, 'depth': 7, 'boosting_type': 'Plain', 'bootstrap_type': 'Bernoulli', 'subsample': 0.5520251684160549}. Best is trial 0 with value: 0.8183035737820725.
[I 2025-04-07 23:29:02,116] Trial 52 finished with value: 0.8159979861561414 and parameters: {'iterations': 144, 'learning_rate': 0.3732512678344234, 'objective': 'Logloss', 'colsample_bylevel': 0.8418271281130474, 'depth': 7, 'boosting_type': 'Plain', 'bootstrap_type': 'Bernoulli', 'subsample': 0.467805047028379}. Best is trial 0 with value: 0.8183035737820725.
[I 2025-04-07 23:29:05,116] Trial 53 finished with value: 0.815075642154356 and parameters: {'iterations': 176, 'learning_rate': 0.20194005941077703, 'objective': 'Logloss', 'colsample_bylevel': 0.5816453827410715, 'depth': 6, 'boosting_type': 'Plain', 'bootstrap_type': 'Bernoulli', 'subsample': 0.39481875522858184}. Best is trial 0 with value: 0.8183035737820725.
