[I 2025-04-07 22:43:19,164] Trial 3 finished with value: 0.7890828224039251 and parameters: {'iterations': 147, 'learning_rate': 0.004754353637694172, 'objective': 'CrossEntropy', 'colsample_bylevel': 0.9262764366833154, 'depth': 5, 'boosting_type': 'Ordered', 'bootstrap_type': 'MVS', 'subsample': 0.36635827044071934}. Best is trial 0 with value: 0.8192256717645383.
[I 2025-04-07 22:43:33,916] Trial 4 finished with value: 0.7991866952751989 and parameters: {'iterations': 140, 'learning_rate': 0.03621071216876084, 'objective': 'CrossEntropy', 'colsample_bylevel': 0.5982281493348783, 'depth': 7, 'boosting_type': 'Ordered', 'bootstrap_type': 'Bayesian', 'bagging_temperature': 5.503760871050104}. Best is trial 0 with value: 0.8192256717645383.
[I 2025-04-07 22:43:36,818] Trial 5 finished with value: 0.8104219055602124 and parameters: {'iterations': 173, 'learning_rate': 0.9783729237256464, 'objective': 'CrossEntropy', 'colsample_bylevel': 0.14955302384207703, 'depth': 9, 'boosting_type': 'Plain', 'bootstrap_type': 'MVS', 'subsample': 0.21902462053954463}. Best is trial 0 with value: 0.8192256717645383.
[I 2025-04-07 22:44:57,096] Trial 6 finished with value: 0.7965874133001558 and parameters: {'iterations': 193, 'learning_rate': 0.0017539804594616315, 'objective': 'CrossEntropy', 'colsample_bylevel': 0.9736108075180727, 'depth': 9, 'boosting_type': 'Ordered', 'bootstrap_type': 'MVS', 'subsample': 0.527642028702721}. Best is trial 0 with value: 0.8192256717645383.
[I 2025-04-07 22:45:16,156] Trial 7 finished with value: 0.807025872446012 and parameters: {'iterations': 243, 'learning_rate': 0.26472679801966803, 'objective': 'CrossEntropy', 'colsample_bylevel': 0.6197793088025851, 'depth': 8, 'boosting_type': 'Plain', 'bootstrap_type': 'Bayesian', 'bagging_temperature': 9.228789951637488}. Best is trial 0 with value: 0.8192256717645383.
[I 2025-04-07 22:45:19,725] Trial 8 finished with value: 0.8168780675533907 and parameters: {'iterations': 186, 'learning_rate': 0.3180689667444512, 'objective': 'CrossEntropy', 'colsample_bylevel': 0.21129037086420852, 'depth': 7, 'boosting_type': 'Plain', 'bootstrap_type': 'Bayesian', 'bagging_temperature': 1.2973391396118295}. Best is trial 0 with value: 0.8192256717645383.
[I 2025-04-07 22:45:22,143] Trial 9 finished with value: 0.8081161246333872 and parameters: {'iterations': 177, 'learning_rate': 0.31806302604622644, 'objective': 'Logloss', 'colsample_bylevel': 0.18823861965041883, 'depth': 6, 'boosting_type': 'Plain', 'bootstrap_type': 'Bayesian', 'bagging_temperature': 4.328163376674196}. Best is trial 0 with value: 0.8192256717645383.
[I 2025-04-07 22:45:26,068] Trial 10 finished with value: 0.7887893389285155 and parameters: {'iterations': 104, 'learning_rate': 0.025444635369328616, 'objective': 'Logloss', 'colsample_bylevel': 0.3609633859840196, 'depth': 4, 'boosting_type': 'Ordered', 'bootstrap_type': 'Bernoulli', 'subsample': 0.9734738803725771}. Best is trial 0 with value: 0.8192256717645383.
[I 2025-04-07 22:45:38,810] Trial 11 finished with value: 0.8164587100504164 and parameters: {'iterations': 207, 'learning_rate': 0.0584803158291934, 'objective': 'CrossEntropy', 'colsample_bylevel': 0.38558609693813767, 'depth': 8, 'boosting_type': 'Plain', 'bootstrap_type': 'Bayesian', 'bagging_temperature': 0.03779279692835846}. Best is trial 0 with value: 0.8192256717645383.
[I 2025-04-07 22:45:54,353] Trial 12 finished with value: 0.8189745036120909 and parameters: {'iterations': 249, 'learning_rate': 0.10462282369693762, 'objective': 'CrossEntropy', 'colsample_bylevel': 0.3542394003175192, 'depth': 8, 'boosting_type': 'Plain', 'bootstrap_type': 'Bayesian', 'bagging_temperature': 0.10655703359596436}. Best is trial 0 with value: 0.8192256717645383.
[I 2025-04-07 22:46:55,920] Trial 13 finished with value: 0.8145721987625227 and parameters: {'iterations': 255, 'learning_rate': 0.08955040876553341, 'objective': 'CrossEntropy', 'colsample_bylevel': 0.4465579552758515, 'depth': 8, 'boosting_type': 'Ordered', 'bootstrap_type': 'Bayesian', 'bagging_temperature': 2.339153746536225}. Best is trial 0 with value: 0.8192256717645383.
[I 2025-04-07 22:48:53,651] Trial 14 finished with value: 0.8024567137793663 and parameters: {'iterations': 222, 'learning_rate': 0.010698393817958151, 'objective': 'Logloss', 'colsample_bylevel': 0.46840135489242757, 'depth': 9, 'boosting_type': 'Ordered', 'bootstrap_type': 'Bayesian', 'bagging_temperature': 2.6135202446269825}. Best is trial 0 with value: 0.8192256717645383.
[I 2025-04-07 22:49:06,008] Trial 15 finished with value: 0.8185128659317717 and parameters: {'iterations': 231, 'learning_rate': 0.10529290115589343, 'objective': 'CrossEntropy', 'colsample_bylevel': 0.28653560283417356, 'depth': 8, 'boosting_type': 'Plain', 'bootstrap_type': 'Bernoulli', 'subsample': 0.9786567453058816}. Best is trial 0 with value: 0.8192256717645383.
[I 2025-04-07 22:49:46,497] Trial 16 finished with value: 0.7987253914782422 and parameters: {'iterations': 121, 'learning_rate': 0.015878914112292166, 'objective': 'CrossEntropy', 'colsample_bylevel': 0.5114866093775732, 'depth': 9, 'boosting_type': 'Ordered', 'bootstrap_type': 'Bayesian', 'bagging_temperature': 0.223429434747716}. Best is trial 0 with value: 0.8192256717645383.
[I 2025-04-07 22:50:02,631] Trial 17 finished with value: 0.7845976617620959 and parameters: {'iterations': 208, 'learning_rate': 0.8492918173064965, 'objective': 'CrossEntropy', 'colsample_bylevel': 0.714799889665529, 'depth': 8, 'boosting_type': 'Plain', 'bootstrap_type': 'Bayesian', 'bagging_temperature': 3.245333182849486}. Best is trial 0 with value: 0.8192256717645383.
[I 2025-04-07 22:51:38,512] Trial 18 finished with value: 0.8151171315553167 and parameters: {'iterations': 248, 'learning_rate': 0.1087220650513904, 'objective': 'Logloss', 'colsample_bylevel': 0.3345312283949249, 'depth': 9, 'boosting_type': 'Ordered', 'bootstrap_type': 'MVS', 'subsample': 0.7492832015147651}. Best is trial 0 with value: 0.8192256717645383.
[I 2025-04-07 22:51:46,245] A new study created in RDB with name: catboost-num_features-8
[I 2025-04-07 22:52:45,239] Trial 0 finished with value: 0.8186388453961877 and parameters: {'iterations': 196, 'learning_rate': 0.1399640318761685, 'objective': 'CrossEntropy', 'colsample_bylevel': 0.46918124739301487, 'depth': 9, 'boosting_type': 'Ordered', 'bootstrap_type': 'Bayesian', 'bagging_temperature': 0.43773525284331316}. Best is trial 0 with value: 0.8186388453961877.
[I 2025-04-07 22:52:52,581] Trial 1 finished with value: 0.7709305505033731 and parameters: {'iterations': 180, 'learning_rate': 0.0015993610558105381, 'objective': 'CrossEntropy', 'colsample_bylevel': 0.24784354028861127, 'depth': 9, 'boosting_type': 'Plain', 'bootstrap_type': 'Bernoulli', 'subsample': 0.7337328431265306}. Best is trial 0 with value: 0.8186388453961877.
[I 2025-04-07 22:53:11,386] Trial 2 finished with value: 0.7630898972166428 and parameters: {'iterations': 229, 'learning_rate': 0.00838188954257078, 'objective': 'CrossEntropy', 'colsample_bylevel': 0.1622443895066002, 'depth': 7, 'boosting_type': 'Ordered', 'bootstrap_type': 'MVS', 'subsample': 0.18345680568189987}. Best is trial 0 with value: 0.8186388453961877.
[I 2025-04-07 22:53:46,752] Trial 3 finished with value: 0.7954133915344752 and parameters: {'iterations': 230, 'learning_rate': 0.02325410613575501, 'objective': 'Logloss', 'colsample_bylevel': 0.4410406066798144, 'depth': 6, 'boosting_type': 'Ordered', 'bootstrap_type': 'Bayesian', 'bagging_temperature': 7.072598529546101}. Best is trial 0 with value: 0.8186388453961877.
[I 2025-04-07 22:54:03,647] Trial 4 finished with value: 0.8188063845527983 and parameters: {'iterations': 122, 'learning_rate': 0.4655035681731948, 'objective': 'Logloss', 'colsample_bylevel': 0.25327429302405424, 'depth': 9, 'boosting_type': 'Ordered', 'bootstrap_type': 'Bayesian', 'bagging_temperature': 0.3052159284585243}. Best is trial 4 with value: 0.8188063845527983.
[I 2025-04-07 22:54:16,231] Trial 5 finished with value: 0.7863575785372745 and parameters: {'iterations': 107, 'learning_rate': 0.00232689773681878, 'objective': 'CrossEntropy', 'colsample_bylevel': 0.9064914542702233, 'depth': 7, 'boosting_type': 'Ordered', 'bootstrap_type': 'Bayesian', 'bagging_temperature': 7.641068184144551}. Best is trial 4 with value: 0.8188063845527983.
[I 2025-04-07 22:54:36,445] Trial 6 finished with value: 0.8038399222578951 and parameters: {'iterations': 236, 'learning_rate': 0.9859682928193301, 'objective': 'Logloss', 'colsample_bylevel': 0.14330605527998133, 'depth': 8, 'boosting_type': 'Ordered', 'bootstrap_type': 'MVS', 'subsample': 0.49425628376691244}. Best is trial 4 with value: 0.8188063845527983.
[I 2025-04-07 22:54:45,746] Trial 7 finished with value: 0.8189743454568139 and parameters: {'iterations': 85, 'learning_rate': 0.3429884828210977, 'objective': 'Logloss', 'colsample_bylevel': 0.6102212254413416, 'depth': 7, 'boosting_type': 'Ordered', 'bootstrap_type': 'Bernoulli', 'subsample': 0.9806983475480598}. Best is trial 7 with value: 0.8189743454568139.
[I 2025-04-07 22:54:49,682] Trial 8 finished with value: 0.8127696503538285 and parameters: {'iterations': 130, 'learning_rate': 0.6499968360803832, 'objective': 'Logloss', 'colsample_bylevel': 0.7214419760531892, 'depth': 7, 'boosting_type': 'Plain', 'bootstrap_type': 'Bernoulli', 'subsample': 0.5032623072532474}. Best is trial 7 with value: 0.8189743454568139.
[I 2025-04-07 22:54:54,128] Trial 9 finished with value: 0.7651440003795726 and parameters: {'iterations': 184, 'learning_rate': 0.026101544569349842, 'objective': 'Logloss', 'colsample_bylevel': 0.15183664476988415, 'depth': 5, 'boosting_type': 'Ordered', 'bootstrap_type': 'Bayesian', 'bagging_temperature': 3.4518180683160917}. Best is trial 7 with value: 0.8189743454568139.
[I 2025-04-07 22:54:55,485] Trial 10 finished with value: 0.809583911039414 and parameters: {'iterations': 67, 'learning_rate': 0.19667747229279994, 'objective': 'Logloss', 'colsample_bylevel': 0.639215406443153, 'depth': 4, 'boosting_type': 'Plain', 'bootstrap_type': 'Bernoulli', 'subsample': 0.9972306940112159}. Best is trial 7 with value: 0.8189743454568139.
[I 2025-04-07 22:55:08,312] Trial 11 finished with value: 0.8164590615065871 and parameters: {'iterations': 86, 'learning_rate': 0.21712529276130554, 'objective': 'Logloss', 'colsample_bylevel': 0.3682542215127503, 'depth': 8, 'boosting_type': 'Ordered', 'bootstrap_type': 'Bernoulli', 'subsample': 0.9899114835084881}. Best is trial 7 with value: 0.8189743454568139.
[I 2025-04-07 22:55:34,601] Trial 12 finished with value: 0.8164592548074812 and parameters: {'iterations': 134, 'learning_rate': 0.08517218263843447, 'objective': 'Logloss', 'colsample_bylevel': 0.7405198911088039, 'depth': 8, 'boosting_type': 'Ordered', 'bootstrap_type': 'Bayesian', 'bagging_temperature': 0.04238437886994789}. Best is trial 7 with value: 0.8189743454568139.
[I 2025-04-07 22:55:44,093] Trial 13 finished with value: 0.8180521068918797 and parameters: {'iterations': 115, 'learning_rate': 0.4328128777390174, 'objective': 'Logloss', 'colsample_bylevel': 0.32533152385706476, 'depth': 6, 'boosting_type': 'Ordered', 'bootstrap_type': 'Bernoulli', 'subsample': 0.7294008344597054}. Best is trial 7 with value: 0.8189743454568139.
[I 2025-04-07 22:55:51,353] Trial 14 finished with value: 0.8052237809303397 and parameters: {'iterations': 64, 'learning_rate': 0.06861338802781207, 'objective': 'Logloss', 'colsample_bylevel': 0.5699135064565916, 'depth': 9, 'boosting_type': 'Plain', 'bootstrap_type': 'MVS', 'subsample': 0.1540282684058898}. Best is trial 7 with value: 0.8189743454568139.
[I 2025-04-07 22:56:00,134] Trial 15 finished with value: 0.8110927299533793 and parameters: {'iterations': 150, 'learning_rate': 0.35531247696431956, 'objective': 'Logloss', 'colsample_bylevel': 0.956858920905822, 'depth': 5, 'boosting_type': 'Ordered', 'bootstrap_type': 'Bayesian', 'bagging_temperature': 3.8055511006386213}. Best is trial 7 with value: 0.8189743454568139.
[I 2025-04-07 22:56:19,755] Trial 16 finished with value: 0.7951618894986653 and parameters: {'iterations': 90, 'learning_rate': 0.009037788274126721, 'objective': 'Logloss', 'colsample_bylevel': 0.8265095165303733, 'depth': 8, 'boosting_type': 'Ordered', 'bootstrap_type': 'Bernoulli', 'subsample': 0.7414096105236327}. Best is trial 7 with value: 0.8189743454568139.
[I 2025-04-07 22:56:32,339] Trial 17 finished with value: 0.7930657170320932 and parameters: {'iterations': 99, 'learning_rate': 0.05935301147112242, 'objective': 'Logloss', 'colsample_bylevel': 0.5407411123807313, 'depth': 6, 'boosting_type': 'Ordered', 'bootstrap_type': 'Bayesian', 'bagging_temperature': 9.786165630378763}. Best is trial 7 with value: 0.8189743454568139.
[I 2025-04-07 22:56:34,754] Trial 18 finished with value: 0.8144887103491542 and parameters: {'iterations': 159, 'learning_rate': 0.932823538543053, 'objective': 'CrossEntropy', 'colsample_bylevel': 0.25874986382022186, 'depth': 4, 'boosting_type': 'Plain', 'bootstrap_type': 'Bernoulli', 'subsample': 0.34078155451569425}. Best is trial 7 with value: 0.8189743454568139.
[I 2025-04-07 22:57:22,726] Trial 19 finished with value: 0.8187648424334123 and parameters: {'iterations': 122, 'learning_rate': 0.4287676071384688, 'objective': 'Logloss', 'colsample_bylevel': 0.6516475318315825, 'depth': 9, 'boosting_type': 'Ordered', 'bootstrap_type': 'MVS', 'subsample': 0.8449460488433325}. Best is trial 7 with value: 0.8189743454568139.
[I 2025-04-07 22:57:31,054] Trial 20 finished with value: 0.8121830524319889 and parameters: {'iterations': 80, 'learning_rate': 0.14863312315437877, 'objective': 'Logloss', 'colsample_bylevel': 0.41468566771203935, 'depth': 7, 'boosting_type': 'Ordered', 'bootstrap_type': 'Bernoulli', 'subsample': 0.6130848328899143}. Best is trial 7 with value: 0.8189743454568139.
[I 2025-04-07 22:58:23,646] Trial 21 finished with value: 0.8198128495890599 and parameters: {'iterations': 120, 'learning_rate': 0.34431885544853635, 'objective': 'Logloss', 'colsample_bylevel': 0.6660664056443854, 'depth': 9, 'boosting_type': 'Ordered', 'bootstrap_type': 'MVS', 'subsample': 0.877650948797084}. Best is trial 21 with value: 0.8198128495890599.
[I 2025-04-07 22:58:55,070] Trial 22 finished with value: 0.819644976549087 and parameters: {'iterations': 139, 'learning_rate': 0.27833914426281564, 'objective': 'Logloss', 'colsample_bylevel': 0.5210882834067405, 'depth': 8, 'boosting_type': 'Ordered', 'bootstrap_type': 'MVS', 'subsample': 0.8641547232958766}. Best is trial 21 with value: 0.8198128495890599.
[I 2025-04-07 22:59:24,426] Trial 23 finished with value: 0.8185130240870485 and parameters: {'iterations': 146, 'learning_rate': 0.2679609495359144, 'objective': 'Logloss', 'colsample_bylevel': 0.5411080642378969, 'depth': 8, 'boosting_type': 'Ordered', 'bootstrap_type': 'MVS', 'subsample': 0.8900496032755111}. Best is trial 21 with value: 0.8198128495890599.
[I 2025-04-07 22:59:45,827] Trial 24 finished with value: 0.8154949293660962 and parameters: {'iterations': 102, 'learning_rate': 0.10425503055830725, 'objective': 'Logloss', 'colsample_bylevel': 0.7539014845272071, 'depth': 8, 'boosting_type': 'Ordered', 'bootstrap_type': 'MVS', 'subsample': 0.8712841077914705}. Best is trial 21 with value: 0.8198128495890599.
[I 2025-04-07 23:00:00,066] Trial 25 finished with value: 0.8100868799654167 and parameters: {'iterations': 140, 'learning_rate': 0.05299149306366444, 'objective': 'Logloss', 'colsample_bylevel': 0.6340475159548518, 'depth': 7, 'boosting_type': 'Ordered', 'bootstrap_type': 'MVS', 'subsample': 0.8924894847769728}. Best is trial 21 with value: 0.8198128495890599.
[I 2025-04-07 23:00:05,958] Trial 26 finished with value: 0.8191838836258327 and parameters: {'iterations': 165, 'learning_rate': 0.2474495991470573, 'objective': 'CrossEntropy', 'colsample_bylevel': 0.8375809933897187, 'depth': 8, 'boosting_type': 'Plain', 'bootstrap_type': 'MVS', 'subsample': 0.6363917780717513}. Best is trial 21 with value: 0.8198128495890599.
[I 2025-04-07 23:00:23,511] Trial 27 finished with value: 0.8018278532529906 and parameters: {'iterations': 169, 'learning_rate': 0.014009871689687925, 'objective': 'CrossEntropy', 'colsample_bylevel': 0.8683975263294449, 'depth': 9, 'boosting_type': 'Plain', 'bootstrap_type': 'MVS', 'subsample': 0.6189578753750635}. Best is trial 21 with value: 0.8198128495890599.
[I 2025-04-07 23:00:36,633] Trial 28 finished with value: 0.8159560047165417 and parameters: {'iterations': 208, 'learning_rate': 0.045898354777279424, 'objective': 'CrossEntropy', 'colsample_bylevel': 0.7933326991011778, 'depth': 8, 'boosting_type': 'Plain', 'bootstrap_type': 'MVS', 'subsample': 0.7859211906869897}. Best is trial 21 with value: 0.8198128495890599.
[I 2025-04-07 23:01:04,447] Trial 29 finished with value: 0.8172554260439566 and parameters: {'iterations': 205, 'learning_rate': 0.12546410057098273, 'objective': 'CrossEntropy', 'colsample_bylevel': 0.48765833565090344, 'depth': 9, 'boosting_type': 'Plain', 'bootstrap_type': 'MVS', 'subsample': 0.6213642664530579}. Best is trial 21 with value: 0.8198128495890599.
[I 2025-04-07 23:01:39,470] Trial 30 finished with value: 0.8136917307634859 and parameters: {'iterations': 255, 'learning_rate': 0.16963310677300572, 'objective': 'CrossEntropy', 'colsample_bylevel': 0.7143650541177368, 'depth': 9, 'boosting_type': 'Plain', 'bootstrap_type': 'MVS', 'subsample': 0.4158375503417238}. Best is trial 21 with value: 0.8198128495890599.
[I 2025-04-07 23:02:11,217] Trial 31 finished with value: 0.8201901377883918 and parameters: {'iterations': 158, 'learning_rate': 0.30071818133706435, 'objective': 'CrossEntropy', 'colsample_bylevel': 0.6121630703587579, 'depth': 8, 'boosting_type': 'Ordered', 'bootstrap_type': 'MVS', 'subsample': 0.9453909142443024}. Best is trial 31 with value: 0.8201901377883918.
[I 2025-04-07 23:02:13,981] A new study created in RDB with name: catboost-num_features-7
[I 2025-04-07 23:02:40,113] Trial 0 finished with value: 0.8167103526686945 and parameters: {'iterations': 158, 'learning_rate': 0.30071818133706435, 'objective': 'CrossEntropy', 'colsample_bylevel': 0.6121630703587579, 'depth': 8, 'boosting_type': 'Ordered', 'bootstrap_type': 'MVS', 'subsample': 0.9453909142443024}. Best is trial 0 with value: 0.8167103526686945.
[I 2025-04-07 23:02:45,762] Trial 1 finished with value: 0.7901309877148496 and parameters: {'iterations': 127, 'learning_rate': 0.01353313225660163, 'objective': 'Logloss', 'colsample_bylevel': 0.5392849468484529, 'depth': 5, 'boosting_type': 'Ordered', 'bootstrap_type': 'MVS', 'subsample': 0.9364665959463766}. Best is trial 0 with value: 0.8167103526686945.
[I 2025-04-07 23:03:14,511] Trial 2 finished with value: 0.8149917144207739 and parameters: {'iterations': 80, 'learning_rate': 0.2864639128645811, 'objective': 'Logloss', 'colsample_bylevel': 0.6928602621388695, 'depth': 9, 'boosting_type': 'Ordered', 'bootstrap_type': 'Bernoulli', 'subsample': 0.32044445864385496}. Best is trial 0 with value: 0.8167103526686945.
[I 2025-04-07 23:03:20,180] Trial 3 finished with value: 0.8045950082680063 and parameters: {'iterations': 124, 'learning_rate': 0.10848028065694802, 'objective': 'CrossEntropy', 'colsample_bylevel': 0.6307611576350606, 'depth': 4, 'boosting_type': 'Ordered', 'bootstrap_type': 'Bernoulli', 'subsample': 0.49977952407356163}. Best is trial 0 with value: 0.8167103526686945.
[I 2025-04-07 23:03:29,809] Trial 4 finished with value: 0.8086195328796034 and parameters: {'iterations': 231, 'learning_rate': 0.28797185399588826, 'objective': 'CrossEntropy', 'colsample_bylevel': 0.23343685911861292, 'depth': 8, 'boosting_type': 'Plain', 'bootstrap_type': 'Bayesian', 'bagging_temperature': 7.851696602936268}. Best is trial 0 with value: 0.8167103526686945.
[I 2025-04-07 23:03:36,905] Trial 5 finished with value: 0.8063556455283353 and parameters: {'iterations': 240, 'learning_rate': 0.10198285206320526, 'objective': 'Logloss', 'colsample_bylevel': 0.3091524131299337, 'depth': 6, 'boosting_type': 'Plain', 'bootstrap_type': 'Bernoulli', 'subsample': 0.1077293726865573}. Best is trial 0 with value: 0.8167103526686945.
[I 2025-04-07 23:03:39,420] Trial 6 finished with value: 0.7959167470622657 and parameters: {'iterations': 190, 'learning_rate': 0.14114282718566445, 'objective': 'CrossEntropy', 'colsample_bylevel': 0.3273666566335187, 'depth': 4, 'boosting_type': 'Plain', 'bootstrap_type': 'Bayesian', 'bagging_temperature': 7.572937290434445}. Best is trial 0 with value: 0.8167103526686945.
[I 2025-04-07 23:03:45,696] Trial 7 finished with value: 0.8084932722502509 and parameters: {'iterations': 184, 'learning_rate': 0.17047586996055986, 'objective': 'CrossEntropy', 'colsample_bylevel': 0.4119969818874084, 'depth': 4, 'boosting_type': 'Ordered', 'bootstrap_type': 'MVS', 'subsample': 0.7446683941937556}. Best is trial 0 with value: 0.8167103526686945.
[I 2025-04-07 23:03:49,493] Trial 8 finished with value: 0.7962940352615976 and parameters: {'iterations': 79, 'learning_rate': 0.015608844368226312, 'objective': 'CrossEntropy', 'colsample_bylevel': 0.6972532496675345, 'depth': 8, 'boosting_type': 'Plain', 'bootstrap_type': 'MVS', 'subsample': 0.7010837132856}. Best is trial 0 with value: 0.8167103526686945.
[I 2025-04-07 23:04:25,409] Trial 9 finished with value: 0.7854354805548087 and parameters: {'iterations': 140, 'learning_rate': 0.005638299391229887, 'objective': 'CrossEntropy', 'colsample_bylevel': 0.37881184251592925, 'depth': 9, 'boosting_type': 'Ordered', 'bootstrap_type': 'Bayesian', 'bagging_temperature': 6.99170966804674}. Best is trial 0 with value: 0.8167103526686945.
