[I 2025-04-07 23:50:11,555] Trial 49 finished with value: 0.8157883074046544 and parameters: {'n_estimators': 189, 'criterion': 'gini', 'max_depth': 19, 'min_samples_split': 12, 'min_samples_leaf': 9}. Best is trial 45 with value: 0.8160818435984893.
[I 2025-04-07 23:50:23,249] Trial 50 finished with value: 0.7542439914174404 and parameters: {'n_estimators': 185, 'criterion': 'gini', 'max_depth': 2, 'min_samples_split': 11, 'min_samples_leaf': 10}. Best is trial 45 with value: 0.8160818435984893.
[I 2025-04-07 23:50:34,942] Trial 51 finished with value: 0.8159978807192901 and parameters: {'n_estimators': 195, 'criterion': 'gini', 'max_depth': 19, 'min_samples_split': 12, 'min_samples_leaf': 9}. Best is trial 45 with value: 0.8160818435984893.
[I 2025-04-07 23:50:50,624] Trial 52 finished with value: 0.8157883425502714 and parameters: {'n_estimators': 195, 'criterion': 'gini', 'max_depth': 19, 'min_samples_split': 12, 'min_samples_leaf': 11}. Best is trial 45 with value: 0.8160818435984893.
[I 2025-04-07 23:51:08,291] Trial 53 finished with value: 0.8144887806403883 and parameters: {'n_estimators': 193, 'criterion': 'gini', 'max_depth': 20, 'min_samples_split': 12, 'min_samples_leaf': 7}. Best is trial 45 with value: 0.8160818435984893.
[I 2025-04-07 23:51:23,684] Trial 54 finished with value: 0.8158302536986369 and parameters: {'n_estimators': 200, 'criterion': 'gini', 'max_depth': 24, 'min_samples_split': 15, 'min_samples_leaf': 11}. Best is trial 45 with value: 0.8160818435984893.
[I 2025-04-07 23:51:38,405] Trial 55 finished with value: 0.8155787692356355 and parameters: {'n_estimators': 200, 'criterion': 'gini', 'max_depth': 18, 'min_samples_split': 10, 'min_samples_leaf': 8}. Best is trial 45 with value: 0.8160818435984893.
[I 2025-04-07 23:51:52,947] Trial 56 finished with value: 0.8150755542903132 and parameters: {'n_estimators': 192, 'criterion': 'gini', 'max_depth': 23, 'min_samples_split': 15, 'min_samples_leaf': 9}. Best is trial 45 with value: 0.8160818435984893.
[I 2025-04-07 23:52:03,826] Trial 57 finished with value: 0.8152852681874174 and parameters: {'n_estimators': 185, 'criterion': 'gini', 'max_depth': 14, 'min_samples_split': 12, 'min_samples_leaf': 10}. Best is trial 45 with value: 0.8160818435984893.
[I 2025-04-07 23:52:05,116] Trial 58 finished with value: 0.8140695285742654 and parameters: {'n_estimators': 10, 'criterion': 'gini', 'max_depth': 25, 'min_samples_split': 13, 'min_samples_leaf': 11}. Best is trial 45 with value: 0.8160818435984893.
[I 2025-04-07 23:52:15,292] Trial 59 finished with value: 0.8019536745621295 and parameters: {'n_estimators': 179, 'criterion': 'gini', 'max_depth': 7, 'min_samples_split': 17, 'min_samples_leaf': 8}. Best is trial 45 with value: 0.8160818435984893.
[I 2025-04-07 23:52:26,853] Trial 60 finished with value: 0.8149918550032421 and parameters: {'n_estimators': 195, 'criterion': 'gini', 'max_depth': 18, 'min_samples_split': 13, 'min_samples_leaf': 9}. Best is trial 45 with value: 0.8160818435984893.
[I 2025-04-07 23:52:38,310] Trial 61 finished with value: 0.81511757087553 and parameters: {'n_estimators': 168, 'criterion': 'gini', 'max_depth': 22, 'min_samples_split': 14, 'min_samples_leaf': 12}. Best is trial 45 with value: 0.8160818435984893.
[I 2025-04-07 23:52:39,917] A new study created in RDB with name: random-forest-num_features-2
[I 2025-04-07 23:52:50,243] Trial 0 finished with value: 0.8105059563034545 and parameters: {'n_estimators': 161, 'criterion': 'gini', 'max_depth': 20, 'min_samples_split': 15, 'min_samples_leaf': 11}. Best is trial 0 with value: 0.8105059563034545.
[I 2025-04-07 23:53:01,314] Trial 1 finished with value: 0.809877113349887 and parameters: {'n_estimators': 154, 'criterion': 'gini', 'max_depth': 64, 'min_samples_split': 13, 'min_samples_leaf': 19}. Best is trial 0 with value: 0.8105059563034545.
[I 2025-04-07 23:53:12,462] Trial 2 finished with value: 0.810170421097211 and parameters: {'n_estimators': 167, 'criterion': 'gini', 'max_depth': 37, 'min_samples_split': 9, 'min_samples_leaf': 18}. Best is trial 0 with value: 0.8105059563034545.
[I 2025-04-07 23:53:17,279] Trial 3 finished with value: 0.8101286505313139 and parameters: {'n_estimators': 72, 'criterion': 'entropy', 'max_depth': 43, 'min_samples_split': 2, 'min_samples_leaf': 19}. Best is trial 0 with value: 0.8105059563034545.
[I 2025-04-07 23:53:19,502] Trial 4 finished with value: 0.7957909784715523 and parameters: {'n_estimators': 30, 'criterion': 'entropy', 'max_depth': 5, 'min_samples_split': 16, 'min_samples_leaf': 7}. Best is trial 0 with value: 0.8105059563034545.
[I 2025-04-07 23:53:29,489] Trial 5 finished with value: 0.8062296836367278 and parameters: {'n_estimators': 168, 'criterion': 'gini', 'max_depth': 37, 'min_samples_split': 10, 'min_samples_leaf': 5}. Best is trial 0 with value: 0.8105059563034545.
[I 2025-04-07 23:53:40,907] Trial 6 finished with value: 0.7678271573697724 and parameters: {'n_estimators': 175, 'criterion': 'entropy', 'max_depth': 3, 'min_samples_split': 4, 'min_samples_leaf': 13}. Best is trial 0 with value: 0.8105059563034545.
[I 2025-04-07 23:53:53,742] Trial 7 finished with value: 0.8100029873774517 and parameters: {'n_estimators': 156, 'criterion': 'gini', 'max_depth': 59, 'min_samples_split': 15, 'min_samples_leaf': 9}. Best is trial 0 with value: 0.8105059563034545.
[I 2025-04-07 23:53:56,045] Trial 8 finished with value: 0.8099190947894865 and parameters: {'n_estimators': 19, 'criterion': 'gini', 'max_depth': 58, 'min_samples_split': 3, 'min_samples_leaf': 7}. Best is trial 0 with value: 0.8105059563034545.
[I 2025-04-07 23:53:58,467] Trial 9 finished with value: 0.8079487436320536 and parameters: {'n_estimators': 24, 'criterion': 'entropy', 'max_depth': 33, 'min_samples_split': 3, 'min_samples_leaf': 6}. Best is trial 0 with value: 0.8105059563034545.
[I 2025-04-07 23:54:05,040] Trial 10 finished with value: 0.8109671019451342 and parameters: {'n_estimators': 106, 'criterion': 'gini', 'max_depth': 21, 'min_samples_split': 20, 'min_samples_leaf': 13}. Best is trial 10 with value: 0.8109671019451342.
[I 2025-04-07 23:54:13,289] Trial 11 finished with value: 0.8110928353902306 and parameters: {'n_estimators': 114, 'criterion': 'gini', 'max_depth': 18, 'min_samples_split': 19, 'min_samples_leaf': 13}. Best is trial 11 with value: 0.8110928353902306.
[I 2025-04-07 23:54:22,827] Trial 12 finished with value: 0.8099189893526353 and parameters: {'n_estimators': 111, 'criterion': 'gini', 'max_depth': 19, 'min_samples_split': 20, 'min_samples_leaf': 14}. Best is trial 11 with value: 0.8110928353902306.
[I 2025-04-07 23:54:31,424] Trial 13 finished with value: 0.8092483055419366 and parameters: {'n_estimators': 111, 'criterion': 'gini', 'max_depth': 18, 'min_samples_split': 20, 'min_samples_leaf': 1}. Best is trial 11 with value: 0.8110928353902306.
[I 2025-04-07 23:54:37,821] Trial 14 finished with value: 0.8098351670559044 and parameters: {'n_estimators': 80, 'criterion': 'gini', 'max_depth': 27, 'min_samples_split': 18, 'min_samples_leaf': 15}. Best is trial 11 with value: 0.8110928353902306.
[I 2025-04-07 23:54:46,709] Trial 15 finished with value: 0.8073621105645967 and parameters: {'n_estimators': 132, 'criterion': 'gini', 'max_depth': 10, 'min_samples_split': 7, 'min_samples_leaf': 16}. Best is trial 11 with value: 0.8110928353902306.
[I 2025-04-07 23:54:51,622] Trial 16 finished with value: 0.8086196031708376 and parameters: {'n_estimators': 79, 'criterion': 'gini', 'max_depth': 11, 'min_samples_split': 18, 'min_samples_leaf': 11}. Best is trial 11 with value: 0.8110928353902306.
[I 2025-04-07 23:55:03,206] Trial 17 finished with value: 0.8103383117099924 and parameters: {'n_estimators': 194, 'criterion': 'gini', 'max_depth': 27, 'min_samples_split': 12, 'min_samples_leaf': 12}. Best is trial 11 with value: 0.8110928353902306.
[I 2025-04-07 23:55:06,969] Trial 18 finished with value: 0.8100447755161573 and parameters: {'n_estimators': 54, 'criterion': 'entropy', 'max_depth': 47, 'min_samples_split': 18, 'min_samples_leaf': 16}. Best is trial 11 with value: 0.8110928353902306.
[I 2025-04-07 23:55:15,529] Trial 19 finished with value: 0.8104641505919401 and parameters: {'n_estimators': 137, 'criterion': 'gini', 'max_depth': 25, 'min_samples_split': 20, 'min_samples_leaf': 9}. Best is trial 11 with value: 0.8110928353902306.
[I 2025-04-07 23:55:21,564] Trial 20 finished with value: 0.8091644480995885 and parameters: {'n_estimators': 96, 'criterion': 'gini', 'max_depth': 12, 'min_samples_split': 17, 'min_samples_leaf': 17}. Best is trial 11 with value: 0.8110928353902306.
[I 2025-04-07 23:55:31,546] Trial 21 finished with value: 0.8105478147333942 and parameters: {'n_estimators': 129, 'criterion': 'gini', 'max_depth': 19, 'min_samples_split': 14, 'min_samples_leaf': 11}. Best is trial 11 with value: 0.8110928353902306.
[I 2025-04-07 23:55:40,640] Trial 22 finished with value: 0.8104639924366632 and parameters: {'n_estimators': 129, 'criterion': 'gini', 'max_depth': 17, 'min_samples_split': 14, 'min_samples_leaf': 13}. Best is trial 11 with value: 0.8110928353902306.
[I 2025-04-07 23:55:47,833] Trial 23 finished with value: 0.8105480607527136 and parameters: {'n_estimators': 96, 'criterion': 'gini', 'max_depth': 25, 'min_samples_split': 17, 'min_samples_leaf': 9}. Best is trial 11 with value: 0.8110928353902306.
[I 2025-04-07 23:55:54,175] Trial 24 finished with value: 0.810799580361332 and parameters: {'n_estimators': 97, 'criterion': 'gini', 'max_depth': 32, 'min_samples_split': 19, 'min_samples_leaf': 9}. Best is trial 11 with value: 0.8110928353902306.
[I 2025-04-07 23:55:59,144] Trial 25 finished with value: 0.8095417362989205 and parameters: {'n_estimators': 64, 'criterion': 'gini', 'max_depth': 33, 'min_samples_split': 19, 'min_samples_leaf': 14}. Best is trial 11 with value: 0.8110928353902306.
[I 2025-04-07 23:56:03,031] Trial 26 finished with value: 0.8103803458680175 and parameters: {'n_estimators': 46, 'criterion': 'entropy', 'max_depth': 45, 'min_samples_split': 16, 'min_samples_leaf': 10}. Best is trial 11 with value: 0.8110928353902306.
[I 2025-04-07 23:56:09,936] Trial 27 finished with value: 0.8079068676293051 and parameters: {'n_estimators': 92, 'criterion': 'gini', 'max_depth': 30, 'min_samples_split': 20, 'min_samples_leaf': 1}. Best is trial 11 with value: 0.8110928353902306.
[I 2025-04-07 23:56:18,145] Trial 28 finished with value: 0.8039237445546259 and parameters: {'n_estimators': 118, 'criterion': 'gini', 'max_depth': 39, 'min_samples_split': 7, 'min_samples_leaf': 4}. Best is trial 11 with value: 0.8110928353902306.
[I 2025-04-07 23:56:27,091] Trial 29 finished with value: 0.8100867393829484 and parameters: {'n_estimators': 141, 'criterion': 'gini', 'max_depth': 14, 'min_samples_split': 16, 'min_samples_leaf': 12}. Best is trial 11 with value: 0.8110928353902306.
[I 2025-04-07 23:56:32,805] Trial 30 finished with value: 0.8099190596438696 and parameters: {'n_estimators': 89, 'criterion': 'gini', 'max_depth': 24, 'min_samples_split': 19, 'min_samples_leaf': 8}. Best is trial 11 with value: 0.8110928353902306.
[I 2025-04-07 23:56:38,984] Trial 31 finished with value: 0.8105059738762629 and parameters: {'n_estimators': 100, 'criterion': 'gini', 'max_depth': 23, 'min_samples_split': 17, 'min_samples_leaf': 10}. Best is trial 11 with value: 0.8110928353902306.
[I 2025-04-07 23:56:46,095] Trial 32 finished with value: 0.8105480783255222 and parameters: {'n_estimators': 117, 'criterion': 'gini', 'max_depth': 29, 'min_samples_split': 18, 'min_samples_leaf': 9}. Best is trial 11 with value: 0.8110928353902306.
[I 2025-04-07 23:56:53,506] Trial 33 finished with value: 0.8108413157816121 and parameters: {'n_estimators': 115, 'criterion': 'gini', 'max_depth': 31, 'min_samples_split': 19, 'min_samples_leaf': 12}. Best is trial 11 with value: 0.8110928353902306.
[I 2025-04-07 23:57:02,300] Trial 34 finished with value: 0.8104640451550889 and parameters: {'n_estimators': 143, 'criterion': 'gini', 'max_depth': 50, 'min_samples_split': 15, 'min_samples_leaf': 13}. Best is trial 11 with value: 0.8110928353902306.
[I 2025-04-07 23:57:09,453] Trial 35 finished with value: 0.8111766928325785 and parameters: {'n_estimators': 120, 'criterion': 'gini', 'max_depth': 38, 'min_samples_split': 19, 'min_samples_leaf': 12}. Best is trial 35 with value: 0.8111766928325785.
[I 2025-04-07 23:57:18,977] Trial 36 finished with value: 0.8107155647637072 and parameters: {'n_estimators': 121, 'criterion': 'entropy', 'max_depth': 39, 'min_samples_split': 12, 'min_samples_leaf': 15}. Best is trial 35 with value: 0.8111766928325785.
[I 2025-04-07 23:57:28,948] Trial 37 finished with value: 0.8103381535547156 and parameters: {'n_estimators': 150, 'criterion': 'gini', 'max_depth': 35, 'min_samples_split': 19, 'min_samples_leaf': 18}. Best is trial 35 with value: 0.8111766928325785.
[I 2025-04-07 23:57:35,798] Trial 38 finished with value: 0.8019119391418494 and parameters: {'n_estimators': 107, 'criterion': 'gini', 'max_depth': 7, 'min_samples_split': 17, 'min_samples_leaf': 20}. Best is trial 35 with value: 0.8111766928325785.
[I 2025-04-07 23:57:45,181] Trial 39 finished with value: 0.8107576516401581 and parameters: {'n_estimators': 125, 'criterion': 'entropy', 'max_depth': 42, 'min_samples_split': 9, 'min_samples_leaf': 12}. Best is trial 35 with value: 0.8111766928325785.
[I 2025-04-07 23:57:59,453] Trial 40 finished with value: 0.8101286153856968 and parameters: {'n_estimators': 165, 'criterion': 'gini', 'max_depth': 22, 'min_samples_split': 15, 'min_samples_leaf': 14}. Best is trial 35 with value: 0.8111766928325785.
[I 2025-04-07 23:58:08,368] Trial 41 finished with value: 0.8104219582786378 and parameters: {'n_estimators': 105, 'criterion': 'gini', 'max_depth': 31, 'min_samples_split': 19, 'min_samples_leaf': 11}. Best is trial 35 with value: 0.8111766928325785.
[I 2025-04-07 23:58:14,868] Trial 42 finished with value: 0.8100448458073914 and parameters: {'n_estimators': 75, 'criterion': 'gini', 'max_depth': 37, 'min_samples_split': 20, 'min_samples_leaf': 13}. Best is trial 35 with value: 0.8111766928325785.
[I 2025-04-07 23:58:21,897] Trial 43 finished with value: 0.8108832093571691 and parameters: {'n_estimators': 86, 'criterion': 'gini', 'max_depth': 15, 'min_samples_split': 19, 'min_samples_leaf': 12}. Best is trial 35 with value: 0.8111766928325785.
[I 2025-04-07 23:58:28,635] Trial 44 finished with value: 0.8032534649185237 and parameters: {'n_estimators': 85, 'criterion': 'gini', 'max_depth': 7, 'min_samples_split': 18, 'min_samples_leaf': 15}. Best is trial 35 with value: 0.8111766928325785.
[I 2025-04-07 23:58:33,830] Trial 45 finished with value: 0.8100866690917142 and parameters: {'n_estimators': 62, 'criterion': 'gini', 'max_depth': 14, 'min_samples_split': 20, 'min_samples_leaf': 12}. Best is trial 35 with value: 0.8111766928325785.
[I 2025-04-07 23:58:42,326] Trial 46 finished with value: 0.8097932734803475 and parameters: {'n_estimators': 112, 'criterion': 'gini', 'max_depth': 16, 'min_samples_split': 16, 'min_samples_leaf': 14}. Best is trial 35 with value: 0.8111766928325785.
[I 2025-04-07 23:58:51,373] Trial 47 finished with value: 0.8107574583392643 and parameters: {'n_estimators': 152, 'criterion': 'entropy', 'max_depth': 20, 'min_samples_split': 19, 'min_samples_leaf': 11}. Best is trial 35 with value: 0.8111766928325785.
[I 2025-04-07 23:58:54,260] Trial 48 finished with value: 0.7568853075505086 and parameters: {'n_estimators': 38, 'criterion': 'gini', 'max_depth': 3, 'min_samples_split': 18, 'min_samples_leaf': 16}. Best is trial 35 with value: 0.8111766928325785.
[I 2025-04-07 23:58:58,947] Trial 49 finished with value: 0.8108414212184634 and parameters: {'n_estimators': 68, 'criterion': 'gini', 'max_depth': 53, 'min_samples_split': 17, 'min_samples_leaf': 12}. Best is trial 35 with value: 0.8111766928325785.
[I 2025-04-07 23:59:03,972] Trial 50 finished with value: 0.8107155823365157 and parameters: {'n_estimators': 65, 'criterion': 'gini', 'max_depth': 63, 'min_samples_split': 14, 'min_samples_leaf': 10}. Best is trial 35 with value: 0.8111766928325785.
[I 2025-04-07 23:59:09,425] Trial 51 finished with value: 0.8105898840370365 and parameters: {'n_estimators': 83, 'criterion': 'gini', 'max_depth': 53, 'min_samples_split': 20, 'min_samples_leaf': 12}. Best is trial 35 with value: 0.8111766928325785.
[I 2025-04-07 23:59:14,231] Trial 52 finished with value: 0.8099190420710609 and parameters: {'n_estimators': 73, 'criterion': 'gini', 'max_depth': 58, 'min_samples_split': 17, 'min_samples_leaf': 13}. Best is trial 35 with value: 0.8111766928325785.
[I 2025-04-07 23:59:20,668] Trial 53 finished with value: 0.8108412454903782 and parameters: {'n_estimators': 103, 'criterion': 'gini', 'max_depth': 51, 'min_samples_split': 18, 'min_samples_leaf': 15}. Best is trial 35 with value: 0.8111766928325785.
[I 2025-04-07 23:59:27,433] Trial 54 finished with value: 0.8105477971605856 and parameters: {'n_estimators': 111, 'criterion': 'gini', 'max_depth': 55, 'min_samples_split': 19, 'min_samples_leaf': 14}. Best is trial 35 with value: 0.8111766928325785.
[I 2025-04-07 23:59:35,623] Trial 55 finished with value: 0.8105058860122203 and parameters: {'n_estimators': 134, 'criterion': 'gini', 'max_depth': 21, 'min_samples_split': 20, 'min_samples_leaf': 13}. Best is trial 35 with value: 0.8111766928325785.
[I 2025-04-07 23:59:41,625] Trial 56 finished with value: 0.8105477971605856 and parameters: {'n_estimators': 88, 'criterion': 'gini', 'max_depth': 14, 'min_samples_split': 18, 'min_samples_leaf': 11}. Best is trial 35 with value: 0.8111766928325785.
[I 2025-04-07 23:59:50,529] Trial 57 finished with value: 0.8109251556511516 and parameters: {'n_estimators': 122, 'criterion': 'gini', 'max_depth': 26, 'min_samples_split': 5, 'min_samples_leaf': 12}. Best is trial 35 with value: 0.8111766928325785.
[I 2025-04-07 23:59:54,264] Trial 58 finished with value: 0.8104641330191316 and parameters: {'n_estimators': 52, 'criterion': 'entropy', 'max_depth': 28, 'min_samples_split': 6, 'min_samples_leaf': 10}. Best is trial 35 with value: 0.8111766928325785.
[I 2025-04-08 00:00:02,261] Trial 59 finished with value: 0.8068589834833173 and parameters: {'n_estimators': 126, 'criterion': 'gini', 'max_depth': 9, 'min_samples_split': 3, 'min_samples_leaf': 8}. Best is trial 35 with value: 0.8111766928325785.
[I 2025-04-08 00:00:08,473] Trial 60 finished with value: 0.8100447755161573 and parameters: {'n_estimators': 93, 'criterion': 'gini', 'max_depth': 26, 'min_samples_split': 5, 'min_samples_leaf': 17}. Best is trial 35 with value: 0.8111766928325785.
[I 2025-04-08 00:00:15,555] Trial 61 finished with value: 0.811008925229457 and parameters: {'n_estimators': 116, 'criterion': 'gini', 'max_depth': 16, 'min_samples_split': 11, 'min_samples_leaf': 12}. Best is trial 35 with value: 0.8111766928325785.
[I 2025-04-08 00:00:25,134] Trial 62 finished with value: 0.8104220637154892 and parameters: {'n_estimators': 124, 'criterion': 'gini', 'max_depth': 17, 'min_samples_split': 10, 'min_samples_leaf': 13}. Best is trial 35 with value: 0.8111766928325785.
[I 2025-04-08 00:00:33,158] Trial 63 finished with value: 0.8104639924366632 and parameters: {'n_estimators': 107, 'criterion': 'gini', 'max_depth': 19, 'min_samples_split': 8, 'min_samples_leaf': 12}. Best is trial 35 with value: 0.8111766928325785.
[I 2025-04-08 00:00:41,745] Trial 64 finished with value: 0.8100867393829484 and parameters: {'n_estimators': 144, 'criterion': 'gini', 'max_depth': 15, 'min_samples_split': 11, 'min_samples_leaf': 14}. Best is trial 35 with value: 0.8111766928325785.
[I 2025-04-08 00:00:53,485] Trial 65 finished with value: 0.8102543136851761 and parameters: {'n_estimators': 183, 'criterion': 'gini', 'max_depth': 22, 'min_samples_split': 2, 'min_samples_leaf': 11}. Best is trial 35 with value: 0.8111766928325785.
[I 2025-04-08 00:01:01,517] Trial 66 finished with value: 0.8097932031891133 and parameters: {'n_estimators': 134, 'criterion': 'gini', 'max_depth': 12, 'min_samples_split': 5, 'min_samples_leaf': 12}. Best is trial 35 with value: 0.8111766928325785.
[I 2025-04-08 00:01:07,988] Trial 67 finished with value: 0.8106736360425332 and parameters: {'n_estimators': 101, 'criterion': 'gini', 'max_depth': 61, 'min_samples_split': 12, 'min_samples_leaf': 10}. Best is trial 35 with value: 0.8111766928325785.
[I 2025-04-08 00:01:16,638] Trial 68 finished with value: 0.8103382238459499 and parameters: {'n_estimators': 122, 'criterion': 'gini', 'max_depth': 18, 'min_samples_split': 13, 'min_samples_leaf': 13}. Best is trial 35 with value: 0.8111766928325785.
[I 2025-04-08 00:01:22,565] Trial 69 finished with value: 0.8106316897485506 and parameters: {'n_estimators': 78, 'criterion': 'entropy', 'max_depth': 24, 'min_samples_split': 8, 'min_samples_leaf': 15}. Best is trial 35 with value: 0.8111766928325785.
[I 2025-04-08 00:01:29,631] Trial 70 finished with value: 0.8107154417540474 and parameters: {'n_estimators': 116, 'criterion': 'gini', 'max_depth': 43, 'min_samples_split': 16, 'min_samples_leaf': 11}. Best is trial 35 with value: 0.8111766928325785.
[I 2025-04-08 00:01:37,912] Trial 71 finished with value: 0.8113863891568742 and parameters: {'n_estimators': 113, 'criterion': 'gini', 'max_depth': 34, 'min_samples_split': 19, 'min_samples_leaf': 12}. Best is trial 71 with value: 0.8113863891568742.
[I 2025-04-08 00:01:44,475] Trial 72 finished with value: 0.8108413157816121 and parameters: {'n_estimators': 98, 'criterion': 'gini', 'max_depth': 35, 'min_samples_split': 20, 'min_samples_leaf': 12}. Best is trial 71 with value: 0.8113863891568742.
[I 2025-04-08 00:01:52,539] Trial 73 finished with value: 0.8106736711881503 and parameters: {'n_estimators': 108, 'criterion': 'gini', 'max_depth': 48, 'min_samples_split': 19, 'min_samples_leaf': 13}. Best is trial 71 with value: 0.8113863891568742.
