[I 2025-04-07 23:56:43,714] Trial 48 finished with value: 0.8138179913928383 and parameters: {'iterations': 157, 'learning_rate': 0.4314962209106577, 'objective': 'Logloss', 'colsample_bylevel': 0.6567728608998546, 'depth': 8, 'boosting_type': 'Plain', 'bootstrap_type': 'MVS', 'subsample': 0.2630544311908606}. Best is trial 46 with value: 0.8149496626899401.
[I 2025-04-07 23:56:45,444] Trial 49 finished with value: 0.7983482438613787 and parameters: {'iterations': 124, 'learning_rate': 0.10627817574160943, 'objective': 'Logloss', 'colsample_bylevel': 0.44415393587301955, 'depth': 9, 'boosting_type': 'Plain', 'bootstrap_type': 'MVS', 'subsample': 0.3185752877367529}. Best is trial 46 with value: 0.8149496626899401.
[I 2025-04-07 23:56:50,077] Trial 50 finished with value: 0.795916395606095 and parameters: {'iterations': 144, 'learning_rate': 0.2076626557241055, 'objective': 'Logloss', 'colsample_bylevel': 0.5356590765647629, 'depth': 8, 'boosting_type': 'Ordered', 'bootstrap_type': 'MVS', 'subsample': 0.3623849347298792}. Best is trial 46 with value: 0.8149496626899401.
[I 2025-04-07 23:56:54,390] Trial 51 finished with value: 0.8136503995178022 and parameters: {'iterations': 159, 'learning_rate': 0.4554044481477051, 'objective': 'Logloss', 'colsample_bylevel': 0.6496091578446886, 'depth': 9, 'boosting_type': 'Plain', 'bootstrap_type': 'MVS', 'subsample': 0.27970783257813053}. Best is trial 46 with value: 0.8149496626899401.
[I 2025-04-07 23:56:58,450] Trial 52 finished with value: 0.8145307445071793 and parameters: {'iterations': 155, 'learning_rate': 0.32449241413940877, 'objective': 'Logloss', 'colsample_bylevel': 0.6562573381989758, 'depth': 9, 'boosting_type': 'Plain', 'bootstrap_type': 'MVS', 'subsample': 0.26369599768270596}. Best is trial 46 with value: 0.8149496626899401.
[I 2025-04-07 23:57:00,864] Trial 53 finished with value: 0.8117638179386745 and parameters: {'iterations': 156, 'learning_rate': 0.3242551878399904, 'objective': 'Logloss', 'colsample_bylevel': 0.5853281403406903, 'depth': 9, 'boosting_type': 'Plain', 'bootstrap_type': 'MVS', 'subsample': 0.1657539473211689}. Best is trial 46 with value: 0.8149496626899401.
[I 2025-04-07 23:57:03,875] Trial 54 finished with value: 0.811847763245065 and parameters: {'iterations': 138, 'learning_rate': 0.6946434567165239, 'objective': 'Logloss', 'colsample_bylevel': 0.6887341587349237, 'depth': 8, 'boosting_type': 'Plain', 'bootstrap_type': 'MVS', 'subsample': 0.8216095602970575}. Best is trial 46 with value: 0.8149496626899401.
[I 2025-04-07 23:57:06,325] Trial 55 finished with value: 0.8128955946726272 and parameters: {'iterations': 124, 'learning_rate': 0.38489912895784445, 'objective': 'Logloss', 'colsample_bylevel': 0.6370358492035215, 'depth': 9, 'boosting_type': 'Plain', 'bootstrap_type': 'MVS', 'subsample': 0.246546193321352}. Best is trial 46 with value: 0.8149496626899401.
[I 2025-04-07 23:57:08,895] Trial 56 finished with value: 0.8090389255281947 and parameters: {'iterations': 171, 'learning_rate': 0.16899960477177794, 'objective': 'Logloss', 'colsample_bylevel': 0.5835304165737478, 'depth': 8, 'boosting_type': 'Plain', 'bootstrap_type': 'MVS', 'subsample': 0.3957268339134556}. Best is trial 46 with value: 0.8149496626899401.
[I 2025-04-07 23:57:16,516] Trial 57 finished with value: 0.8135242794709179 and parameters: {'iterations': 208, 'learning_rate': 0.284330987487453, 'objective': 'Logloss', 'colsample_bylevel': 0.5036617583592049, 'depth': 9, 'boosting_type': 'Plain', 'bootstrap_type': 'MVS', 'subsample': 0.4776465708493911}. Best is trial 46 with value: 0.8149496626899401.
[I 2025-04-07 23:57:20,617] Trial 58 finished with value: 0.80652337798584 and parameters: {'iterations': 198, 'learning_rate': 0.06018796273833793, 'objective': 'Logloss', 'colsample_bylevel': 0.7193920385170504, 'depth': 7, 'boosting_type': 'Plain', 'bootstrap_type': 'MVS', 'subsample': 0.14014717708624588}. Best is trial 46 with value: 0.8149496626899401.
[I 2025-04-07 23:57:24,863] Trial 59 finished with value: 0.810464115446323 and parameters: {'iterations': 177, 'learning_rate': 0.8977182816100105, 'objective': 'Logloss', 'colsample_bylevel': 0.6805395203210212, 'depth': 8, 'boosting_type': 'Plain', 'bootstrap_type': 'Bayesian', 'bagging_temperature': 0.09204527046382172}. Best is trial 46 with value: 0.8149496626899401.
[I 2025-04-07 23:57:26,111] Trial 60 finished with value: 0.7897116653574925 and parameters: {'iterations': 142, 'learning_rate': 0.6536178589482238, 'objective': 'Logloss', 'colsample_bylevel': 0.10579007984188238, 'depth': 9, 'boosting_type': 'Plain', 'bootstrap_type': 'MVS', 'subsample': 0.3343992770857443}. Best is trial 46 with value: 0.8149496626899401.
[I 2025-04-07 23:57:29,589] Trial 61 finished with value: 0.8136083653597769 and parameters: {'iterations': 159, 'learning_rate': 0.47451343464323853, 'objective': 'Logloss', 'colsample_bylevel': 0.6461126496766655, 'depth': 9, 'boosting_type': 'Plain', 'bootstrap_type': 'MVS', 'subsample': 0.28649646374440546}. Best is trial 46 with value: 0.8149496626899401.
[I 2025-04-07 23:57:32,711] Trial 62 finished with value: 0.8133987744723324 and parameters: {'iterations': 162, 'learning_rate': 0.41936206144087945, 'objective': 'Logloss', 'colsample_bylevel': 0.6174262726648185, 'depth': 9, 'boosting_type': 'Plain', 'bootstrap_type': 'MVS', 'subsample': 0.2635296265776748}. Best is trial 46 with value: 0.8149496626899401.
[I 2025-04-07 23:57:35,168] Trial 63 finished with value: 0.8110091712487766 and parameters: {'iterations': 147, 'learning_rate': 0.35636477213806805, 'objective': 'Logloss', 'colsample_bylevel': 0.5620244350838238, 'depth': 9, 'boosting_type': 'Plain', 'bootstrap_type': 'MVS', 'subsample': 0.19806435345446427}. Best is trial 46 with value: 0.8149496626899401.
[I 2025-04-07 23:57:40,120] Trial 64 finished with value: 0.8136082950685427 and parameters: {'iterations': 155, 'learning_rate': 0.4720073649097143, 'objective': 'Logloss', 'colsample_bylevel': 0.7693214896997751, 'depth': 9, 'boosting_type': 'Plain', 'bootstrap_type': 'MVS', 'subsample': 0.1003728429230763}. Best is trial 46 with value: 0.8149496626899401.
[I 2025-04-07 23:57:43,218] Trial 65 finished with value: 0.8114282827324312 and parameters: {'iterations': 132, 'learning_rate': 0.2256546733453695, 'objective': 'Logloss', 'colsample_bylevel': 0.662810763273448, 'depth': 8, 'boosting_type': 'Plain', 'bootstrap_type': 'MVS', 'subsample': 0.2347675145740577}. Best is trial 46 with value: 0.8149496626899401.
[I 2025-04-07 23:57:46,716] Trial 66 finished with value: 0.8098353779296069 and parameters: {'iterations': 176, 'learning_rate': 0.12184788348570678, 'objective': 'Logloss', 'colsample_bylevel': 0.728135304857496, 'depth': 6, 'boosting_type': 'Plain', 'bootstrap_type': 'MVS', 'subsample': 0.34427221785820145}. Best is trial 46 with value: 0.8149496626899401.
[I 2025-04-07 23:57:50,548] Trial 67 finished with value: 0.8120572662684669 and parameters: {'iterations': 182, 'learning_rate': 0.7877659126992439, 'objective': 'Logloss', 'colsample_bylevel': 0.6944382734409293, 'depth': 7, 'boosting_type': 'Plain', 'bootstrap_type': 'Bernoulli', 'subsample': 0.283795907284277}. Best is trial 46 with value: 0.8149496626899401.
[I 2025-04-07 23:58:08,683] Trial 68 finished with value: 0.8074869829420747 and parameters: {'iterations': 193, 'learning_rate': 0.581090057340867, 'objective': 'Logloss', 'colsample_bylevel': 0.5967008664383064, 'depth': 9, 'boosting_type': 'Ordered', 'bootstrap_type': 'MVS', 'subsample': 0.22495909073636783}. Best is trial 46 with value: 0.8149496626899401.
[I 2025-04-07 23:58:17,637] Trial 69 finished with value: 0.8130633974213662 and parameters: {'iterations': 204, 'learning_rate': 0.2764199505333211, 'objective': 'CrossEntropy', 'colsample_bylevel': 0.6401804123321623, 'depth': 8, 'boosting_type': 'Plain', 'bootstrap_type': 'MVS', 'subsample': 0.165093649259604}. Best is trial 46 with value: 0.8149496626899401.
[I 2025-04-07 23:58:19,676] Trial 70 finished with value: 0.8060204617782627 and parameters: {'iterations': 107, 'learning_rate': 0.18843120009436912, 'objective': 'Logloss', 'colsample_bylevel': 0.7315872016962612, 'depth': 6, 'boosting_type': 'Plain', 'bootstrap_type': 'Bernoulli', 'subsample': 0.13106765404208057}. Best is trial 46 with value: 0.8149496626899401.
[I 2025-04-07 23:58:24,149] Trial 71 finished with value: 0.8135665420754542 and parameters: {'iterations': 160, 'learning_rate': 0.47931713319017294, 'objective': 'Logloss', 'colsample_bylevel': 0.6433183781844253, 'depth': 9, 'boosting_type': 'Plain', 'bootstrap_type': 'MVS', 'subsample': 0.2843045807100589}. Best is trial 46 with value: 0.8149496626899401.
[I 2025-04-07 23:58:29,734] Trial 72 finished with value: 0.8138599728324382 and parameters: {'iterations': 169, 'learning_rate': 0.36647173433544566, 'objective': 'Logloss', 'colsample_bylevel': 0.6705822248351312, 'depth': 9, 'boosting_type': 'Plain', 'bootstrap_type': 'MVS', 'subsample': 0.3781915163133317}. Best is trial 46 with value: 0.8149496626899401.
[I 2025-04-07 23:58:35,162] Trial 73 finished with value: 0.8133986690354813 and parameters: {'iterations': 168, 'learning_rate': 0.35274894387364913, 'objective': 'Logloss', 'colsample_bylevel': 0.6837075836604634, 'depth': 9, 'boosting_type': 'Plain', 'bootstrap_type': 'MVS', 'subsample': 0.3739385385849967}. Best is trial 46 with value: 0.8149496626899401.
[I 2025-04-07 23:58:37,578] Trial 74 finished with value: 0.8126025329446229 and parameters: {'iterations': 80, 'learning_rate': 0.5815879770194805, 'objective': 'Logloss', 'colsample_bylevel': 0.6077588104319607, 'depth': 9, 'boosting_type': 'Plain', 'bootstrap_type': 'MVS', 'subsample': 0.32213218011056544}. Best is trial 46 with value: 0.8149496626899401.
[I 2025-04-07 23:58:42,987] Trial 75 finished with value: 0.813775922089196 and parameters: {'iterations': 153, 'learning_rate': 0.2737375470372294, 'objective': 'CrossEntropy', 'colsample_bylevel': 0.7620817444748722, 'depth': 9, 'boosting_type': 'Plain', 'bootstrap_type': 'MVS', 'subsample': 0.4013349028595263}. Best is trial 46 with value: 0.8149496626899401.
[I 2025-04-07 23:58:45,673] Trial 76 finished with value: 0.8127278622151228 and parameters: {'iterations': 137, 'learning_rate': 0.14696601241516216, 'objective': 'CrossEntropy', 'colsample_bylevel': 0.8172748132364461, 'depth': 7, 'boosting_type': 'Plain', 'bootstrap_type': 'MVS', 'subsample': 0.43060139312803536}. Best is trial 46 with value: 0.8149496626899401.
[I 2025-04-07 23:58:49,265] Trial 77 finished with value: 0.813943566682658 and parameters: {'iterations': 149, 'learning_rate': 0.2635740320280218, 'objective': 'CrossEntropy', 'colsample_bylevel': 0.7728454319038591, 'depth': 8, 'boosting_type': 'Plain', 'bootstrap_type': 'MVS', 'subsample': 0.5322666648648144}. Best is trial 46 with value: 0.8149496626899401.
[I 2025-04-07 23:58:56,518] Trial 78 finished with value: 0.7972161859624891 and parameters: {'iterations': 188, 'learning_rate': 0.020380618026364955, 'objective': 'CrossEntropy', 'colsample_bylevel': 0.7386525391031311, 'depth': 6, 'boosting_type': 'Ordered', 'bootstrap_type': 'Bernoulli', 'subsample': 0.5888431882596772}. Best is trial 46 with value: 0.8149496626899401.
[I 2025-04-07 23:59:05,410] Trial 79 finished with value: 0.8112188148546465 and parameters: {'iterations': 219, 'learning_rate': 0.20239554240688018, 'objective': 'CrossEntropy', 'colsample_bylevel': 0.7040174045624117, 'depth': 8, 'boosting_type': 'Plain', 'bootstrap_type': 'Bayesian', 'bagging_temperature': 5.6385936440297515}. Best is trial 46 with value: 0.8149496626899401.
[I 2025-04-07 23:59:06,806] Trial 80 finished with value: 0.6377394866279713 and parameters: {'iterations': 149, 'learning_rate': 0.0027522171868430826, 'objective': 'CrossEntropy', 'colsample_bylevel': 0.14344737675966823, 'depth': 7, 'boosting_type': 'Plain', 'bootstrap_type': 'MVS', 'subsample': 0.5171540871200161}. Best is trial 46 with value: 0.8149496626899401.
[I 2025-04-07 23:59:11,420] Trial 81 finished with value: 0.8128956298182445 and parameters: {'iterations': 153, 'learning_rate': 0.2787383379288037, 'objective': 'CrossEntropy', 'colsample_bylevel': 0.7697313800398129, 'depth': 9, 'boosting_type': 'Plain', 'bootstrap_type': 'MVS', 'subsample': 0.4676305415678784}. Best is trial 46 with value: 0.8149496626899401.
[I 2025-04-07 23:59:15,320] Trial 82 finished with value: 0.8139855481222575 and parameters: {'iterations': 165, 'learning_rate': 0.3736161849785724, 'objective': 'CrossEntropy', 'colsample_bylevel': 0.8560537461506377, 'depth': 8, 'boosting_type': 'Plain', 'bootstrap_type': 'MVS', 'subsample': 0.3963884159468969}. Best is trial 46 with value: 0.8149496626899401.
[I 2025-04-07 23:59:19,746] Trial 83 finished with value: 0.8125603582041292 and parameters: {'iterations': 181, 'learning_rate': 0.3895622044165855, 'objective': 'CrossEntropy', 'colsample_bylevel': 0.8322523306736102, 'depth': 8, 'boosting_type': 'Plain', 'bootstrap_type': 'MVS', 'subsample': 0.7610438124125543}. Best is trial 46 with value: 0.8149496626899401.
[I 2025-04-07 23:59:23,740] Trial 84 finished with value: 0.812015442984144 and parameters: {'iterations': 171, 'learning_rate': 0.6706711331868811, 'objective': 'CrossEntropy', 'colsample_bylevel': 0.8493697701385046, 'depth': 8, 'boosting_type': 'Plain', 'bootstrap_type': 'MVS', 'subsample': 0.44596719184867006}. Best is trial 46 with value: 0.8149496626899401.
[I 2025-04-07 23:59:27,545] Trial 85 finished with value: 0.8124766061986325 and parameters: {'iterations': 164, 'learning_rate': 0.34140100268897444, 'objective': 'CrossEntropy', 'colsample_bylevel': 0.7883134843741393, 'depth': 8, 'boosting_type': 'Plain', 'bootstrap_type': 'MVS', 'subsample': 0.6548334171659976}. Best is trial 46 with value: 0.8149496626899401.
[I 2025-04-07 23:59:31,458] Trial 86 finished with value: 0.8136083302141598 and parameters: {'iterations': 199, 'learning_rate': 0.24485161188586368, 'objective': 'CrossEntropy', 'colsample_bylevel': 0.9009074569741069, 'depth': 7, 'boosting_type': 'Plain', 'bootstrap_type': 'MVS', 'subsample': 0.35617247351651415}. Best is trial 46 with value: 0.8149496626899401.
[I 2025-04-07 23:59:34,070] Trial 87 finished with value: 0.8111349574122985 and parameters: {'iterations': 173, 'learning_rate': 0.7883432387880321, 'objective': 'CrossEntropy', 'colsample_bylevel': 0.8652744833846252, 'depth': 6, 'boosting_type': 'Plain', 'bootstrap_type': 'Bernoulli', 'subsample': 0.49092502879518846}. Best is trial 46 with value: 0.8149496626899401.
[I 2025-04-07 23:59:38,710] Trial 88 finished with value: 0.8116379439111097 and parameters: {'iterations': 189, 'learning_rate': 0.10434203506604497, 'objective': 'CrossEntropy', 'colsample_bylevel': 0.8085793907579752, 'depth': 8, 'boosting_type': 'Plain', 'bootstrap_type': 'MVS', 'subsample': 0.5365817333345564}. Best is trial 46 with value: 0.8149496626899401.
[I 2025-04-07 23:59:44,754] Trial 89 finished with value: 0.8120573189868925 and parameters: {'iterations': 167, 'learning_rate': 0.42016310901943915, 'objective': 'CrossEntropy', 'colsample_bylevel': 0.9472668679968997, 'depth': 8, 'boosting_type': 'Plain', 'bootstrap_type': 'MVS', 'subsample': 0.5930132835388038}. Best is trial 46 with value: 0.8149496626899401.
[I 2025-04-07 23:59:48,862] Trial 90 finished with value: 0.7916823855439048 and parameters: {'iterations': 127, 'learning_rate': 0.15639875921981963, 'objective': 'CrossEntropy', 'colsample_bylevel': 0.5499936020927768, 'depth': 5, 'boosting_type': 'Ordered', 'bootstrap_type': 'MVS', 'subsample': 0.19006632170463117}. Best is trial 46 with value: 0.8149496626899401.
[I 2025-04-07 23:59:52,288] Trial 91 finished with value: 0.8131472372909057 and parameters: {'iterations': 142, 'learning_rate': 0.29980357138150815, 'objective': 'CrossEntropy', 'colsample_bylevel': 0.6677179375747788, 'depth': 9, 'boosting_type': 'Plain', 'bootstrap_type': 'MVS', 'subsample': 0.41050633825651894}. Best is trial 46 with value: 0.8149496626899401.
[I 2025-04-07 23:59:56,121] Trial 92 finished with value: 0.8131892187305052 and parameters: {'iterations': 155, 'learning_rate': 0.5429685638429833, 'objective': 'CrossEntropy', 'colsample_bylevel': 0.7370534143224664, 'depth': 9, 'boosting_type': 'Plain', 'bootstrap_type': 'MVS', 'subsample': 0.39235324635282665}. Best is trial 46 with value: 0.8149496626899401.
[I 2025-04-08 00:00:00,090] Trial 93 finished with value: 0.8130215214186176 and parameters: {'iterations': 146, 'learning_rate': 0.2506035699100875, 'objective': 'CrossEntropy', 'colsample_bylevel': 0.7654248843366579, 'depth': 9, 'boosting_type': 'Plain', 'bootstrap_type': 'MVS', 'subsample': 0.2514533729523936}. Best is trial 46 with value: 0.8149496626899401.
[I 2025-04-08 00:00:03,601] Trial 94 finished with value: 0.8136083653597769 and parameters: {'iterations': 135, 'learning_rate': 0.3080852971011311, 'objective': 'CrossEntropy', 'colsample_bylevel': 0.7031106645803255, 'depth': 9, 'boosting_type': 'Plain', 'bootstrap_type': 'MVS', 'subsample': 0.30851641747595737}. Best is trial 46 with value: 0.8149496626899401.
[I 2025-04-08 00:00:06,490] Trial 95 finished with value: 0.8136085410878622 and parameters: {'iterations': 150, 'learning_rate': 0.36293816674227813, 'objective': 'CrossEntropy', 'colsample_bylevel': 0.8862601593976045, 'depth': 6, 'boosting_type': 'Plain', 'bootstrap_type': 'MVS', 'subsample': 0.6959891198169901}. Best is trial 46 with value: 0.8149496626899401.
[I 2025-04-08 00:00:09,905] Trial 96 finished with value: 0.8094161082906753 and parameters: {'iterations': 180, 'learning_rate': 0.1959375465164499, 'objective': 'CrossEntropy', 'colsample_bylevel': 0.629703017424211, 'depth': 9, 'boosting_type': 'Plain', 'bootstrap_type': 'Bayesian', 'bagging_temperature': 8.262373498241542}. Best is trial 46 with value: 0.8149496626899401.
[I 2025-04-08 00:00:12,743] Trial 97 finished with value: 0.7949523161840295 and parameters: {'iterations': 159, 'learning_rate': 0.011755401283223227, 'objective': 'CrossEntropy', 'colsample_bylevel': 0.7560487007294546, 'depth': 7, 'boosting_type': 'Plain', 'bootstrap_type': 'MVS', 'subsample': 0.40821482351763355}. Best is trial 46 with value: 0.8149496626899401.
[I 2025-04-08 00:00:15,892] Trial 98 finished with value: 0.8134825089050206 and parameters: {'iterations': 171, 'learning_rate': 0.5252069777923628, 'objective': 'CrossEntropy', 'colsample_bylevel': 0.680085243932509, 'depth': 8, 'boosting_type': 'Plain', 'bootstrap_type': 'Bernoulli', 'subsample': 0.36867119525382613}. Best is trial 46 with value: 0.8149496626899401.
[I 2025-04-08 00:00:18,909] Trial 99 finished with value: 0.8126440047727748 and parameters: {'iterations': 164, 'learning_rate': 0.44112163908787133, 'objective': 'Logloss', 'colsample_bylevel': 0.7198221486103142, 'depth': 5, 'boosting_type': 'Plain', 'bootstrap_type': 'MVS', 'subsample': 0.3371018654290358}. Best is trial 46 with value: 0.8149496626899401.
[I 2025-04-08 00:00:34,614] Trial 100 finished with value: 0.813943601828275 and parameters: {'iterations': 215, 'learning_rate': 0.22362747748659997, 'objective': 'CrossEntropy', 'colsample_bylevel': 0.7819640039251095, 'depth': 9, 'boosting_type': 'Plain', 'bootstrap_type': 'MVS', 'subsample': 0.2119527099175691}. Best is trial 46 with value: 0.8149496626899401.
[I 2025-04-08 00:00:45,424] Trial 101 finished with value: 0.8132310244420194 and parameters: {'iterations': 207, 'learning_rate': 0.31377890748020365, 'objective': 'CrossEntropy', 'colsample_bylevel': 0.789883126352443, 'depth': 9, 'boosting_type': 'Plain', 'bootstrap_type': 'MVS', 'subsample': 0.17221084845561094}. Best is trial 46 with value: 0.8149496626899401.
[I 2025-04-08 00:01:00,963] Trial 102 finished with value: 0.8136920470740396 and parameters: {'iterations': 232, 'learning_rate': 0.21999858287493737, 'objective': 'CrossEntropy', 'colsample_bylevel': 0.8360627818958086, 'depth': 9, 'boosting_type': 'Plain', 'bootstrap_type': 'MVS', 'subsample': 0.22178592307557565}. Best is trial 46 with value: 0.8149496626899401.
[I 2025-04-08 00:01:06,332] Trial 103 finished with value: 0.8131054667250084 and parameters: {'iterations': 196, 'learning_rate': 0.26626971615707257, 'objective': 'CrossEntropy', 'colsample_bylevel': 0.7747925951084291, 'depth': 9, 'boosting_type': 'Plain', 'bootstrap_type': 'MVS', 'subsample': 0.20339722831086654}. Best is trial 46 with value: 0.8149496626899401.
[I 2025-04-08 00:01:21,481] Trial 104 finished with value: 0.812015214537633 and parameters: {'iterations': 213, 'learning_rate': 0.40036164530969953, 'objective': 'CrossEntropy', 'colsample_bylevel': 0.8105697457079204, 'depth': 9, 'boosting_type': 'Plain', 'bootstrap_type': 'MVS', 'subsample': 0.2559218769815268}. Best is trial 46 with value: 0.8149496626899401.
[I 2025-04-08 00:01:24,565] Trial 105 finished with value: 0.8142791194617096 and parameters: {'iterations': 186, 'learning_rate': 0.6255125934265484, 'objective': 'CrossEntropy', 'colsample_bylevel': 0.6643569142787291, 'depth': 8, 'boosting_type': 'Plain', 'bootstrap_type': 'MVS', 'subsample': 0.3041543966409372}. Best is trial 46 with value: 0.8149496626899401.
[I 2025-04-08 00:01:31,221] Trial 106 finished with value: 0.8113451984936588 and parameters: {'iterations': 239, 'learning_rate': 0.6446091339459695, 'objective': 'Logloss', 'colsample_bylevel': 0.601994284052782, 'depth': 8, 'boosting_type': 'Plain', 'bootstrap_type': 'MVS', 'subsample': 0.2967737309767437}. Best is trial 46 with value: 0.8149496626899401.
[I 2025-04-08 00:01:35,281] Trial 107 finished with value: 0.8120573189868925 and parameters: {'iterations': 185, 'learning_rate': 0.17268925643783414, 'objective': 'CrossEntropy', 'colsample_bylevel': 0.6691075124833067, 'depth': 8, 'boosting_type': 'Plain', 'bootstrap_type': 'MVS', 'subsample': 0.26991706041080793}. Best is trial 46 with value: 0.8149496626899401.
