[I 2025-04-07 23:00:02,722] Trial 42 finished with value: 0.8162488204252268 and parameters: {'n_estimators': 158, 'criterion': 'entropy', 'max_depth': 49, 'min_samples_split': 2, 'min_samples_leaf': 2}. Best is trial 31 with value: 0.816332713013192.
[I 2025-04-07 23:00:14,631] Trial 43 finished with value: 0.8160391943921652 and parameters: {'n_estimators': 157, 'criterion': 'entropy', 'max_depth': 51, 'min_samples_split': 2, 'min_samples_leaf': 2}. Best is trial 31 with value: 0.816332713013192.
[I 2025-04-07 23:00:21,739] Trial 44 finished with value: 0.8158302009802114 and parameters: {'n_estimators': 83, 'criterion': 'entropy', 'max_depth': 48, 'min_samples_split': 19, 'min_samples_leaf': 2}. Best is trial 31 with value: 0.816332713013192.
[I 2025-04-07 23:00:32,072] Trial 45 finished with value: 0.815410650176343 and parameters: {'n_estimators': 139, 'criterion': 'entropy', 'max_depth': 31, 'min_samples_split': 3, 'min_samples_leaf': 4}. Best is trial 31 with value: 0.816332713013192.
[I 2025-04-07 23:00:43,359] Trial 46 finished with value: 0.8158298143784233 and parameters: {'n_estimators': 158, 'criterion': 'entropy', 'max_depth': 39, 'min_samples_split': 5, 'min_samples_leaf': 2}. Best is trial 31 with value: 0.816332713013192.
[I 2025-04-07 23:00:54,785] Trial 47 finished with value: 0.8154109137684712 and parameters: {'n_estimators': 169, 'criterion': 'gini', 'max_depth': 54, 'min_samples_split': 2, 'min_samples_leaf': 6}. Best is trial 31 with value: 0.816332713013192.
[I 2025-04-07 23:01:08,788] Trial 48 finished with value: 0.8160812812686162 and parameters: {'n_estimators': 192, 'criterion': 'entropy', 'max_depth': 60, 'min_samples_split': 3, 'min_samples_leaf': 2}. Best is trial 31 with value: 0.816332713013192.
[I 2025-04-07 23:01:20,064] Trial 49 finished with value: 0.8168779445437309 and parameters: {'n_estimators': 152, 'criterion': 'entropy', 'max_depth': 44, 'min_samples_split': 13, 'min_samples_leaf': 3}. Best is trial 49 with value: 0.8168779445437309.
[I 2025-04-07 23:01:29,475] Trial 50 finished with value: 0.8161232627082157 and parameters: {'n_estimators': 123, 'criterion': 'entropy', 'max_depth': 43, 'min_samples_split': 13, 'min_samples_leaf': 3}. Best is trial 49 with value: 0.8168779445437309.
[I 2025-04-07 23:01:40,574] Trial 51 finished with value: 0.8155367526504188 and parameters: {'n_estimators': 151, 'criterion': 'entropy', 'max_depth': 49, 'min_samples_split': 14, 'min_samples_leaf': 4}. Best is trial 49 with value: 0.8168779445437309.
[I 2025-04-07 23:01:51,998] Trial 52 finished with value: 0.8161652792934324 and parameters: {'n_estimators': 138, 'criterion': 'entropy', 'max_depth': 45, 'min_samples_split': 11, 'min_samples_leaf': 2}. Best is trial 49 with value: 0.8168779445437309.
[I 2025-04-07 23:02:06,884] Trial 53 finished with value: 0.8153690201929141 and parameters: {'n_estimators': 163, 'criterion': 'entropy', 'max_depth': 19, 'min_samples_split': 13, 'min_samples_leaf': 7}. Best is trial 49 with value: 0.8168779445437309.
[I 2025-04-07 23:02:08,731] A new study created in RDB with name: random-forest-num_features-7
[I 2025-04-07 23:02:21,936] Trial 0 finished with value: 0.8154527897712196 and parameters: {'n_estimators': 152, 'criterion': 'entropy', 'max_depth': 44, 'min_samples_split': 13, 'min_samples_leaf': 3}. Best is trial 0 with value: 0.8154527897712196.
[I 2025-04-07 23:02:33,401] Trial 1 finished with value: 0.812937382811333 and parameters: {'n_estimators': 145, 'criterion': 'entropy', 'max_depth': 53, 'min_samples_split': 16, 'min_samples_leaf': 20}. Best is trial 0 with value: 0.8154527897712196.
[I 2025-04-07 23:02:38,891] Trial 2 finished with value: 0.7944911881151582 and parameters: {'n_estimators': 54, 'criterion': 'entropy', 'max_depth': 7, 'min_samples_split': 14, 'min_samples_leaf': 13}. Best is trial 0 with value: 0.8154527897712196.
[I 2025-04-07 23:02:45,061] Trial 3 finished with value: 0.8152013755994524 and parameters: {'n_estimators': 84, 'criterion': 'gini', 'max_depth': 40, 'min_samples_split': 16, 'min_samples_leaf': 4}. Best is trial 0 with value: 0.8154527897712196.
[I 2025-04-07 23:02:55,011] Trial 4 finished with value: 0.8136501710712911 and parameters: {'n_estimators': 116, 'criterion': 'gini', 'max_depth': 47, 'min_samples_split': 7, 'min_samples_leaf': 17}. Best is trial 0 with value: 0.8154527897712196.
[I 2025-04-07 23:03:10,728] Trial 5 finished with value: 0.8140690365356262 and parameters: {'n_estimators': 196, 'criterion': 'gini', 'max_depth': 63, 'min_samples_split': 3, 'min_samples_leaf': 2}. Best is trial 0 with value: 0.8154527897712196.
[I 2025-04-07 23:03:26,795] Trial 6 finished with value: 0.8148660512669117 and parameters: {'n_estimators': 193, 'criterion': 'entropy', 'max_depth': 37, 'min_samples_split': 16, 'min_samples_leaf': 3}. Best is trial 0 with value: 0.8154527897712196.
[I 2025-04-07 23:03:36,642] Trial 7 finished with value: 0.8151595698879381 and parameters: {'n_estimators': 133, 'criterion': 'entropy', 'max_depth': 34, 'min_samples_split': 20, 'min_samples_leaf': 8}. Best is trial 0 with value: 0.8154527897712196.
[I 2025-04-07 23:03:45,488] Trial 8 finished with value: 0.8125601473304268 and parameters: {'n_estimators': 135, 'criterion': 'gini', 'max_depth': 57, 'min_samples_split': 6, 'min_samples_leaf': 18}. Best is trial 0 with value: 0.8154527897712196.
[I 2025-04-07 23:04:00,090] Trial 9 finished with value: 0.8165428662305096 and parameters: {'n_estimators': 190, 'criterion': 'entropy', 'max_depth': 46, 'min_samples_split': 17, 'min_samples_leaf': 1}. Best is trial 9 with value: 0.8165428662305096.
[I 2025-04-07 23:04:03,157] Trial 10 finished with value: 0.813482421040978 and parameters: {'n_estimators': 23, 'criterion': 'entropy', 'max_depth': 22, 'min_samples_split': 19, 'min_samples_leaf': 8}. Best is trial 9 with value: 0.8165428662305096.
[I 2025-04-07 23:04:16,158] Trial 11 finished with value: 0.8157044499623064 and parameters: {'n_estimators': 166, 'criterion': 'entropy', 'max_depth': 24, 'min_samples_split': 12, 'min_samples_leaf': 1}. Best is trial 9 with value: 0.8165428662305096.
[I 2025-04-07 23:04:31,678] Trial 12 finished with value: 0.8152850221680981 and parameters: {'n_estimators': 174, 'criterion': 'entropy', 'max_depth': 22, 'min_samples_split': 9, 'min_samples_leaf': 1}. Best is trial 9 with value: 0.8165428662305096.
[I 2025-04-07 23:04:45,578] Trial 13 finished with value: 0.8152431813109666 and parameters: {'n_estimators': 161, 'criterion': 'entropy', 'max_depth': 24, 'min_samples_split': 12, 'min_samples_leaf': 5}. Best is trial 9 with value: 0.8165428662305096.
[I 2025-04-07 23:04:59,699] Trial 14 finished with value: 0.7939880434610701 and parameters: {'n_estimators': 177, 'criterion': 'entropy', 'max_depth': 7, 'min_samples_split': 10, 'min_samples_leaf': 7}. Best is trial 9 with value: 0.8165428662305096.
[I 2025-04-07 23:05:08,126] Trial 15 finished with value: 0.8141951741553191 and parameters: {'n_estimators': 96, 'criterion': 'entropy', 'max_depth': 28, 'min_samples_split': 17, 'min_samples_leaf': 12}. Best is trial 9 with value: 0.8165428662305096.
[I 2025-04-07 23:05:22,401] Trial 16 finished with value: 0.814404782615572 and parameters: {'n_estimators': 197, 'criterion': 'entropy', 'max_depth': 17, 'min_samples_split': 14, 'min_samples_leaf': 6}. Best is trial 9 with value: 0.8165428662305096.
[I 2025-04-07 23:05:34,122] Trial 17 finished with value: 0.8116796793313897 and parameters: {'n_estimators': 171, 'criterion': 'entropy', 'max_depth': 12, 'min_samples_split': 18, 'min_samples_leaf': 1}. Best is trial 9 with value: 0.8165428662305096.
[I 2025-04-07 23:05:42,060] Trial 18 finished with value: 0.8146144086486334 and parameters: {'n_estimators': 113, 'criterion': 'gini', 'max_depth': 32, 'min_samples_split': 11, 'min_samples_leaf': 10}. Best is trial 9 with value: 0.8165428662305096.
[I 2025-04-07 23:05:47,761] Trial 19 finished with value: 0.8135244024805777 and parameters: {'n_estimators': 70, 'criterion': 'entropy', 'max_depth': 49, 'min_samples_split': 7, 'min_samples_leaf': 14}. Best is trial 9 with value: 0.8165428662305096.
[I 2025-04-07 23:06:01,913] Trial 20 finished with value: 0.8145306390703281 and parameters: {'n_estimators': 180, 'criterion': 'entropy', 'max_depth': 41, 'min_samples_split': 14, 'min_samples_leaf': 10}. Best is trial 9 with value: 0.8165428662305096.
[I 2025-04-07 23:06:16,296] Trial 21 finished with value: 0.8154108259044286 and parameters: {'n_estimators': 153, 'criterion': 'entropy', 'max_depth': 45, 'min_samples_split': 13, 'min_samples_leaf': 3}. Best is trial 9 with value: 0.8165428662305096.
[I 2025-04-07 23:06:31,405] Trial 22 finished with value: 0.8164588857785017 and parameters: {'n_estimators': 155, 'criterion': 'entropy', 'max_depth': 56, 'min_samples_split': 9, 'min_samples_leaf': 1}. Best is trial 9 with value: 0.8165428662305096.
[I 2025-04-07 23:06:43,944] Trial 23 finished with value: 0.8150333619770113 and parameters: {'n_estimators': 130, 'criterion': 'entropy', 'max_depth': 63, 'min_samples_split': 9, 'min_samples_leaf': 1}. Best is trial 9 with value: 0.8165428662305096.
[I 2025-04-07 23:06:57,591] Trial 24 finished with value: 0.8154528424896453 and parameters: {'n_estimators': 165, 'criterion': 'entropy', 'max_depth': 56, 'min_samples_split': 4, 'min_samples_leaf': 5}. Best is trial 9 with value: 0.8165428662305096.
[I 2025-04-07 23:07:13,749] Trial 25 finished with value: 0.8160815624335529 and parameters: {'n_estimators': 185, 'criterion': 'entropy', 'max_depth': 51, 'min_samples_split': 5, 'min_samples_leaf': 4}. Best is trial 9 with value: 0.8165428662305096.
[I 2025-04-07 23:07:29,710] Trial 26 finished with value: 0.8155786110803586 and parameters: {'n_estimators': 190, 'criterion': 'gini', 'max_depth': 52, 'min_samples_split': 5, 'min_samples_leaf': 4}. Best is trial 9 with value: 0.8165428662305096.
[I 2025-04-07 23:07:44,270] Trial 27 finished with value: 0.8149075758134892 and parameters: {'n_estimators': 183, 'criterion': 'entropy', 'max_depth': 57, 'min_samples_split': 2, 'min_samples_leaf': 6}. Best is trial 9 with value: 0.8165428662305096.
[I 2025-04-07 23:07:54,639] Trial 28 finished with value: 0.8152848991584382 and parameters: {'n_estimators': 143, 'criterion': 'entropy', 'max_depth': 60, 'min_samples_split': 7, 'min_samples_leaf': 3}. Best is trial 9 with value: 0.8165428662305096.
[I 2025-04-07 23:08:07,800] Trial 29 finished with value: 0.8152849343040552 and parameters: {'n_estimators': 153, 'criterion': 'entropy', 'max_depth': 50, 'min_samples_split': 8, 'min_samples_leaf': 2}. Best is trial 9 with value: 0.8165428662305096.
[I 2025-04-07 23:08:23,738] Trial 30 finished with value: 0.8166266182360064 and parameters: {'n_estimators': 199, 'criterion': 'entropy', 'max_depth': 43, 'min_samples_split': 5, 'min_samples_leaf': 4}. Best is trial 30 with value: 0.8166266182360064.
[I 2025-04-07 23:08:38,527] Trial 31 finished with value: 0.8159558114156479 and parameters: {'n_estimators': 184, 'criterion': 'entropy', 'max_depth': 43, 'min_samples_split': 5, 'min_samples_leaf': 4}. Best is trial 30 with value: 0.8166266182360064.
[I 2025-04-07 23:08:53,325] Trial 32 finished with value: 0.8149077515415746 and parameters: {'n_estimators': 199, 'criterion': 'entropy', 'max_depth': 54, 'min_samples_split': 2, 'min_samples_leaf': 2}. Best is trial 30 with value: 0.8166266182360064.
[I 2025-04-07 23:09:05,448] Trial 33 finished with value: 0.8150755542903134 and parameters: {'n_estimators': 159, 'criterion': 'entropy', 'max_depth': 45, 'min_samples_split': 4, 'min_samples_leaf': 5}. Best is trial 30 with value: 0.8166266182360064.
[I 2025-04-07 23:09:20,016] Trial 34 finished with value: 0.8157463435378632 and parameters: {'n_estimators': 200, 'criterion': 'entropy', 'max_depth': 38, 'min_samples_split': 5, 'min_samples_leaf': 8}. Best is trial 30 with value: 0.8166266182360064.
[I 2025-04-07 23:09:33,145] Trial 35 finished with value: 0.815578558361933 and parameters: {'n_estimators': 145, 'criterion': 'entropy', 'max_depth': 48, 'min_samples_split': 8, 'min_samples_leaf': 4}. Best is trial 30 with value: 0.8166266182360064.
[I 2025-04-07 23:09:49,393] Trial 36 finished with value: 0.8151592184317675 and parameters: {'n_estimators': 184, 'criterion': 'gini', 'max_depth': 53, 'min_samples_split': 10, 'min_samples_leaf': 3}. Best is trial 30 with value: 0.8166266182360064.
[I 2025-04-07 23:09:52,259] Trial 37 finished with value: 0.8052653581953428 and parameters: {'n_estimators': 13, 'criterion': 'entropy', 'max_depth': 41, 'min_samples_split': 6, 'min_samples_leaf': 2}. Best is trial 30 with value: 0.8166266182360064.
[I 2025-04-07 23:10:10,408] Trial 38 finished with value: 0.8149078394056174 and parameters: {'n_estimators': 189, 'criterion': 'gini', 'max_depth': 60, 'min_samples_split': 15, 'min_samples_leaf': 6}. Best is trial 30 with value: 0.8166266182360064.
[I 2025-04-07 23:10:25,976] Trial 39 finished with value: 0.8135245606358545 and parameters: {'n_estimators': 171, 'criterion': 'entropy', 'max_depth': 35, 'min_samples_split': 3, 'min_samples_leaf': 15}. Best is trial 30 with value: 0.8166266182360064.
[I 2025-04-07 23:10:31,362] Trial 40 finished with value: 0.8143629066128234 and parameters: {'n_estimators': 57, 'criterion': 'entropy', 'max_depth': 47, 'min_samples_split': 6, 'min_samples_leaf': 9}. Best is trial 30 with value: 0.8166266182360064.
[I 2025-04-07 23:10:45,462] Trial 41 finished with value: 0.8166685469571803 and parameters: {'n_estimators': 189, 'criterion': 'entropy', 'max_depth': 43, 'min_samples_split': 4, 'min_samples_leaf': 4}. Best is trial 41 with value: 0.8166685469571803.
[I 2025-04-07 23:10:58,838] Trial 42 finished with value: 0.8134824737594037 and parameters: {'n_estimators': 190, 'criterion': 'entropy', 'max_depth': 51, 'min_samples_split': 4, 'min_samples_leaf': 20}. Best is trial 41 with value: 0.8166685469571803.
[I 2025-04-07 23:11:11,371] Trial 43 finished with value: 0.8137758342251533 and parameters: {'n_estimators': 174, 'criterion': 'entropy', 'max_depth': 44, 'min_samples_split': 3, 'min_samples_leaf': 2}. Best is trial 41 with value: 0.8166685469571803.
[I 2025-04-07 23:11:27,542] Trial 44 finished with value: 0.8157044851079235 and parameters: {'n_estimators': 200, 'criterion': 'entropy', 'max_depth': 55, 'min_samples_split': 20, 'min_samples_leaf': 3}. Best is trial 41 with value: 0.8166685469571803.
[I 2025-04-07 23:11:40,185] Trial 45 finished with value: 0.8147820532420953 and parameters: {'n_estimators': 187, 'criterion': 'entropy', 'max_depth': 38, 'min_samples_split': 7, 'min_samples_leaf': 7}. Best is trial 41 with value: 0.8166685469571803.
[I 2025-04-07 23:11:51,658] Trial 46 finished with value: 0.8133146358650478 and parameters: {'n_estimators': 163, 'criterion': 'gini', 'max_depth': 31, 'min_samples_split': 3, 'min_samples_leaf': 1}. Best is trial 41 with value: 0.8166685469571803.
[I 2025-04-07 23:12:04,819] Trial 47 finished with value: 0.8157044499623062 and parameters: {'n_estimators': 177, 'criterion': 'entropy', 'max_depth': 60, 'min_samples_split': 8, 'min_samples_leaf': 5}. Best is trial 41 with value: 0.8166685469571803.
[I 2025-04-07 23:12:13,564] Trial 48 finished with value: 0.815871989118917 and parameters: {'n_estimators': 96, 'criterion': 'entropy', 'max_depth': 47, 'min_samples_split': 6, 'min_samples_leaf': 4}. Best is trial 41 with value: 0.8166685469571803.
[I 2025-04-07 23:12:15,492] A new study created in RDB with name: random-forest-num_features-6
[I 2025-04-07 23:12:28,869] Trial 0 finished with value: 0.8150332741129687 and parameters: {'n_estimators': 189, 'criterion': 'entropy', 'max_depth': 43, 'min_samples_split': 4, 'min_samples_leaf': 4}. Best is trial 0 with value: 0.8150332741129687.
[I 2025-04-07 23:12:34,951] Trial 1 finished with value: 0.8148240522545034 and parameters: {'n_estimators': 85, 'criterion': 'gini', 'max_depth': 42, 'min_samples_split': 9, 'min_samples_leaf': 15}. Best is trial 0 with value: 0.8150332741129687.
[I 2025-04-07 23:12:44,564] Trial 2 finished with value: 0.8142371907405357 and parameters: {'n_estimators': 142, 'criterion': 'entropy', 'max_depth': 36, 'min_samples_split': 6, 'min_samples_leaf': 17}. Best is trial 0 with value: 0.8150332741129687.
[I 2025-04-07 23:12:52,257] Trial 3 finished with value: 0.8151593590142359 and parameters: {'n_estimators': 88, 'criterion': 'entropy', 'max_depth': 21, 'min_samples_split': 11, 'min_samples_leaf': 9}. Best is trial 3 with value: 0.8151593590142359.
[I 2025-04-07 23:12:59,496] Trial 4 finished with value: 0.8149916441295397 and parameters: {'n_estimators': 80, 'criterion': 'gini', 'max_depth': 49, 'min_samples_split': 10, 'min_samples_leaf': 3}. Best is trial 3 with value: 0.8151593590142359.
[I 2025-04-07 23:13:07,547] Trial 5 finished with value: 0.814572304199374 and parameters: {'n_estimators': 80, 'criterion': 'entropy', 'max_depth': 24, 'min_samples_split': 7, 'min_samples_leaf': 12}. Best is trial 3 with value: 0.8151593590142359.
[I 2025-04-07 23:13:24,585] Trial 6 finished with value: 0.8157041863701784 and parameters: {'n_estimators': 190, 'criterion': 'entropy', 'max_depth': 56, 'min_samples_split': 15, 'min_samples_leaf': 5}. Best is trial 6 with value: 0.8157041863701784.
[I 2025-04-07 23:13:33,617] Trial 7 finished with value: 0.8154527897712196 and parameters: {'n_estimators': 98, 'criterion': 'gini', 'max_depth': 56, 'min_samples_split': 18, 'min_samples_leaf': 3}. Best is trial 6 with value: 0.8157041863701784.
[I 2025-04-07 23:13:39,718] Trial 8 finished with value: 0.8152431988837753 and parameters: {'n_estimators': 65, 'criterion': 'gini', 'max_depth': 18, 'min_samples_split': 10, 'min_samples_leaf': 12}. Best is trial 6 with value: 0.8157041863701784.
[I 2025-04-07 23:13:48,836] Trial 9 finished with value: 0.8141953323105959 and parameters: {'n_estimators': 116, 'criterion': 'entropy', 'max_depth': 21, 'min_samples_split': 15, 'min_samples_leaf': 19}. Best is trial 6 with value: 0.8157041863701784.
[I 2025-04-07 23:14:02,213] Trial 10 finished with value: 0.7870707709718291 and parameters: {'n_estimators': 200, 'criterion': 'entropy', 'max_depth': 5, 'min_samples_split': 20, 'min_samples_leaf': 8}. Best is trial 6 with value: 0.8157041863701784.
[I 2025-04-07 23:14:04,050] Trial 11 finished with value: 0.8125601121848097 and parameters: {'n_estimators': 11, 'criterion': 'gini', 'max_depth': 62, 'min_samples_split': 16, 'min_samples_leaf': 5}. Best is trial 6 with value: 0.8157041863701784.
[I 2025-04-07 23:14:15,095] Trial 12 finished with value: 0.8153270211805062 and parameters: {'n_estimators': 158, 'criterion': 'gini', 'max_depth': 63, 'min_samples_split': 16, 'min_samples_leaf': 1}. Best is trial 6 with value: 0.8157041863701784.
[I 2025-04-07 23:14:18,879] Trial 13 finished with value: 0.8163332401974481 and parameters: {'n_estimators': 45, 'criterion': 'gini', 'max_depth': 55, 'min_samples_split': 20, 'min_samples_leaf': 6}. Best is trial 13 with value: 0.8163332401974481.
[I 2025-04-07 23:14:21,915] Trial 14 finished with value: 0.8146560562048709 and parameters: {'n_estimators': 27, 'criterion': 'entropy', 'max_depth': 52, 'min_samples_split': 14, 'min_samples_leaf': 7}. Best is trial 13 with value: 0.8163332401974481.
[I 2025-04-07 23:14:26,124] Trial 15 finished with value: 0.816039704003613 and parameters: {'n_estimators': 49, 'criterion': 'gini', 'max_depth': 32, 'min_samples_split': 20, 'min_samples_leaf': 6}. Best is trial 13 with value: 0.8163332401974481.
[I 2025-04-07 23:14:30,659] Trial 16 finished with value: 0.8159560574349675 and parameters: {'n_estimators': 50, 'criterion': 'gini', 'max_depth': 33, 'min_samples_split': 19, 'min_samples_leaf': 11}. Best is trial 13 with value: 0.8163332401974481.
[I 2025-04-07 23:14:35,538] Trial 17 finished with value: 0.8159136718207713 and parameters: {'n_estimators': 44, 'criterion': 'gini', 'max_depth': 29, 'min_samples_split': 13, 'min_samples_leaf': 7}. Best is trial 13 with value: 0.8163332401974481.
[I 2025-04-07 23:14:38,931] Trial 18 finished with value: 0.811595997617127 and parameters: {'n_estimators': 39, 'criterion': 'gini', 'max_depth': 12, 'min_samples_split': 18, 'min_samples_leaf': 1}. Best is trial 13 with value: 0.8163332401974481.
[I 2025-04-07 23:14:48,687] Trial 19 finished with value: 0.8157882898318458 and parameters: {'n_estimators': 117, 'criterion': 'gini', 'max_depth': 40, 'min_samples_split': 20, 'min_samples_leaf': 9}. Best is trial 13 with value: 0.8163332401974481.
[I 2025-04-07 23:14:50,777] Trial 20 finished with value: 0.8150336958603737 and parameters: {'n_estimators': 16, 'criterion': 'gini', 'max_depth': 28, 'min_samples_split': 17, 'min_samples_leaf': 14}. Best is trial 13 with value: 0.8163332401974481.
[I 2025-04-07 23:14:55,226] Trial 21 finished with value: 0.8162913993403167 and parameters: {'n_estimators': 48, 'criterion': 'gini', 'max_depth': 34, 'min_samples_split': 20, 'min_samples_leaf': 11}. Best is trial 13 with value: 0.8163332401974481.
[I 2025-04-07 23:15:00,314] Trial 22 finished with value: 0.8154528249168365 and parameters: {'n_estimators': 60, 'criterion': 'gini', 'max_depth': 34, 'min_samples_split': 20, 'min_samples_leaf': 6}. Best is trial 13 with value: 0.8163332401974481.
[I 2025-04-07 23:15:05,699] Trial 23 finished with value: 0.8157462732466293 and parameters: {'n_estimators': 64, 'criterion': 'gini', 'max_depth': 46, 'min_samples_split': 18, 'min_samples_leaf': 10}. Best is trial 13 with value: 0.8163332401974481.
[I 2025-04-07 23:15:08,768] Trial 24 finished with value: 0.8105479904614796 and parameters: {'n_estimators': 31, 'criterion': 'gini', 'max_depth': 12, 'min_samples_split': 13, 'min_samples_leaf': 15}. Best is trial 13 with value: 0.8163332401974481.
