[I 2025-04-07 23:04:43,948] Trial 10 finished with value: 0.8113860025550863 and parameters: {'iterations': 177, 'learning_rate': 0.9065962952148784, 'objective': 'Logloss', 'colsample_bylevel': 0.9431578966075731, 'depth': 7, 'boosting_type': 'Ordered', 'bootstrap_type': 'MVS', 'subsample': 0.9873013865144944}. Best is trial 0 with value: 0.8167103526686945.
[I 2025-04-07 23:05:09,956] Trial 11 finished with value: 0.7914306550615838 and parameters: {'iterations': 71, 'learning_rate': 0.0010967561945476345, 'objective': 'Logloss', 'colsample_bylevel': 0.8210722484919217, 'depth': 9, 'boosting_type': 'Ordered', 'bootstrap_type': 'Bernoulli', 'subsample': 0.33925403993567554}. Best is trial 0 with value: 0.8167103526686945.
[I 2025-04-07 23:05:12,867] Trial 12 finished with value: 0.8022471404647306 and parameters: {'iterations': 99, 'learning_rate': 0.944902698036367, 'objective': 'Logloss', 'colsample_bylevel': 0.10246561873224974, 'depth': 8, 'boosting_type': 'Ordered', 'bootstrap_type': 'Bernoulli', 'subsample': 0.2891258352813436}. Best is trial 0 with value: 0.8167103526686945.
[I 2025-04-07 23:05:46,786] Trial 13 finished with value: 0.8104640978735145 and parameters: {'iterations': 210, 'learning_rate': 0.0514497439410244, 'objective': 'Logloss', 'colsample_bylevel': 0.764297201432383, 'depth': 7, 'boosting_type': 'Ordered', 'bootstrap_type': 'Bernoulli', 'subsample': 0.4602164186891554}. Best is trial 0 with value: 0.8167103526686945.
[I 2025-04-07 23:06:45,862] Trial 14 finished with value: 0.8131889375655685 and parameters: {'iterations': 156, 'learning_rate': 0.47465546312061563, 'objective': 'CrossEntropy', 'colsample_bylevel': 0.5174573432448888, 'depth': 9, 'boosting_type': 'Ordered', 'bootstrap_type': 'MVS', 'subsample': 0.714107871620825}. Best is trial 0 with value: 0.8167103526686945.
[I 2025-04-07 23:07:07,490] Trial 15 finished with value: 0.7986416570455539 and parameters: {'iterations': 103, 'learning_rate': 0.03643367982967329, 'objective': 'Logloss', 'colsample_bylevel': 0.8833152748746711, 'depth': 8, 'boosting_type': 'Ordered', 'bootstrap_type': 'MVS', 'subsample': 0.1639890228204121}. Best is trial 0 with value: 0.8167103526686945.
[I 2025-04-07 23:07:53,948] Trial 16 finished with value: 0.8139015325246326 and parameters: {'iterations': 255, 'learning_rate': 0.3224164060320198, 'objective': 'CrossEntropy', 'colsample_bylevel': 0.6444528228569436, 'depth': 7, 'boosting_type': 'Ordered', 'bootstrap_type': 'Bernoulli', 'subsample': 0.32105626792463515}. Best is trial 0 with value: 0.8167103526686945.
[I 2025-04-07 23:08:27,679] Trial 17 finished with value: 0.8057689597424529 and parameters: {'iterations': 97, 'learning_rate': 0.05649524261792128, 'objective': 'Logloss', 'colsample_bylevel': 0.5028454488612126, 'depth': 9, 'boosting_type': 'Ordered', 'bootstrap_type': 'Bernoulli', 'subsample': 0.8426196165184803}. Best is trial 0 with value: 0.8167103526686945.
[I 2025-04-07 23:08:32,291] Trial 18 finished with value: 0.8144045717418693 and parameters: {'iterations': 159, 'learning_rate': 0.46966066339629636, 'objective': 'Logloss', 'colsample_bylevel': 0.9950763993969332, 'depth': 6, 'boosting_type': 'Plain', 'bootstrap_type': 'MVS', 'subsample': 0.5981101985059835}. Best is trial 0 with value: 0.8167103526686945.
[I 2025-04-07 23:09:31,689] Trial 19 finished with value: 0.8025406415129485 and parameters: {'iterations': 207, 'learning_rate': 0.015523484484870344, 'objective': 'CrossEntropy', 'colsample_bylevel': 0.7426806882301491, 'depth': 8, 'boosting_type': 'Ordered', 'bootstrap_type': 'Bayesian', 'bagging_temperature': 0.09444765263627097}. Best is trial 0 with value: 0.8167103526686945.
[I 2025-04-07 23:10:20,396] Trial 20 finished with value: 0.796000446349337 and parameters: {'iterations': 123, 'learning_rate': 0.0029798630487699244, 'objective': 'Logloss', 'colsample_bylevel': 0.6325233207377216, 'depth': 9, 'boosting_type': 'Ordered', 'bootstrap_type': 'MVS', 'subsample': 0.39839732155574403}. Best is trial 0 with value: 0.8167103526686945.
[I 2025-04-07 23:10:25,095] Trial 21 finished with value: 0.8169619601413558 and parameters: {'iterations': 153, 'learning_rate': 0.4755756806166141, 'objective': 'Logloss', 'colsample_bylevel': 0.9522953566486262, 'depth': 6, 'boosting_type': 'Plain', 'bootstrap_type': 'MVS', 'subsample': 0.5902443309063481}. Best is trial 21 with value: 0.8169619601413558.
[I 2025-04-07 23:10:28,893] Trial 22 finished with value: 0.8167942452566598 and parameters: {'iterations': 148, 'learning_rate': 0.2599702310362375, 'objective': 'Logloss', 'colsample_bylevel': 0.8563226567044822, 'depth': 5, 'boosting_type': 'Plain', 'bootstrap_type': 'MVS', 'subsample': 0.6216314078898779}. Best is trial 21 with value: 0.8169619601413558.
[I 2025-04-07 23:10:32,427] Trial 23 finished with value: 0.8133985460258215 and parameters: {'iterations': 148, 'learning_rate': 0.6251613082283157, 'objective': 'Logloss', 'colsample_bylevel': 0.8577825524150144, 'depth': 5, 'boosting_type': 'Plain', 'bootstrap_type': 'MVS', 'subsample': 0.609926993128897}. Best is trial 21 with value: 0.8169619601413558.
[I 2025-04-07 23:10:36,233] Trial 24 finished with value: 0.8157462556738206 and parameters: {'iterations': 169, 'learning_rate': 0.19967448796746828, 'objective': 'Logloss', 'colsample_bylevel': 0.9733713513807318, 'depth': 5, 'boosting_type': 'Plain', 'bootstrap_type': 'MVS', 'subsample': 0.8487358669471985}. Best is trial 21 with value: 0.8169619601413558.
[I 2025-04-07 23:10:39,332] Trial 25 finished with value: 0.812099071979981 and parameters: {'iterations': 136, 'learning_rate': 0.0936685274928125, 'objective': 'Logloss', 'colsample_bylevel': 0.8988468352253463, 'depth': 6, 'boosting_type': 'Plain', 'bootstrap_type': 'MVS', 'subsample': 0.5808802302437386}. Best is trial 21 with value: 0.8169619601413558.
[I 2025-04-07 23:10:44,486] Trial 26 finished with value: 0.8156623279402384 and parameters: {'iterations': 197, 'learning_rate': 0.4032874567347448, 'objective': 'CrossEntropy', 'colsample_bylevel': 0.8030809205760916, 'depth': 5, 'boosting_type': 'Plain', 'bootstrap_type': 'MVS', 'subsample': 0.8105719118653214}. Best is trial 21 with value: 0.8169619601413558.
[I 2025-04-07 23:10:49,307] Trial 27 finished with value: 0.8166684590931375 and parameters: {'iterations': 168, 'learning_rate': 0.22160896721995002, 'objective': 'Logloss', 'colsample_bylevel': 0.9182065668783652, 'depth': 6, 'boosting_type': 'Plain', 'bootstrap_type': 'MVS', 'subsample': 0.6595922068045414}. Best is trial 21 with value: 0.8169619601413558.
[I 2025-04-07 23:10:53,465] Trial 28 finished with value: 0.8095413848427497 and parameters: {'iterations': 145, 'learning_rate': 0.6692606553902611, 'objective': 'CrossEntropy', 'colsample_bylevel': 0.8364299715202701, 'depth': 7, 'boosting_type': 'Plain', 'bootstrap_type': 'MVS', 'subsample': 0.5097276266722129}. Best is trial 21 with value: 0.8169619601413558.
[I 2025-04-07 23:10:56,130] Trial 29 finished with value: 0.8023732077931891 and parameters: {'iterations': 113, 'learning_rate': 0.06780263052522516, 'objective': 'Logloss', 'colsample_bylevel': 0.5487471281544548, 'depth': 5, 'boosting_type': 'Plain', 'bootstrap_type': 'MVS', 'subsample': 0.9053086010694096}. Best is trial 21 with value: 0.8169619601413558.
[I 2025-04-07 23:10:59,146] Trial 30 finished with value: 0.7973000785504543 and parameters: {'iterations': 132, 'learning_rate': 0.024597122442852466, 'objective': 'Logloss', 'colsample_bylevel': 0.46180194370178773, 'depth': 6, 'boosting_type': 'Plain', 'bootstrap_type': 'MVS', 'subsample': 0.8059969585193298}. Best is trial 21 with value: 0.8169619601413558.
[I 2025-04-07 23:11:03,439] Trial 31 finished with value: 0.8169201720026498 and parameters: {'iterations': 170, 'learning_rate': 0.21610658436101599, 'objective': 'Logloss', 'colsample_bylevel': 0.9099354388269518, 'depth': 6, 'boosting_type': 'Plain', 'bootstrap_type': 'MVS', 'subsample': 0.686037451273888}. Best is trial 21 with value: 0.8169619601413558.
[I 2025-04-07 23:11:07,065] Trial 32 finished with value: 0.8167103526686945 and parameters: {'iterations': 154, 'learning_rate': 0.2276436489143011, 'objective': 'Logloss', 'colsample_bylevel': 0.9974160398032971, 'depth': 6, 'boosting_type': 'Plain', 'bootstrap_type': 'MVS', 'subsample': 0.6527221356599145}. Best is trial 21 with value: 0.8169619601413558.
[I 2025-04-07 23:11:10,777] Trial 33 finished with value: 0.8142369974396418 and parameters: {'iterations': 166, 'learning_rate': 0.1444852342900198, 'objective': 'Logloss', 'colsample_bylevel': 0.7669159185118759, 'depth': 5, 'boosting_type': 'Plain', 'bootstrap_type': 'MVS', 'subsample': 0.7637973224680028}. Best is trial 21 with value: 0.8169619601413558.
[I 2025-04-07 23:11:19,054] Trial 34 finished with value: 0.8172554787623822 and parameters: {'iterations': 176, 'learning_rate': 0.31538824641015534, 'objective': 'Logloss', 'colsample_bylevel': 0.7069034147229618, 'depth': 7, 'boosting_type': 'Plain', 'bootstrap_type': 'MVS', 'subsample': 0.9294212407027955}. Best is trial 34 with value: 0.8172554787623822.
[I 2025-04-07 23:11:24,853] Trial 35 finished with value: 0.8165844786411298 and parameters: {'iterations': 177, 'learning_rate': 0.3446077989862143, 'objective': 'Logloss', 'colsample_bylevel': 0.7015944523905889, 'depth': 7, 'boosting_type': 'Plain', 'bootstrap_type': 'MVS', 'subsample': 0.5332096574461808}. Best is trial 34 with value: 0.8172554787623822.
[I 2025-04-07 23:11:29,146] Trial 36 finished with value: 0.8096254883044173 and parameters: {'iterations': 199, 'learning_rate': 0.6474203179086284, 'objective': 'Logloss', 'colsample_bylevel': 0.9312283276741047, 'depth': 6, 'boosting_type': 'Plain', 'bootstrap_type': 'MVS', 'subsample': 0.6651669767133773}. Best is trial 34 with value: 0.8172554787623822.
[I 2025-04-07 23:11:37,237] Trial 37 finished with value: 0.8086616021832457 and parameters: {'iterations': 217, 'learning_rate': 0.09787604977550118, 'objective': 'Logloss', 'colsample_bylevel': 0.8750577023110796, 'depth': 4, 'boosting_type': 'Plain', 'bootstrap_type': 'Bayesian', 'bagging_temperature': 1.810417574586042}. Best is trial 34 with value: 0.8172554787623822.
[I 2025-04-07 23:11:40,440] Trial 38 finished with value: 0.8154529127808793 and parameters: {'iterations': 187, 'learning_rate': 0.1579200885812568, 'objective': 'Logloss', 'colsample_bylevel': 0.5924110192741692, 'depth': 5, 'boosting_type': 'Plain', 'bootstrap_type': 'MVS', 'subsample': 0.4613316765173109}. Best is trial 34 with value: 0.8172554787623822.
[I 2025-04-07 23:11:44,240] Trial 39 finished with value: 0.8171297628900943 and parameters: {'iterations': 119, 'learning_rate': 0.25622394984958186, 'objective': 'Logloss', 'colsample_bylevel': 0.8108439819789797, 'depth': 7, 'boosting_type': 'Plain', 'bootstrap_type': 'MVS', 'subsample': 0.9023102026658432}. Best is trial 34 with value: 0.8172554787623822.
[I 2025-04-07 23:11:47,545] Trial 40 finished with value: 0.8115957691706163 and parameters: {'iterations': 118, 'learning_rate': 0.4749977412226374, 'objective': 'Logloss', 'colsample_bylevel': 0.7270024123525428, 'depth': 7, 'boosting_type': 'Plain', 'bootstrap_type': 'Bayesian', 'bagging_temperature': 3.945968046401756}. Best is trial 34 with value: 0.8172554787623822.
[I 2025-04-07 23:11:52,291] Trial 41 finished with value: 0.8166687402580741 and parameters: {'iterations': 145, 'learning_rate': 0.2610605447137565, 'objective': 'Logloss', 'colsample_bylevel': 0.7861705247001182, 'depth': 7, 'boosting_type': 'Plain', 'bootstrap_type': 'MVS', 'subsample': 0.942734391066945}. Best is trial 34 with value: 0.8172554787623822.
[I 2025-04-07 23:11:57,108] Trial 42 finished with value: 0.815284987022481 and parameters: {'iterations': 178, 'learning_rate': 0.2789607942880957, 'objective': 'Logloss', 'colsample_bylevel': 0.8407875630323889, 'depth': 6, 'boosting_type': 'Plain', 'bootstrap_type': 'MVS', 'subsample': 0.8952533611384698}. Best is trial 34 with value: 0.8172554787623822.
[I 2025-04-07 23:12:00,289] Trial 43 finished with value: 0.8145725677915022 and parameters: {'iterations': 130, 'learning_rate': 0.1426991856628387, 'objective': 'Logloss', 'colsample_bylevel': 0.9392315129648747, 'depth': 6, 'boosting_type': 'Plain', 'bootstrap_type': 'MVS', 'subsample': 0.9778664107808245}. Best is trial 34 with value: 0.8172554787623822.
[I 2025-04-07 23:12:06,386] Trial 44 finished with value: 0.8075291752553768 and parameters: {'iterations': 163, 'learning_rate': 0.7332321489346916, 'objective': 'Logloss', 'colsample_bylevel': 0.8137978838656269, 'depth': 7, 'boosting_type': 'Plain', 'bootstrap_type': 'MVS', 'subsample': 0.7538371844997288}. Best is trial 34 with value: 0.8172554787623822.
[I 2025-04-07 23:12:10,591] Trial 45 finished with value: 0.8085775514400038 and parameters: {'iterations': 106, 'learning_rate': 0.07351301065240352, 'objective': 'Logloss', 'colsample_bylevel': 0.6795146232080207, 'depth': 7, 'boosting_type': 'Plain', 'bootstrap_type': 'MVS', 'subsample': 0.8889690650444761}. Best is trial 34 with value: 0.8172554787623822.
[I 2025-04-07 23:12:13,810] Trial 46 finished with value: 0.8162074891795431 and parameters: {'iterations': 149, 'learning_rate': 0.36967275501856994, 'objective': 'Logloss', 'colsample_bylevel': 0.8959354492311943, 'depth': 4, 'boosting_type': 'Plain', 'bootstrap_type': 'MVS', 'subsample': 0.6135117307000666}. Best is trial 34 with value: 0.8172554787623822.
[I 2025-04-07 23:12:16,825] Trial 47 finished with value: 0.8026242705087855 and parameters: {'iterations': 89, 'learning_rate': 0.956818042714588, 'objective': 'Logloss', 'colsample_bylevel': 0.9478961559481631, 'depth': 5, 'boosting_type': 'Plain', 'bootstrap_type': 'Bayesian', 'bagging_temperature': 9.94312144103429}. Best is trial 34 with value: 0.8172554787623822.
[I 2025-04-07 23:12:17,708] A new study created in RDB with name: catboost-num_features-6
[I 2025-04-07 23:12:22,697] Trial 0 finished with value: 0.8172555841992335 and parameters: {'iterations': 176, 'learning_rate': 0.31538824641015534, 'objective': 'Logloss', 'colsample_bylevel': 0.7069034147229618, 'depth': 7, 'boosting_type': 'Plain', 'bootstrap_type': 'MVS', 'subsample': 0.9294212407027955}. Best is trial 0 with value: 0.8172555841992335.
[I 2025-04-07 23:12:27,964] Trial 1 finished with value: 0.8128537889611132 and parameters: {'iterations': 174, 'learning_rate': 0.0628547300109737, 'objective': 'Logloss', 'colsample_bylevel': 0.8429719989782705, 'depth': 7, 'boosting_type': 'Plain', 'bootstrap_type': 'Bernoulli', 'subsample': 0.9892545670615364}. Best is trial 0 with value: 0.8172555841992335.
[I 2025-04-07 23:12:34,981] Trial 2 finished with value: 0.8157461678097778 and parameters: {'iterations': 251, 'learning_rate': 0.2129651475815258, 'objective': 'Logloss', 'colsample_bylevel': 0.464228480063396, 'depth': 4, 'boosting_type': 'Plain', 'bootstrap_type': 'Bayesian', 'bagging_temperature': 1.0673371111835706}. Best is trial 0 with value: 0.8172555841992335.
[I 2025-04-07 23:12:38,953] Trial 3 finished with value: 0.7928981251570569 and parameters: {'iterations': 128, 'learning_rate': 0.07317082867938914, 'objective': 'CrossEntropy', 'colsample_bylevel': 0.1948138282431735, 'depth': 6, 'boosting_type': 'Ordered', 'bootstrap_type': 'Bernoulli', 'subsample': 0.22211683486905265}. Best is trial 0 with value: 0.8172555841992335.
[I 2025-04-07 23:12:41,341] Trial 4 finished with value: 0.8139015325246326 and parameters: {'iterations': 191, 'learning_rate': 0.9881680397324938, 'objective': 'CrossEntropy', 'colsample_bylevel': 0.29164630214741205, 'depth': 5, 'boosting_type': 'Plain', 'bootstrap_type': 'MVS', 'subsample': 0.2871147028562941}. Best is trial 0 with value: 0.8172555841992335.
[I 2025-04-07 23:12:57,739] Trial 5 finished with value: 0.7929817014344683 and parameters: {'iterations': 181, 'learning_rate': 0.003293969446518261, 'objective': 'CrossEntropy', 'colsample_bylevel': 0.6708875542938921, 'depth': 7, 'boosting_type': 'Ordered', 'bootstrap_type': 'MVS', 'subsample': 0.2137660847564425}. Best is trial 0 with value: 0.8172555841992335.
[I 2025-04-07 23:14:08,441] Trial 6 finished with value: 0.8162914696315509 and parameters: {'iterations': 248, 'learning_rate': 0.05176571540024065, 'objective': 'CrossEntropy', 'colsample_bylevel': 0.6976296724874572, 'depth': 8, 'boosting_type': 'Ordered', 'bootstrap_type': 'Bernoulli', 'subsample': 0.8488303373233566}. Best is trial 0 with value: 0.8172555841992335.
[I 2025-04-07 23:14:16,501] Trial 7 finished with value: 0.7890828399767337 and parameters: {'iterations': 182, 'learning_rate': 0.002006575490813212, 'objective': 'CrossEntropy', 'colsample_bylevel': 0.802979745648045, 'depth': 5, 'boosting_type': 'Ordered', 'bootstrap_type': 'Bernoulli', 'subsample': 0.8485540068418839}. Best is trial 0 with value: 0.8172555841992335.
[I 2025-04-07 23:14:21,682] Trial 8 finished with value: 0.7902569671792655 and parameters: {'iterations': 147, 'learning_rate': 0.05717781832970137, 'objective': 'CrossEntropy', 'colsample_bylevel': 0.22121919029824255, 'depth': 8, 'boosting_type': 'Ordered', 'bootstrap_type': 'MVS', 'subsample': 0.20390500785630167}. Best is trial 0 with value: 0.8172555841992335.
[I 2025-04-07 23:14:23,047] Trial 9 finished with value: 0.8064394678250661 and parameters: {'iterations': 67, 'learning_rate': 0.30933811510299764, 'objective': 'CrossEntropy', 'colsample_bylevel': 0.31154021845236396, 'depth': 4, 'boosting_type': 'Plain', 'bootstrap_type': 'Bernoulli', 'subsample': 0.8398044841713431}. Best is trial 0 with value: 0.8172555841992335.
[I 2025-04-07 23:14:31,173] Trial 10 finished with value: 0.7896698069275525 and parameters: {'iterations': 109, 'learning_rate': 0.009551501376890464, 'objective': 'Logloss', 'colsample_bylevel': 0.9561018635001535, 'depth': 9, 'boosting_type': 'Plain', 'bootstrap_type': 'Bayesian', 'bagging_temperature': 9.529009993222461}. Best is trial 0 with value: 0.8172555841992335.
[I 2025-04-07 23:16:07,413] Trial 11 finished with value: 0.8018278005345649 and parameters: {'iterations': 232, 'learning_rate': 0.015025886466924106, 'objective': 'Logloss', 'colsample_bylevel': 0.5859555476232472, 'depth': 9, 'boosting_type': 'Ordered', 'bootstrap_type': 'MVS', 'subsample': 0.6194809467969827}. Best is trial 0 with value: 0.8172555841992335.
[I 2025-04-07 23:17:06,256] Trial 12 finished with value: 0.8137342218145331 and parameters: {'iterations': 217, 'learning_rate': 0.28303759533226897, 'objective': 'Logloss', 'colsample_bylevel': 0.7066503729362081, 'depth': 8, 'boosting_type': 'Ordered', 'bootstrap_type': 'Bernoulli', 'subsample': 0.6533650109872681}. Best is trial 0 with value: 0.8172555841992335.
[I 2025-04-07 23:17:18,593] Trial 13 finished with value: 0.7820815694626762 and parameters: {'iterations': 214, 'learning_rate': 0.8663017738466574, 'objective': 'Logloss', 'colsample_bylevel': 0.489811612209928, 'depth': 8, 'boosting_type': 'Plain', 'bootstrap_type': 'MVS', 'subsample': 0.9950475830190619}. Best is trial 0 with value: 0.8172555841992335.
[I 2025-04-07 23:17:28,567] Trial 14 finished with value: 0.796293982543172 and parameters: {'iterations': 255, 'learning_rate': 0.02095643022974227, 'objective': 'CrossEntropy', 'colsample_bylevel': 0.9347408366440305, 'depth': 6, 'boosting_type': 'Plain', 'bootstrap_type': 'Bayesian', 'bagging_temperature': 6.595190021829879}. Best is trial 0 with value: 0.8172555841992335.
[I 2025-04-07 23:17:37,487] Trial 15 finished with value: 0.8101704562428281 and parameters: {'iterations': 98, 'learning_rate': 0.09863670707324064, 'objective': 'Logloss', 'colsample_bylevel': 0.6466260718483174, 'depth': 7, 'boosting_type': 'Ordered', 'bootstrap_type': 'Bernoulli', 'subsample': 0.7709703586540504}. Best is trial 0 with value: 0.8172555841992335.
[I 2025-04-07 23:17:50,763] Trial 16 finished with value: 0.796797056906026 and parameters: {'iterations': 208, 'learning_rate': 0.004719638066556855, 'objective': 'CrossEntropy', 'colsample_bylevel': 0.7650439799419758, 'depth': 8, 'boosting_type': 'Plain', 'bootstrap_type': 'MVS', 'subsample': 0.4572220151796}. Best is trial 0 with value: 0.8172555841992335.
[I 2025-04-07 23:18:27,381] Trial 17 finished with value: 0.816794420984745 and parameters: {'iterations': 153, 'learning_rate': 0.21186332795293303, 'objective': 'Logloss', 'colsample_bylevel': 0.4278383586164148, 'depth': 9, 'boosting_type': 'Ordered', 'bootstrap_type': 'Bernoulli', 'subsample': 0.4654897573060365}. Best is trial 0 with value: 0.8172555841992335.
[I 2025-04-07 23:18:58,467] Trial 18 finished with value: 0.8061877900611709 and parameters: {'iterations': 150, 'learning_rate': 0.1791992907501232, 'objective': 'Logloss', 'colsample_bylevel': 0.40587325943597147, 'depth': 9, 'boosting_type': 'Ordered', 'bootstrap_type': 'MVS', 'subsample': 0.4255273932124892}. Best is trial 0 with value: 0.8172555841992335.
[I 2025-04-07 23:19:01,223] Trial 19 finished with value: 0.8157044148166893 and parameters: {'iterations': 130, 'learning_rate': 0.5448433641845256, 'objective': 'Logloss', 'colsample_bylevel': 0.5851075324956836, 'depth': 6, 'boosting_type': 'Plain', 'bootstrap_type': 'Bayesian', 'bagging_temperature': 0.9538094285233907}. Best is trial 0 with value: 0.8172555841992335.
[I 2025-04-07 23:19:03,402] Trial 20 finished with value: 0.7952042399672443 and parameters: {'iterations': 163, 'learning_rate': 0.15074090680679297, 'objective': 'Logloss', 'colsample_bylevel': 0.1316390220962677, 'depth': 9, 'boosting_type': 'Plain', 'bootstrap_type': 'MVS', 'subsample': 0.44766196328404934}. Best is trial 0 with value: 0.8172555841992335.
