[I 2025-04-08 00:01:38,292] Trial 108 finished with value: 0.8110090482391167 and parameters: {'iterations': 192, 'learning_rate': 0.9030629578502701, 'objective': 'Logloss', 'colsample_bylevel': 0.5784867267906747, 'depth': 8, 'boosting_type': 'Plain', 'bootstrap_type': 'Bernoulli', 'subsample': 0.31395465732754213}. Best is trial 46 with value: 0.8149496626899401.
[I 2025-04-08 00:02:00,439] Trial 109 finished with value: 0.8078227993132547 and parameters: {'iterations': 226, 'learning_rate': 0.5106023550444122, 'objective': 'CrossEntropy', 'colsample_bylevel': 0.6553580304098707, 'depth': 8, 'boosting_type': 'Ordered', 'bootstrap_type': 'MVS', 'subsample': 0.22894299868335083}. Best is trial 46 with value: 0.8149496626899401.
[I 2025-04-08 00:02:03,506] Trial 110 finished with value: 0.8128118953855562 and parameters: {'iterations': 177, 'learning_rate': 0.6040749285241342, 'objective': 'Logloss', 'colsample_bylevel': 0.6944184175769686, 'depth': 6, 'boosting_type': 'Plain', 'bootstrap_type': 'MVS', 'subsample': 0.9277112572624515}. Best is trial 46 with value: 0.8149496626899401.
[I 2025-04-08 00:02:07,487] Trial 111 finished with value: 0.8136083477869682 and parameters: {'iterations': 158, 'learning_rate': 0.34561622042773466, 'objective': 'CrossEntropy', 'colsample_bylevel': 0.7481638396425211, 'depth': 9, 'boosting_type': 'Plain', 'bootstrap_type': 'MVS', 'subsample': 0.375546580432501}. Best is trial 46 with value: 0.8149496626899401.
[I 2025-04-08 00:02:14,690] Trial 112 finished with value: 0.8078227465948291 and parameters: {'iterations': 201, 'learning_rate': 0.7270981706366508, 'objective': 'CrossEntropy', 'colsample_bylevel': 0.6237689177527836, 'depth': 9, 'boosting_type': 'Plain', 'bootstrap_type': 'MVS', 'subsample': 0.4383085680025712}. Best is trial 46 with value: 0.8149496626899401.
[I 2025-04-08 00:02:17,516] Trial 113 finished with value: 0.813524349762152 and parameters: {'iterations': 154, 'learning_rate': 0.44201850279322397, 'objective': 'CrossEntropy', 'colsample_bylevel': 0.7237644166098126, 'depth': 8, 'boosting_type': 'Plain', 'bootstrap_type': 'MVS', 'subsample': 0.12835992579676356}. Best is trial 46 with value: 0.8149496626899401.
[I 2025-04-08 00:02:21,430] Trial 114 finished with value: 0.8135246133542801 and parameters: {'iterations': 174, 'learning_rate': 0.23248133672904792, 'objective': 'CrossEntropy', 'colsample_bylevel': 0.7130249048840321, 'depth': 9, 'boosting_type': 'Plain', 'bootstrap_type': 'MVS', 'subsample': 0.24425709002262014}. Best is trial 46 with value: 0.8149496626899401.
[I 2025-04-08 00:02:24,433] Trial 115 finished with value: 0.8126440926368174 and parameters: {'iterations': 169, 'learning_rate': 0.2769182779690498, 'objective': 'CrossEntropy', 'colsample_bylevel': 0.6800277554399077, 'depth': 7, 'boosting_type': 'Plain', 'bootstrap_type': 'MVS', 'subsample': 0.3317601147161546}. Best is trial 46 with value: 0.8149496626899401.
[I 2025-04-08 00:02:34,397] Trial 116 finished with value: 0.8123090670420219 and parameters: {'iterations': 217, 'learning_rate': 0.38201815988256194, 'objective': 'CrossEntropy', 'colsample_bylevel': 0.7487423140199053, 'depth': 9, 'boosting_type': 'Plain', 'bootstrap_type': 'Bayesian', 'bagging_temperature': 7.72089484527993}. Best is trial 46 with value: 0.8149496626899401.
[I 2025-04-08 00:02:37,438] Trial 117 finished with value: 0.8001928791465238 and parameters: {'iterations': 185, 'learning_rate': 0.034368050541468895, 'objective': 'Logloss', 'colsample_bylevel': 0.6534355828562572, 'depth': 8, 'boosting_type': 'Plain', 'bootstrap_type': 'MVS', 'subsample': 0.3468335431184434}. Best is trial 46 with value: 0.8149496626899401.
[I 2025-04-08 00:02:41,466] Trial 118 finished with value: 0.8140276525715169 and parameters: {'iterations': 162, 'learning_rate': 0.49937737387067427, 'objective': 'CrossEntropy', 'colsample_bylevel': 0.7758182507715121, 'depth': 9, 'boosting_type': 'Plain', 'bootstrap_type': 'MVS', 'subsample': 0.17907098506458655}. Best is trial 46 with value: 0.8149496626899401.
[I 2025-04-08 00:02:43,210] Trial 119 finished with value: 0.8122247878522689 and parameters: {'iterations': 163, 'learning_rate': 0.5093575898907262, 'objective': 'Logloss', 'colsample_bylevel': 0.8573719909554421, 'depth': 5, 'boosting_type': 'Plain', 'bootstrap_type': 'Bernoulli', 'subsample': 0.1784106072575601}. Best is trial 46 with value: 0.8149496626899401.
[I 2025-04-08 00:02:47,245] Trial 120 finished with value: 0.8133565821590304 and parameters: {'iterations': 203, 'learning_rate': 0.5922536643888886, 'objective': 'CrossEntropy', 'colsample_bylevel': 0.615952345913002, 'depth': 6, 'boosting_type': 'Plain', 'bootstrap_type': 'MVS', 'subsample': 0.20891446625427063}. Best is trial 46 with value: 0.8149496626899401.
[I 2025-04-08 00:02:51,958] Trial 121 finished with value: 0.8133567227414987 and parameters: {'iterations': 166, 'learning_rate': 0.3363807237870707, 'objective': 'CrossEntropy', 'colsample_bylevel': 0.7854073952100911, 'depth': 9, 'boosting_type': 'Plain', 'bootstrap_type': 'MVS', 'subsample': 0.11852714141341394}. Best is trial 46 with value: 0.8149496626899401.
=== Number of features: 14 ===

訓練集準確率: 0.8332704481616569
測試集準確率: 0.8110328638497653
10-fold CV 準確率:  0.8208191388972359

1  before_merged_pr_count            : 50.78804197382467
2  before_closed_pr_count            : 17.863432405786067
3  before_pr_count                   : 11.429181808431244
4  opening_pr_count                  : 4.12287467611662
5  user_account_age                  : 3.1972658491028594
6  additions                         : 2.479805425497824
7  opened_pr_count_in_30_days        : 2.2270267946688658
8  commits                           : 2.2189378423997583
9  nature                            : 1.6082970918295052
10 changed_files                     : 1.2697704573445607
11 changes_quality                   : 0.8784198936497941
12 description_quality               : 0.7133006591661598
13 deletions                         : 0.6854344248026658
14 user_type                         : 0.5182106973794045

Removed feature: user_type

=== Number of features: 13 ===

訓練集準確率: 0.8329769840271664
測試集準確率: 0.8138832997987927
10-fold CV 準確率:  0.8188906637425513

1. before_merged_pr_count: 50.04332618579702
2. before_pr_count: 16.33625176925494
3. before_closed_pr_count: 13.421868694367193
4. opening_pr_count: 5.548303480144038
5. user_account_age: 3.120262915275775
6. opened_pr_count_in_30_days: 2.675045895446023
7. commits: 2.103810358845706
8. additions: 1.8707004223895134
9. nature: 1.5158734401099552
10. changed_files: 1.4606837190522033
11. deletions: 0.6800265063423022
12. description_quality: 0.6682157893493276
13. changes_quality: 0.5556308236259908

Removed feature: changes_quality

=== Number of features: 12 ===

訓練集準確率: 0.8333962185050099
測試集準確率: 0.8118712273641852
10-fold CV 準確率:  0.8196870809983464

1. before_merged_pr_count: 52.07995946866382
2. before_closed_pr_count: 15.558074924962009
3. before_pr_count: 12.977864247602538
4. opening_pr_count: 4.848248022389879
5. user_account_age: 3.6167496044785676
6. opened_pr_count_in_30_days: 2.735800121252308
7. additions: 1.944006543996476
8. commits: 1.732071204379632
9. nature: 1.5693194493843325
10. changed_files: 1.212481981579731
11. deletions: 1.0034845734521793
12. description_quality: 0.7219398578585132

Removed feature: description_quality

=== Number of features: 11 ===

訓練集準確率: 0.8309646585335178
測試集準確率: 0.8135479543930249
10-fold CV 準確率:  0.8203578526730878

1. before_merged_pr_count: 53.45100161541342
2. before_pr_count: 14.809496973455703
3. before_closed_pr_count: 14.171546549827493
4. opening_pr_count: 5.279742677484642
5. user_account_age: 3.0537722490956463
6. additions: 1.931840156765397
7. opened_pr_count_in_30_days: 1.9242324934340955
8. commits: 1.8059122505188154
9. nature: 1.3952140865377374
10. changed_files: 1.3414813984778926
11. deletions: 0.8357595489891269

Removed feature: deletions

=== Number of features: 10 ===

訓練集準確率: 0.8278203999496918
測試集準確率: 0.8118712273641852
10-fold CV 準確率:  0.8197289394282862

1. before_merged_pr_count: 53.82772555869369
2. before_closed_pr_count: 19.66744214110681
3. before_pr_count: 10.911558686410553
4. opening_pr_count: 4.130256398218317
5. user_account_age: 3.0913195853034567
6. opened_pr_count_in_30_days: 2.0694561207259485
7. commits: 2.0135251456931513
8. additions: 2.001518592653339
9. nature: 1.484026940989858
10. changed_files: 0.8031708302048782

Removed feature: changed_files

=== Number of features: 9 ===

訓練集準確率: 0.8281557875319666
測試集準確率: 0.8095238095238095
10-fold CV 準確率:  0.8192256717645383

1. before_merged_pr_count: 54.31461624922748
2. before_closed_pr_count: 16.331122224505762
3. before_pr_count: 12.565602173048596
4. opening_pr_count: 4.712201381339808
5. user_account_age: 3.658276625150984
6. commits: 2.5348160372016024
7. opened_pr_count_in_30_days: 2.2298065555254807
8. additions: 2.1734074171395923
9. nature: 1.4801513368607107

Removed feature: nature

=== Number of features: 8 ===

訓練集準確率: 0.8320965916236951
測試集準確率: 0.8132126089872569
10-fold CV 準確率:  0.8201901377883918

1. before_merged_pr_count: 53.16944613016321
2. before_pr_count: 14.951640885134683
3. before_closed_pr_count: 14.100522445295734
4. opening_pr_count: 5.977231225606585
5. user_account_age: 3.9479774175174307
6. additions: 2.728898811887926
7. opened_pr_count_in_30_days: 2.6225809664080644
8. commits: 2.501702117986364

Removed feature: commits

=== Number of features: 7 ===

訓練集準確率: 0.843960927346665
測試集準確率: 0.8095238095238095
10-fold CV 準確率:  0.8172554787623822

1. before_merged_pr_count: 46.951657069671306
2. before_closed_pr_count: 14.98927322328867
3. before_pr_count: 12.520110024430203
4. opening_pr_count: 8.099115946114612
5. user_account_age: 6.5438597008788655
6. additions: 5.5041030839873555
7. opened_pr_count_in_30_days: 5.391880951628979

Removed feature: opened_pr_count_in_30_days

=== Number of features: 6 ===

訓練集準確率: 0.8411939797928981
測試集準確率: 0.8070087189805499
10-fold CV 準確率:  0.8172555841992335

1. before_merged_pr_count: 48.38496223093903
2. before_closed_pr_count: 19.49188404353772
3. before_pr_count: 10.232617524539648
4. opening_pr_count: 8.94527791491934
5. user_account_age: 6.971797975201795
6. additions: 5.973460310862485

Removed feature: additions

=== Number of features: 5 ===

訓練集準確率: 0.8274011654718484
測試集準確率: 0.806841046277666
10-fold CV 準確率:  0.8183453092023527

1. before_merged_pr_count: 55.43458524485642
2. before_closed_pr_count: 18.384196571762278
3. before_pr_count: 14.71638346250555
4. opening_pr_count: 6.87325692022259
5. user_account_age: 4.591577800653175

Removed feature: user_account_age

=== Number of features: 4 ===

訓練集準確率: 0.8245922944702972
測試集準確率: 0.8061703554661301
10-fold CV 準確率:  0.8175491555386856

1. before_merged_pr_count: 59.81576977347477
2. before_closed_pr_count: 18.68399421108278
3. before_pr_count: 15.123305346986076
4. opening_pr_count: 6.376930668456369

Removed feature: opening_pr_count

=== Number of features: 3 ===

訓練集準確率: 0.8218672703643147
測試集準確率: 0.8024815560026828
10-fold CV 準確率:  0.816081703016021

1. before_merged_pr_count: 64.69193849419031
2. before_pr_count: 19.767206607837824
3. before_closed_pr_count: 15.540854897971863

Removed feature: before_closed_pr_count

=== Number of features: 2 ===

訓練集準確率: 0.8206934138263531
測試集準確率: 0.8038229376257545
10-fold CV 準確率:  0.8149496626899401

1. before_merged_pr_count: 66.725245812979
2. before_pr_count: 33.27475418702101

Removed feature: before_pr_count

=== Final Result ===
訓練集準確率:  {'init': 0.8332704481616569, 13: 0.8329769840271664, 12: 0.8333962185050099, 11: 0.8309646585335178, 10: 0.8278203999496918, 9: 0.8281557875319666, 8: 0.8320965916236951, 7: 0.843960927346665, 6: 0.8411939797928981, 5: 0.8274011654718484, 4: 0.8245922944702972, 3: 0.8218672703643147, 2: 0.8206934138263531}
測試集準確率:  {'init': 0.8110328638497653, 13: 0.8138832997987927, 12: 0.8118712273641852, 11: 0.8135479543930249, 10: 0.8118712273641852, 9: 0.8095238095238095, 8: 0.8132126089872569, 7: 0.8095238095238095, 6: 0.8070087189805499, 5: 0.806841046277666, 4: 0.8061703554661301, 3: 0.8024815560026828, 2: 0.8038229376257545}
10-fold CV 準確率:  {'init': 0.8208191388972359, 13: 0.8188906637425513, 12: 0.8196870809983464, 11: 0.8203578526730878, 10: 0.8197289394282862, 9: 0.8192256717645383, 8: 0.8201901377883918, 7: 0.8172554787623822, 6: 0.8172555841992335, 5: 0.8183453092023527, 4: 0.8175491555386856, 3: 0.816081703016021, 2: 0.8149496626899401}

特徵重要性表:  {'init': [('before_merged_pr_count', 50.78804197382467), ('before_closed_pr_count', 17.863432405786067), ('before_pr_count', 11.429181808431244), ('opening_pr_count', 4.12287467611662), ('user_account_age', 3.1972658491028594), ('additions', 2.479805425497824), ('opened_pr_count_in_30_days', 2.2270267946688658), ('commits', 2.2189378423997583), ('nature', 1.6082970918295052), ('changed_files', 1.2697704573445607), ('changes_quality', 0.8784198936497941), ('description_quality', 0.7133006591661598), ('deletions', 0.6854344248026658), ('user_type', 0.5182106973794045)], 13: [('before_merged_pr_count', 50.04332618579702), ('before_pr_count', 16.33625176925494), ('before_closed_pr_count', 13.421868694367193), ('opening_pr_count', 5.548303480144038), ('user_account_age', 3.120262915275775), ('opened_pr_count_in_30_days', 2.675045895446023), ('commits', 2.103810358845706), ('additions', 1.8707004223895134), ('nature', 1.5158734401099552), ('changed_files', 1.4606837190522033), ('deletions', 0.6800265063423022), ('description_quality', 0.6682157893493276), ('changes_quality', 0.5556308236259908)], 12: [('before_merged_pr_count', 52.07995946866382), ('before_closed_pr_count', 15.558074924962009), ('before_pr_count', 12.977864247602538), ('opening_pr_count', 4.848248022389879), ('user_account_age', 3.6167496044785676), ('opened_pr_count_in_30_days', 2.735800121252308), ('additions', 1.944006543996476), ('commits', 1.732071204379632), ('nature', 1.5693194493843325), ('changed_files', 1.212481981579731), ('deletions', 1.0034845734521793), ('description_quality', 0.7219398578585132)], 11: [('before_merged_pr_count', 53.45100161541342), ('before_pr_count', 14.809496973455703), ('before_closed_pr_count', 14.171546549827493), ('opening_pr_count', 5.279742677484642), ('user_account_age', 3.0537722490956463), ('additions', 1.931840156765397), ('opened_pr_count_in_30_days', 1.9242324934340955), ('commits', 1.8059122505188154), ('nature', 1.3952140865377374), ('changed_files', 1.3414813984778926), ('deletions', 0.8357595489891269)], 10: [('before_merged_pr_count', 53.82772555869369), ('before_closed_pr_count', 19.66744214110681), ('before_pr_count', 10.911558686410553), ('opening_pr_count', 4.130256398218317), ('user_account_age', 3.0913195853034567), ('opened_pr_count_in_30_days', 2.0694561207259485), ('commits', 2.0135251456931513), ('additions', 2.001518592653339), ('nature', 1.484026940989858), ('changed_files', 0.8031708302048782)], 9: [('before_merged_pr_count', 54.31461624922748), ('before_closed_pr_count', 16.331122224505762), ('before_pr_count', 12.565602173048596), ('opening_pr_count', 4.712201381339808), ('user_account_age', 3.658276625150984), ('commits', 2.5348160372016024), ('opened_pr_count_in_30_days', 2.2298065555254807), ('additions', 2.1734074171395923), ('nature', 1.4801513368607107)], 8: [('before_merged_pr_count', 53.16944613016321), ('before_pr_count', 14.951640885134683), ('before_closed_pr_count', 14.100522445295734), ('opening_pr_count', 5.977231225606585), ('user_account_age', 3.9479774175174307), ('additions', 2.728898811887926), ('opened_pr_count_in_30_days', 2.6225809664080644), ('commits', 2.501702117986364)], 7: [('before_merged_pr_count', 46.951657069671306), ('before_closed_pr_count', 14.98927322328867), ('before_pr_count', 12.520110024430203), ('opening_pr_count', 8.099115946114612), ('user_account_age', 6.5438597008788655), ('additions', 5.5041030839873555), ('opened_pr_count_in_30_days', 5.391880951628979)], 6: [('before_merged_pr_count', 48.38496223093903), ('before_closed_pr_count', 19.49188404353772), ('before_pr_count', 10.232617524539648), ('opening_pr_count', 8.94527791491934), ('user_account_age', 6.971797975201795), ('additions', 5.973460310862485)], 5: [('before_merged_pr_count', 55.43458524485642), ('before_closed_pr_count', 18.384196571762278), ('before_pr_count', 14.71638346250555), ('opening_pr_count', 6.87325692022259), ('user_account_age', 4.591577800653175)], 4: [('before_merged_pr_count', 59.81576977347477), ('before_closed_pr_count', 18.68399421108278), ('before_pr_count', 15.123305346986076), ('opening_pr_count', 6.376930668456369)], 3: [('before_merged_pr_count', 64.69193849419031), ('before_pr_count', 19.767206607837824), ('before_closed_pr_count', 15.540854897971863)], 2: [('before_merged_pr_count', 66.725245812979), ('before_pr_count', 33.27475418702101)]}
