[I 2025-04-07 22:00:09,568] A new study created in RDB with name: catboost-num_features-13
[I 2025-04-07 22:01:16,906] Trial 0 finished with value: 0.8188906637425513 and parameters: {'iterations': 164, 'learning_rate': 0.21452421430497562, 'objective': 'CrossEntropy', 'colsample_bylevel': 0.5744820300507832, 'depth': 9, 'boosting_type': 'Ordered', 'bootstrap_type': 'Bernoulli', 'subsample': 0.9337456176876163}. Best is trial 0 with value: 0.8188906637425513.
[I 2025-04-07 22:01:56,894] Trial 1 finished with value: 0.8046364625233497 and parameters: {'iterations': 240, 'learning_rate': 0.3667454722900429, 'objective': 'CrossEntropy', 'colsample_bylevel': 0.3787531454519659, 'depth': 7, 'boosting_type': 'Ordered', 'bootstrap_type': 'Bayesian', 'bagging_temperature': 9.86729131859071}. Best is trial 0 with value: 0.8188906637425513.
[I 2025-04-07 22:02:52,617] Trial 2 finished with value: 0.809331653372837 and parameters: {'iterations': 156, 'learning_rate': 0.2512183097830407, 'objective': 'CrossEntropy', 'colsample_bylevel': 0.8647268372268443, 'depth': 9, 'boosting_type': 'Ordered', 'bootstrap_type': 'MVS', 'subsample': 0.110444712486359}. Best is trial 0 with value: 0.8188906637425513.
[I 2025-04-07 22:02:59,370] Trial 3 finished with value: 0.8009472622442937 and parameters: {'iterations': 153, 'learning_rate': 0.5626951953619521, 'objective': 'CrossEntropy', 'colsample_bylevel': 0.40146607016241886, 'depth': 8, 'boosting_type': 'Plain', 'bootstrap_type': 'Bayesian', 'bagging_temperature': 6.652013489957321}. Best is trial 0 with value: 0.8188906637425513.
[I 2025-04-07 22:03:06,607] Trial 4 finished with value: 0.8024563447503871 and parameters: {'iterations': 145, 'learning_rate': 0.09573848016794442, 'objective': 'Logloss', 'colsample_bylevel': 0.7342151343535197, 'depth': 8, 'boosting_type': 'Plain', 'bootstrap_type': 'Bayesian', 'bagging_temperature': 8.619802695925067}. Best is trial 0 with value: 0.8188906637425513.
[I 2025-04-07 22:03:14,848] Trial 5 finished with value: 0.7718942960420763 and parameters: {'iterations': 68, 'learning_rate': 0.0023694964347116382, 'objective': 'CrossEntropy', 'colsample_bylevel': 0.21490403631891025, 'depth': 8, 'boosting_type': 'Ordered', 'bootstrap_type': 'Bernoulli', 'subsample': 0.8110641039715717}. Best is trial 0 with value: 0.8188906637425513.
[I 2025-04-07 22:03:21,385] Trial 6 finished with value: 0.8140693704189885 and parameters: {'iterations': 221, 'learning_rate': 0.12130670307435278, 'objective': 'CrossEntropy', 'colsample_bylevel': 0.49909789795363957, 'depth': 4, 'boosting_type': 'Plain', 'bootstrap_type': 'Bernoulli', 'subsample': 0.7758946409706748}. Best is trial 0 with value: 0.8188906637425513.
[I 2025-04-07 22:03:43,302] Trial 7 finished with value: 0.8136920470740394 and parameters: {'iterations': 215, 'learning_rate': 0.24359145019228037, 'objective': 'CrossEntropy', 'colsample_bylevel': 0.15580137316892934, 'depth': 6, 'boosting_type': 'Ordered', 'bootstrap_type': 'MVS', 'subsample': 0.9713271716921805}. Best is trial 0 with value: 0.8188906637425513.
[I 2025-04-07 22:03:54,205] Trial 8 finished with value: 0.8041334057333044 and parameters: {'iterations': 226, 'learning_rate': 0.062459322424403926, 'objective': 'CrossEntropy', 'colsample_bylevel': 0.9549670124170792, 'depth': 7, 'boosting_type': 'Plain', 'bootstrap_type': 'Bayesian', 'bagging_temperature': 7.137937745215282}. Best is trial 0 with value: 0.8188906637425513.
[I 2025-04-07 22:04:03,555] Trial 9 finished with value: 0.788537942329557 and parameters: {'iterations': 167, 'learning_rate': 0.0062061510968118684, 'objective': 'CrossEntropy', 'colsample_bylevel': 0.5910846128091725, 'depth': 5, 'boosting_type': 'Ordered', 'bootstrap_type': 'MVS', 'subsample': 0.9056669912456343}. Best is trial 0 with value: 0.8188906637425513.
[I 2025-04-07 22:04:39,386] Trial 10 finished with value: 0.7923111406334296 and parameters: {'iterations': 94, 'learning_rate': 0.011115251130655802, 'objective': 'Logloss', 'colsample_bylevel': 0.6800586254357688, 'depth': 9, 'boosting_type': 'Ordered', 'bootstrap_type': 'Bernoulli', 'subsample': 0.401670642913508}. Best is trial 0 with value: 0.8188906637425513.
[I 2025-04-07 22:04:42,224] Trial 11 finished with value: 0.7979707623611528 and parameters: {'iterations': 192, 'learning_rate': 0.028739791564061378, 'objective': 'Logloss', 'colsample_bylevel': 0.44086618145754025, 'depth': 4, 'boosting_type': 'Plain', 'bootstrap_type': 'Bernoulli', 'subsample': 0.6770604152154703}. Best is trial 0 with value: 0.8188906637425513.
[I 2025-04-07 22:04:49,700] Trial 12 finished with value: 0.8139016731071009 and parameters: {'iterations': 255, 'learning_rate': 0.10518775092859568, 'objective': 'CrossEntropy', 'colsample_bylevel': 0.5301308199951413, 'depth': 4, 'boosting_type': 'Plain', 'bootstrap_type': 'Bernoulli', 'subsample': 0.6537367943804907}. Best is trial 0 with value: 0.8188906637425513.
[I 2025-04-07 22:04:51,958] Trial 13 finished with value: 0.8102956449308598 and parameters: {'iterations': 121, 'learning_rate': 0.9122392679168841, 'objective': 'CrossEntropy', 'colsample_bylevel': 0.2973826989153365, 'depth': 5, 'boosting_type': 'Plain', 'bootstrap_type': 'Bernoulli', 'subsample': 0.7974949848018966}. Best is trial 0 with value: 0.8188906637425513.
[I 2025-04-07 22:05:15,725] Trial 14 finished with value: 0.8001090217041759 and parameters: {'iterations': 192, 'learning_rate': 0.02132349603495595, 'objective': 'Logloss', 'colsample_bylevel': 0.5491231276882247, 'depth': 6, 'boosting_type': 'Ordered', 'bootstrap_type': 'Bernoulli', 'subsample': 0.4119332367496683}. Best is trial 0 with value: 0.8188906637425513.
[I 2025-04-07 22:05:19,604] Trial 15 finished with value: 0.8168364024243446 and parameters: {'iterations': 196, 'learning_rate': 0.14243946806368366, 'objective': 'CrossEntropy', 'colsample_bylevel': 0.6915027168180389, 'depth': 5, 'boosting_type': 'Plain', 'bootstrap_type': 'Bernoulli', 'subsample': 0.9787582327999176}. Best is trial 0 with value: 0.8188906637425513.
[I 2025-04-07 22:05:23,533] Trial 16 finished with value: 0.7883282635780698 and parameters: {'iterations': 185, 'learning_rate': 0.001010480319748452, 'objective': 'CrossEntropy', 'colsample_bylevel': 0.784409597423021, 'depth': 5, 'boosting_type': 'Plain', 'bootstrap_type': 'Bernoulli', 'subsample': 0.943549064240828}. Best is trial 0 with value: 0.8188906637425513.
[I 2025-04-07 22:05:40,273] Trial 17 finished with value: 0.8046786548366519 and parameters: {'iterations': 112, 'learning_rate': 0.0512412883274167, 'objective': 'CrossEntropy', 'colsample_bylevel': 0.6358934938332899, 'depth': 6, 'boosting_type': 'Ordered', 'bootstrap_type': 'Bernoulli', 'subsample': 0.9884102929490848}. Best is trial 0 with value: 0.8188906637425513.
[I 2025-04-07 22:05:56,059] Trial 18 finished with value: 0.8168783662911357 and parameters: {'iterations': 136, 'learning_rate': 0.18727306480132277, 'objective': 'Logloss', 'colsample_bylevel': 0.8134132633372433, 'depth': 7, 'boosting_type': 'Ordered', 'bootstrap_type': 'Bernoulli', 'subsample': 0.48195228827611325}. Best is trial 0 with value: 0.8188906637425513.
[I 2025-04-07 22:06:44,315] Trial 19 finished with value: 0.7934009886462083 and parameters: {'iterations': 128, 'learning_rate': 0.9153563308690001, 'objective': 'Logloss', 'colsample_bylevel': 0.9782915408441092, 'depth': 9, 'boosting_type': 'Ordered', 'bootstrap_type': 'MVS', 'subsample': 0.3956729271379396}. Best is trial 0 with value: 0.8188906637425513.
[I 2025-04-07 22:06:53,814] Trial 20 finished with value: 0.8170458175837038 and parameters: {'iterations': 91, 'learning_rate': 0.37817342792307324, 'objective': 'Logloss', 'colsample_bylevel': 0.8365970491533834, 'depth': 7, 'boosting_type': 'Ordered', 'bootstrap_type': 'Bernoulli', 'subsample': 0.5044196375977237}. Best is trial 0 with value: 0.8188906637425513.
[I 2025-04-07 22:07:02,505] Trial 21 finished with value: 0.816207682480437 and parameters: {'iterations': 89, 'learning_rate': 0.3147078867094455, 'objective': 'Logloss', 'colsample_bylevel': 0.8410827287294287, 'depth': 7, 'boosting_type': 'Ordered', 'bootstrap_type': 'Bernoulli', 'subsample': 0.5236689250258111}. Best is trial 0 with value: 0.8188906637425513.
[I 2025-04-07 22:07:17,353] Trial 22 finished with value: 0.8164590966522042 and parameters: {'iterations': 65, 'learning_rate': 0.4647804575363874, 'objective': 'Logloss', 'colsample_bylevel': 0.9071477585670058, 'depth': 8, 'boosting_type': 'Ordered', 'bootstrap_type': 'Bernoulli', 'subsample': 0.5220152824345299}. Best is trial 0 with value: 0.8188906637425513.
[I 2025-04-07 22:07:30,240] Trial 23 finished with value: 0.8156626618236006 and parameters: {'iterations': 136, 'learning_rate': 0.18511133541611008, 'objective': 'Logloss', 'colsample_bylevel': 0.7812946222241426, 'depth': 7, 'boosting_type': 'Ordered', 'bootstrap_type': 'Bernoulli', 'subsample': 0.2829426512191876}. Best is trial 0 with value: 0.8188906637425513.
[I 2025-04-07 22:08:06,088] Trial 24 finished with value: 0.812895577099819 and parameters: {'iterations': 172, 'learning_rate': 0.0602313693594085, 'objective': 'Logloss', 'colsample_bylevel': 0.8059339964104161, 'depth': 8, 'boosting_type': 'Ordered', 'bootstrap_type': 'Bernoulli', 'subsample': 0.6174801584474878}. Best is trial 0 with value: 0.8188906637425513.
[I 2025-04-07 22:08:44,543] Trial 25 finished with value: 0.8141108598199491 and parameters: {'iterations': 104, 'learning_rate': 0.5081975743560699, 'objective': 'Logloss', 'colsample_bylevel': 0.9002643463199616, 'depth': 9, 'boosting_type': 'Ordered', 'bootstrap_type': 'Bernoulli', 'subsample': 0.28686288597627174}. Best is trial 0 with value: 0.8188906637425513.
[I 2025-04-07 22:08:51,988] Trial 26 finished with value: 0.8159140935681763 and parameters: {'iterations': 81, 'learning_rate': 0.20731028194024784, 'objective': 'Logloss', 'colsample_bylevel': 0.7159405594388706, 'depth': 7, 'boosting_type': 'Ordered', 'bootstrap_type': 'Bernoulli', 'subsample': 0.4879538360448688}. Best is trial 0 with value: 0.8188906637425513.
[I 2025-04-07 22:09:11,354] Trial 27 finished with value: 0.7959165361885632 and parameters: {'iterations': 140, 'learning_rate': 0.017131393188293192, 'objective': 'Logloss', 'colsample_bylevel': 0.6073163713286333, 'depth': 6, 'boosting_type': 'Ordered', 'bootstrap_type': 'Bernoulli', 'subsample': 0.6038411907051879}. Best is trial 0 with value: 0.8188906637425513.
[I 2025-04-07 22:09:34,416] Trial 28 finished with value: 0.8017020143710429 and parameters: {'iterations': 104, 'learning_rate': 0.04294261053406674, 'objective': 'Logloss', 'colsample_bylevel': 0.9946442980573096, 'depth': 8, 'boosting_type': 'Ordered', 'bootstrap_type': 'MVS', 'subsample': 0.29342082911547107}. Best is trial 0 with value: 0.8188906637425513.
[I 2025-04-07 22:09:45,779] Trial 29 finished with value: 0.8188904880144658 and parameters: {'iterations': 117, 'learning_rate': 0.39005427520939867, 'objective': 'Logloss', 'colsample_bylevel': 0.7484420603888683, 'depth': 7, 'boosting_type': 'Ordered', 'bootstrap_type': 'Bayesian', 'bagging_temperature': 0.0646380650043179}. Best is trial 0 with value: 0.8188906637425513.
[I 2025-04-07 22:10:03,905] Trial 30 finished with value: 0.8167522989626772 and parameters: {'iterations': 121, 'learning_rate': 0.6739723725651863, 'objective': 'Logloss', 'colsample_bylevel': 0.47625812110644694, 'depth': 6, 'boosting_type': 'Ordered', 'bootstrap_type': 'Bayesian', 'bagging_temperature': 0.31610379137725264}. Best is trial 0 with value: 0.8188906637425513.
[I 2025-04-07 22:10:18,920] Trial 31 finished with value: 0.8185548649441801 and parameters: {'iterations': 128, 'learning_rate': 0.3848903560639683, 'objective': 'Logloss', 'colsample_bylevel': 0.7797089625454958, 'depth': 7, 'boosting_type': 'Ordered', 'bootstrap_type': 'Bayesian', 'bagging_temperature': 0.9183643787977966}. Best is trial 0 with value: 0.8188906637425513.
[I 2025-04-07 22:10:24,416] A new study created in RDB with name: catboost-num_features-12
[I 2025-04-07 22:11:27,612] Trial 0 finished with value: 0.8196870809983464 and parameters: {'iterations': 164, 'learning_rate': 0.21452421430497562, 'objective': 'CrossEntropy', 'colsample_bylevel': 0.5744820300507832, 'depth': 9, 'boosting_type': 'Ordered', 'bootstrap_type': 'Bernoulli', 'subsample': 0.9337456176876163}. Best is trial 0 with value: 0.8196870809983464.
[I 2025-04-07 22:11:50,822] Trial 1 finished with value: 0.7558369665114987 and parameters: {'iterations': 218, 'learning_rate': 0.0012606625147606383, 'objective': 'CrossEntropy', 'colsample_bylevel': 0.1749662344107787, 'depth': 7, 'boosting_type': 'Ordered', 'bootstrap_type': 'Bayesian', 'bagging_temperature': 6.635373863157556}. Best is trial 0 with value: 0.8196870809983464.
[I 2025-04-07 22:12:26,358] Trial 2 finished with value: 0.8123089616051706 and parameters: {'iterations': 106, 'learning_rate': 0.14547417687696, 'objective': 'CrossEntropy', 'colsample_bylevel': 0.7093760007266459, 'depth': 9, 'boosting_type': 'Ordered', 'bootstrap_type': 'Bernoulli', 'subsample': 0.13132964854156107}. Best is trial 0 with value: 0.8196870809983464.
[I 2025-04-07 22:12:33,116] Trial 3 finished with value: 0.8061035987354608 and parameters: {'iterations': 131, 'learning_rate': 0.23965571463051175, 'objective': 'CrossEntropy', 'colsample_bylevel': 0.9725121982577188, 'depth': 5, 'boosting_type': 'Ordered', 'bootstrap_type': 'MVS', 'subsample': 0.2650295016009724}. Best is trial 0 with value: 0.8196870809983464.
[I 2025-04-07 22:12:55,999] Trial 4 finished with value: 0.793862187006314 and parameters: {'iterations': 239, 'learning_rate': 0.02138569207785712, 'objective': 'CrossEntropy', 'colsample_bylevel': 0.6245168733789214, 'depth': 4, 'boosting_type': 'Ordered', 'bootstrap_type': 'Bayesian', 'bagging_temperature': 5.000546123826296}. Best is trial 0 with value: 0.8196870809983464.
[I 2025-04-07 22:13:00,583] Trial 5 finished with value: 0.7922690713297872 and parameters: {'iterations': 113, 'learning_rate': 0.03355688427500739, 'objective': 'CrossEntropy', 'colsample_bylevel': 0.6358673104815471, 'depth': 4, 'boosting_type': 'Ordered', 'bootstrap_type': 'MVS', 'subsample': 0.41698570628439413}. Best is trial 0 with value: 0.8196870809983464.
[I 2025-04-07 22:13:06,912] Trial 6 finished with value: 0.7738228942064207 and parameters: {'iterations': 86, 'learning_rate': 0.0436708369280351, 'objective': 'CrossEntropy', 'colsample_bylevel': 0.13126152357694487, 'depth': 9, 'boosting_type': 'Ordered', 'bootstrap_type': 'Bernoulli', 'subsample': 0.8065833365271323}. Best is trial 0 with value: 0.8196870809983464.
[I 2025-04-07 22:13:26,926] Trial 7 finished with value: 0.7611194054767415 and parameters: {'iterations': 202, 'learning_rate': 0.017263006275716135, 'objective': 'Logloss', 'colsample_bylevel': 0.1019435428933863, 'depth': 9, 'boosting_type': 'Ordered', 'bootstrap_type': 'Bernoulli', 'subsample': 0.566051046669409}. Best is trial 0 with value: 0.8196870809983464.
[I 2025-04-07 22:13:28,908] Trial 8 finished with value: 0.8136918186275285 and parameters: {'iterations': 70, 'learning_rate': 0.31620665165076883, 'objective': 'Logloss', 'colsample_bylevel': 0.41457742885859705, 'depth': 6, 'boosting_type': 'Plain', 'bootstrap_type': 'Bernoulli', 'subsample': 0.5100612570410897}. Best is trial 0 with value: 0.8196870809983464.
[I 2025-04-07 22:13:34,031] Trial 9 finished with value: 0.7939043617468075 and parameters: {'iterations': 165, 'learning_rate': 0.036162374074974614, 'objective': 'Logloss', 'colsample_bylevel': 0.3589357575709161, 'depth': 4, 'boosting_type': 'Ordered', 'bootstrap_type': 'Bernoulli', 'subsample': 0.11785026957810078}. Best is trial 0 with value: 0.8196870809983464.
[I 2025-04-07 22:13:39,499] Trial 10 finished with value: 0.8002770528994254 and parameters: {'iterations': 169, 'learning_rate': 0.8936858555326442, 'objective': 'Logloss', 'colsample_bylevel': 0.8599130996908328, 'depth': 7, 'boosting_type': 'Plain', 'bootstrap_type': 'Bayesian', 'bagging_temperature': 0.3967508888578273}. Best is trial 0 with value: 0.8196870809983464.
[I 2025-04-07 22:13:41,649] Trial 11 finished with value: 0.8132727247166824 and parameters: {'iterations': 65, 'learning_rate': 0.8447643575885732, 'objective': 'Logloss', 'colsample_bylevel': 0.4297941806108586, 'depth': 6, 'boosting_type': 'Plain', 'bootstrap_type': 'Bernoulli', 'subsample': 0.9688644226961854}. Best is trial 0 with value: 0.8196870809983464.
[I 2025-04-07 22:13:48,568] Trial 12 finished with value: 0.8175906449396461 and parameters: {'iterations': 140, 'learning_rate': 0.22351038766050044, 'objective': 'Logloss', 'colsample_bylevel': 0.4163884136555669, 'depth': 8, 'boosting_type': 'Plain', 'bootstrap_type': 'Bernoulli', 'subsample': 0.6343862539359781}. Best is trial 0 with value: 0.8196870809983464.
[I 2025-04-07 22:13:56,038] Trial 13 finished with value: 0.8162492421726316 and parameters: {'iterations': 143, 'learning_rate': 0.10924393488749543, 'objective': 'Logloss', 'colsample_bylevel': 0.5177396842397184, 'depth': 8, 'boosting_type': 'Plain', 'bootstrap_type': 'Bernoulli', 'subsample': 0.7660427792615965}. Best is trial 0 with value: 0.8196870809983464.
[I 2025-04-07 22:14:02,786] Trial 14 finished with value: 0.789376323452143 and parameters: {'iterations': 188, 'learning_rate': 0.005534275520546501, 'objective': 'CrossEntropy', 'colsample_bylevel': 0.31113239558365835, 'depth': 8, 'boosting_type': 'Plain', 'bootstrap_type': 'Bernoulli', 'subsample': 0.7392747524481096}. Best is trial 0 with value: 0.8196870809983464.
[I 2025-04-07 22:14:09,326] Trial 15 finished with value: 0.8172555841992335 and parameters: {'iterations': 146, 'learning_rate': 0.3341753442230996, 'objective': 'Logloss', 'colsample_bylevel': 0.7456428809793603, 'depth': 8, 'boosting_type': 'Plain', 'bootstrap_type': 'MVS', 'subsample': 0.6451846281188028}. Best is trial 0 with value: 0.8196870809983464.
[I 2025-04-07 22:14:14,417] Trial 16 finished with value: 0.8152431813109666 and parameters: {'iterations': 181, 'learning_rate': 0.10674562753692705, 'objective': 'CrossEntropy', 'colsample_bylevel': 0.25793605721501406, 'depth': 8, 'boosting_type': 'Plain', 'bootstrap_type': 'Bernoulli', 'subsample': 0.9506922113719478}. Best is trial 0 with value: 0.8196870809983464.
[I 2025-04-07 22:14:27,737] Trial 17 finished with value: 0.7935687913949472 and parameters: {'iterations': 121, 'learning_rate': 0.007339396501178843, 'objective': 'Logloss', 'colsample_bylevel': 0.49966268621082427, 'depth': 9, 'boosting_type': 'Plain', 'bootstrap_type': 'Bernoulli', 'subsample': 0.83536215506494}. Best is trial 0 with value: 0.8196870809983464.
[I 2025-04-07 22:14:31,843] Trial 18 finished with value: 0.8131050625504119 and parameters: {'iterations': 151, 'learning_rate': 0.07459045355675362, 'objective': 'Logloss', 'colsample_bylevel': 0.5869742033616694, 'depth': 7, 'boosting_type': 'Plain', 'bootstrap_type': 'MVS', 'subsample': 0.42955844415668376}. Best is trial 0 with value: 0.8196870809983464.
[I 2025-04-07 22:15:39,191] Trial 19 finished with value: 0.8025823593604201 and parameters: {'iterations': 248, 'learning_rate': 0.5243940103110963, 'objective': 'CrossEntropy', 'colsample_bylevel': 0.7377736310020766, 'depth': 8, 'boosting_type': 'Ordered', 'bootstrap_type': 'Bayesian', 'bagging_temperature': 9.785842235517066}. Best is trial 0 with value: 0.8196870809983464.
[I 2025-04-07 22:16:00,579] Trial 20 finished with value: 0.8133145304281966 and parameters: {'iterations': 219, 'learning_rate': 0.19484625271596384, 'objective': 'CrossEntropy', 'colsample_bylevel': 0.23801270136120906, 'depth': 9, 'boosting_type': 'Plain', 'bootstrap_type': 'Bernoulli', 'subsample': 0.6492484542471031}. Best is trial 0 with value: 0.8196870809983464.
[I 2025-04-07 22:16:06,949] Trial 21 finished with value: 0.8163331347605969 and parameters: {'iterations': 140, 'learning_rate': 0.39189517243886446, 'objective': 'Logloss', 'colsample_bylevel': 0.8304461150026885, 'depth': 8, 'boosting_type': 'Plain', 'bootstrap_type': 'MVS', 'subsample': 0.6129528902399036}. Best is trial 0 with value: 0.8196870809983464.
[I 2025-04-07 22:16:13,908] Trial 22 finished with value: 0.8137753773321312 and parameters: {'iterations': 159, 'learning_rate': 0.48366853231099033, 'objective': 'Logloss', 'colsample_bylevel': 0.7536828303324171, 'depth': 8, 'boosting_type': 'Plain', 'bootstrap_type': 'MVS', 'subsample': 0.6686063376817579}. Best is trial 0 with value: 0.8196870809983464.
[I 2025-04-07 22:16:16,932] Trial 23 finished with value: 0.806523219830563 and parameters: {'iterations': 98, 'learning_rate': 0.06519026855912395, 'objective': 'Logloss', 'colsample_bylevel': 0.4599232575907028, 'depth': 7, 'boosting_type': 'Plain', 'bootstrap_type': 'MVS', 'subsample': 0.8822872270764607}. Best is trial 0 with value: 0.8196870809983464.
[I 2025-04-07 22:16:33,058] Trial 24 finished with value: 0.8175908206677317 and parameters: {'iterations': 127, 'learning_rate': 0.220436358524187, 'objective': 'Logloss', 'colsample_bylevel': 0.6611881531950761, 'depth': 9, 'boosting_type': 'Plain', 'bootstrap_type': 'MVS', 'subsample': 0.48750277273098774}. Best is trial 0 with value: 0.8196870809983464.
[I 2025-04-07 22:16:50,087] Trial 25 finished with value: 0.8168360685409825 and parameters: {'iterations': 128, 'learning_rate': 0.1626443353952536, 'objective': 'Logloss', 'colsample_bylevel': 0.5662071831560708, 'depth': 9, 'boosting_type': 'Plain', 'bootstrap_type': 'MVS', 'subsample': 0.37881359065338127}. Best is trial 0 with value: 0.8196870809983464.
