[I 2025-04-07 23:52:00,164] Trial 72 finished with value: 0.8131472197180971 and parameters: {'iterations': 128, 'learning_rate': 0.2739003577859122, 'objective': 'Logloss', 'colsample_bylevel': 0.7190866847267124, 'depth': 8, 'boosting_type': 'Plain', 'bootstrap_type': 'Bayesian', 'bagging_temperature': 2.3737003113120823}. Best is trial 53 with value: 0.8157464665475229.
[I 2025-04-07 23:52:05,967] Trial 73 finished with value: 0.814237331323004 and parameters: {'iterations': 140, 'learning_rate': 0.34860708584091804, 'objective': 'Logloss', 'colsample_bylevel': 0.8344218870065244, 'depth': 9, 'boosting_type': 'Plain', 'bootstrap_type': 'Bayesian', 'bagging_temperature': 1.6286349901361565}. Best is trial 53 with value: 0.8157464665475229.
[I 2025-04-07 23:52:08,582] Trial 74 finished with value: 0.792059585879194 and parameters: {'iterations': 118, 'learning_rate': 0.0010101091902624919, 'objective': 'Logloss', 'colsample_bylevel': 0.7619348666862906, 'depth': 7, 'boosting_type': 'Plain', 'bootstrap_type': 'Bayesian', 'bagging_temperature': 2.7905458888307058}. Best is trial 53 with value: 0.8157464665475229.
[I 2025-04-07 23:52:11,383] Trial 75 finished with value: 0.8143209778916495 and parameters: {'iterations': 97, 'learning_rate': 0.4098902119076444, 'objective': 'Logloss', 'colsample_bylevel': 0.8907649237016874, 'depth': 8, 'boosting_type': 'Plain', 'bootstrap_type': 'Bayesian', 'bagging_temperature': 3.843482601407852}. Best is trial 53 with value: 0.8157464665475229.
[I 2025-04-07 23:52:13,749] Trial 76 finished with value: 0.8122247351338434 and parameters: {'iterations': 150, 'learning_rate': 0.15474269156788914, 'objective': 'Logloss', 'colsample_bylevel': 0.6912873466387071, 'depth': 6, 'boosting_type': 'Plain', 'bootstrap_type': 'Bayesian', 'bagging_temperature': 0.4060072250287947}. Best is trial 53 with value: 0.8157464665475229.
[I 2025-04-07 23:52:17,764] Trial 77 finished with value: 0.8131470615628201 and parameters: {'iterations': 176, 'learning_rate': 0.17993014077286096, 'objective': 'Logloss', 'colsample_bylevel': 0.7944361425428884, 'depth': 7, 'boosting_type': 'Plain', 'bootstrap_type': 'MVS', 'subsample': 0.9240093191495075}. Best is trial 53 with value: 0.8157464665475229.
[I 2025-04-07 23:52:21,543] Trial 78 finished with value: 0.8115123510484816 and parameters: {'iterations': 155, 'learning_rate': 0.09707713427540347, 'objective': 'Logloss', 'colsample_bylevel': 0.7292116184852174, 'depth': 8, 'boosting_type': 'Plain', 'bootstrap_type': 'Bernoulli', 'subsample': 0.7926398263845743}. Best is trial 53 with value: 0.8157464665475229.
[I 2025-04-07 23:52:25,790] Trial 79 finished with value: 0.8069845763459453 and parameters: {'iterations': 146, 'learning_rate': 0.23248681084857922, 'objective': 'Logloss', 'colsample_bylevel': 0.6460203086693541, 'depth': 4, 'boosting_type': 'Ordered', 'bootstrap_type': 'Bayesian', 'bagging_temperature': 2.203047367065297}. Best is trial 53 with value: 0.8157464665475229.
[I 2025-04-07 23:52:41,400] Trial 80 finished with value: 0.7925628183973247 and parameters: {'iterations': 203, 'learning_rate': 0.0017752370208933886, 'objective': 'CrossEntropy', 'colsample_bylevel': 0.6659231315089122, 'depth': 9, 'boosting_type': 'Plain', 'bootstrap_type': 'Bayesian', 'bagging_temperature': 1.2137807016350142}. Best is trial 53 with value: 0.8157464665475229.
[I 2025-04-07 23:52:44,002] Trial 81 finished with value: 0.816081703016021 and parameters: {'iterations': 199, 'learning_rate': 0.4689095601994416, 'objective': 'Logloss', 'colsample_bylevel': 0.7378530134318768, 'depth': 5, 'boosting_type': 'Plain', 'bootstrap_type': 'Bernoulli', 'subsample': 0.38966767190709095}. Best is trial 81 with value: 0.816081703016021.
[I 2025-04-07 23:52:50,277] Trial 82 finished with value: 0.8099191475079122 and parameters: {'iterations': 238, 'learning_rate': 0.7690478587880585, 'objective': 'Logloss', 'colsample_bylevel': 0.7600552471491612, 'depth': 5, 'boosting_type': 'Plain', 'bootstrap_type': 'Bernoulli', 'subsample': 0.3319172502556251}. Best is trial 81 with value: 0.816081703016021.
[I 2025-04-07 23:52:50,823] A new study created in RDB with name: catboost-num_features-2
[I 2025-04-07 23:52:53,750] Trial 0 finished with value: 0.8133148115931332 and parameters: {'iterations': 199, 'learning_rate': 0.4689095601994416, 'objective': 'Logloss', 'colsample_bylevel': 0.7378530134318768, 'depth': 5, 'boosting_type': 'Plain', 'bootstrap_type': 'Bernoulli', 'subsample': 0.38966767190709095}. Best is trial 0 with value: 0.8133148115931332.
[I 2025-04-07 23:53:07,941] Trial 1 finished with value: 0.800779687942066 and parameters: {'iterations': 87, 'learning_rate': 0.05679634128383112, 'objective': 'Logloss', 'colsample_bylevel': 0.759623188556617, 'depth': 9, 'boosting_type': 'Ordered', 'bootstrap_type': 'Bayesian', 'bagging_temperature': 3.5249566670035684}. Best is trial 0 with value: 0.8133148115931332.
[I 2025-04-07 23:53:12,434] Trial 2 finished with value: 0.7933173420775629 and parameters: {'iterations': 166, 'learning_rate': 0.05795109514175022, 'objective': 'Logloss', 'colsample_bylevel': 0.6995067385775643, 'depth': 5, 'boosting_type': 'Ordered', 'bootstrap_type': 'MVS', 'subsample': 0.2843240720056721}. Best is trial 0 with value: 0.8133148115931332.
[I 2025-04-07 23:53:16,734] Trial 3 finished with value: 0.7851839082277647 and parameters: {'iterations': 213, 'learning_rate': 0.0133965348679701, 'objective': 'CrossEntropy', 'colsample_bylevel': 0.5289319104635446, 'depth': 4, 'boosting_type': 'Plain', 'bootstrap_type': 'Bayesian', 'bagging_temperature': 3.2836951692606164}. Best is trial 0 with value: 0.8133148115931332.
[I 2025-04-07 23:53:19,621] Trial 4 finished with value: 0.7902568793152229 and parameters: {'iterations': 98, 'learning_rate': 0.0014756382383813561, 'objective': 'CrossEntropy', 'colsample_bylevel': 0.8809435257751853, 'depth': 5, 'boosting_type': 'Ordered', 'bootstrap_type': 'MVS', 'subsample': 0.41933548020154077}. Best is trial 0 with value: 0.8133148115931332.
[I 2025-04-07 23:53:25,221] Trial 5 finished with value: 0.791891941285732 and parameters: {'iterations': 231, 'learning_rate': 0.015271121512882943, 'objective': 'CrossEntropy', 'colsample_bylevel': 0.5361803202029698, 'depth': 9, 'boosting_type': 'Plain', 'bootstrap_type': 'Bernoulli', 'subsample': 0.3364117890408267}. Best is trial 0 with value: 0.8133148115931332.
[I 2025-04-07 23:53:42,470] Trial 6 finished with value: 0.7853933936783579 and parameters: {'iterations': 254, 'learning_rate': 0.0090253185289351, 'objective': 'Logloss', 'colsample_bylevel': 0.47819446185179815, 'depth': 8, 'boosting_type': 'Ordered', 'bootstrap_type': 'Bayesian', 'bagging_temperature': 2.0445973432335807}. Best is trial 0 with value: 0.8133148115931332.
[I 2025-04-07 23:53:52,096] Trial 7 finished with value: 0.7889152481016973 and parameters: {'iterations': 230, 'learning_rate': 0.0011607414801330334, 'objective': 'Logloss', 'colsample_bylevel': 0.8019457285565978, 'depth': 5, 'boosting_type': 'Plain', 'bootstrap_type': 'Bayesian', 'bagging_temperature': 2.844603280944007}. Best is trial 0 with value: 0.8133148115931332.
[I 2025-04-07 23:53:55,076] Trial 8 finished with value: 0.76422174424183 and parameters: {'iterations': 185, 'learning_rate': 0.0015493659582329993, 'objective': 'Logloss', 'colsample_bylevel': 0.6838827122225017, 'depth': 4, 'boosting_type': 'Plain', 'bootstrap_type': 'Bayesian', 'bagging_temperature': 9.127691361683818}. Best is trial 0 with value: 0.8133148115931332.
[I 2025-04-07 23:53:58,746] Trial 9 finished with value: 0.8017439079465998 and parameters: {'iterations': 139, 'learning_rate': 0.05335630701447151, 'objective': 'Logloss', 'colsample_bylevel': 0.8692479349320804, 'depth': 7, 'boosting_type': 'Plain', 'bootstrap_type': 'Bayesian', 'bagging_temperature': 9.29710642801056}. Best is trial 0 with value: 0.8133148115931332.
[I 2025-04-07 23:53:59,918] Trial 10 finished with value: 0.8036305422441531 and parameters: {'iterations': 130, 'learning_rate': 0.9659381685095688, 'objective': 'CrossEntropy', 'colsample_bylevel': 0.23105554175464255, 'depth': 6, 'boosting_type': 'Plain', 'bootstrap_type': 'Bernoulli', 'subsample': 0.9676370356545073}. Best is trial 0 with value: 0.8133148115931332.
[I 2025-04-07 23:54:00,891] Trial 11 finished with value: 0.7925628183973247 and parameters: {'iterations': 132, 'learning_rate': 0.8114906165176003, 'objective': 'CrossEntropy', 'colsample_bylevel': 0.10997701897114459, 'depth': 6, 'boosting_type': 'Plain', 'bootstrap_type': 'Bernoulli', 'subsample': 0.997542676702333}. Best is trial 0 with value: 0.8133148115931332.
[I 2025-04-07 23:54:02,340] Trial 12 finished with value: 0.8069841897441574 and parameters: {'iterations': 195, 'learning_rate': 0.9655322292476736, 'objective': 'CrossEntropy', 'colsample_bylevel': 0.2941724530971304, 'depth': 6, 'boosting_type': 'Plain', 'bootstrap_type': 'Bernoulli', 'subsample': 0.8029434596079899}. Best is trial 0 with value: 0.8133148115931332.
[I 2025-04-07 23:54:03,997] Trial 13 finished with value: 0.8066492520134044 and parameters: {'iterations': 194, 'learning_rate': 0.2599513089705659, 'objective': 'CrossEntropy', 'colsample_bylevel': 0.3847792759163127, 'depth': 7, 'boosting_type': 'Plain', 'bootstrap_type': 'Bernoulli', 'subsample': 0.6501021627953699}. Best is trial 0 with value: 0.8133148115931332.
[I 2025-04-07 23:54:05,362] Trial 14 finished with value: 0.8033793213732798 and parameters: {'iterations': 174, 'learning_rate': 0.34017299215431307, 'objective': 'Logloss', 'colsample_bylevel': 0.3254331458883129, 'depth': 6, 'boosting_type': 'Plain', 'bootstrap_type': 'Bernoulli', 'subsample': 0.665066584699074}. Best is trial 0 with value: 0.8133148115931332.
[I 2025-04-07 23:54:11,446] Trial 15 finished with value: 0.8109254895345138 and parameters: {'iterations': 205, 'learning_rate': 0.16278619285825288, 'objective': 'CrossEntropy', 'colsample_bylevel': 0.9903050308223618, 'depth': 5, 'boosting_type': 'Plain', 'bootstrap_type': 'Bernoulli', 'subsample': 0.14810509187821522}. Best is trial 0 with value: 0.8133148115931332.
[I 2025-04-07 23:54:18,075] Trial 16 finished with value: 0.8105479377430539 and parameters: {'iterations': 212, 'learning_rate': 0.18195043546241144, 'objective': 'CrossEntropy', 'colsample_bylevel': 0.9605248183157009, 'depth': 4, 'boosting_type': 'Plain', 'bootstrap_type': 'Bernoulli', 'subsample': 0.15271579695134646}. Best is trial 0 with value: 0.8133148115931332.
[I 2025-04-07 23:54:19,436] Trial 17 finished with value: 0.8012828677417712 and parameters: {'iterations': 64, 'learning_rate': 0.13779633905044184, 'objective': 'Logloss', 'colsample_bylevel': 0.9972498870144936, 'depth': 5, 'boosting_type': 'Plain', 'bootstrap_type': 'Bernoulli', 'subsample': 0.10495271559933653}. Best is trial 0 with value: 0.8133148115931332.
[I 2025-04-07 23:54:39,953] Trial 18 finished with value: 0.8006537260504587 and parameters: {'iterations': 252, 'learning_rate': 0.3657056102370329, 'objective': 'CrossEntropy', 'colsample_bylevel': 0.7068451977914795, 'depth': 5, 'boosting_type': 'Ordered', 'bootstrap_type': 'MVS', 'subsample': 0.4565144092235476}. Best is trial 0 with value: 0.8133148115931332.
[I 2025-04-07 23:54:41,820] Trial 19 finished with value: 0.8014086363324845 and parameters: {'iterations': 151, 'learning_rate': 0.12724903699030962, 'objective': 'Logloss', 'colsample_bylevel': 0.6197931009838569, 'depth': 4, 'boosting_type': 'Plain', 'bootstrap_type': 'Bernoulli', 'subsample': 0.22765434699373738}. Best is trial 0 with value: 0.8133148115931332.
[I 2025-04-07 23:54:49,154] Trial 20 finished with value: 0.8103380656906728 and parameters: {'iterations': 215, 'learning_rate': 0.504806486166378, 'objective': 'Logloss', 'colsample_bylevel': 0.8703184333084273, 'depth': 7, 'boosting_type': 'Plain', 'bootstrap_type': 'Bernoulli', 'subsample': 0.49331564698874286}. Best is trial 0 with value: 0.8133148115931332.
[I 2025-04-07 23:54:53,379] Trial 21 finished with value: 0.8075295970027818 and parameters: {'iterations': 210, 'learning_rate': 0.13997263720738745, 'objective': 'CrossEntropy', 'colsample_bylevel': 0.9894086364573995, 'depth': 4, 'boosting_type': 'Plain', 'bootstrap_type': 'Bernoulli', 'subsample': 0.10543579148169725}. Best is trial 0 with value: 0.8133148115931332.
[I 2025-04-07 23:54:58,140] Trial 22 finished with value: 0.8115959624715101 and parameters: {'iterations': 233, 'learning_rate': 0.18077346130202052, 'objective': 'CrossEntropy', 'colsample_bylevel': 0.9457626077856354, 'depth': 4, 'boosting_type': 'Plain', 'bootstrap_type': 'Bernoulli', 'subsample': 0.20927472848573253}. Best is trial 0 with value: 0.8133148115931332.
[I 2025-04-07 23:55:03,900] Trial 23 finished with value: 0.8097933789171987 and parameters: {'iterations': 238, 'learning_rate': 0.07775940241317322, 'objective': 'CrossEntropy', 'colsample_bylevel': 0.9177571995688742, 'depth': 5, 'boosting_type': 'Plain', 'bootstrap_type': 'Bernoulli', 'subsample': 0.3476577208041467}. Best is trial 0 with value: 0.8133148115931332.
[I 2025-04-07 23:55:05,862] Trial 24 finished with value: 0.8134408613487834 and parameters: {'iterations': 184, 'learning_rate': 0.5146575735082071, 'objective': 'CrossEntropy', 'colsample_bylevel': 0.7967682118876778, 'depth': 4, 'boosting_type': 'Plain', 'bootstrap_type': 'Bernoulli', 'subsample': 0.21794279525047522}. Best is trial 24 with value: 0.8134408613487834.
[I 2025-04-07 23:55:08,079] Trial 25 finished with value: 0.813105290996923 and parameters: {'iterations': 178, 'learning_rate': 0.574098349732495, 'objective': 'CrossEntropy', 'colsample_bylevel': 0.8146844817402041, 'depth': 4, 'boosting_type': 'Plain', 'bootstrap_type': 'MVS', 'subsample': 0.24295897287448937}. Best is trial 24 with value: 0.8134408613487834.
[I 2025-04-07 23:55:13,196] Trial 26 finished with value: 0.7997319092329293 and parameters: {'iterations': 178, 'learning_rate': 0.532570397578372, 'objective': 'CrossEntropy', 'colsample_bylevel': 0.7868459414053138, 'depth': 4, 'boosting_type': 'Ordered', 'bootstrap_type': 'MVS', 'subsample': 0.3635434304238656}. Best is trial 24 with value: 0.8134408613487834.
[I 2025-04-07 23:55:14,909] Trial 27 finished with value: 0.81155422705123 and parameters: {'iterations': 153, 'learning_rate': 0.5879374054290148, 'objective': 'CrossEntropy', 'colsample_bylevel': 0.6218301470628749, 'depth': 4, 'boosting_type': 'Plain', 'bootstrap_type': 'MVS', 'subsample': 0.2581065194094354}. Best is trial 24 with value: 0.8134408613487834.
[I 2025-04-07 23:55:17,132] Trial 28 finished with value: 0.7888733545261405 and parameters: {'iterations': 161, 'learning_rate': 0.0033102628428506344, 'objective': 'Logloss', 'colsample_bylevel': 0.8320167253024738, 'depth': 5, 'boosting_type': 'Plain', 'bootstrap_type': 'MVS', 'subsample': 0.5272586134429298}. Best is trial 24 with value: 0.8134408613487834.
[I 2025-04-07 23:55:20,148] Trial 29 finished with value: 0.790718007384094 and parameters: {'iterations': 113, 'learning_rate': 0.026684391512681278, 'objective': 'Logloss', 'colsample_bylevel': 0.7467361361175089, 'depth': 4, 'boosting_type': 'Ordered', 'bootstrap_type': 'MVS', 'subsample': 0.4170099067518078}. Best is trial 24 with value: 0.8134408613487834.
[I 2025-04-07 23:55:23,020] Trial 30 finished with value: 0.8129795399790181 and parameters: {'iterations': 188, 'learning_rate': 0.3032362687658294, 'objective': 'CrossEntropy', 'colsample_bylevel': 0.6184943911575348, 'depth': 6, 'boosting_type': 'Plain', 'bootstrap_type': 'MVS', 'subsample': 0.2923770405006539}. Best is trial 24 with value: 0.8134408613487834.
[I 2025-04-07 23:55:26,281] Trial 31 finished with value: 0.8141114924410564 and parameters: {'iterations': 190, 'learning_rate': 0.3868632571418742, 'objective': 'CrossEntropy', 'colsample_bylevel': 0.611674982510838, 'depth': 6, 'boosting_type': 'Plain', 'bootstrap_type': 'MVS', 'subsample': 0.2966445941316163}. Best is trial 31 with value: 0.8141114924410564.
[I 2025-04-07 23:55:29,243] Trial 32 finished with value: 0.8144467289095545 and parameters: {'iterations': 168, 'learning_rate': 0.5430512656197508, 'objective': 'CrossEntropy', 'colsample_bylevel': 0.7492318275557701, 'depth': 5, 'boosting_type': 'Plain', 'bootstrap_type': 'MVS', 'subsample': 0.19286703775642003}. Best is trial 32 with value: 0.8144467289095545.
[I 2025-04-07 23:55:32,711] Trial 33 finished with value: 0.8139855129766405 and parameters: {'iterations': 195, 'learning_rate': 0.2509506998060269, 'objective': 'CrossEntropy', 'colsample_bylevel': 0.7258945843436815, 'depth': 6, 'boosting_type': 'Plain', 'bootstrap_type': 'MVS', 'subsample': 0.18156852205032037}. Best is trial 32 with value: 0.8144467289095545.
[I 2025-04-07 23:55:35,649] Trial 34 finished with value: 0.8055171765417064 and parameters: {'iterations': 168, 'learning_rate': 0.0860489979885428, 'objective': 'CrossEntropy', 'colsample_bylevel': 0.6572116454503049, 'depth': 6, 'boosting_type': 'Plain', 'bootstrap_type': 'MVS', 'subsample': 0.1858093021070768}. Best is trial 32 with value: 0.8144467289095545.
[I 2025-04-07 23:55:37,730] Trial 35 finished with value: 0.8083680132709852 and parameters: {'iterations': 148, 'learning_rate': 0.24218342616243754, 'objective': 'CrossEntropy', 'colsample_bylevel': 0.4669608869294831, 'depth': 7, 'boosting_type': 'Plain', 'bootstrap_type': 'MVS', 'subsample': 0.30646227135340537}. Best is trial 32 with value: 0.8144467289095545.
[I 2025-04-07 23:55:54,331] Trial 36 finished with value: 0.8051815358986119 and parameters: {'iterations': 202, 'learning_rate': 0.4025883913098768, 'objective': 'CrossEntropy', 'colsample_bylevel': 0.7486157721872725, 'depth': 6, 'boosting_type': 'Ordered', 'bootstrap_type': 'MVS', 'subsample': 0.18476494217656358}. Best is trial 32 with value: 0.8144467289095545.
[I 2025-04-07 23:55:57,686] Trial 37 finished with value: 0.8132726895710652 and parameters: {'iterations': 167, 'learning_rate': 0.6765549740853004, 'objective': 'CrossEntropy', 'colsample_bylevel': 0.5876282855665927, 'depth': 8, 'boosting_type': 'Plain', 'bootstrap_type': 'MVS', 'subsample': 0.5869709834975032}. Best is trial 32 with value: 0.8144467289095545.
[I 2025-04-07 23:56:00,799] Trial 38 finished with value: 0.8058106424443074 and parameters: {'iterations': 184, 'learning_rate': 0.08693557890647799, 'objective': 'CrossEntropy', 'colsample_bylevel': 0.7122007476367069, 'depth': 5, 'boosting_type': 'Plain', 'bootstrap_type': 'MVS', 'subsample': 0.2708229760427711}. Best is trial 32 with value: 0.8144467289095545.
[I 2025-04-07 23:56:08,355] Trial 39 finished with value: 0.7916404568227308 and parameters: {'iterations': 193, 'learning_rate': 0.03657036159776483, 'objective': 'CrossEntropy', 'colsample_bylevel': 0.5116972344614638, 'depth': 8, 'boosting_type': 'Ordered', 'bootstrap_type': 'MVS', 'subsample': 0.14150388411939238}. Best is trial 32 with value: 0.8144467289095545.
[I 2025-04-07 23:56:14,610] Trial 40 finished with value: 0.8113024438504836 and parameters: {'iterations': 222, 'learning_rate': 0.24716182671188544, 'objective': 'CrossEntropy', 'colsample_bylevel': 0.5652882538652666, 'depth': 5, 'boosting_type': 'Plain', 'bootstrap_type': 'MVS', 'subsample': 0.20988765902529055}. Best is trial 32 with value: 0.8144467289095545.
[I 2025-04-07 23:56:17,070] Trial 41 finished with value: 0.811134781684213 and parameters: {'iterations': 199, 'learning_rate': 0.4291458620406255, 'objective': 'Logloss', 'colsample_bylevel': 0.6695609551555272, 'depth': 5, 'boosting_type': 'Plain', 'bootstrap_type': 'Bayesian', 'bagging_temperature': 6.5700405707404155}. Best is trial 32 with value: 0.8144467289095545.
[I 2025-04-07 23:56:24,058] Trial 42 finished with value: 0.8092062362382944 and parameters: {'iterations': 221, 'learning_rate': 0.7535977985429557, 'objective': 'CrossEntropy', 'colsample_bylevel': 0.7613978377426016, 'depth': 6, 'boosting_type': 'Plain', 'bootstrap_type': 'MVS', 'subsample': 0.386405100481519}. Best is trial 32 with value: 0.8144467289095545.
[I 2025-04-07 23:56:26,494] Trial 43 finished with value: 0.8126440399183918 and parameters: {'iterations': 183, 'learning_rate': 0.2254402450972832, 'objective': 'Logloss', 'colsample_bylevel': 0.8474694150145261, 'depth': 5, 'boosting_type': 'Plain', 'bootstrap_type': 'Bayesian', 'bagging_temperature': 0.30965588608806094}. Best is trial 32 with value: 0.8144467289095545.
[I 2025-04-07 23:56:29,187] Trial 44 finished with value: 0.7927304629907865 and parameters: {'iterations': 165, 'learning_rate': 0.007951551987553943, 'objective': 'CrossEntropy', 'colsample_bylevel': 0.7130891161700659, 'depth': 7, 'boosting_type': 'Plain', 'bootstrap_type': 'MVS', 'subsample': 0.3129933142415757}. Best is trial 32 with value: 0.8144467289095545.
[I 2025-04-07 23:56:32,429] Trial 45 finished with value: 0.8114702465992222 and parameters: {'iterations': 173, 'learning_rate': 0.9618847291448084, 'objective': 'CrossEntropy', 'colsample_bylevel': 0.9108110010349043, 'depth': 6, 'boosting_type': 'Plain', 'bootstrap_type': 'Bayesian', 'bagging_temperature': 6.385920749540398}. Best is trial 32 with value: 0.8144467289095545.
[I 2025-04-07 23:56:36,026] Trial 46 finished with value: 0.8149496626899401 and parameters: {'iterations': 192, 'learning_rate': 0.3734544392854053, 'objective': 'Logloss', 'colsample_bylevel': 0.6540127818153206, 'depth': 9, 'boosting_type': 'Plain', 'bootstrap_type': 'Bernoulli', 'subsample': 0.4018199661422929}. Best is trial 46 with value: 0.8149496626899401.
[I 2025-04-07 23:56:41,123] Trial 47 finished with value: 0.8133988096179495 and parameters: {'iterations': 190, 'learning_rate': 0.3129026175036506, 'objective': 'CrossEntropy', 'colsample_bylevel': 0.7887749792389791, 'depth': 9, 'boosting_type': 'Plain', 'bootstrap_type': 'Bernoulli', 'subsample': 0.4334026813497268}. Best is trial 46 with value: 0.8149496626899401.
