[I 2025-04-07 22:45:34,400] Trial 25 finished with value: 0.8183876069525061 and parameters: {'n_estimators': 127, 'criterion': 'gini', 'max_depth': 26, 'min_samples_split': 18, 'min_samples_leaf': 7}. Best is trial 24 with value: 0.8195194364048846.
[I 2025-04-07 22:45:44,012] Trial 26 finished with value: 0.814698318809407 and parameters: {'n_estimators': 136, 'criterion': 'entropy', 'max_depth': 13, 'min_samples_split': 11, 'min_samples_leaf': 4}. Best is trial 24 with value: 0.8195194364048846.
[I 2025-04-07 22:45:55,791] Trial 27 finished with value: 0.8186807741173618 and parameters: {'n_estimators': 160, 'criterion': 'gini', 'max_depth': 35, 'min_samples_split': 16, 'min_samples_leaf': 3}. Best is trial 24 with value: 0.8195194364048846.
[I 2025-04-07 22:46:04,408] Trial 28 finished with value: 0.8197710965959712 and parameters: {'n_estimators': 109, 'criterion': 'gini', 'max_depth': 27, 'min_samples_split': 13, 'min_samples_leaf': 5}. Best is trial 28 with value: 0.8197710965959712.
[I 2025-04-07 22:46:12,161] Trial 29 finished with value: 0.818177998492253 and parameters: {'n_estimators': 81, 'criterion': 'gini', 'max_depth': 27, 'min_samples_split': 16, 'min_samples_leaf': 10}. Best is trial 28 with value: 0.8197710965959712.
[I 2025-04-07 22:46:21,164] Trial 30 finished with value: 0.8193098103718232 and parameters: {'n_estimators': 112, 'criterion': 'gini', 'max_depth': 38, 'min_samples_split': 17, 'min_samples_leaf': 5}. Best is trial 28 with value: 0.8197710965959712.
[I 2025-04-07 22:46:30,225] Trial 31 finished with value: 0.8183455376488638 and parameters: {'n_estimators': 120, 'criterion': 'gini', 'max_depth': 37, 'min_samples_split': 17, 'min_samples_leaf': 5}. Best is trial 28 with value: 0.8197710965959712.
[I 2025-04-07 22:46:37,649] Trial 32 finished with value: 0.8180101957435143 and parameters: {'n_estimators': 100, 'criterion': 'gini', 'max_depth': 18, 'min_samples_split': 19, 'min_samples_leaf': 7}. Best is trial 28 with value: 0.8197710965959712.
[I 2025-04-07 22:46:45,809] Trial 33 finished with value: 0.8186388981146134 and parameters: {'n_estimators': 105, 'criterion': 'gini', 'max_depth': 30, 'min_samples_split': 15, 'min_samples_leaf': 4}. Best is trial 28 with value: 0.8197710965959712.
[I 2025-04-07 22:46:54,501] Trial 34 finished with value: 0.8179682143039146 and parameters: {'n_estimators': 117, 'criterion': 'gini', 'max_depth': 48, 'min_samples_split': 17, 'min_samples_leaf': 3}. Best is trial 28 with value: 0.8197710965959712.
[I 2025-04-07 22:47:00,999] Trial 35 finished with value: 0.8089548044937185 and parameters: {'n_estimators': 90, 'criterion': 'gini', 'max_depth': 10, 'min_samples_split': 14, 'min_samples_leaf': 6}. Best is trial 28 with value: 0.8197710965959712.
[I 2025-04-07 22:47:07,871] Trial 36 finished with value: 0.8196452401412152 and parameters: {'n_estimators': 74, 'criterion': 'entropy', 'max_depth': 27, 'min_samples_split': 19, 'min_samples_leaf': 5}. Best is trial 28 with value: 0.8197710965959712.
[I 2025-04-07 22:47:14,928] Trial 37 finished with value: 0.8185970572574821 and parameters: {'n_estimators': 70, 'criterion': 'entropy', 'max_depth': 20, 'min_samples_split': 19, 'min_samples_leaf': 7}. Best is trial 28 with value: 0.8197710965959712.
[I 2025-04-07 22:47:20,806] Trial 38 finished with value: 0.8156624685227067 and parameters: {'n_estimators': 56, 'criterion': 'entropy', 'max_depth': 28, 'min_samples_split': 19, 'min_samples_leaf': 17}. Best is trial 28 with value: 0.8197710965959712.
[I 2025-04-07 22:47:24,466] Trial 39 finished with value: 0.818512971368623 and parameters: {'n_estimators': 24, 'criterion': 'entropy', 'max_depth': 34, 'min_samples_split': 3, 'min_samples_leaf': 5}. Best is trial 28 with value: 0.8197710965959712.
[I 2025-04-07 22:47:32,093] Trial 40 finished with value: 0.817926391019592 and parameters: {'n_estimators': 76, 'criterion': 'entropy', 'max_depth': 16, 'min_samples_split': 16, 'min_samples_leaf': 6}. Best is trial 28 with value: 0.8197710965959712.
[I 2025-04-07 22:47:42,203] Trial 41 finished with value: 0.8186390035514647 and parameters: {'n_estimators': 113, 'criterion': 'entropy', 'max_depth': 25, 'min_samples_split': 18, 'min_samples_leaf': 4}. Best is trial 28 with value: 0.8197710965959712.
[I 2025-04-07 22:47:50,407] Trial 42 finished with value: 0.8193934745132772 and parameters: {'n_estimators': 93, 'criterion': 'entropy', 'max_depth': 31, 'min_samples_split': 17, 'min_samples_leaf': 2}. Best is trial 28 with value: 0.8197710965959712.
[I 2025-04-07 22:47:56,964] Trial 43 finished with value: 0.8187647194237524 and parameters: {'n_estimators': 66, 'criterion': 'entropy', 'max_depth': 30, 'min_samples_split': 14, 'min_samples_leaf': 2}. Best is trial 28 with value: 0.8197710965959712.
[I 2025-04-07 22:48:06,130] Trial 44 finished with value: 0.81897415215592 and parameters: {'n_estimators': 93, 'criterion': 'entropy', 'max_depth': 41, 'min_samples_split': 19, 'min_samples_leaf': 2}. Best is trial 28 with value: 0.8197710965959712.
[I 2025-04-07 22:48:11,840] Trial 45 finished with value: 0.8174651926594864 and parameters: {'n_estimators': 49, 'criterion': 'entropy', 'max_depth': 33, 'min_samples_split': 15, 'min_samples_leaf': 3}. Best is trial 28 with value: 0.8197710965959712.
[I 2025-04-07 22:48:20,983] Trial 46 finished with value: 0.8179682845951488 and parameters: {'n_estimators': 95, 'criterion': 'entropy', 'max_depth': 20, 'min_samples_split': 20, 'min_samples_leaf': 13}. Best is trial 28 with value: 0.8197710965959712.
[I 2025-04-07 22:48:33,065] Trial 47 finished with value: 0.8185553921284361 and parameters: {'n_estimators': 129, 'criterion': 'entropy', 'max_depth': 29, 'min_samples_split': 18, 'min_samples_leaf': 9}. Best is trial 28 with value: 0.8197710965959712.
[I 2025-04-07 22:48:39,844] Trial 48 finished with value: 0.8186804578068081 and parameters: {'n_estimators': 59, 'criterion': 'entropy', 'max_depth': 42, 'min_samples_split': 13, 'min_samples_leaf': 2}. Best is trial 28 with value: 0.8197710965959712.
[I 2025-04-07 22:48:47,393] Trial 49 finished with value: 0.8183455025032467 and parameters: {'n_estimators': 74, 'criterion': 'entropy', 'max_depth': 24, 'min_samples_split': 15, 'min_samples_leaf': 4}. Best is trial 28 with value: 0.8197710965959712.
[I 2025-04-07 22:49:01,941] Trial 50 finished with value: 0.8187647545693697 and parameters: {'n_estimators': 200, 'criterion': 'entropy', 'max_depth': 36, 'min_samples_split': 16, 'min_samples_leaf': 8}. Best is trial 28 with value: 0.8197710965959712.
[I 2025-04-07 22:49:10,116] Trial 51 finished with value: 0.8191840593539181 and parameters: {'n_estimators': 109, 'criterion': 'gini', 'max_depth': 57, 'min_samples_split': 17, 'min_samples_leaf': 5}. Best is trial 28 with value: 0.8197710965959712.
[I 2025-04-07 22:49:19,980] Trial 52 finished with value: 0.8191421130599356 and parameters: {'n_estimators': 121, 'criterion': 'gini', 'max_depth': 32, 'min_samples_split': 17, 'min_samples_leaf': 6}. Best is trial 28 with value: 0.8197710965959712.
[I 2025-04-07 22:49:28,519] Trial 53 finished with value: 0.8178423929947755 and parameters: {'n_estimators': 101, 'criterion': 'gini', 'max_depth': 38, 'min_samples_split': 20, 'min_samples_leaf': 5}. Best is trial 28 with value: 0.8197710965959712.
[I 2025-04-07 22:49:31,553] Trial 54 finished with value: 0.8174229124821416 and parameters: {'n_estimators': 20, 'criterion': 'gini', 'max_depth': 48, 'min_samples_split': 19, 'min_samples_leaf': 3}. Best is trial 28 with value: 0.8197710965959712.
[I 2025-04-07 22:49:38,920] Trial 55 finished with value: 0.8165431122498292 and parameters: {'n_estimators': 87, 'criterion': 'gini', 'max_depth': 45, 'min_samples_split': 17, 'min_samples_leaf': 16}. Best is trial 28 with value: 0.8197710965959712.
[I 2025-04-07 22:49:51,054] Trial 56 finished with value: 0.8191838309074072 and parameters: {'n_estimators': 155, 'criterion': 'gini', 'max_depth': 22, 'min_samples_split': 12, 'min_samples_leaf': 2}. Best is trial 28 with value: 0.8197710965959712.
[I 2025-04-07 22:50:01,070] Trial 57 finished with value: 0.81914206034151 and parameters: {'n_estimators': 136, 'criterion': 'gini', 'max_depth': 26, 'min_samples_split': 18, 'min_samples_leaf': 5}. Best is trial 28 with value: 0.8197710965959712.
[I 2025-04-07 22:50:09,241] Trial 58 finished with value: 0.8179683373135745 and parameters: {'n_estimators': 109, 'criterion': 'gini', 'max_depth': 51, 'min_samples_split': 16, 'min_samples_leaf': 4}. Best is trial 28 with value: 0.8197710965959712.
[I 2025-04-07 22:50:16,722] Trial 59 finished with value: 0.8185972154127589 and parameters: {'n_estimators': 80, 'criterion': 'gini', 'max_depth': 60, 'min_samples_split': 10, 'min_samples_leaf': 7}. Best is trial 28 with value: 0.8197710965959712.
[I 2025-04-07 22:50:20,924] Trial 60 finished with value: 0.8187645964140927 and parameters: {'n_estimators': 36, 'criterion': 'gini', 'max_depth': 54, 'min_samples_split': 19, 'min_samples_leaf': 3}. Best is trial 28 with value: 0.8197710965959712.
[I 2025-04-07 22:50:32,215] Trial 61 finished with value: 0.8194355086713024 and parameters: {'n_estimators': 144, 'criterion': 'gini', 'max_depth': 22, 'min_samples_split': 10, 'min_samples_leaf': 1}. Best is trial 28 with value: 0.8197710965959712.
[I 2025-04-07 22:50:42,641] Trial 62 finished with value: 0.8184294126640204 and parameters: {'n_estimators': 139, 'criterion': 'gini', 'max_depth': 20, 'min_samples_split': 9, 'min_samples_leaf': 1}. Best is trial 28 with value: 0.8197710965959712.
[I 2025-04-07 22:50:54,838] Trial 63 finished with value: 0.8190163444692221 and parameters: {'n_estimators': 149, 'criterion': 'gini', 'max_depth': 31, 'min_samples_split': 10, 'min_samples_leaf': 1}. Best is trial 28 with value: 0.8197710965959712.
[I 2025-04-07 22:51:08,054] Trial 64 finished with value: 0.8189324343084484 and parameters: {'n_estimators': 171, 'criterion': 'gini', 'max_depth': 28, 'min_samples_split': 8, 'min_samples_leaf': 2}. Best is trial 28 with value: 0.8197710965959712.
[I 2025-04-07 22:51:18,180] Trial 65 finished with value: 0.8172975304932159 and parameters: {'n_estimators': 125, 'criterion': 'gini', 'max_depth': 15, 'min_samples_split': 12, 'min_samples_leaf': 4}. Best is trial 28 with value: 0.8197710965959712.
[I 2025-04-07 22:51:27,854] Trial 66 finished with value: 0.8185551461091165 and parameters: {'n_estimators': 133, 'criterion': 'gini', 'max_depth': 21, 'min_samples_split': 17, 'min_samples_leaf': 3}. Best is trial 28 with value: 0.8197710965959712.
[I 2025-04-07 22:51:36,093] Trial 67 finished with value: 0.8182198042037673 and parameters: {'n_estimators': 99, 'criterion': 'gini', 'max_depth': 24, 'min_samples_split': 18, 'min_samples_leaf': 6}. Best is trial 28 with value: 0.8197710965959712.
[I 2025-04-07 22:51:47,927] Trial 68 finished with value: 0.8188905583057 and parameters: {'n_estimators': 123, 'criterion': 'entropy', 'max_depth': 27, 'min_samples_split': 20, 'min_samples_leaf': 1}. Best is trial 28 with value: 0.8197710965959712.
[I 2025-04-07 22:51:58,815] Trial 69 finished with value: 0.7700073102883522 and parameters: {'n_estimators': 112, 'criterion': 'gini', 'max_depth': 3, 'min_samples_split': 14, 'min_samples_leaf': 5}. Best is trial 28 with value: 0.8197710965959712.
[I 2025-04-07 22:52:00,311] A new study created in RDB with name: random-forest-num_features-8
[I 2025-04-07 22:52:08,804] Trial 0 finished with value: 0.8146983715278326 and parameters: {'n_estimators': 109, 'criterion': 'gini', 'max_depth': 27, 'min_samples_split': 13, 'min_samples_leaf': 5}. Best is trial 0 with value: 0.8146983715278326.
[I 2025-04-07 22:52:13,347] Trial 1 finished with value: 0.8142789964520499 and parameters: {'n_estimators': 48, 'criterion': 'gini', 'max_depth': 47, 'min_samples_split': 8, 'min_samples_leaf': 3}. Best is trial 0 with value: 0.8146983715278326.
[I 2025-04-07 22:52:18,135] Trial 2 finished with value: 0.8139018664079949 and parameters: {'n_estimators': 53, 'criterion': 'entropy', 'max_depth': 39, 'min_samples_split': 14, 'min_samples_leaf': 10}. Best is trial 0 with value: 0.8146983715278326.
[I 2025-04-07 22:52:23,564] Trial 3 finished with value: 0.811470176307988 and parameters: {'n_estimators': 63, 'criterion': 'gini', 'max_depth': 30, 'min_samples_split': 19, 'min_samples_leaf': 16}. Best is trial 0 with value: 0.8146983715278326.
[I 2025-04-07 22:52:31,175] Trial 4 finished with value: 0.8149496626899401 and parameters: {'n_estimators': 93, 'criterion': 'entropy', 'max_depth': 22, 'min_samples_split': 12, 'min_samples_leaf': 6}. Best is trial 4 with value: 0.8149496626899401.
[I 2025-04-07 22:52:41,969] Trial 5 finished with value: 0.813272742289491 and parameters: {'n_estimators': 145, 'criterion': 'gini', 'max_depth': 39, 'min_samples_split': 11, 'min_samples_leaf': 11}. Best is trial 4 with value: 0.8149496626899401.
[I 2025-04-07 22:52:47,276] Trial 6 finished with value: 0.8122668571559112 and parameters: {'n_estimators': 68, 'criterion': 'gini', 'max_depth': 49, 'min_samples_split': 15, 'min_samples_leaf': 18}. Best is trial 4 with value: 0.8149496626899401.
[I 2025-04-07 22:52:55,110] Trial 7 finished with value: 0.8139432855177212 and parameters: {'n_estimators': 103, 'criterion': 'gini', 'max_depth': 20, 'min_samples_split': 3, 'min_samples_leaf': 2}. Best is trial 4 with value: 0.8149496626899401.
[I 2025-04-07 22:53:05,716] Trial 8 finished with value: 0.8152010417160902 and parameters: {'n_estimators': 152, 'criterion': 'entropy', 'max_depth': 45, 'min_samples_split': 6, 'min_samples_leaf': 2}. Best is trial 8 with value: 0.8152010417160902.
[I 2025-04-07 22:53:10,859] Trial 9 finished with value: 0.8127697206450627 and parameters: {'n_estimators': 75, 'criterion': 'entropy', 'max_depth': 35, 'min_samples_split': 9, 'min_samples_leaf': 17}. Best is trial 8 with value: 0.8152010417160902.
[I 2025-04-07 22:53:21,634] Trial 10 finished with value: 0.7729000230203791 and parameters: {'n_estimators': 190, 'criterion': 'entropy', 'max_depth': 4, 'min_samples_split': 2, 'min_samples_leaf': 9}. Best is trial 8 with value: 0.8152010417160902.
[I 2025-04-07 22:53:32,670] Trial 11 finished with value: 0.8157461678097778 and parameters: {'n_estimators': 157, 'criterion': 'entropy', 'max_depth': 64, 'min_samples_split': 6, 'min_samples_leaf': 6}. Best is trial 11 with value: 0.8157461678097778.
[I 2025-04-07 22:53:44,513] Trial 12 finished with value: 0.8159976698455876 and parameters: {'n_estimators': 160, 'criterion': 'entropy', 'max_depth': 64, 'min_samples_split': 6, 'min_samples_leaf': 1}. Best is trial 12 with value: 0.8159976698455876.
[I 2025-04-07 22:53:58,197] Trial 13 finished with value: 0.815327056326123 and parameters: {'n_estimators': 194, 'criterion': 'entropy', 'max_depth': 61, 'min_samples_split': 5, 'min_samples_leaf': 7}. Best is trial 12 with value: 0.8159976698455876.
[I 2025-04-07 22:54:11,000] Trial 14 finished with value: 0.8160394579842933 and parameters: {'n_estimators': 150, 'criterion': 'entropy', 'max_depth': 64, 'min_samples_split': 6, 'min_samples_leaf': 1}. Best is trial 14 with value: 0.8160394579842933.
[I 2025-04-07 22:54:13,641] Trial 15 finished with value: 0.8130629756739612 and parameters: {'n_estimators': 18, 'criterion': 'entropy', 'max_depth': 56, 'min_samples_split': 9, 'min_samples_leaf': 1}. Best is trial 14 with value: 0.8160394579842933.
[I 2025-04-07 22:54:23,557] Trial 16 finished with value: 0.8126021111972179 and parameters: {'n_estimators': 130, 'criterion': 'entropy', 'max_depth': 55, 'min_samples_split': 4, 'min_samples_leaf': 13}. Best is trial 14 with value: 0.8160394579842933.
[I 2025-04-07 22:54:35,560] Trial 17 finished with value: 0.8153267751611866 and parameters: {'n_estimators': 173, 'criterion': 'entropy', 'max_depth': 56, 'min_samples_split': 7, 'min_samples_leaf': 4}. Best is trial 14 with value: 0.8160394579842933.
[I 2025-04-07 22:54:45,046] Trial 18 finished with value: 0.80086335208352 and parameters: {'n_estimators': 128, 'criterion': 'entropy', 'max_depth': 9, 'min_samples_split': 17, 'min_samples_leaf': 20}. Best is trial 14 with value: 0.8160394579842933.
[I 2025-04-07 22:54:56,635] Trial 19 finished with value: 0.8151175533027215 and parameters: {'n_estimators': 164, 'criterion': 'entropy', 'max_depth': 62, 'min_samples_split': 10, 'min_samples_leaf': 8}. Best is trial 14 with value: 0.8160394579842933.
[I 2025-04-07 22:55:10,674] Trial 20 finished with value: 0.8146139517556115 and parameters: {'n_estimators': 175, 'criterion': 'entropy', 'max_depth': 53, 'min_samples_split': 2, 'min_samples_leaf': 1}. Best is trial 14 with value: 0.8160394579842933.
[I 2025-04-07 22:55:21,760] Trial 21 finished with value: 0.8148237535167583 and parameters: {'n_estimators': 130, 'criterion': 'entropy', 'max_depth': 64, 'min_samples_split': 6, 'min_samples_leaf': 4}. Best is trial 14 with value: 0.8160394579842933.
[I 2025-04-07 22:55:33,551] Trial 22 finished with value: 0.8159139705585166 and parameters: {'n_estimators': 149, 'criterion': 'entropy', 'max_depth': 63, 'min_samples_split': 5, 'min_samples_leaf': 6}. Best is trial 14 with value: 0.8160394579842933.
[I 2025-04-07 22:55:44,429] Trial 23 finished with value: 0.8157880789581433 and parameters: {'n_estimators': 143, 'criterion': 'entropy', 'max_depth': 59, 'min_samples_split': 4, 'min_samples_leaf': 3}. Best is trial 14 with value: 0.8160394579842933.
[I 2025-04-07 22:55:58,639] Trial 24 finished with value: 0.8150752906981852 and parameters: {'n_estimators': 180, 'criterion': 'entropy', 'max_depth': 50, 'min_samples_split': 8, 'min_samples_leaf': 1}. Best is trial 14 with value: 0.8160394579842933.
[I 2025-04-07 22:56:07,664] Trial 25 finished with value: 0.8126440399183918 and parameters: {'n_estimators': 116, 'criterion': 'entropy', 'max_depth': 42, 'min_samples_split': 5, 'min_samples_leaf': 13}. Best is trial 14 with value: 0.8160394579842933.
[I 2025-04-07 22:56:22,482] Trial 26 finished with value: 0.816165525312752 and parameters: {'n_estimators': 164, 'criterion': 'entropy', 'max_depth': 52, 'min_samples_split': 4, 'min_samples_leaf': 5}. Best is trial 26 with value: 0.816165525312752.
[I 2025-04-07 22:56:38,047] Trial 27 finished with value: 0.8157879032300579 and parameters: {'n_estimators': 199, 'criterion': 'entropy', 'max_depth': 52, 'min_samples_split': 7, 'min_samples_leaf': 4}. Best is trial 26 with value: 0.816165525312752.
[I 2025-04-07 22:56:53,723] Trial 28 finished with value: 0.8161653847302837 and parameters: {'n_estimators': 165, 'criterion': 'entropy', 'max_depth': 58, 'min_samples_split': 3, 'min_samples_leaf': 3}. Best is trial 26 with value: 0.816165525312752.
[I 2025-04-07 22:57:03,784] Trial 29 finished with value: 0.815159271150193 and parameters: {'n_estimators': 115, 'criterion': 'gini', 'max_depth': 57, 'min_samples_split': 2, 'min_samples_leaf': 5}. Best is trial 26 with value: 0.816165525312752.
[I 2025-04-07 22:57:18,748] Trial 30 finished with value: 0.8158299725337003 and parameters: {'n_estimators': 185, 'criterion': 'entropy', 'max_depth': 45, 'min_samples_split': 3, 'min_samples_leaf': 3}. Best is trial 26 with value: 0.816165525312752.
[I 2025-04-07 22:57:33,887] Trial 31 finished with value: 0.816332713013192 and parameters: {'n_estimators': 163, 'criterion': 'entropy', 'max_depth': 59, 'min_samples_split': 4, 'min_samples_leaf': 2}. Best is trial 31 with value: 0.816332713013192.
[I 2025-04-07 22:57:50,384] Trial 32 finished with value: 0.8160815097151272 and parameters: {'n_estimators': 168, 'criterion': 'entropy', 'max_depth': 52, 'min_samples_split': 4, 'min_samples_leaf': 3}. Best is trial 31 with value: 0.816332713013192.
[I 2025-04-07 22:58:06,986] Trial 33 finished with value: 0.8162074013155005 and parameters: {'n_estimators': 169, 'criterion': 'entropy', 'max_depth': 48, 'min_samples_split': 4, 'min_samples_leaf': 5}. Best is trial 31 with value: 0.816332713013192.
[I 2025-04-07 22:58:20,126] Trial 34 finished with value: 0.8147819829508613 and parameters: {'n_estimators': 138, 'criterion': 'gini', 'max_depth': 41, 'min_samples_split': 3, 'min_samples_leaf': 8}. Best is trial 31 with value: 0.816332713013192.
[I 2025-04-07 22:58:37,199] Trial 35 finished with value: 0.8161654725943264 and parameters: {'n_estimators': 179, 'criterion': 'entropy', 'max_depth': 47, 'min_samples_split': 4, 'min_samples_leaf': 5}. Best is trial 31 with value: 0.816332713013192.
[I 2025-04-07 22:58:53,913] Trial 36 finished with value: 0.8160816327247871 and parameters: {'n_estimators': 183, 'criterion': 'entropy', 'max_depth': 47, 'min_samples_split': 4, 'min_samples_leaf': 5}. Best is trial 31 with value: 0.816332713013192.
[I 2025-04-07 22:59:11,730] Trial 37 finished with value: 0.8146143910758248 and parameters: {'n_estimators': 199, 'criterion': 'gini', 'max_depth': 34, 'min_samples_split': 8, 'min_samples_leaf': 7}. Best is trial 31 with value: 0.816332713013192.
[I 2025-04-07 22:59:24,881] Trial 38 finished with value: 0.8144048177611889 and parameters: {'n_estimators': 175, 'criterion': 'entropy', 'max_depth': 27, 'min_samples_split': 12, 'min_samples_leaf': 11}. Best is trial 31 with value: 0.816332713013192.
[I 2025-04-07 22:59:33,059] Trial 39 finished with value: 0.8141951741553191 and parameters: {'n_estimators': 99, 'criterion': 'gini', 'max_depth': 37, 'min_samples_split': 7, 'min_samples_leaf': 9}. Best is trial 31 with value: 0.816332713013192.
[I 2025-04-07 22:59:36,602] Trial 40 finished with value: 0.8134823858953609 and parameters: {'n_estimators': 31, 'criterion': 'entropy', 'max_depth': 44, 'min_samples_split': 16, 'min_samples_leaf': 5}. Best is trial 31 with value: 0.816332713013192.
[I 2025-04-07 22:59:50,315] Trial 41 finished with value: 0.816332713013192 and parameters: {'n_estimators': 163, 'criterion': 'entropy', 'max_depth': 49, 'min_samples_split': 3, 'min_samples_leaf': 2}. Best is trial 31 with value: 0.816332713013192.
